basepk,hid,speechdate,pid,opid,speakeroldname,speakerposition,maintopic,subtopic,subsubtopic,speechtext,speakerparty,speakerriding,speakername,speakerurl
4752152,ca.proc.d.2018-09-17.10238577,2018-09-17,8880684e-3bb8-4705-a2b4-767f37811391,234412,Mr. Dean Allison,,Government Orders,Comprehensive and Progressive Agreement for Trans-Pacific Partnership Implementation Act,,"Mr. Speaker, I had a chance to be in the member for Essex's part of the country this summer and to tour the Chrysler plant and to listen to some of their concerns. I know she is well aware that Chrysler employs over 6,000 people there, as well as another 4,000 in Brampton. They are very concerned. Ninety-five per cent of the cars they produce go to the U.S., so the talk about the threat of a potential 25% tariff is something that concerns them greatly.
On top of that, we have a whole bunch of other issues around the table. We have supply chains in the immediate area of these auto plants, and they are concerned as well. Certainly, the steel and aluminum tariffs have been major issues, not only for steel and aluminum producers, but also for those people who supply the industry. 
As we move forward with any kind of trade deal, one of the things we need to be mindful of, which the auto sector did say it has some concerns about, is non-tariff barriers. Those are issues that we need to constantly fight against as we look at some of these things. We need to go into this agreement with eyes wide open, realizing there will be more work to be done to make sure the deal continues to do what it is supposed to do. ",Conservative,Niagara West,Dean Allison,http://www.parl.gc.ca/Parliamentarians/en/members/dean-allison(234412)
4752153,ca.proc.d.2018-09-17.10238579,2018-09-17,07cf5767-802c-406c-92a7-7dc92af79b40,229526,"Mr. Kevin Lamoureux (Parliamentary Secretary to the Leader of the Government in the House of Commons, Lib.)",,Government Orders,Comprehensive and Progressive Agreement for Trans-Pacific Partnership Implementation Act,,"Mr. Speaker, in listening to the trade debate, I appreciate the Conservatives are supporting this legislation. However, they seem to be stuck on misinformation that goes back to the era of Stephen Harper. I know they are great fans of Stephen Harper. Every time the name comes up they tend to applaud their new leader, who kind of tries to emulate Stephen Harper.
There is a bit of misinformation. The member opposite tries to give the impression that Stephen Harper signed 50-plus trade agreements. The reality is that the EU agreement, which had over 28 nations, was never finalized under Stephen Harper. In fact, it was off track, it was going nowhere. 
The good news is that the current government minister was the one who got it back on track, and it was this Prime Minister and the efforts of this cabinet that got the deal done. The good news is that the minister who was responsible for getting it back on track is the one who is negotiating NAFTA. That is good news for all Canadians.
I would ask my colleague this. Does he not agree that achieving a good deal is the type of thing we should be striving for, first and foremost, for all Canadians?",Liberal,Winnipeg North,Kevin Lamoureux,http://www.parl.gc.ca/Parliamentarians/en/members/kevin-lamoureux(229526)
4752154,ca.proc.d.2018-09-17.10238582,2018-09-17,8880684e-3bb8-4705-a2b4-767f37811391,234412,Mr. Dean Allison,,Government Orders,Comprehensive and Progressive Agreement for Trans-Pacific Partnership Implementation Act,,"Mr. Speaker, I want to remind my colleague from Winnipeg North that those trade deals we brought wrapped in a bow and put them at the Liberals' doorstep. All they had to do was walk them across the finish line. All the heavy lifting had been done. However, that almost got screwed up, believe it or not. It was unbelievable in terms of the Prime Minister walking out, leaving the former trade minister at a table trying to explain where the Prime Minister was. It was like, “What happened?” There were no comments. I think actions like that have created a conflict that did not previously exist.
Quite frankly, when we look at what the differences are with the CPTTP, other than the name, which is mostly all that is different about that, the same strong regulations around labour and environment are still there. There are a few sidebar agreements, but most of these are non-binding. Therefore, at the end of the day, the deal that we have in place under CETA was largely negotiated by the former government. Yes, the current government still had to ratify it. As a matter of fact, the individual member states still need to do that today. TPP was the same. The current government should be thankful for all the heavy lifting that was done by the former government to get us to where we were. The Liberal government almost messed up some of those agreements. However, thank goodness it finally saw the light and was able to move these things across the finish line. ",Conservative,Niagara West,Dean Allison,http://www.parl.gc.ca/Parliamentarians/en/members/dean-allison(234412)
4752155,ca.proc.d.2018-09-17.10238585,2018-09-17,b15d7c05-f054-45fe-804e-54d178f2d3b4,216128,"Mr. Randy Hoback (Prince Albert, CPC)",,Government Orders,Comprehensive and Progressive Agreement for Trans-Pacific Partnership Implementation Act,,"Mr. Speaker, it is interesting to listen to the Liberals say, “Don't talk down our economy.” For the last three years, all the Liberals have done is talk. The reality is if they had signed the TPP three years ago, Obama would have signed it and we would not be in NAFTA negotiations, as we sit today, and a lot of these problems that Canadian businesses face would not be there. However, what did they do? They talked and they talked, and the reality is we are in crisis mode.
I know this member has been across Canada talking to businesses, labour groups and different people right across Canada. Therefore, he should not talk down our economy; rather, he should tell us what they are telling him in those meetings.",Conservative,Prince Albert,Randy Hoback,http://www.parl.gc.ca/Parliamentarians/en/members/randy-hoback(216128)
4752156,ca.proc.d.2018-09-17.10238587,2018-09-17,8880684e-3bb8-4705-a2b4-767f37811391,234412,Mr. Dean Allison,,Government Orders,Comprehensive and Progressive Agreement for Trans-Pacific Partnership Implementation Act,,"Mr. Speaker, I thank my hon. colleague because I know that he has also been on the road talking to businesses this summer and I am sure he is hearing some of the same things I have heard.
I have heard a number of things. The first thing is that we need to get a NAFTA deal done yesterday. The challenge right now is the uncertainty that it creates around businesses that normally like to plan two to three to five years out. Some of these businesses are saying they cannot even plan for the next three to six months because they do not know what is going on. I have heard story after story.
I have personally talked to over 150 stakeholders, business people, associations and chambers of commerce. This is not stuff I am making up, this is stuff I have heard from people on the ground. I know that my hon. colleague has also heard from people on the ground. They are saying that uncertainty is the killer of business. It is what kills businesses with respect to being able to figure out what they are doing next week, next quarter. As a matter of fact, I have heard a number of people say they have issues. One company I talked to in Welland had already laid off 25% of its workforce because of the uncertainty. A number of other companies in the steel and aluminum industry have said there is no way for them to figure out the tariffs going across the border and because of that they will actually have to lay off some of the people on our side of the country. 
The challenge I have is that when businesses do not have certainty there is no way that they can plan for the future. I had a number of businesses that were actually going to invest and double the size of their companies here in Canada with no government money, and they have put their investments on hold. Members should think about that. These were companies that were going to invest in their own businesses, and that has been put on hold because of the uncertainty in this country.",Conservative,Niagara West,Dean Allison,http://www.parl.gc.ca/Parliamentarians/en/members/dean-allison(234412)
