basepk,hid,speechdate,pid,opid,speakeroldname,speakerposition,maintopic,subtopic,subsubtopic,speechtext,speakerparty,speakerriding,speakername,speakerurl
4752137,ca.proc.d.2018-09-17.10238491,2018-09-17,,,,,Government Orders,Comprehensive and Progressive Agreement for Trans-Pacific Partnership Implementation Act,,"moved that Bill C-79, an act to implement the comprehensive and progressive agreement for trans-Pacific partnership between Canada, Australia, Brunei, Chile, Japan, Malaysia, Mexico, New Zealand, Peru, Singapore and Vietnam, be read the second time and referred to a committee. 
Mr. Speaker, it is with enthusiasm and optimism that I rise in the House today to speak about our government's plan to diversify Canada's trade. Specifically, I will speak about Bill C-79, the legislation before members today to implement the comprehensive and progressive agreement for trans-Pacific partnership, otherwise known as the CPTPP.
This is the first government bill to be debated in the fall sitting. That is a statement in itself and I intend to speak to that too. It reflects the importance we attach to swift ratification of the new CPTPP so that our farmers, ranchers, entrepreneurs and workers from across the country can get down to the business of tapping new markets and bringing brand Canada to more corners of the world.
There has never been a better time for Canadians to diversify. As a trading nation we need to add to our list of customers and to the roster of our innovative, hard-working, entrepreneurial and ambitious sellers. 
Today I am meeting with my counterpart from the United Kingdom. In the last two weeks I was in Israel, Thailand and Singapore. After the United States withdrew, Canada took the lead in March 2017, relaunching stalled talks for the old TPP and then working tirelessly to secure a deal that reflected not just the ambitions of the few but the dreams of the many.
This effort was in large part about driving real changes for the middle class who have not always seen their interests reflected in agreements. We changed the terms of trade protecting our intellectual property, our unique culture and we expanded access to a market of 500 million consumers covering 13% of global GDP.
The new CPTPP was renegotiated with a view to looking beyond the few current large exporters to those unaccustomed or ready for new markets, because while competition is a very healthy thing, if workers feel that their quality work going out the front door is undermined by weaker standards of work coming through the back door, support for trade suffers.
Bill C-79 is of critical importance to the Canadian economy. It is vital particularly for our agricultural sectors that are now, even as I speak, reaping the harvests that will soon be shipped to new markets. As we have said from the outset, Canada will be among the first six countries to ratify as long as the House and the other place recognize the opportunity this deal brings to countless hard-working Canadians and move swiftly to pass the bill.
Bill C-79 brings forward all legislative instruments required to ratify and implement the agreement. Other regulatory changes will also be required for Canada to ratify and that regulatory process will follow royal assent of the bill. This is not just a new trade agreement for Canada. This is a signal to the world that trade matters, that rules matter and we will not be drawn into the world of protectionism. This bill is a statement that we will seek out every opportunity and negotiate terms that benefit the middle class and those working hard to join it.
The bill also speaks directly to Canada's diversification imperative. As a middle power, we cannot afford the status quo and we cannot afford to wait for the world to come to us. Our competitiveness depends on opening more markets and making those markets more accessible particularly for small and medium-sized businesses.
On Friday we will celebrate another landmark trade agreement secured under this government, the first anniversary of the trade agreement with Europe, CETA. In just one year, business is booming. Last week we learned container traffic at the port of Montreal is already up year on year 20%. That is 20% more traffic in the made-in-Canada goods Canadians produce each and every day. 
In addition to trans-Atlantic trade, we are expanding preferential access across our hemisphere moving forward on a free trade agreement our government initiated with Mercosur, including Brazil, Argentina, Paraguay and Uruguay and enhanced membership with the Pacific alliance, including Mexico, Peru, Chile and Colombia. With the new CPTPP, we extend our reach to the Pacific with an eye to the long term. We are, after all, a Pacific nation.
That is why reorienting and renewing what is now the CPTPP is so critical for us. Asia matters to Canada. Asia is home to the world's fastest-growing middle class. By 2030, nearly two-thirds of the world's middle class, estimated to be 3.5 billion people, will call Asia home. The CPTPP is a cornerstone for Canada's greater engagement with Asia-Pacific countries and solidly anchors Canada's place in the Asian market.
There are 10 new markets on offer: Australia, Brunei, Chile, Japan, Malaysia, Mexico, New Zealand, Peru, Singapore and Vietnam. That is a trading bloc representing close to 500 million people and 13.5% of global GDP. 
Under the Comprehensive and Progressive Agreement for Trans-Pacific Partnership, or CPTPP, consumers will benefit from lower prices and greater selection. Workers will also benefit from the creation of more good-quality jobs in all export sectors across Canada.
The CPTPP translates to benefits for farmers and growers, fisher men and women, lumber jacks and jills, Bay Street and Main Street, miners and chemists, manufacturers and service providers. The CPTPP will also level the playing field for Canadian exporters staying even with competitors that already have preferential access to countries like Japan, the world's third largest economy. Last year our bilateral trade with Japan reached $29 billion; just imagine next year. The opportunities are enormous.
For example, the quality and beauty of Canadian wood is world renowned. In Japan, indeed throughout the Asia-Pacific region, the environmental and structural benefits of wooden construction are being embraced, including plans for a 1,048-foot wooden skyscraper. The home for the world's current tallest wooden building is here in Canada, a residential structure at the University of British Columbia. Incidentally, as Canada's minister of natural resources, I had the pleasure of cutting the ribbon on that project. 
With the advent of CPTPP, market opportunities for Canada's forest products sector are inviting and impressive. Canadian high-tech companies like OpenText have been battling and succeeding in the ultra-competitive Asian markets for decades. The IP protections secured in the CPTPP will protect the investments these companies have made in Canada and allow them to compete and win in Asia.
We consulted extensively with Canadians for more than two years to get the agreement right. We fought hard on their behalf to make important changes, suspensions to certain articles or side letters with the full force of international law in areas such as intellectual property, investor-state dispute settlement, culture and autos. 
The CPTPP also includes many other significant achievements. For example, financial service providers will benefit from enhanced investment protection and preferential access, including in Malaysia and Vietnam where commitments go far beyond what either country has offered in any FTA.
Through the government procurement chapter, Canadian businesses will be able to access open and fair procurement in all CPTPP markets. CPTPP parties will eliminate tariffs on over 95% of tariff lines, covering 99% of current Canadian exports to CPTPP markets, with the vast majority to be eliminated immediately upon entry into force of this agreement.
The CPTPP also addresses non-tariff measures that we know are prevalent and which create business uncertainty for our exporters. That includes the auto sector where we know non-tariff barriers have been a constant irritant. In addition, the chapter on state-owned enterprises and designated monopolies provides for rules to help ensure that state-owned enterprises operate on a commercial basis and in a non-discriminatory manner when making purchases and sales.
We did not stop there. The CPTPP also includes dedicated chapters on labour, the environment, small and medium-sized enterprises, transparency and anti-corruption. The labour chapter includes binding commitments to ensure that national laws and policies provide protection for fundamental principles and rights at work, including freedom of association, collective bargaining and the elimination of child labour and forced labour. When we relaunched stalled talks, these chapters were on ice. Now, both the labour and environment chapters are fully enforceable through the agreement's dispute settlement mechanism. 
We reaffirmed our right to regulate in the public interest. We promoted labour rights, environmental protection, and conservation. We preserved cultural identity and diversity. We promoted corporate social responsibility, gender equality and indigenous rights. Canada is now poised to be the only G7 country with free trade agreements with all of the other G7 countries.
To realize that remarkable value proposition, diversification into new markets must be a national project to which every farmer, rancher, fisher, manufacturer, entrepreneur, business owner and innovator commits their efforts.
I want to be very clear: diversification is a national priority. Diversification must be a project to which every farmer, rancher, fisher, manufacturer, entrepreneur, business owner, and innovator commits their efforts.
We need every Canadian with ambitions to grow their business to think global. We have countless people-to-people ties to almost every country on earth. These are the bridges over which more trade can flow.
We also need to support our youth in gaining global experience for their future career prospects, and securing Canada's place in the global economy. We will not stop until Canada is the epicentre of global trade and the world's most connected, stable, predictable, innovative and in-demand market on earth. We are focused on providing the middle class with unparalleled access to sell east across the Atlantic, south across our hemisphere, and west across the entire Pacific basin.
My first trip as the Minister of International Trade Diversification outside of North America was to Thailand and Singapore. In Singapore, I pushed for an acceleration of talks toward a possible free trade agreement, with the ASEAN nations adding some of the largest and fastest-growing countries to our ever-expanding piece of the Pacific pie.
While we must open opportunities for all Canadians, we must also focus on areas where Canada has a clear global competitive advantage. Our most innovative business sectors have the greatest export potential. This is a message that is coming through loud and clear through the work of the superclusters and economic strategy tables for advanced manufacturing, agrifood, health and bio-sciences, clean technology, digital industries, and resources of the future. We are committed to continuing this work with industry partners to turn high-growth Canadian companies into global successes. We are a government that invests in its ideas.
We recently announced $50 million to support diversification efforts and opportunities for small and medium-sized businesses. We need to link our small and medium-sized businesses to global supply chains and to multinationals and global infrastructure projects the world over. More global companies should see Canada as critical and integral to their supply chain, and our SMEs need access to international markets to scale-up.
Exports and imports account for 60% of Canada's GDP. This government knows that our competitiveness depends on making real investments in our future. The previous government talked a good game but focused only on the detail that worked for the top 1%. They scaled back the programs available through our trade commissioner service so it could only serve the privileged few, the ones largely operating overseas. We will reverse that trend and get our sales numbers way up.
Canada will also carry the mantle of defender of the global rules-based order. Canada played a key role in building the multilateral trading system of the last century and we will not see it eroded. We will defend it and we will reform it. Our convening power and commitment to the rules-based order is an essential strength and we will put it to work for more Canadians. That is why next month I will host a WTO reform summit in Ottawa.
Canada is the home of Marconi's Signal Hill and Bell Northern Research, precursors to our current successes in high tech. We were the birthplace of the Ski-Doo and the regional jet; the home of canola, an agri-innovation that helps feed the world; and Cirque du Soleil, which helps feed the soul.
We are the home of international gaming studios and the burgeoning hub of artificial intelligence. We are the home of the Canadarm and CANDU, the Toronto International Film Festival and Canada Goose. There is nothing like brand Canada. We are naturally global, but we have not always been actively global. The CPTPP is a call to action.
I urge all members in this House and the other place to move swiftly on this bill. Now is our time.
I urge all members in the House and the other place to move swiftly on this bill. Now is our time.",,,"Hon. Jim Carr (Minister of International Trade Diversification, Lib.)",
4752138,ca.proc.d.2018-09-17.10238511,2018-09-17,8880684e-3bb8-4705-a2b4-767f37811391,234412,"Mr. Dean Allison (Niagara West, CPC)",,Government Orders,Comprehensive and Progressive Agreement for Trans-Pacific Partnership Implementation Act,,"Mr. Speaker, I welcome my hon. colleague to the role as the new Minister of International Trade Diversification.
I have a couple of questions for the minister. I want to point out that this party and its leader said in June that we would pass the bill at all stages so we could move forward on this initiative. It was also this party and its leader who said that we would come back in the summertime and move forward on this. It was also this party, under the former leadership, which had strong chapters on environment and labour, which remain virtually unchanged with the CPTPP.
I did read the article on the port of Montreal receiving 20% more, and we see that trade is up 12%. The challenge is that exports are only up 1% to CETA countries, to European countries.
Given the fact that the minister talks about certainty and the best place to do business, the challenge we have right now is around regulation and red tape. It is around getting some types of rules in place so people understand and can invest in energy, etc. in our country.
What will the government do to show the world that we are a predictable and reliable place to invest in?",Conservative,Niagara West,Dean Allison,http://www.parl.gc.ca/Parliamentarians/en/members/dean-allison(234412)
4752139,ca.proc.d.2018-09-17.10238514,2018-09-17,,,,,Government Orders,Comprehensive and Progressive Agreement for Trans-Pacific Partnership Implementation Act,,"Mr. Speaker, I look forward to working with the member to ensure the bill can move as expeditiously as possible through the House of Commons and the other place.
The hon. member knows that in order to have expedited processes, unanimous consent of all parties of the House is required. This was not possible, and he knows that. However, I take it from his very constructive intervention that he will work with us to ensure the process is as smooth as it can be, and we both undertake to have serious conversations with our counterparts on the other side of the House to ensure the bill moves as fast as we know the Canadian people want it to move.
The member also knows that we have taken many steps to ensure the regulatory process is more clear, that the timelines are predictable and that investors understand at the front end precisely what is involved in the process. We think that is a step forward. We hope that for many years to come it will serve the people of Canada.",,,Hon. Jim Carr,
4752140,ca.proc.d.2018-09-17.10238516,2018-09-17,0f7e3c8d-e579-44c0-b8b7-202b425758e4,218968,"Ms. Tracey Ramsey (Essex, NDP)",,Government Orders,Comprehensive and Progressive Agreement for Trans-Pacific Partnership Implementation Act,,"Mr. Speaker, I too welcome the minister. However, I am quite stunned by the minister's speech today. It indicates to me that the previous minister and his team have not fully briefed him on the impacts of NAFTA for working people, which he mentioned throughout his speech. We had 400 witnesses at committee on the TPP and we received written comments from 60,000 Canadians, 95% of which opposed the trans-Pacific partnership under its previous iteration.
The minister should really be well aware that industry and labour groups in the auto and auto parts sectors in Canada are strongly opposed to the CPTPP. The auto industry is already facing potential U.S. punitive tariffs. It is in the crosshairs of NAFTA. It knows its sector inside and out and it knows how false the Liberals' claims are that the CPTPP will open up markets in the Asia-Pacific, particularly Japan.
I really encourage the minister to speak with those in the auto sector in Ontario. I also encourage him to look at the statistics around the jobs that potentially would be lost. Twenty-thousand auto parts jobs in Canada would be lost under the CPTPP. It is not just me saying that. It is groups like the Canadian Vehicle Manufacturers' Association, Unifor, the Canadian Labour Congress, as well as the Automotive Parts Manufacturers' Association of Canada. If the minister speaks with his staff, he will find it has had several meetings around this.
The auto industry does not want this trade deal. As a former auto worker who represents a region filled with auto workers, I understand this impact. Why is the government ignoring them?",New Democratic Party,Essex,Tracey Ramsey,http://www.parl.gc.ca/Parliamentarians/en/members/tracey-ramsey(218968)
4752141,ca.proc.d.2018-09-17.10238521,2018-09-17,,,,,Government Orders,Comprehensive and Progressive Agreement for Trans-Pacific Partnership Implementation Act,,"Mr. Speaker, I would like to welcome the member to this new relationship. I invite her to join us in a very constructive way to ensure the legislation passes in the interest of the entire Canadian economy.
We have been having conversations, as the member knows, with various sectors for quite some time now. We are confident that this agreement will give access to markets that these sectors do not now have.
She also knows that trade produces growth and growth produces jobs. We are interested in creating new wealth for Canadians and that this new wealth is translated into new job opportunities for Canadians working now and Canadians who are looking for opportunities to work because we have opened up export markets.
I know the member's party is not traditionally supportive of any free trade agreements. We could look at the conversation in 1993 around NAFTA, and it would be very similar to the conversation we are having today. However, the world has changed. Canada is an outward looking nation. We know that these agreements will create opportunities for the working people of Canada, and we invite the member to join us to ensure we get there as quickly as we can.",,,Hon. Jim Carr,
4752142,ca.proc.d.2018-09-17.10238524,2018-09-17,b6e2c8aa-fc83-4d52-ad66-7910b8805f90,216881,"Mr. Arnold Viersen (Peace River—Westlock, CPC)",,Government Orders,Comprehensive and Progressive Agreement for Trans-Pacific Partnership Implementation Act,,"Mr. Speaker, it is great to back in the chamber, this place of democracy in Canada.
I listened intently to the minister's speech. One of the things I heard over the summer was about the business climate in Canada, particularly in northern Alberta, Peace River—Westlock, the riding I come from, where we are seeing mass amounts of capital fleeing the province of Alberta and Canada. I know the government wants to use this to say that Canada is open for business. What is the government's plan to ensure we can get some of these major energy projects up and running again, particularly in northern Alberta?",Conservative,Peace River—Westlock,Arnold Viersen,http://www.parl.gc.ca/Parliamentarians/en/members/arnold-viersen(216881)
4752143,ca.proc.d.2018-09-17.10238527,2018-09-17,,,,,Government Orders,Comprehensive and Progressive Agreement for Trans-Pacific Partnership Implementation Act,,"Mr. Speaker, as the member knows, I have had the privilege for the last two and a half years, almost three, of working with the people of northern Alberta, working with the energy workers of northern Alberta.
In my travels around the world, and most recently in the Asia-Pacific, I know there is a real appetite to have more serious conversations about the resources that are so important to the member's constituents, his province and indeed for all Canadians. Therefore, the sustainable development of our natural resources and the exploration of new export markets for those resources is a very important part of the government's strategic role. I look forward to working with the hon. member to ensure we do it in the best way we can.",,,Hon. Jim Carr,
4752144,ca.proc.d.2018-09-17.10238529,2018-09-17,07cf5767-802c-406c-92a7-7dc92af79b40,229526,"Mr. Kevin Lamoureux (Parliamentary Secretary to the Leader of the Government in the House of Commons, Lib.)",,Government Orders,Comprehensive and Progressive Agreement for Trans-Pacific Partnership Implementation Act,,"Mr. Speaker, we recognize that Canada is really dependent on world international trade. Since day one, the Prime Minister has been focused on Canada's middle class and those aspiring to become a part of it. In many ways trade is one one way we can enhance and grow that middle class.
Could my colleague provide for the House his thoughts on how trade agreements and trade in general enhance the opportunity for Canadians in all regions of the country to benefit and, in particular, for what has been the Prime Minister's number one priority, Canada's middle class^",Liberal,Winnipeg North,Kevin Lamoureux,http://www.parl.gc.ca/Parliamentarians/en/members/kevin-lamoureux(229526)
4752145,ca.proc.d.2018-09-17.10238531,2018-09-17,,,,,Government Orders,Comprehensive and Progressive Agreement for Trans-Pacific Partnership Implementation Act,,"Mr. Speaker, my fellow Manitoban understands how dependent we all are on international trade and how important it is for us to diversify markets. However, it is important to add another dimension to the answer and the discussion.
We spend an awful lot of time talking about how we distribute the national wealth. These are very important conversations. We all have ways we think we should be distributing this wealth that are equitable, that give opportunity to Canadians.
Also, we have to talk about creating wealth. The wealth is created in large measure by small and medium enterprise. Those enterprises that trade most freely, particularly in expanding markets, are the ones that create good jobs, the ones that create higher-paying jobs. That is the link between trade, wealth creation and jobs.",,,Hon. Jim Carr,
4752146,ca.proc.d.2018-09-17.10238533,2018-09-17,eaa6694f-1e20-4aae-ad3b-e694b0e12c59,224170,"Ms. Elizabeth May (Saanich—Gulf Islands, GP)",,Government Orders,Comprehensive and Progressive Agreement for Trans-Pacific Partnership Implementation Act,,"Mr. Speaker, I congratulate the minister of international trade on his new portfolio. There are a lot of issues with TPP, but the short question is about the investor-state provision. We are now opening ourselves up to completely groundless charges against Canada, which Canada inevitably loses. Such was the case with Bilcon, where our Environmental Assessment Agency did a great job; two ministers, federally and provincially, did a great job; and Bilcon managed to go to a secret chapter 11 venue. Even though Canada appealed, we lost, and we now owe Bilcon up to $580 million. 
Why would we open ourselves up now to disputes from additional countries, including Malaysia and Japan? I do not think we will have much trouble from Brunei, but from large economic players. Their corporations can attack our laws, which are in place to protect our environment, labour rights, and public health. ",Green Party,Saanich—Gulf Islands,Elizabeth May,http://www.parl.gc.ca/Parliamentarians/en/members/elizabeth-may(224170)
4752147,ca.proc.d.2018-09-17.10238535,2018-09-17,,,,,Government Orders,Comprehensive and Progressive Agreement for Trans-Pacific Partnership Implementation Act,,"Mr. Speaker, I just have a small correction, if I could, for my friend and hon. member: It is international trade diversification. That is a very purposeful and important word, and it leads to an answer to her question. Canada must always retain the capacity to respect the rules of the world trade order. As a matter of fact, I think we are on the verge of helping to lead a discussion on reforms to the WTO. It is also important that investors have confidence when they invest money around the world that those investments are reasonably protected. 
I also look forward to working with my hon. colleague as we seek swift passage of this important legislation. ",,,Hon. Jim Carr,
