basepk,hid,speechdate,pid,opid,speakeroldname,speakerposition,maintopic,subtopic,subsubtopic,speechtext,speakerparty,speakerriding,speakername,speakerurl
4739800,ca.proc.d.2018-04-16.10049238,2018-04-16,deea27ee-c7f2-4442-99ac-2417bbea8359,219640,"Mr. Steven MacKinnon (Parliamentary Secretary to the Minister of Public Services and Procurement, Lib.)",,Government Orders,"Budget Implementation Act, 2018, No. 1",,"Mr. Speaker, I am proud to rise once again on behalf of the people of Gatineau. They did me the supreme honour of electing me to represent them in this House, and I am grateful to them every day for this honour and the weighty responsibility that comes with it. I am proud to rise today to support this bill and our government's budget plan in general.
Today is our first day back in the House since tragedy struck the community of Humboldt, Saskatchewan. Like Humboldt, Gatineau is a hockey town, a town where parents work hard every day to help their kids take part in organized sports like hockey, a town where parents put their kids on buses and send them off on long overnight trips to all kinds of destinations in the United States, Ontario, the Maritimes, and other parts of Quebec. On behalf of the people of Gatineau, I want to express our deepest condolences and dismay at what has happened. Our thoughts are with the parents and communities affected by this horrific tragedy.
In Gatineau, we introduced a plan based on our national election promises that focuses on the middle class and investing in our communities. That includes public transit, so this year I was very pleased to participate in announcing the Rapibus extension as well as other major construction projects in Gatineau, such as the Parks Canada artifact storage facility, the Library and Archives Canada Gatineau 2 document preservation facility, and the revitalization of Terrasses de la Chaudière. We are investing heavily in federal public assets in Gatineau.
I can assure my constituents that I will continue to fight for more investment in public transit. One of the files I am working on is a sixth interprovincial link between Quebec and Ontario, which people have been debating for the past 100 years. I made it my mission to champion that link, and I will continue to advocate and fight for it until the day the announcement is made. 
More generally speaking, our budget plan is working. It is working for parents and for our most vulnerable seniors, whose guaranteed income supplement has gone up by 10%. It is working for infrastructure in Gatineau and across the country. It is working for our small businesses.
 I have been very pleased to meet business people in my riding on several occasions. They are very satisfied and very happy that we have delivered on our commitment and are lowering the small business tax rate to 9% beginning next year. Our plan is also working when it comes to unemployment, which is under 6% at just 5.9%. That is the lowest unemployment rate ever seen for as long as Canada has been recording these statistics. Since the second quarter of 2016, GDP growth has been 3.7%, the best rate of any major industrialized country. Wage growth in Canada is tracking at approximately 3%. Once again, that rate is higher than anywhere else in the world. Year after year, the projected debt-to-GDP ratio is going down. Our plan is clearly working. It is improving Canadians' quality of life and prosperity and helping us keep our campaign commitments and the solemn promise we made to hard-working Canadians.
I want to highlight two initiatives in this budget. People sometimes become cynical at election time. People make choices based on personalities and specific commitments, but also based on philosophies. Here are two initiatives that Canadians would never have seen under a Conservative government, because these are not the kinds of things the Conservatives would ever choose. These two initiatives will benefit those who need it the most in our society, specifically people working hard to join the middle class. They are people working hard to become more prosperous and to be more productive citizens for themselves, for their children, and for future generations. Of course I am talking about the Canada workers benefit and the Canada child benefit.
What is the Canada workers benefit? We know that there are people who are receiving social assistance or other benefits. Perhaps they have a family member who is ill. Perhaps they work part time. Perhaps they are caring for their children. Regardless of their circumstances, they find it difficult to make the decision to get off social assistance and enter the labour market with confidence because they may be penalized by doing so. They might not earn enough to justify getting off welfare or other social programs. Obviously, with such a low unemployment rate, everyone benefits when the number of people in the labour force increases. We also want these people to have the dignity that comes with productive work and personal growth. We want them to feel as though they are contributing to the economy and becoming productive citizens.
The Canada workers benefit was created specifically to help those people and provide them with direct assistance. This year, eligible workers will automatically receive the benefit after filing their tax return, without submitting an application. They will be entitled to an increased Canada workers benefit. Our initiative will affect two million Canadians and lift 70,000 people out of poverty. They will be eligible for up to $1,300 in benefits tax free.
There is also the Canada child benefit, which will be indexed this year for the first time. In my riding of Gatineau alone, 11,260 payments were made in January 2018 for 19,860 children. An average payment of $540 a month represents a total of $6.1 million in the pockets of Gatineau parents. I am proud of this, because this money is going directly to those who need it most. These people must make choices for their children. They need to spend money to enrol their children in sports or piano lessons, or to invest in a registered education savings plan. We committed to make these choices, and these are choices that a Conservative government would never have made or maintained, because it wants to eliminate the deficit at any cost. One has to wonder what a Conservative government would cut. This is also a tax-free benefit that is automatically reinvested in our economy and in local businesses.
I am proud of these two measures. Unfortunately, I do not have enough time to talk about the other wonderful initiatives in this year's budget.
I am particularly proud of the fact that we are keeping our word and fulfilling our commitments to the people who need it most. They can access these resources and become good, highly productive citizens who can keep contributing to the Canadian economy.",Liberal,Gatineau,Steven MacKinnon,http://www.parl.gc.ca/Parliamentarians/en/members/steven-mackinnon(219640)
4739801,ca.proc.d.2018-04-16.10049447,2018-04-16,61c83e21-f9a3-4e4b-b881-4b2d1ce33c43,234471,"Mr. John Brassard (Barrie—Innisfil, CPC)",,Government Orders,"Budget Implementation Act, 2018, No. 1",,"Mr. Speaker, I am glad that my glass was full with water every time the hon. member blamed the previous Conservative government for the past.
I want to talk specifically about deficits. On this side of the House, we have asked about that on numerous occasions and the finance committee has asked on numerous occasions. The member will recall that the promise in the last election by the Prime Minister was to have minor deficits and to balance the budget by 2019. We now know that the budget will not be balanced until far off. The finance minister is not even admitting when the budget will be balanced. 
My question to the hon. member is this: When will the budget be balanced?",Conservative,Barrie—Innisfil,John Brassard,http://www.parl.gc.ca/Parliamentarians/en/members/john-brassard(234471)
4739802,ca.proc.d.2018-04-16.10049463,2018-04-16,deea27ee-c7f2-4442-99ac-2417bbea8359,219640,Mr. Steven MacKinnon,,Government Orders,"Budget Implementation Act, 2018, No. 1",,"Mr. Speaker, lessons on deficit and debt from the Conservative Party are lessons that we do not normally take. The last balanced budget presented in this House was, of course, presented by a Liberal government. It was absolutely a pride to create a fiscal situation that benefited the previous government when it was first elected. However, the Conservatives automatically, immediately, and systematically, in a structured way, took us back into deficit, and then for 10 years there were deficits as far as the eye could see.
 We will take no lessons from the other side of the House with respect to deficits. Those people borrowed and begged every year they were in office, and now they get up and decry it. They should be ashamed of themselves.",Liberal,Gatineau,Steven MacKinnon,http://www.parl.gc.ca/Parliamentarians/en/members/steven-mackinnon(219640)
4739803,ca.proc.d.2018-04-16.10049484,2018-04-16,4efcc2e2-bd91-4234-b907-a24838d4f1aa,217139,"Ms. Christine Moore (Abitibi—Témiscamingue, NDP)",,Government Orders,"Budget Implementation Act, 2018, No. 1",,"Mr. Speaker, people come to my office every week because they are unable to access the benefits to which they are entitled. These people are often poor and unable to get the Canada Revenue Agency to process their files. It is maddening to see the number of documents they are asked to produce, for example, to prove that their children really do live with them. I really do not know where they would be if not with their parents. In every case, these people are poor and could have used that money. 
 Some people have not received any benefits since 2009, and the government has never helped them get that money. These people come to my office and I help them as best I can to figure out their file with the Canada Revenue Agency. In some cases, they have missed out on $20,000 in benefits. 
The member believes that the Canada child benefit lifts all children out of poverty. However, the reality is that many parents never access these benefits and the government is not doing anything to help them. They do not even have access to in-person services and are forced to fight for these benefits. We try to help them as best we can but, sadly, some cases are overlooked because the Canada Revenue Agency does not send me a list of those who might need help. 
 What are my colleague's thoughts on that?",New Democratic Party,Abitibi—Témiscamingue,Christine Moore,http://www.parl.gc.ca/Parliamentarians/en/members/christine-moore(217139)
4739804,ca.proc.d.2018-04-16.10049521,2018-04-16,deea27ee-c7f2-4442-99ac-2417bbea8359,219640,Mr. Steven MacKinnon,,Government Orders,"Budget Implementation Act, 2018, No. 1",,"Mr. Speaker, we made a commitment in the last election, one that we are working hard to fulfill. That commitment was for automatic enrolment of the people my colleague was talking about. There are indeed people who do not file tax returns. However, we encourage everyone to file a tax return so that we can determine whether they are eligible for benefits. I am especially proud of the fact that, starting this year, eligible workers will automatically receive the Canada workers benefit, without needing to apply. 
I just listed a few statistics about my riding, and we can get the figures for my colleague's riding or other ridings. These are, of course, benefits that automatically go into Canadians' bank accounts, under the Canada child benefit, and they are tax free. Yes, we are working very hard.
The member mentioned the people she meets in her riding. I too am meeting people, and we handle their files with care. There are some exceptions, but I am certain that with a little bit of work, we will be able to make sure that Canadians automatically receive the benefits they are entitled to.",Liberal,Gatineau,Steven MacKinnon,http://www.parl.gc.ca/Parliamentarians/en/members/steven-mackinnon(219640)
4739805,ca.proc.d.2018-04-16.10049559,2018-04-16,e277e13e-59ec-425f-a957-eb5e54d8cb62,218743,"Mr. Gérard Deltell (Louis-Saint-Laurent, CPC)",,Government Orders,"Budget Implementation Act, 2018, No. 1",,"Mr. Speaker, I am very pleased to speak after my colleague from the Outaouais region, the hon. member for Gatineau, for whom I have a great deal of respect and esteem, despite his oversights, to put it politely.
Before getting down to the nitty-gritty of this budget, let us establish the facts. What was the state of Canada's economy when the Liberal government was elected nearly two and a half years ago? There is no denying that the Liberals are an extraordinarily lucky bunch. When they came to power, the house was in order. Canada had a budgetary surplus, not a $2.9-billion deficit. We like to compare ourselves to the best. Let us compare ourselves to the G7. Canada had the best debt-to-GDP ratio of all G7 countries. Let us not forget that, when we came to power, we had just come through the worst economic crisis on the planet since the Great Depression of the 1930s. In the most challenging economic times, our government was able to keep Canada afloat, allowing it to emerge from the crisis with one of the strongest economies possible.
Then, unfortunately the Liberals came to power. That is the problem. Let us not forget that they were elected on a promise to run small deficits for three years and to return to a balanced budget in 2019. That was the Liberal Party's solemn promise. That promise then vanished into this air as small deficits grew into deficits three times larger than planned and, worse yet, as achieving zero deficit by 2019 went from hypothetical to unrealistic. These people have absolutely no idea when they will return to a balanced budget. We will be in deficit for the foreseeable future.
The finance department says that, if nothing changes, Canada could, technically, in theory, return to a balanced budget in 2045. Our economy would certainly struggle in the meantime. The Liberals were elected on promises that they have now broken. They promised a small deficit, but ran up a big one. They promised a zero deficit and a balanced budget. They said the deficits would support an infrastructure program to stimulate the economy, but that is not what they delivered. They promised hundreds of billions in infrastructure spending, but the finance department's reports show that very little of the infrastructure funding has actually been handed out. The government is using these chronic deficits for routine spending, not investment.
This is economics 101. It makes perfect sense for the head of a household to borrow money to buy a home and then pay that money back, but anyone borrowing money from the bank to buy groceries has a problem. That is not an appropriate way to manage money. Anyone who tries to do what the Liberal government is doing is headed for a brick wall. 
My Liberal colleague from Gatineau talked about how amazing the Canada child benefit is, about how the government is lifting people out of poverty and giving them all kinds of money. They have no trouble handing out money that is not theirs, money they are borrowing from our children. A deficit is just deferred taxation, and that is one thing this government is very good at. It is constantly maxing out its credit card.
That is why we completely disagree with the government's policy. The minister, the member, and our Liberal colleagues seem to have forgotten that in their first iteration of the Canada child benefit, which was to be absolutely extraordinary, they forgot a small detail: they forgot to take inflation into consideration. Any accountant at any firm who forgot to factor in inflation would be dismissed with a swift kick in the backside. The government, however, still crows over its lofty principles, claiming to be doing the right thing and giving more money to children. I can see why this is the party for families, the party for children. By working for children, the government is making them foot the bill down the line.
The government boasts about its lofty principles, but reality is catching up to it. For example, the Liberals are always repeating how they are going after the so-called 1%, the richest Canadians. The top 1% of Canadians with the highest salaries are going to pay. The Liberals forgot to mention that these people already pay 70% of the taxes in Canada. They said that these people would definitely pay more taxes. Is that right? Not exactly. In a report released last fall by the Department of Finance, and not by the Conservative Party, we learned that not only do the so-called 1%, the wealthiest Canadians, not pay more taxes, they pay less. The wealthy paid $1.2 billion less under the current Liberal government even though the Liberals kept repeating that they would make the rich pay more in order to give to the poor. Not only are the rich paying less taxes, but the poor were given money we do not have because the Liberals are running up a deficit. They went into deficit financing.
Clearly, this government says one thing and does the opposite. It was elected on promises it cannot keep. Faced with their greatest economic challenge yet, the Liberals are doing nothing.
Now I want to raise the question of competitiveness with the United States of America, our great ally and partner but also our greatest competitor. 
We all recognize that the president is not exactly the same kind of man that we had when we were in office. We can like him or we can dislike him, but we have to deal with him. That is the reality of politics. What we see now in the new administration, the Trump administration, is someone very aggressive, someone very productive, and someone who is first and foremost helping small business in America, and big business too. He is helping the business community of America.
What we see in the government is everything but that. Worse than that, it has no plan. The Liberal government has no plan to address the serious issue raised by the new administration in America. There is nothing in the government's budget to help our small business community to face and address the issue of the new competitiveness of America. There is nothing to address the fact that maybe NAFTA will collapse. That would not be good, so we have to be ready for that. 
We do not want it to collapse. We were the party that created NAFTA, the first free trade agreement, in 1988, thanks to the Right Honourable Brian Mulroney. We can be proud of this heritage. We also recognize that the other governments pushed that forward, even if at that time they said they were not going to be part of that deal. That was good. Now we have to address the new reality that maybe NAFTA will not be run again.
What can we do? What will the government do? There is nothing in the budget. What is the government doing to help our businesses address the issue of the new help being given by the American administration to their business community? It is doing nothing.
That is also worrisome. The budget needs to address today's realities. However, today's global economic reality is not about the collapse of oil prices as it was in the past. On the contrary, oil prices have risen. It is not about dealing with the worst economic crisis. It is exactly the opposite. We are experiencing an economic boom.
It is not about the collapse of the American economy, like it was in 2008-09. On the contrary, the American economy is booming. However, we are dealing with an aggressive protectionist American President. That is his right. We respect his choice and he makes his own decisions of course. We are dealing with a very aggressive protectionist American President and the government is doing absolutely nothing. The American President strongly supports the private sector and helps entrepreneurs a great deal, unlike Canada, whose government led an unspeakable attack against our entrepreneurs last summer with the reprehensible plan it tabled on July 11, in the middle of the summer, if memory serves. Fortunately, thanks to the extraordinary work of the member for Carleton, Canadian business people across the country united and put a stop to the Liberal government's plan, which sought to punish them for creating jobs and wealth. It is a good thing that we were there. 
There is nothing in this budget to help business owners or meet their needs. The government is going on a spending spree, as we have mentioned, and is creating deficits. We are talking about a 20% increase in spending. Twenty percent in three years is a lot. It represents $60 billion. A 2% or 3% increase would be in keeping with inflation. A little is okay, but in this case, we are talking about hyper-inflation, not inflation. A normal increase would have been 6% in three years. However, this government has increased spending by 20% in three years. Such is the hallmark of the Liberal government. We think this is very bad. The spending was supposedly for investments in infrastructure, but there have not been any infrastructure investments. The government is investing just 0.1% of our GDP on creating wealth and jobs in our country. This is not what the government promised during the election campaign. It promised to run small deficits. This is no surprise, given that the Prime Minister may not have studied at the great schools of economics. This is no guarantee, but three years ago, the Prime Minister introduced an unprecedented economic policy, or economic philosophy. I remind members that when the hon. Joe Oliver tabled the final budget of the previous government, the leader of the Liberal Party said that the budget would balance itself.
I was in university when I was young. I studied a lot, and I have never seen the fiscal or economic theory elsewhere, other than from the present Prime Minister, that a budget balances by itself. If there is someone else who has some information about that, I will welcome it. I really want to understand how someone can seriously speak such stupidity, but that is the signature of the present Prime Minister. 
The Liberals have attacked businesses in several ways, by raising their taxes and reducing the government assistance they might be eligible for. The best way to help our businesses is to tax them less. However, in the past three years, the government has done something entirely different. First, it imposed a carbon tax, which will come into force across Canada in a few short months. Next, it reduced all the tax credits we had introduced for research, recruitment, and business development. The tax credits we brought in have been abolished by this government. That is the kind of thing that makes businesses owners lose confidence. This is troubling. All the economic indicators of business confidence are negative. Private investment in Canada is down 5% since 2015. Compared with the United States, it is not just a drop of 5%, it is actually another 5% to 9% on top of that. That is a difference of 14%. Canadian business owners feel uncomfortable and are investing less, while American business owners are investing three times more, relatively speaking. That is not a good thing.
Foreign investment in Canada has fallen by 42% over the past year. This means that less wealth is being created, since nothing is better for a nation's economy than foreign investment. It is a real source of wealth creation. When entrepreneurs create jobs and wealth, it is basically because their products are sold abroad, whether in Europe, Asia, or the United States. This is about the Canadian dollars, yen, euros, or even pounds that might be invested in our economy. That is the real source of wealth creation. That is why we are very worried about the fact that foreign investment has fallen by 42%.
As a final point, I want to talk about the debt. I have a bit of an obsession with the debt, because those folks over there were elected on a promise that they would run up small deficits and balance the books again by 2019, but they are not keeping their promises. On top of that, the debt generated by deficits is money that we cannot spend for our children. Quite the opposite, it is our children who will be forced to pay because of today's mismanagement. This government will go down in history for bringing Canada's national debt to $1 trillion. This is not “billions of bilious blue blistering barnacles” for those familiar with Tintin, but rather $1 trillion. This has “Liberal government” written all over it.
All these bad signs have shaken people's trust in their political leaders. A party can be elected on a certain campaign platform and then change direction based on external factors; however, in this case, there are no external factors. It is nothing but bad faith that has led the Liberal government to run up such huge deficits, rather than the small deficits promised and the balanced budget promised by 2019. Instead, it has absolutely no idea when we will return to a balanced budget. This government has just catapulted Canada towards the sad reality of a trillion-dollar debt. That is right, I said $1 trillion.
For all these reasons, we will vote against this budget. We feel it is an irresponsible, wrong-headed budget that will force our children to pay the price. It does nothing to help our economy and our entrepreneurs prepare for the new reality of a powerful neighbour that is both our number-one partner and our number-one competitor, the United States of America.
 We hope this government will get public finances under control and take the bull by the horns so that one day, maybe a year and a half from now, we will be fortunate enough to have a realistic and responsible government led by the hon. member for Regina—Qu'Appelle. ",Conservative,Louis-Saint-Laurent,Gérard Deltell,http://www.parl.gc.ca/Parliamentarians/en/members/gerard-deltell(218743)
