basepk,hid,speechdate,pid,opid,speakeroldname,speakerposition,maintopic,subtopic,subsubtopic,speechtext,speakerparty,speakerriding,speakername,speakerurl
4739890,ca.proc.d.2018-04-16.10050071,2018-04-16,a71a1741-7ff2-4246-b0da-4622e96b10cf,235389,"Mr. Guy Caron (Rimouski-Neigette—Témiscouata—Les Basques, NDP)",,Emergency Debate,Trans Mountain Expansion Project,,"Mr. Speaker, let me pick up on what the parliamentary secretary said. This is not the way that he said it during the campaign. This is not what he said on his campaign website during the electoral campaign. What he said on his website was, “A new, independent, evidence-based process must be established. The Kinder Morgan expansion project must satisfy this new rigourous review..”.
There has been no new rigorous review. This is at the core of the problem we are facing now. We are currently undergoing an emergency debate, and the Liberals only have themselves to blame. They spent the whole electoral campaign in 2015 talking about the need to redo the environmental assessment process and that we needed to ensure there would be a more rigorous process in place which Kinder Morgan, the Trans Mountain project, would have to undergo.
The Liberals have failed to fulfill this promise. They have failed to meet the hope that people, especially in British Columbia, have in the government. This is the crux of the problem right now. We have hundreds of people who are protesting against the construction of this pipeline. We have a government that is musing sometimes about the possibility of sending the army to face them. This makes no sense.
Not only did the Liberals promise during the campaign that the Trans Mountain project would undergo a new environmental assessment process, it was said extensively. The Prime Minister has said since 2013, since he was the leader of the Liberal Party, that governments grant permits and communities grant permission.
This is what the party that is now in government has said for five years. Now what we have in this House is a competition between both the government and the official opposition to see who will be the biggest booster of this project, without taking into account what the people in British Columbia are thinking about and saying. They do not trust the government. They do not trust the process.
I understand the situation because we dealt with the same problem when we talked about the energy east pipeline for Quebec. I seriously doubt that this government would have had the guts to do to Quebec what it is currently doing to British Columbia. It is not a matter of war between the two provinces. Alberta Premier Rachel Notley is doing what she thinks she needs to do to protect her economy and the interests of her people. That is why she was elected. The premier of British Columbia is doing the same thing.
Let me be clear. John Horgan was elected on the basis of the opposition he has of the process that is currently pushing this project down the throats of the provinces.
We have been talking a lot about how the economy and the environment go hand in hand. We, on this side of the House, have been saying that for years and possibly even decades. The government decided to adopt that approach. That is fine.
What has dawned on me in this debate is that the government says we cannot talk about the economy without talking about the environment. We agree in principle, but it is a very convenient excuse for the Liberals. Every time that we ask them a question about the environment and the environmental consequences, they reply that we do not know about the economy. Then, when other questions are about the economy and the jobs being created, they talk about the importance of the environment. Let us be consistent here. 
We have a crisis of the government's own making because during 2015, the Liberals were basically hunting for votes. They promised that we would have a new electoral system in place and that 2015 would be the last time for a first-past-the-post election. That was false. They promised everything they could to be in the position they are in. They cannot blame the official opposition and the NDP for the mess they have themselves created by raising those expectations. 
I see a lot of British Columbia MPs here. They will have a significant challenge, an uphill battle, in 2019. Their constituents, especially those around Burnaby and Vancouver, will ensure that the government will be reminded of the promises from 2015 that they broke. 
I talked about the promises we heard from the parliamentary secretary during the 2015 election. Let us hear about the Liberal MP for Burnaby North—Seymour. He is now the parliamentary secretary for fisheries and oceans. He said during the election that they were going to redo the National Energy Board process and that Kinder Morgan would have to go through a new revised process. Consistently in British Columbia, Liberals were elected on this commitment. Why do they think people are at the gate now? Why are they surprised? 
That does not make any sense. We are in this situation partly because of the changes that the Conservative government of the time made to the environmental assessment process in 2012. The process was not perfect, but at least the provinces were a lot more involved than they are now. I know that Quebec and British Columbia were far more involved than they are now in the process that the Conservatives put in place.
Mr. Speaker, I am also reminded that I will be splitting my time with the member for Skeena—Bulkley Valley, which is something I should not have forgotten. I am sure he will have interesting things to say as well after I am finished. 
The process we had in 2012 was not ideal, but it got the job done. I was in Parliament back then. Then the Conservatives made changes that cut down the time available to conduct studies and hold consultations as well as the number of stakeholders allowed to express their views on projects. After all that, it was no wonder people objected to this project. I know because I represent a riding right next to Cacouna, where there was a proposal to build an oil terminal that would have endangered marine animals, especially belugas. The proposal was flawed, but there was an attempt to force it through, and the people reacted. The first thing people realized was that there were precious few opportunities for them to air their views on this issue. That is what the Liberals were supposed to change. It is also what we promised to change if we took office, but they refused to actually do it.
What we have right now is a crisis, because the Liberals failed to fulfill the election promises they made, and people have noticed.
 This is not a simple matter. As the Prime Minister said, it may eventually become a constitutional matter, because in his mind it is clear that the federal government has the sole responsibility for this, and it can impose a decision on any province that does not agree. This reminds me a lot of what his father was saying at the time. However, if we pursue that logic to the extent of it, then what does it mean for first nations and indigenous people? If the government feels that it has the sole responsibility, the sole power in implementing and pushing a project like this, that means it will have the sole power in pushing it down the throat of indigenous people as well. This is a very dangerous path that the government is pushing forward.
We have proposed a sensible solution that will be more collaborative than what the government is promising right now. I encourage the government to go in that direction and seek an agreement with British Columbia, which is already on board, with first nations and indigenous people, and with Alberta, to seek clarity at the Supreme Court of Canada and ensure whether this is really the sole responsibility of the government, and whether the environmental laws of the provinces matter or do not matter. The previous decisions of the Supreme Court were not linked to a project so controversial and so misaligned with provincial desires. I think it would be wise for the government to listen to this advice. ",New Democratic Party,Rimouski-Neigette—Témiscouata—Les Basques,Guy Caron,http://www.parl.gc.ca/Parliamentarians/en/members/guy-caron(235389)
4739891,ca.proc.d.2018-04-16.10050074,2018-04-16,3106c3be-f49e-4c55-9d12-fb6441875251,219988,"Mr. Randeep Sarai (Surrey Centre, Lib.)",,Emergency Debate,Trans Mountain Expansion Project,,"Mr. Speaker, my colleague across the way said that there has to be community consent and community buy-in, and I completely agree. 
What about the 42 indigenous communities that have signed on? What about the company that has actually engaged with them? There are 30 indigenous communities in British Columbia that have signed beneficial agreements and are now counting on them. Does that not count as community consent?
 The companies that work with these communities are given instructions to work with them to get their involvement and buy-in. After doing all these steps, after getting through the NEB process, not once but twice, what is the answer to those 42 communities that have committed and signed beneficial agreements, including 30 in British Columbia?",Liberal,Surrey Centre,Randeep Sarai,http://www.parl.gc.ca/Parliamentarians/en/members/randeep-sarai(219988)
4739892,ca.proc.d.2018-04-16.10050076,2018-04-16,a71a1741-7ff2-4246-b0da-4622e96b10cf,235389,Mr. Guy Caron,,Emergency Debate,Trans Mountain Expansion Project,,"Mr. Speaker, what about the City of Burnaby? What about the cities that are in the path of this pipeline as well? If we are talking about consent, let us go to the fullest extent of what it means.
What we are seeing right now, with the message that the government is sending, is that for this project the government is reacting. The Liberals are very nervous that it might not pass, and they have been fighting with the Conservatives to see who the biggest booster of this project is and who can actually implement it as fast as possible. 
Let us make no mistake. When the Prime Minister is telling us in the House, and all Canadians, that the government will have the power to enforce the implementation of this project and that it is the sole level of government that can do so, this means nothing for the consent that is being sought. It means nothing for the guarantees of reconciliation for first nations in the future, and it means nothing for the communities that have legitimate questions about the potential dangers and risks of those projects.",New Democratic Party,Rimouski-Neigette—Témiscouata—Les Basques,Guy Caron,http://www.parl.gc.ca/Parliamentarians/en/members/guy-caron(235389)
4739893,ca.proc.d.2018-04-16.10050079,2018-04-16,26c8b0bc-42d4-4db5-bf7d-1e1544c7b4b5,218173,"Mr. Dan Albas (Central Okanagan—Similkameen—Nicola, CPC)",,Emergency Debate,Trans Mountain Expansion Project,,"Mr. Speaker, the member has been given a lot responsibility by his leader, Jagmeet Singh, who has expressed various views on this. 
As a British Columbian, I have concerns, especially when I hear from my constituents who are also concerned, that members of this place are participating in contravening court orders. One of the member's caucus who has participated is facing sanctions in front of a court. 
I would like to know if the member's leader, Jagmeet Singh, has instructed this gentleman to work with his caucus to make sure that, as members of Parliament, we can have debates about the laws of this country but we will not violate them. We cannot be in both streams. This is not a question of democracy. It is not a question of constitutionality. It is respect for the rule of law. Has Mr. Singh put an edict out for his caucus to support the rule of law and not participate in future protests that violate it?",Conservative,Central Okanagan—Similkameen—Nicola,Dan Albas,http://www.parl.gc.ca/Parliamentarians/en/members/dan-albas(218173)
4739894,ca.proc.d.2018-04-16.10050081,2018-04-16,a71a1741-7ff2-4246-b0da-4622e96b10cf,235389,Mr. Guy Caron,,Emergency Debate,Trans Mountain Expansion Project,,"Mr. Speaker, we are all grown adults here. We all make our own decisions, and we all assume responsibility for those decisions. That is the case in this House, and that is the case outside of this House. What I can say about the protests that are taking place right now is that the people who are protesting what is going on are acting out of genuine concern. This concern has not been adequately responded to by the government, and I would submit that, at the time, this was the case for the previous government as well.
Instead of once again using the force of law and order to try to force a decision, why do we not try to get the input of those who are going to be at the receiving end of that decision? This is really at the core of the problem right now. These people do not feel that they have been listened to, and honestly, with the process that we have, they have not. They have not been listened to. The new process that was put in place, and that is still in place right now for the Trans Mountain project, was a process that was hurried, and it rejected a large number of people who wanted to speak about it, to present, and to intervene. People do not feel that they have been listened to because the intent was to try to speed up this project as much as possible, and this is what we have right now. We have hundreds or thousands of people opposing it actively and this will not be going away, so we might as well try to find a way to get along with it. This is why I am suggesting that the government go to the Supreme Court of Canada with Alberta, B.C., and first nations.",New Democratic Party,Rimouski-Neigette—Témiscouata—Les Basques,Guy Caron,http://www.parl.gc.ca/Parliamentarians/en/members/guy-caron(235389)
4739895,ca.proc.d.2018-04-16.10050083,2018-04-16,031462db-8f61-48ed-bf9f-b033eb8312bb,233016,"Mr. Nathan Cullen (Skeena—Bulkley Valley, NDP)",,Emergency Debate,Trans Mountain Expansion Project,,"Mr. Speaker, I enter this debate, which is an emergency debate, as many have called this situation with the Kinder Morgan proposal a crisis. For many Canadians, it does represent a crisis. Actually, from both sides, if we want to take at least two sides of the issue, it is a crisis.
For those who are in Alberta and in the energy sector seeking to move product to market, particularly Asian markets, this represents a crisis of uncertainty and frustration with a process that was promised to be different. This actually unites them with the people on the other side of this issue, who were promised a better process and more clarity about rights and title for indigenous Canadians, about protection for our environment, and about some understanding of how the environment and the economy go together, which the Liberals constantly talk about. 
I represent northwestern British Columbia, and for many of the people I represent this is a movie they have seen before. When northern gateway was first proposed, it met with stiff and consistent resistance, as the voices of those who had legitimate questions about the project and about the safety of our rivers and our ocean environment were rejected and refused. They were not allowed to testify. In fact, they were called, by their own government, enemies of the state and foreign-funded radicals. Do we hear some similar rhetoric brewing up again, that those who dare to ask questions or pose significant concerns over something that potentially threatens their lives and communities are somehow un-Canadian?
Now, the Liberals came in on a promise to do better than Stephen Harper. When it comes to the environment in particular, that does not seem like it would be all that hard to do. When Stephen Harper was in office, he gutted some of our most fundamental environmental protections, which had existed for decades. The bar was set very low. He put in place climate change targets that the Liberals called ridiculous and unsatisfactory, the same climate targets that the Liberals cannot even meet now, and the environmental process that these pipelines were going through rejected the claims of first nations and ignored significant and basic concerns.
I say to my colleague and friend, the natural resources minister, that he and his government cannot answer a question such as whether bitumen sinks when it hits salt water or fresh water, and how, for God's sake, one cleans it up if it does. They cannot answer that question. They could not answer it when northern gateway was proposed in northern British Columbia. They still cannot answer it, years later, when they are pushing their Kinder Morgan project forward in the south of British Columbia.
How dare the premier of my province pose such questions? In the event of an oil spill like the Kalamazoo spill, or an accident on the sea like that of Nathan E. Stewart, or the one that happened in Vancouver harbour, where it took 14 hours to find booms, when my premier asks how exactly we clean up an oil spill when it hits our coastline, that is his jurisdictional responsibility as a premier. Does everyone believe in the rule of law? Yes, we do. Is it the premier's responsibility to protect that on behalf of British Columbians? Yes, it is. Would the Liberals like to go to the Supreme Court and clarify that? No, they would not. “Let us not clarify those questions,"" say the Liberals, because they believe in the Constitution and the rule of law, except for the parts they do not want to observe and acknowledge.
We find this frustrating, because this new bitumen proposal would move almost 900,000 barrels to our coast, with 12 new pump stations, 19 storage units, and a 700% increase in oil tanker traffic through a place we all recognize as a precious and important part of the world. It is as if, when British Columbians stand for place and pride of place and home, they are somehow less Canadian. To my Alberta friends and colleagues, to my family from Alberta, we understand pride of home, defence of family, and hope for the future. That is exactly the same conversation we are having in British Columbia.
The Prime Minister, who came in on the hope and aspiration to unite and not divide, says that of course the Liberals would rather do it with the provincial government, but they will do it whether the provincial government likes it or not. His minister says that they will not tolerate opposition in the House of Commons. They would rather work with the provinces, but if not, they are going to do it anyway.
The Liberals say that they believe in the rights and title of first nations individuals. However, when the Minister of Natural Resources himself gets a briefing in January from his own department that tells him that consultations with first nations in British Columbia have been “paternalistic”, “inadequate”, and “unrealistic”, the Liberals are suddenly surprised that they are in court with first nations over this little tack-on consultation process. Some of the first nation communities were not notified until after the consultation had moved through their communities. This was the consultation process, and this is what is being challenged in court.
I have news for the Liberals. They are going to lose that challenge. The Delgamuukw, Haida, Sparrow, and Tsilqhot'in have tested this question time and time again. Governments in Canada insist on relearning the lesson over and over again and somehow blame first nations for standing up for their constitutional rights. It is the government and the Liberal Prime Minister who said that there is no more important relationship to Canada than that with Canada's first nations people. I challenge that. I do not believe him anymore. I did believe him at one point. 
When asked specifically on tape what he would do with the Kinder Morgan project, the Prime Minister said the review would be redone. Two and half years later, we have omnibus environmental legislation that has somehow unified environmentalists, oil activists, and first nations in their dislike of this bill. Congratulations, there is some unity bone within the Conservatives. I mean the Liberals. Excuse me. I am confused tonight as I watch them violently agree with one another as to who is the best promoter of a project that has significant and real consequences, significant and real risks that the people of British Columbia face on behalf of all Canadians. All Canadians like coming out to B.C. The Prime Minister loves to surf. My Alberta family loves to fish. We love welcoming Canada to British Columbia and our beautiful coast. We love talking about how much British Columbia has to offer.
This question of reconciliation, a word that falls so easily from the lips of the Prime Minister but is so rarely enacted with any kind of meaning or effectiveness, is frustrating to people in British Columbia, because we believed him when he said he would redo the process. We believed him when he said the government would set more ambitious climate targets. We believed him when he said he was going to work to unite the provinces, not seek to divide. He is actually making the claim that by posing significant questions about an oil pipeline, the Premier of British Columbia is somehow ruining the climate change program of the country. Only in Canada could an oil pipeline for almost 900,000 barrels a day be vital to a climate change program. Only in Canada could the Prime Minister stand up to a premier who was duly elected on the promise to raise these questions and to raise the voices of British Columbians. We have a country and a situation in which we are somehow less than.
This question goes to the heart of who we are as a nation. If we want to do better and achieve what we set out to do to bring the country together and finally and fully reconcile with first nations people, then we have to listen. They should not list off the number of meetings and then ignore what people said. They should not list off the word “consultation” over and over again, yet not abide by the serious concerns or address and answer legitimate and important questions put to the government. 
It is our coast, and we will defend it. If the government has any doubt in its mind about the seriousness, diligence, and determination of the people of British Columbia, it is beginning to find out. I ask it to not find out any more and to listen and refer the question to the Supreme Court. Work with the Premier of British Columbia, stop bullying him, and understand that when we stand up for our coast and for future generations, we are standing up for all Canadians.",New Democratic Party,Skeena—Bulkley Valley,Nathan Cullen,http://www.parl.gc.ca/Parliamentarians/en/members/nathan-cullen(233016)
4739896,ca.proc.d.2018-04-16.10050086,2018-04-16,3da57866-49d8-42d1-9f5b-c78561f67c9d,215963,"Mr. Sukh Dhaliwal (Surrey—Newton, Lib.)",,Emergency Debate,Trans Mountain Expansion Project,,"Mr. Speaker, the hon. member from Skeena—Bulkley Valley mentioned indigenous communities and first nations. Ernie Crey, Chief of the Cheam First Nation, said, “If this project doesn't go through it will hurt our people. It appears that Premier Horgan is prepared to actively undermine the prosperity of First Nations in B.C.” 
It is not only going to undermine the prosperity of B.C. first nations. In fact, when I look at my constituency of Surrey—Newton, 1,000 people are moving into Surrey every month. Surrey needs a hospital. Surrey needs bridges. Premier Horgan has promised a hospital for Surrey.
Would not the billions of dollars British Columbians would get in revenue help the people in Surrey with their prosperity and in building hospitals and bridges?",Liberal,Surrey—Newton,Sukh Dhaliwal,http://www.parl.gc.ca/Parliamentarians/en/members/sukh-dhaliwal(215963)
4739897,ca.proc.d.2018-04-16.10050088,2018-04-16,031462db-8f61-48ed-bf9f-b033eb8312bb,233016,Mr. Nathan Cullen,,Emergency Debate,Trans Mountain Expansion Project,,"Mr. Speaker, the federal Liberals stand up and say that we are standing in the way of first nations' prosperity, while they are ignoring the rights and title of first nations people to be self-determinists and to make decisions for themselves, with their inherent rights and title intact, as promised in section 35 of our own Constitution. It is a section the NDP fought for, against the wishes of Trudeau senior, who did not believe that there was any need to recognize individual, and particularly first nation, rights and title. When they say to first nation people, in what has been described by their own officials as a “paternalistic” way, that this is the way forward, that we do not have to acknowledge or take into full account the rights and title of first nation people, does he not understand that it continues the colonial spirit that has so often undermined the full value and potential of this country? 
Of course, there are first nation people interested in this project, as there are first nation people opposed. However, one does not get to selectively quote and then say that the problem must be a wash. That is not how rights work. Rights work in our courts and in our fundamental belief in the inherent strength of our Constitution. We either believe in it or we do not. We do not get to selectively choose which part and who speaks for it. That is why the B.C. government has backed up that first nation claim. That is why the Prime Minister, who claims to believe in UNDRIP, should be doing the same thing, as opposed to what he is doing right now.",New Democratic Party,Skeena—Bulkley Valley,Nathan Cullen,http://www.parl.gc.ca/Parliamentarians/en/members/nathan-cullen(233016)
