basepk,hid,speechdate,pid,opid,speakeroldname,speakerposition,maintopic,subtopic,subsubtopic,speechtext,speakerparty,speakerriding,speakername,speakerurl
4739574,ca.proc.d.2018-04-16.10047779,2018-04-16,e277e13e-59ec-425f-a957-eb5e54d8cb62,218743,"Mr. Gérard Deltell (Louis-Saint-Laurent, CPC)",,Oral Questions,Natural Resources,,"Mr. Speaker, the Liberal Prime Minister and his government detest and despise Canadian oil. That is the truth. I would remind you that with regard to Alberta oil, on January 12, 2017, in Calgary, the Prime Minister said that “we need to phase them out.” It is unacceptable for a Prime Minister of Canada to say that. Today, the Prime Minister is saying that there is nothing to worry about and that the western pipeline will go forward, but it is not, because the person supposed to sell the project is doing a bad job. 
Can the Prime Minister acknowledge that he does not believe in Alberta oil? ",Conservative,Louis-Saint-Laurent,Gérard Deltell,http://www.parl.gc.ca/Parliamentarians/en/members/gerard-deltell(218743)
4739575,ca.proc.d.2018-04-16.10047782,2018-04-16,bc2e82f3-02f1-46e2-b9be-7d5f04ddddc9,214106,"Hon. Marc Garneau (Minister of Transport, Lib.)",,Oral Questions,Natural Resources,,"Mr. Speaker, as we have said time and time again, this project is in the national interest. We cannot make that any clearer. That is why we are going to move it forward and ensure that it is built. We are currently talking to our partners. I can also say that Harper's Conservatives were unable to accomplish anything on this file for 10 years. They did not even initiate discussions with indigenous peoples. They did not develop environmental strategies. We believe in developing both the economy and the environment. ",Liberal,Notre-Dame-de-Grâce—Westmount,Marc Garneau,http://www.parl.gc.ca/Parliamentarians/en/members/marc-garneau(214106)
4739576,ca.proc.d.2018-04-16.10047784,2018-04-16,e277e13e-59ec-425f-a957-eb5e54d8cb62,218743,"Mr. Gérard Deltell (Louis-Saint-Laurent, CPC)",,Oral Questions,Natural Resources,,"Mr. Speaker, the minister will agree with me. This is a very serious subject. Not as serious as the rivalry between the Canadiens and the Nordiques, of course. We know that.
However, what I want to say to the minister is very serious. Sadly, this government's record so far is one of failure after failure. First there was northern gateway, which the Liberal government said no to. Then there was energy east, which was cancelled by the company because of the Liberals' policies. Now the issue is Trans Mountain, and the outcome is uncertain.
Does the minister realize that when his boss, the Prime Minister, says we need to phase out Alberta oil, he is sending a terrible message not only to Canadians, but to the world?",Conservative,Louis-Saint-Laurent,Gérard Deltell,http://www.parl.gc.ca/Parliamentarians/en/members/gerard-deltell(218743)
4739577,ca.proc.d.2018-04-16.10047786,2018-04-16,bc2e82f3-02f1-46e2-b9be-7d5f04ddddc9,214106,"Hon. Marc Garneau (Minister of Transport, Lib.)",,Oral Questions,Natural Resources,,"Mr. Speaker, I can only repeat that our government is moving ahead on this project. It is in the national interest. It is important for our country. It is important not only for Alberta, but for Canada as a whole. By contrast, the Harper Conservatives did not get anything done during their 10 years in office. We are moving ahead on this project. The question is not if, but when. We are working with our partners to make sure that we are going to move forward on this project, which is so important for Canada.",Liberal,Notre-Dame-de-Grâce—Westmount,Marc Garneau,http://www.parl.gc.ca/Parliamentarians/en/members/marc-garneau(214106)
4739578,ca.proc.d.2018-04-16.10047788,2018-04-16,9d3d2220-818c-494e-8d58-29f7cee7b65d,216537,"Hon. Candice Bergen (Portage—Lisgar, CPC)",,Oral Questions,Natural Resources,,"Mr. Speaker, nine weeks ago, when talking about Trans Mountain pipeline and our motion supporting it, the natural resources minister said “There is simply no need for a motion today that attempts to manufacture a crisis where one does not exist....” 
Well, there is a crisis. If that minister spent half the time recognizing the crisis going on in the energy sector as he does compiling the list of interviews that he clearly spent a whole bunch of time doing, he would know that this is a crisis not only on pipelines but jobs. It is the Liberals abdication of responsibility to the energy sector that has caused this. When—",Conservative,Portage—Lisgar,Candice Bergen,http://www.parl.gc.ca/Parliamentarians/en/members/candice-hoeppner(216537)
4739579,ca.proc.d.2018-04-16.10047791,2018-04-16,3176068f-62ee-4b2f-aacd-1131201c6db1,214707,The Speaker,,Oral Questions,Natural Resources,,The hon. Minister of Natural Resources.,Liberal,Halifax West,Geoff Regan,http://www.parl.gc.ca/Parliamentarians/en/members/geoff-regan(214707)
4739580,ca.proc.d.2018-04-16.10047792,2018-04-16,131b0f70-8840-4d9a-94ff-fa579a1ef7af,214246,"Hon. Jim Carr (Minister of Natural Resources, Lib.)",,Oral Questions,Natural Resources,,"Mr. Speaker, I do not talk to the press enough and I talk to the press too much.
 All the time we look at ways to embolden and enhance the oil and gas sector and the future of the energy sector in Canada. As a matter of fact, it was only a week ago when the Prime Minister and I were in Fort McMurray, talking to workers and CEOs within the energy sector, understanding the importance of certainty for investment, the importance of investment in the sector internationally, that Canada was a place where people could have confidence. That is why we are determined to see this project, in the national interest, will be built.",Liberal,Winnipeg South Centre,Jim Carr,http://www.parl.gc.ca/Parliamentarians/en/members/jim-carr(214246)
4739581,ca.proc.d.2018-04-16.10047794,2018-04-16,9d3d2220-818c-494e-8d58-29f7cee7b65d,216537,"Hon. Candice Bergen (Portage—Lisgar, CPC)",,Oral Questions,Natural Resources,,"Mr. Speaker, we have been warning the Liberal government that its policies are hurting Canada's energy sector, killing competitiveness and jobs. Its carbon tax, its tanker ban, and its disastrous approval process has killed projects like Petronas LNG, northern gateway, energy east. Now we see Trans Mountain dying a slow death. Investment and jobs are leaving Canada as we speak.
 When will the Liberals get their heads out of the sand and realize their policies are disastrous for Canada's energy sector?",Conservative,Portage—Lisgar,Candice Bergen,http://www.parl.gc.ca/Parliamentarians/en/members/candice-hoeppner(216537)
4739582,ca.proc.d.2018-04-16.10047796,2018-04-16,131b0f70-8840-4d9a-94ff-fa579a1ef7af,214246,"Hon. Jim Carr (Minister of Natural Resources, Lib.)",,Oral Questions,Natural Resources,,"Mr. Speaker, approved pipelines, job creation for the people of Alberta, for the people of western Canada, compared to the 10-year record of the Harper Conservative government of not one kilometre of pipeline built to tidewater, no consultation with indigenous people, court cases that said the Harper government had failed in its constitutional responsibilities, no conversation with the importance of energy and the environment being part of the conversation, why would we want to mimic that record of failure?",Liberal,Winnipeg South Centre,Jim Carr,http://www.parl.gc.ca/Parliamentarians/en/members/jim-carr(214246)
4739583,ca.proc.d.2018-04-16.10047798,2018-04-16,363e30d6-e47b-4c39-91ad-667deb63009c,217115,"Ms. Sheila Malcolmson (Nanaimo—Ladysmith, NDP)",,Oral Questions,Natural Resources,,"Mr. Speaker, in 2015, in B.C., the Prime Minister said that it was essential for social licence for any project like the Kinder Morgan pipeline. When he okayed Kinder Morgan, using Harper's deeply flawed process and over the objections of cities and first nations, he went back on his word. 
He also promised provinces a co-operative relationship, but instead is pushing Kinder Morgan through, in spite of the alarm raised by B.C. over oil tanker traffic increases and increased oil spill risk. Why did the Liberal government break its promise?",New Democratic Party,Nanaimo—Ladysmith,Sheila Malcolmson,http://www.parl.gc.ca/Parliamentarians/en/members/sheila-malcolmson(217115)
4739584,ca.proc.d.2018-04-16.10047802,2018-04-16,131b0f70-8840-4d9a-94ff-fa579a1ef7af,214246,"Hon. Jim Carr (Minister of Natural Resources, Lib.)",,Oral Questions,Natural Resources,,"Mr. Speaker, the member talks about the same process that was used by the Harper government. As I said a moment ago, we changed the process. We added layers of consultation with indigenous peoples, because the Federal Court of Appeal said that the Harper government did not consult enough. We sent an expert panel that went up and down the line. There are now 44 indigenous communities that will benefit, 33 of them in British Columbia.
 We know that projects like this do not achieve consensus everywhere. We do know that this is in the national interest.",Liberal,Winnipeg South Centre,Jim Carr,http://www.parl.gc.ca/Parliamentarians/en/members/jim-carr(214246)
4739585,ca.proc.d.2018-04-16.10047804,2018-04-16,031462db-8f61-48ed-bf9f-b033eb8312bb,233016,"Mr. Nathan Cullen (Skeena—Bulkley Valley, NDP)",,Oral Questions,Natural Resources,,"Mr. Speaker, last year the people of British Columbia elected a government truly committed to our coast. More than two years ago, the Liberal government promised to completely redo Stephen Harper's failed assessment of the Kinder Morgan pipeline project. However, because the Liberals broke that promise, the people of B.C. have taken to the streets and to the courts to defend our beautiful coast and our legal rights.
 However, it is not just the Prime Minister who is betraying that commitment. Every single Liberal MP elected from B.C. broke that promise too. My question is simple. Is there just one B.C. Liberal MP who has the courage to stand up to the Prime Minister? Is there just one who will stand with British Columbians—",New Democratic Party,Skeena—Bulkley Valley,Nathan Cullen,http://www.parl.gc.ca/Parliamentarians/en/members/nathan-cullen(233016)
4739586,ca.proc.d.2018-04-16.10047806,2018-04-16,3176068f-62ee-4b2f-aacd-1131201c6db1,214707,The Speaker,,Oral Questions,Natural Resources,,The hon. Minister of Natural Resources.,Liberal,Halifax West,Geoff Regan,http://www.parl.gc.ca/Parliamentarians/en/members/geoff-regan(214707)
4739587,ca.proc.d.2018-04-16.10047807,2018-04-16,131b0f70-8840-4d9a-94ff-fa579a1ef7af,214246,"Hon. Jim Carr (Minister of Natural Resources, Lib.)",,Oral Questions,Natural Resources,,"Mr. Speaker, the member opposite forgot to mention the $1.5 billion ocean protection plan. He did not mention it because, for whatever reason, he is not prepared to admit that this government has established and will establish a world-class system to protect our coasts. Why is that not part of the conversation? This is a coast that the member and his riding know all too well is essential not only to British Columbiana but to all Canadians.",Liberal,Winnipeg South Centre,Jim Carr,http://www.parl.gc.ca/Parliamentarians/en/members/jim-carr(214246)
4739588,ca.proc.d.2018-04-16.10047809,2018-04-16,6e88c64b-66df-4989-84da-2a037744909c,218596,"Mr. Jamie Schmale (Haliburton—Kawartha Lakes—Brock, CPC)",,Oral Questions,Natural Resources,,"Mr. Speaker, for months now, we have been demanding that the Prime Minister take action to get Trans Mountain built, but all we have gotten are slogans and platitudes. This crisis is about more than a pipeline. It is about the confidence that job-creating businesses have in Canada. This crisis will take more than just a layover on his way to Paris to get the problem solved.
When will it get built?",Conservative,Haliburton—Kawartha Lakes—Brock,Jamie Schmale,http://www.parl.gc.ca/Parliamentarians/en/members/jamie-schmale(218596)
4739589,ca.proc.d.2018-04-16.10047812,2018-04-16,131b0f70-8840-4d9a-94ff-fa579a1ef7af,214246,"Hon. Jim Carr (Minister of Natural Resources, Lib.)",,Oral Questions,Natural Resources,,"Mr. Speaker, the government is committed to having the pipeline built. We intervened in motions at the National Energy Board when there were attempts to unnecessarily delay the project, and we happened to be successful in that motion. We will be continually alert to attempts to delay because we know that delay adds to uncertainty and uncertainty adds to costs. What the Prime Minister said yesterday was that we would not tolerate unnecessary delays and that we would add certainty.",Liberal,Winnipeg South Centre,Jim Carr,http://www.parl.gc.ca/Parliamentarians/en/members/jim-carr(214246)
4739590,ca.proc.d.2018-04-16.10047815,2018-04-16,6e88c64b-66df-4989-84da-2a037744909c,218596,"Mr. Jamie Schmale (Haliburton—Kawartha Lakes—Brock, CPC)",,Oral Questions,Natural Resources,,"Mr. Speaker, the Prime Minister continues to demonstrate that he either does not want the Trans Mountain pipeline to be built or really does not care if it even proceeds. Instead, he continues to make matters worse by imposing policies that harm the Canadian energy sector, like the carbon tax and new regulations that penalize Canadian oil experts.
 The failure of the Prime Minister to take leadership has caused this crisis. When will the Liberals finally take this crisis seriously?",Conservative,Haliburton—Kawartha Lakes—Brock,Jamie Schmale,http://www.parl.gc.ca/Parliamentarians/en/members/jamie-schmale(218596)
4739591,ca.proc.d.2018-04-16.10047817,2018-04-16,131b0f70-8840-4d9a-94ff-fa579a1ef7af,214246,"Hon. Jim Carr (Minister of Natural Resources, Lib.)",,Oral Questions,Natural Resources,,"Mr. Speaker, I just do not understand where the preamble comes from. Members opposite talk about “just words”. If they were tuning in to what the Prime Minister said yesterday, or maybe they tuned off after the Leader of the Opposition was finished, not waiting for the Premier of Alberta, not waiting for the Prime Minister of Canada, he would have heard not only words but commitment in significant and substantial ways, because this pipeline will be built.",Liberal,Winnipeg South Centre,Jim Carr,http://www.parl.gc.ca/Parliamentarians/en/members/jim-carr(214246)
4739592,ca.proc.d.2018-04-16.10047820,2018-04-16,00000000-0000-0000-0000-000000000000,237030,"Mrs. Stephanie Kusie (Calgary Midnapore, CPC)",,Oral Questions,Natural Resources,,"Mr. Speaker, it has been five months since the Prime Minister approved the Trans Mountain pipeline, but Kinder Morgan is still unable to get its shovels into the ground. The Prime Minister has failed to show the leadership required to solve an interprovincial dispute. The blame for this project's failing to move forward falls squarely at his feet.
 When will the Prime Minister stop promising this pipeline and start delivering it?",Conservative,Calgary Midnapore,Stephanie Kusie,http://www.parl.gc.ca/Parliamentarians/en/members/stephanie-kusie(237030)
4739593,ca.proc.d.2018-04-16.10047823,2018-04-16,131b0f70-8840-4d9a-94ff-fa579a1ef7af,214246,"Hon. Jim Carr (Minister of Natural Resources, Lib.)",,Oral Questions,Natural Resources,,"Actually it was not five months ago, Mr. Speaker, when the pipeline was approved; it was more than a year ago. Ever since the pipeline was approved, the Prime Minister in his speeches, regardless of where they are delivered, whether in Nanaimo, in Vancouver, in Edmonton, in Fort McMurray, in Calgary, in Winnipeg, in St. John's, Newfoundland, in Fredericton, has the same message. The message is that we have the capacity and the commitment in this government to make sure that we are stewards of the environment, that we are creating good jobs for the energy sector in Canada, while—",Liberal,Winnipeg South Centre,Jim Carr,http://www.parl.gc.ca/Parliamentarians/en/members/jim-carr(214246)
4739594,ca.proc.d.2018-04-16.10047824,2018-04-16,3176068f-62ee-4b2f-aacd-1131201c6db1,214707,The Speaker,,Oral Questions,Natural Resources,,The hon. member for Peace River—Westlock.,Liberal,Halifax West,Geoff Regan,http://www.parl.gc.ca/Parliamentarians/en/members/geoff-regan(214707)
4739595,ca.proc.d.2018-04-16.10047825,2018-04-16,b6e2c8aa-fc83-4d52-ad66-7910b8805f90,216881,"Mr. Arnold Viersen (Peace River—Westlock, CPC)",,Oral Questions,Natural Resources,,"Mr. Speaker, the Prime Minister says he wants the Trans Mountain pipeline built, but like every promise he makes, it is all talk and no action. Let us be clear. Since the government has taken power, 125,000 jobs have been lost in the Canadian oil patch. That is devastating for local communities and families. We are six weeks away from losing this project and all the jobs that go with it.
When will the pipeline be built?",Conservative,Peace River—Westlock,Arnold Viersen,http://www.parl.gc.ca/Parliamentarians/en/members/arnold-viersen(216881)
4739596,ca.proc.d.2018-04-16.10047828,2018-04-16,131b0f70-8840-4d9a-94ff-fa579a1ef7af,214246,"Hon. Jim Carr (Minister of Natural Resources, Lib.)",,Oral Questions,Natural Resources,,"Mr. Speaker, the member quotes 125,000 jobs lost. He does not quote that half of them have been regained. As often is the case in having a discussion with members opposite, we do not get the full picture. For example, how often do we hear them talk about the jobs that have been created by approving Line 3? How many times do we hear them talking about the pipelines we have approved in northern Alberta? Why do they not talk about this government's commitment to work with the private sector to make sure that Canada is at the leading edge of using the resources we have and the—",Liberal,Winnipeg South Centre,Jim Carr,http://www.parl.gc.ca/Parliamentarians/en/members/jim-carr(214246)
4739597,ca.proc.d.2018-04-16.10047829,2018-04-16,3176068f-62ee-4b2f-aacd-1131201c6db1,214707,The Speaker,,Oral Questions,Natural Resources,,The hon. member for Edmonton Strathcona.,Liberal,Halifax West,Geoff Regan,http://www.parl.gc.ca/Parliamentarians/en/members/geoff-regan(214707)
4739598,ca.proc.d.2018-04-16.10047830,2018-04-16,f40d602c-1ae6-414e-bac3-23a2f31f1cdf,224989,"Ms. Linda Duncan (Edmonton Strathcona, NDP)",,Oral Questions,The Environment,,"Mr. Speaker, the Prime Minister is now promising to remove the uncertainty around the Kinder Morgan pipeline, yet 28 months into their mandate, the Liberals have yet to deliver their promised strengthened environmental and project review laws. Industry, legal experts, and indigenous leaders alike all agree that this fast-tracked omnibus bill will create even greater uncertainty and fails to make significant reforms.
Will the government finally agree to divide this bill and enable constructive dialogue and to deliver the promised strengthened environmental and energy laws?",New Democratic Party,Edmonton Strathcona,Linda Duncan,http://www.parl.gc.ca/Parliamentarians/en/members/linda-duncan(224989)
4739599,ca.proc.d.2018-04-16.10047833,2018-04-16,858770e9-c9c2-4a95-a6e4-679c973912fd,234517,"Mr. Jonathan Wilkinson (Parliamentary Secretary to the Minister of Environment and Climate Change, Lib.)",,Oral Questions,The Environment,,"Mr. Speaker, our government has brought forward in Bill C-69 better rules for the review of major projects that will protect our environment, fish, and waterways; will restore public trust and respect indigenous rights; and will strengthen our economy and encourage investment. Reforms to these laws were important because of the gutting of environmental assessment procedures undertaken in 2012 under the previous Conservative government. We are committed to changing the way decisions on projects are made so that they are guided by science, evidence, and indigenous traditional knowledge.",Liberal,North Vancouver,Jonathan Wilkinson,http://www.parl.gc.ca/Parliamentarians/en/members/jonathan-wilkinson(234517)
4739600,ca.proc.d.2018-04-16.10047835,2018-04-16,3c3ee442-a873-4845-84d0-7da07a66ce61,217244,"Mr. Alexandre Boulerice (Rosemont—La Petite-Patrie, NDP)",,Oral Questions,The Environment,,"Mr. Speaker, after we said yes to Kinder Morgan.
Stick with me, because the Liberals' logic is hard to follow. On the one hand, they present a new environmental assessment process designed to regain public trust. On the other hand, they cannot tell us which projects will be subject to this process. The process is useless if nothing is assessed. The Minister of the Environment is already giving a free pass to some potentially high-polluting projects.
What is the point of an environmental assessment process if the projects that pose a danger to our environment are not even assessed?",New Democratic Party,Rosemont—La Petite-Patrie,Alexandre Boulerice,http://www.parl.gc.ca/Parliamentarians/en/members/alexandre-boulerice(217244)
4739601,ca.proc.d.2018-04-16.10047837,2018-04-16,858770e9-c9c2-4a95-a6e4-679c973912fd,234517,"Mr. Jonathan Wilkinson (Parliamentary Secretary to the Minister of Environment and Climate Change, Lib.)",,Oral Questions,The Environment,,"Mr. Speaker, the environment and the economy go together. We proposed improved regulations that will protect the environment, restore public trust, and respect the rights of indigenous peoples. These better regulations provide for one assessment per project, to reduce overlap and support a clearer and more effective process.",Liberal,North Vancouver,Jonathan Wilkinson,http://www.parl.gc.ca/Parliamentarians/en/members/jonathan-wilkinson(234517)
4739602,ca.proc.d.2018-04-16.10047840,2018-04-16,93d34552-e08f-449a-86bf-d0cac6a69f23,232967,"Mr. Bryan May (Cambridge, Lib.)",,Oral Questions,Seniors,,"Mr. Speaker, as the chair of the Standing Committee on Human Resources, Skills and Social Development and the Status of Persons with Disabilities, I was proud to table our committee's study on Canada's seniors, tabled in the House a few weeks ago. Our government has shown that it is committed to improving income security and to promoting social inclusion for seniors.
Could the minister responsible for seniors tell this House what the next steps are for Canadian seniors?",Liberal,Cambridge,Bryan May,http://www.parl.gc.ca/Parliamentarians/en/members/bryan-may(232967)
4739603,ca.proc.d.2018-04-16.10047843,2018-04-16,d67a49c2-65bd-411e-8bb4-29ff759c5829,214003,"Hon. Jean-Yves Duclos (Minister of Families, Children and Social Development, Lib.)",,Oral Questions,Seniors,,"Mr. Speaker, I would first like to thank the member for Cambridge as well as all members of the HUMA committee for their outstanding work on behalf of seniors. I would also like to thank the member for Nickel Belt for tabling the motion that led to this report, as well as all members of the Liberal caucus on seniors.
I will also say that we are looking forward to working with the National Seniors Council to review and respond to the important work of the committee.",Liberal,Québec,Jean-Yves Duclos,http://www.parl.gc.ca/Parliamentarians/en/members/jean-yves-duclos(214003)
4739604,ca.proc.d.2018-04-16.10047845,2018-04-16,9fe7bceb-dae2-4f26-b87b-2de1f38b4b84,234445,"Mr. Pierre Paul-Hus (Charlesbourg—Haute-Saint-Charles, CPC)",,Oral Questions,Public Safety,,"Mr. Speaker, on February 22, the Prime Minister told Canadians that one of his MPs had invited Mr. Atwal in India. Then, on February 27, he claimed that this was a conspiracy by rogue members of the Indian government. 
Today, Mr. Jean, the national security adviser, revealed that he never mentioned the Indian government in his briefing.
Will the Prime Minister do the right thing and withdraw his comments?",Conservative,Charlesbourg—Haute-Saint-Charles,Pierre Paul-Hus,http://www.parl.gc.ca/Parliamentarians/en/members/pierre-paul-hus(234445)
4739605,ca.proc.d.2018-04-16.10047848,2018-04-16,1a1a9dee-c228-40fc-b926-42f8441d84f0,214405,"Hon. Ralph Goodale (Minister of Public Safety and Emergency Preparedness, Lib.)",,Oral Questions,Public Safety,,"Mr. Speaker, the Prime Minister has always supported his national security adviser. Whether by accident or by design, the opposition continues to pursue a faulty and misleading line of argument. To provide the opposition with full information, both classified and unclassified, an offer has been outstanding for more than three weeks now to provide that full briefing to the Leader of the Opposition.
When will that briefing be scheduled by the Leader of the Opposition?",Liberal,Regina—Wascana,Ralph Goodale,http://www.parl.gc.ca/Parliamentarians/en/members/ralph-goodale(214405)
4739606,ca.proc.d.2018-04-16.10047850,2018-04-16,9fe7bceb-dae2-4f26-b87b-2de1f38b4b84,234445,"Mr. Pierre Paul-Hus (Charlesbourg—Haute-Saint-Charles, CPC)",,Oral Questions,Public Safety,,"Mr. Speaker, I think this morning's briefing was fairly clear. Nevertheless, according to the testimony given by the national security adviser this morning, Canadians still do not know the truth about the Atwal affair. Mr. Jean denies saying that there was a conspiracy orchestrated by rogue elements within the Indian government. We do not need a classified briefing to find that out. He said it this morning. Our relations with India, a country that is so important for our companies' exports, remain fragile because of the Prime Minister's actions.
When will the Prime Minister show some leadership and apologize to the Indian government?",Conservative,Charlesbourg—Haute-Saint-Charles,Pierre Paul-Hus,http://www.parl.gc.ca/Parliamentarians/en/members/pierre-paul-hus(234445)
