basepk,hid,speechdate,pid,opid,speakeroldname,speakerposition,maintopic,subtopic,subsubtopic,speechtext,speakerparty,speakerriding,speakername,speakerurl
4763108,ca.proc.d.2018-11-27.10401955,2018-11-27,08f8d23a-fbea-4e7b-ba41-34c9f62dde9e,217216,"Ms. Anne Minh-Thu Quach (Salaberry—Suroît, NDP)",,Government Orders,"Budget Implementation Act, 2018, No. 2",Report stage,"Mr. Speaker, today we are talking about the Liberals, who are proposing a hefty 850-page bill. It is an omnibus bill. It is the largest bill ever introduced in the House of Commons. The omnibus bills that the Conservatives used to introduce were 75 pages long. Today we are seeing an 800% or even 900% increase with this 851-page bill. The Liberals were elected on a promise to be more transparent and more accountable.
Furthermore, we are debating this unusually large bill under a gag order. This morning, the Minister of Employment, Workforce Development and Labour was boasting about how she has already given opposition members 15 hours of debate.
According to my calculations, 15 hours of debate divided by 851 pages equals one minute and five seconds per page. Is it responsible to allocate so little time to debate a bill? I use the phrase “debate a bill” loosely, because only eight NDP MPs and five Conservative MPs spoke to this bill before today, if memory serves.
The Liberals say that they are more democratic, more transparent and more accountable, but I have my doubts. I think that everyone has reason to doubt the goodwill and good faith of the Liberals.
As my colleague from Jonquière said, this bill amends seven acts. The Liberals have never been able to tell us how many clauses and subclauses are in this mammoth bill. They themselves do not even know. They do not even know all the things they put in this bill. It is ridiculous to have to debate it under time allocation.
I will focus on just a few points in my speech because, unfortunately, nobody in the House can cover all the measures introduced in the nearly 900-page bill in just 10 minutes.
Women have been waiting 42 years for the Liberals to keep their promises on pay equity. Unions have been fighting Canada Post in court over that for 30 years. The government is yet again telling women they will have to wait. Pay equity legislation will come into force not in a matter of weeks or months, but in four years.
Our party has been a tireless advocate for this important issue. We have even proposed changes in the past. As we heard from my colleague from Jonquière, the NDP proposed 36 amendments. The Conservatives proposed amendments. The other parties proposed amendments. How many amendments did the Liberals accept? Not one single amendment was accepted, despite the fact that they reflected the demands of unions and the demands of various women's groups. Not one amendment was accepted to improve the bill, to give women a stronger voice. The Liberals did not agree to any of our suggestions.
Canada is facing some major challenges that require a bolder approach than the one the Liberals are using. The first initiatives requiring employers to determine how many people must receive more pay are a step in the right direction. However, what could possibly justify how long it will take to implement this? Is it acceptable that women continue to be underpaid for another four years under this government?
In 2018, women earn on average $12,700 less than men. If we multiply that by four, that means nearly $51,000 less for women. The government says it is proud to have introduced pay equity legislation. However, women will still have $51,000 less in their pockets, which is a lot.
If I had to summarize the government's action, I would have to say that it is nothing but half measures. The time it will take to implement pay equity is the biggest problem lurking behind the government's facade of good intentions, but it is not the only one. There is also the fact that budget implementation act, 2018, No. 2 does not require employers to apply pay equity to workers who were already under contract if changes are subsequently made to the contract following a call for tenders. Why? We do not know.
The bill also does not include any of the pay transparency measures that advocates have called for. Salaries cannot be compared when pay equity issues are being addressed. What is wrong with that picture? Will the pay equity commissioner have the resources needed to do his or her work properly? We do not know that either.
Speaking of half measures, why did the government not adopt the recommendations set out in the Bilson report, including the creation of a pay equity hearings tribunal? Lastly, the Liberals are once again professing to support equality while telling a segment of the population that is being treated unfairly to grin and bear it. I would like to remind the government that women represent 51% of the population.
The government made its choice. It chose not to make the investments needed to ensure that women receive equal pay, and chose instead to give big business, the richest people in the world, $14 billion in tax cuts. This measure was introduced last week in the Minister of Finance's fall economic statement. Did the rich and these big corporations really need that $14 billion this fall? I do not think so. They are getting help, yet many of them evade taxes or openly use tax havens to avoid paying taxes.
The same is true for web giants like Netflix, Apple and Facebook, which pay virtually nothing in taxes and then get tax breaks. However, they use our services and are quite happy to hire highly skilled workers from Quebec and Canada. The Liberals claim that our SMEs are important and that they want to support buying local, but they support the web giants that do not need to worry about all of the taxes imposed on our SMEs under Canadian law.
How much of this money will go to rural areas? We have no idea. The government is allocating billions of dollars for businesses to buy new equipment and innovate, but how can we innovate when our rural areas do not even have access to high-speed Internet or a 3G or LTE cellular network?
The Auditor General criticized the government for its lack of judgment in managing public money allocated to the connect to innovate program. Some municipalities in my riding are turned down for this program or CRTC funds for ridiculous reasons, such as the fact that there is already a home with high-speed Internet within a 25-kilometre radius. This is happening in Saint-Louis-de-Gonzague, and all the areas served by Coop CSUR in the Soulanges area are under the same restriction. Do we really want a double standard for our rural and urban areas?
On another subject, how will the poverty reduction strategy be funded? Apparently, it will be made up of existing programs without any additional money. I think the Liberals are just thumbing their noses at us. They have targets, but no plan. That seems to be a theme with this government, because it does not have a plan for the environment either. The Liberals got themselves elected in 2015 by saying, “We have a plan, we have a plan, we have a plan”. Today, there is no plan, there is no plan, there is no plan. I think I will use that in an ad. 
Are they going to help the most vulnerable citizens access health care services more easily? No. There is no plan for pharmacare either, even though we know that we could save $3 billion a year according to conservative estimates. We could make a lot of investments in health care with that money.
What other measures does the bill include to drastically reduce our CO2 and methane emissions starting this year? None. Is the government planning to help rural areas go green, develop public transit, make their homes more energy efficient, or use solar and wind power? No.
Is the government going to implement restrictions to help big corporations reduce their greenhouse gas emissions? No, of course there is no plan to do that. Will the federal government finally have a costed plan for reducing its own greenhouse gas emissions? No, it has no plan for that either.
 It has been pointed out that many citizen movements have been launched. In Quebec, artists, scientists, economists and citizens have signed A Pact for the Transition. Millennials have been criticized for not being more involved in all kinds of things, but yesterday, young people who realized that the government is not doing anything for the environment took action, and a youth environmental group called ENvironnement JEUnesse brought suit against the federal government for failing to take action on the environment.
I have to stop now because I am out of time, but that shows just how important the environment is to people 35 and under and how absurd it was for the government to spend $4.5 billion of taxpayers' money on a pipeline.
That move was not a plan or investment for keeping our planet healthy for current and future generations. It is shameful.",New Democratic Party,Salaberry—Suroît,Anne Minh-Thu Quach,http://www.parl.gc.ca/Parliamentarians/en/members/anne-minh-thu-quach(217216)
4763109,ca.proc.d.2018-11-27.10402024,2018-11-27,634edc34-ea0d-406f-ade1-eeec6c5bad04,234552,"Mr. Adam Vaughan (Parliamentary Secretary to the Minister of Families, Children and Social Development (Housing and Urban Affairs), Lib.)",,Government Orders,"Budget Implementation Act, 2018, No. 2",Report stage,"Mr. Speaker, I am delighted to have the opportunity to ask my colleague opposite a question.
The purpose of my question is simple.
The member opposite complained that there was not enough investment to back up the strategy or move forward some of these critical social issues in order to achieve them. I will take housing as an example, because I have often heard the opposite side say that it all comes after the next election. 
The member opposite knows, because she complained that in the first budget the money was too little to solve the problem. I agree, we needed the full $40 billion on top of the first investment. However, in our first budget, we tripled transfers to provinces and that money is building housing now, supporting housing now and renewing housing agreements now. We doubled the money that was going to homeless organizations that are fighting homelessness. We have now added an additional $40 billion on top of that, and reprofiled the money to be a little more flexible so that it can, in particular, support women and children across the country. In other words, the national housing strategy is not a 10-year, $40-billion program, but actually closer to $55 billion over 14 years, if we take into account the dollars announced before we reprofiled the money. 
Would the member not agree that, from the minute we took office and the first budget we passed right through to now, we have invested well beyond $40 billion? Will the member also agree that those dollars are being spent as we speak?",Liberal,Spadina—Fort York,Adam Vaughan,http://www.parl.gc.ca/Parliamentarians/en/members/adam-vaughan(234552)
4763110,ca.proc.d.2018-11-27.10402026,2018-11-27,08f8d23a-fbea-4e7b-ba41-34c9f62dde9e,217216,Ms. Anne Minh-Thu Quach,,Government Orders,"Budget Implementation Act, 2018, No. 2",Report stage,"Mr. Speaker, I hear my colleague from Hamilton Mountain shouting that it is 14 years. I am not the one saying so. Many social housing organizations across Canada are saying that 90% of the investments in social housing announced by the Liberals will not come until after the next election.
Way to go. The housing crisis is happening right now.
People are also talking about other crises. I do not know if the Liberals have their heads buried in the sand or what, but every week for the last four weeks, someone has had something to say about the environment. Global warming is the number one issue. Everyone says that urgent action is needed now.
What do the Liberals propose in these 851 pages? There is nothing for the environment, a big fat zero in terms of investment and a big fat zero in terms of plans. There is nothing for decarbonization, nothing for public transit, nothing for reviewing building codes to make them more energy efficient. There is also nothing to keep fossil fuels in the ground or to promote the development of green and renewable energy sources.
Where is the Liberals' vision for addressing climate change? I do not see it here. It is nowhere to be found.",New Democratic Party,Salaberry—Suroît,Anne Minh-Thu Quach,http://www.parl.gc.ca/Parliamentarians/en/members/anne-minh-thu-quach(217216)
4763111,ca.proc.d.2018-11-27.10402031,2018-11-27,eaa6694f-1e20-4aae-ad3b-e694b0e12c59,224170,"Ms. Elizabeth May (Saanich—Gulf Islands, GP)",,Government Orders,"Budget Implementation Act, 2018, No. 2",Report stage,"Mr. Speaker, I thank my colleague for her speech. I wholeheartedly agree with what she said about climate change.
What we need right now is not a plan to deal with a small issue because this is no longer about the environment. No, climate change has now become a critical and urgent issue. It is clearly no longer an environmental issue. It has become a threat to the security of our country and our planet.
I would like to ask the member if she has anything else to propose to effectively address this threat.",Green Party,Saanich—Gulf Islands,Elizabeth May,http://www.parl.gc.ca/Parliamentarians/en/members/elizabeth-may(224170)
4763112,ca.proc.d.2018-11-27.10402034,2018-11-27,08f8d23a-fbea-4e7b-ba41-34c9f62dde9e,217216,Ms. Anne Minh-Thu Quach,,Government Orders,"Budget Implementation Act, 2018, No. 2",Report stage,"Mr. Speaker, I thank my colleague from Saanich—Gulf Islands. She is obviously very involved in this file and her involvement in and commitment to society in general are a good example of some of the things that can be done.
Many scientists, industry representatives, workers in the environmental field, and people around the world are carrying out initiatives in this regard. Thousands of initiatives are being carried out around the world. I am talking about initiatives pertaining to permaculture, local currency, buy local networks, geothermal energy, wind energy, the creation of construction standards for more energy efficient buildings, and awareness campaigns regarding the fight against plastic.
We are calling on the government to establish a plan for every department. Right now, only 5 out of 19 departments have a plan to reduce greenhouse gas emissions. Environment Canada does not even have one. That makes no sense at all. I cannot believe it.
The government needs to have its own plan to adapt to climate change and apply it through public policies in every department and every sector, whether it be transport, food, housing construction and so on. There is an urgent need to act now.
Young people and the general public understand that. The only one who does not is the government. ",New Democratic Party,Salaberry—Suroît,Anne Minh-Thu Quach,http://www.parl.gc.ca/Parliamentarians/en/members/anne-minh-thu-quach(217216)
4763113,ca.proc.d.2018-11-27.10402044,2018-11-27,18e36567-4082-4ce3-a35b-d4aba65560ca,234557,"Mr. David Lametti (Parliamentary Secretary to the Minister of Innovation, Science and Economic Development, Lib.)",,Government Orders,"Budget Implementation Act, 2018, No. 2",Report stage,"Mr. Speaker, I am honoured to rise today in the House to speak to our economic update.
I did not get a chance to ask my colleague who just spoke a question. I think she was a bit unfair to the connect to innovate program. We invested $500 million in Canada, and the CRTC will invest even more to create the backbone of the system. 
 True, there are some challenges with the maps, but the CRTC and the Minister of Innovation are always open to redrawing the maps to better connect Canadians.
We invested $100 million in Quebec, and I was there for a number of the announcements. I assure the member and the House that we are working on getting people connected, since this has become a necessity in our country.
I would like to take a moment with the time that I have to speak about some of the intellectual property provisions in the economic update, with the backdrop being that the government had to address yet another deficit from the previous government, which was the innovation deficit.
 The previous government, under Harper, had not invested for 10 years in either basic research or in innovation. We had fallen behind our neighbours and competitors in a variety of different ways. We had previously been good at this.
We have now brought that back, with massive, historic investments, in both fundamental curiosity-based research, as well as investing in both people and technology in order to make Canada a world leader in a variety of different digital areas, the new economy, artificial intelligence and training people, from kids all the way to the elderly, upscaling and retraining, in order that we be positioned to take advantage of that.
All of this is framed by an IP strategy that we announced earlier in 2018. It really pushes Canadians and Canadian inventors to think about intellectual property as part of the way in which they monetize their investments. I know the minister is fond of saying, and he is right, that companies that think about intellectual property tend to be more profitable and do better. We certainly are trying to buttress that with an array of policies in the IP strategy, as well as in the fall economic statement.
First, I want to speak a little about notice and notice regime and the improvements we have made to that. It is an interesting Canadian invention, the notice and notice regime. One of my old colleagues, Daniel Gervais, who was at the University of Ottawa at the time and is now at the University of Amsterdam, came up with this. The idea is that Internet service providers should not be liable for copyright infringement going on the Internet when they are acting only as a conduit. This accords with our traditional underlying principle of net neutrality.
What we do is we allow copyright holders, right holders to point out to an Internet service provider that there has been an alleged infringement of copyright through its architecture. Then we ask the Internet service provider to act in a certain way in order to maintain an immunity from liability.
In the United States, the Americans reacted with something called notice and take down, in which a copyright holder would tell the Internet service provider that there had been an infringement. In order for the Internet service provider to maintain its immunity, it would simply take down the work.
This system was widely criticized in the United States because it was being abused. People were alleging copyright infringement in all sorts of cases, when perhaps there was not even copyright infringement at all. It led to a silencing or had a chilling effect on free speech, among other things.
Our Canadian response was quite a good one. When such an allegation would be made, we would ask the Internet service provider to first freeze the information, archive it, and then give notice to the person who had put up the content that some sort of infringement had happened. This then would allow for both the information to be preserved and for the copyright holder to pursue it in our court system, if he or she wanted to do that, a court system in which we have a great deal of confidence, and get to the right result without the abuse that happened in the notice and take down system.
What began to happen in Canada, and I saw this myself a number of times in my teachings, was that American rights holders, through American law firms, would often allege content infringement in Canada. They would then send a letter to those people telling them that they had infringed copyright and that they would be sued unless they paid x thousands of dollars by clicking on the link included. Sadly, a number of people did not realize this kind of claim was in contravention of Canadian law and they paid the money. This kind of trolling is what we are trying to prevent by standardizing the kinds of letters that are used in the notice and notice regime and by prohibiting any request for a monetary settlement in these letters.
We also heard from Internet service providers in Canada that it was difficult for them to maintain and archive all these various kinds of claims. Therefore, by standardizing the form, we also reduce the costs and increase the incentive for Canadian Internet service providers to comply with the system.
It is a good system. We are improving it by standardizing costs, making it more fair and preventing trolls from taking advantage of the system.
I am very proud of the Minister of Foreign Affairs and her team for having preserved the notice and notice regime in the renegotiation of the free trade agreement with Mexico and the United States. It is a strong Canadian addition to international copyright. I am pleased we have taken steps to improve it, based on the consultations we have had. These were widely shared among people and were widely agreed upon.
We are also making improvements to the patent regime, which again will help the innovative climate in Canada. We are allowing for experimentation on patents and not calling it patent infringement. It has been said that the patent system is a bargain whereby a person gets a monopoly for 20-odd years for an invention after having disclosed the secret of the invention publicly. Yes, it is true. We do not want people to infringe on the economic rights of the patent holder. However, it is not an infringement on the economic rights of the patent holder because it is not an absolute right for some other researcher to do experiments with the patent to develop another invention or improve an invention. We have recognized that in the statute.
Because licensing is such an important part of the patent regime, we have also protected licensees who licence a critical patent for their own processes and inventions, such that if the company falls into insolvency or bankruptcy or goes under creditor protection, the licensee will not lose the right to use that licence.
With respect to trademark, we are adding bad faith as a ground for opposition to trademarks. That too is something that accords overall with what we are trying to do.
I and other colleagues have spoken about a new college for patent and trademark agents to improve the quality of advice and service that is given. Again, this helps Canadian innovators.
Finally, we have brought in major improvements to the functioning of the Copyright Board, which plays such a critical role for both rights holders and users with respect to establishing rights and tariffs moving forward. If we can do that more quickly, more efficiently and in a substantively better way, it helps everyone.",Liberal,LaSalle—Émard—Verdun,David Lametti,http://www.parl.gc.ca/Parliamentarians/en/members/david-lametti(234557)
4763114,ca.proc.d.2018-11-27.10402125,2018-11-27,33ef2052-c37d-446f-9d03-515d01591eba,217551,"Mr. Larry Maguire (Brandon—Souris, CPC)",,Government Orders,"Budget Implementation Act, 2018, No. 2",Report stage,"Mr. Speaker, my colleague has expounded on a number of programs that the Liberals think they are putting to good use in Canada. However, I have one problem. They are spending $49.5 million more every day than they are taking in. They are adding that much to the debt, over $2 million an hour.
Programs and projects could be put in place that would help them with the revenue side and sustain the jobs we already have rather than lose them, and one would be the building of pipelines in Canada. It would even reduce greenhouse gases around the world if we could get pipelines to both coasts. We would have a more efficient export program and help put people to work in other countries, as well as reduce greenhouse gases with oil they could use here rather than the products they presently use.
 I wanted to point that out for my colleague across the way. 
I heard the Minister of Employment, Workforce Development and Labour this morning refer to this as a fiscally sound management update for the fiscal accountability of the government. I would like to ask the member two things. When does he think the budget will ever be balanced? With $49.5 million more being spent every day than the government is taking in, how is this sound fiscal management?",Conservative,Brandon—Souris,Larry Maguire,http://www.parl.gc.ca/Parliamentarians/en/members/larry-maguire(217551)
4763115,ca.proc.d.2018-11-27.10402148,2018-11-27,18e36567-4082-4ce3-a35b-d4aba65560ca,234557,Mr. David Lametti,,Government Orders,"Budget Implementation Act, 2018, No. 2",Report stage,"Mr. Speaker, I am a homeowner and I have a mortgage on my house. If the roof caves in or the plumbing breaks, I will have to spend money to fix it. My colleague next to me referred to that as an infrastructure deficit. There are simply times when in order to preserve the whole of the investment, we have to make other investments. That is precisely what we are doing.
 We inherited a massive infrastructure deficit. In my home province, bridges are falling, infrastructure is deteriorating, water and environmental infrastructure. We had an innovation deficit. Now we are remedying that. 
Yes, we have to spend money to do it, but, as has been pointed out a number of times, our debt-to-GDP ratio is going down and we have the best position in the G7 with respect to both overall debt and debt-to-GDP ratio. We are doing it prudently and saving the house.",Liberal,LaSalle—Émard—Verdun,David Lametti,http://www.parl.gc.ca/Parliamentarians/en/members/david-lametti(234557)
