basepk,hid,speechdate,pid,opid,speakeroldname,speakerposition,maintopic,subtopic,subsubtopic,speechtext,speakerparty,speakerriding,speakername,speakerurl
4747072,ca.proc.d.2018-05-31.10171811,2018-05-31,07cf5767-802c-406c-92a7-7dc92af79b40,229526,"Mr. Kevin Lamoureux (Parliamentary Secretary to the Leader of the Government in the House of Commons, Lib.)",,Routine Proceedings,Government Response to Petitions,,"Mr. Speaker, pursuant to Standing Order 36(8), I have the honour to table, in both official languages, the government's response to 11 petitions.
While I am on my feet, I move:
 That the House do now proceed to orders of the day. 
",Liberal,Winnipeg North,Kevin Lamoureux,http://www.parl.gc.ca/Parliamentarians/en/members/kevin-lamoureux(229526)
4747073,ca.proc.d.2018-05-31.10171819,2018-05-31,3176068f-62ee-4b2f-aacd-1131201c6db1,214707,The Speaker,,Routine Proceedings,Government Response to Petitions,,Is it the pleasure of the House to adopt the motion? ,Liberal,Halifax West,Geoff Regan,http://www.parl.gc.ca/Parliamentarians/en/members/geoff-regan(214707)
4747074,ca.proc.d.2018-05-31.p0,2018-05-31,,,,intervention,Routine Proceedings,Government Response to Petitions,," Agreed. 
 No. ",,,Some hon. members,
4747075,ca.proc.d.2018-05-31.10172154,2018-05-31,3176068f-62ee-4b2f-aacd-1131201c6db1,214707,The Speaker,,Routine Proceedings,Government Response to Petitions,,I declare the motion carried. ,Liberal,Halifax West,Geoff Regan,http://www.parl.gc.ca/Parliamentarians/en/members/geoff-regan(214707)
4747076,ca.proc.d.2018-05-31.10172157,2018-05-31,d67a49c2-65bd-411e-8bb4-29ff759c5829,214003,"Hon. Jean-Yves Duclos (Minister of Families, Children and Social Development, Lib.)",,Government Orders,"Budget Implementation Act, 2018, No. 1",Bill C-74—Time Allocation Motion,"moved:
 That in relation to Bill C-74, An Act to implement certain provisions of the budget tabled in Parliament on February 27, 2018 and other measures, not more than five further hours shall be allotted to the consideration of the report stage and five hours shall be allotted to the consideration at third reading stage of the said Bill; and 
 that, at the expiry of the five hours provided for the consideration at report stage and at the expiry of the five hours provided for the consideration of the third reading stage of the said Bill, any proceedings before the House shall be interrupted, if required for the purpose of this Order, and in turn every question necessary for the disposal of the said stages of the Bill shall be put forthwith and successively without further debate or amendment. 
",Liberal,Québec,Jean-Yves Duclos,http://www.parl.gc.ca/Parliamentarians/en/members/jean-yves-duclos(214003)
4747077,ca.proc.d.2018-05-31.10172159,2018-05-31,3176068f-62ee-4b2f-aacd-1131201c6db1,214707,The Speaker,,Government Orders,"Budget Implementation Act, 2018, No. 1",Bill C-74—Time Allocation Motion,"Pursuant to Standing Order 67.1, there will now be a 30-minute question period. I invite hon. members who wish to ask questions to rise in their places so the Chair will have some idea of the number of members who wish to participate in the question period. 
The hon. House Leader of the Official Opposition. ",Liberal,Halifax West,Geoff Regan,http://www.parl.gc.ca/Parliamentarians/en/members/geoff-regan(214707)
4747078,ca.proc.d.2018-05-31.10172164,2018-05-31,9d3d2220-818c-494e-8d58-29f7cee7b65d,216537,"Hon. Candice Bergen (Portage—Lisgar, CPC)",,Government Orders,"Budget Implementation Act, 2018, No. 1",Bill C-74—Time Allocation Motion,"Mr. Speaker, in three days debate has been shut down in this House on five major bills. It is unbelievable—well, it is actually not unbelievable, because everything the Liberals said they would do while they were campaigning has been an absolute fabrication. Coming here self-righteously and saying, “We are not going to shut down debate” was just another big, phony act. It seems like everything the Liberals do is a big, phony act. 
I saw the height of it last night when the minister gave notice of this time allocation. He said there had been consultations with the opposition on Bill C-74. That is outright misleading of the House and misleading Canadians. There has not been one iota, not one syllable, of consultation. Nobody has asked anybody on this side about how much time was needed for Bill C-74.
Not only are the Liberals breaking their word; now they are misleading the House on incredibly important issues. This is the carbon tax that is going to be implemented. We do not know how much it is going to cost because they will not tell Canadians, and now they are saying they have consulted with us on Bill C-74. That is not true. Why are the Liberals misleading this House?",Conservative,Portage—Lisgar,Candice Bergen,http://www.parl.gc.ca/Parliamentarians/en/members/candice-hoeppner(216537)
4747079,ca.proc.d.2018-05-31.10172168,2018-05-31,cee27afa-cdf8-4e99-ab22-22290f86aa3a,214082,"Hon. Catherine McKenna (Minister of Environment and Climate Change, Lib.)",,Government Orders,"Budget Implementation Act, 2018, No. 1",Bill C-74—Time Allocation Motion,"Mr. Speaker, Canadians elected us to deliver an ambitious agenda, and Bill C-74 is an important step in our plan to help grow our economy by focusing on the middle class and helping those working hard to join it. The budget implementation act provides the legislative framework to implement key campaign commitments that were reiterated in budget 2018.
Through this bill, we are taking the next step in our ambitious plan to grow our economy by focusing on the middle class and helping those working hard to join it. Over the last two years, Canada's economic growth has been fuelled by a stronger middle class. Canadians' hard work, combined with historic investments in people and in communities, helped to create more good jobs, almost 600,000 of them since November 2015, with more help for those who need it most, which has meant more money for people to save, invest, and spend in their communities.",Liberal,Ottawa Centre,Catherine McKenna,http://www.parl.gc.ca/Parliamentarians/en/members/catherine-mckenna(214082)
4747080,ca.proc.d.2018-05-31.10172170,2018-05-31,02c2cb20-f27d-46a5-8e78-ab4b405bf07b,214864,The Deputy Speaker,,Government Orders,"Budget Implementation Act, 2018, No. 1",Bill C-74—Time Allocation Motion,"I am going to ask hon. members, both those posing questions and a minister who may be responding, to keep their interventions to no more than around one minute. 
Questions, the hon. member for Berthier—Maskinongé.",Conservative,Simcoe North,Bruce Stanton,http://www.parl.gc.ca/Parliamentarians/en/members/bruce-stanton(214864)
4747081,ca.proc.d.2018-05-31.10172171,2018-05-31,c861cfd8-ac30-4ddf-9d31-79dd34dcc59e,236900,"Ms. Ruth Ellen Brosseau (Berthier—Maskinongé, NDP)",,Government Orders,"Budget Implementation Act, 2018, No. 1",Bill C-74—Time Allocation Motion,"Mr. Speaker, sadly, the minister obviously did not hear the question from the House leader of the official opposition. There has been absolutely no consultation on allocating time on Bill C-74. This is the fifth time that the Liberals are imposing closure in three days. This is unbelievable. 
I have been here for seven years, and we were used to time allocation because we had a lot under the previous government, but we have never seen a government limit debate to the point where it is doing the bare minimum. It is an insult to democracy.
The Liberals promised they would do things differently, yet they are going ahead and shutting down debate. We are 338 MPs in this House and we are here to represent our constituents. How can the Liberals justify doing time allocation on an important bill like Bill C-74?",New Democratic Party,Berthier—Maskinongé,Ruth Ellen Brosseau,http://www.parl.gc.ca/Parliamentarians/en/members/ruth-ellen-brosseau(236900)
4747082,ca.proc.d.2018-05-31.10172176,2018-05-31,cee27afa-cdf8-4e99-ab22-22290f86aa3a,214082,Hon. Catherine McKenna,,Government Orders,"Budget Implementation Act, 2018, No. 1",Bill C-74—Time Allocation Motion,"Mr. Speaker, Canadians elected us to deliver an ambitious agenda, and Bill C-74 is an important step in our plan to grow the economy by focusing on the middle class and helping those working hard to join it. This bill has been debated extensively in the House and in the committee. We have seen four days of second reading debate, during which more than 45 members have spoken. This includes 13 Conservative members, six NDP members, and one member from the Green Party. At committee stage, we saw 13 meetings, during which more than 106 witnesses spoke. 
We have made a commitment as a government to work collaboratively with all parties to ensure that Parliament works more efficiently. It is important for us to make every effort to reach a consensus about how much time is required by all parties to debate legislation in the House of Commons.",Liberal,Ottawa Centre,Catherine McKenna,http://www.parl.gc.ca/Parliamentarians/en/members/catherine-mckenna(214082)
4747083,ca.proc.d.2018-05-31.10172178,2018-05-31,4437c848-d8c7-4a39-a948-1539969f3a90,234764,"Ms. Marilyn Gladu (Sarnia—Lambton, CPC)",,Government Orders,"Budget Implementation Act, 2018, No. 1",Bill C-74—Time Allocation Motion,"Mr. Speaker, I just cannot believe the current government. 
The Liberals got elected by telling Canadians that they were going to do things differently, that they were going to be open and transparent, that they were going to be truthful with Canadians, and that they would keep their promises. We have seen nothing but broken promises and no transparency. 
The minister who is responding to questions on the budget for the finance minister does not even know how much her carbon tax would cost the average Canadian and how much reduction in greenhouse gas emissions we are going to get. When will the minister come clean, be open and transparent, and start keeping the promises of the government?",Conservative,Sarnia—Lambton,Marilyn Gladu,http://www.parl.gc.ca/Parliamentarians/en/members/marilyn-gladu(234764)
4747084,ca.proc.d.2018-05-31.10172189,2018-05-31,cee27afa-cdf8-4e99-ab22-22290f86aa3a,214082,Hon. Catherine McKenna,,Government Orders,"Budget Implementation Act, 2018, No. 1",Bill C-74—Time Allocation Motion,"Mr. Speaker, we have been very clear. My department released information showing that carbon pricing works. It works by reducing emissions and by fostering innovation. The provinces that have a price on pollution right now are where 80% of Canadians live, and those provinces are not only tackling climate change but are also the fastest-growing economies in the country: Alberta, British Columbia, Quebec, and Ontario. We know that putting a price on pollution is important and that tackling climate change is important, and there is also a $23 trillion economic opportunity.",Liberal,Ottawa Centre,Catherine McKenna,http://www.parl.gc.ca/Parliamentarians/en/members/catherine-mckenna(214082)
4747085,ca.proc.d.2018-05-31.10172193,2018-05-31,26c8b0bc-42d4-4db5-bf7d-1e1544c7b4b5,218764,"Mr. Dan Albas (Central Okanagan—Similkameen—Nicola, CPC)",,Government Orders,"Budget Implementation Act, 2018, No. 1",Bill C-74—Time Allocation Motion,"Mr. Speaker, this debate is supposed to be about the government justifying the use of time allocation on Bill C-74. Instead we have a minister of the crown who is actually engaging in debate when we are supposed to be hearing the government justify time allocation. 
She said that this bill received debate at committee; we did not hear one single witness on division 20, on the deferred prosecution agreement, which is a departure from the way we handle the Criminal Code. I would like to hear a justification from the minister as to why she is making it difficult for her own members to be able to discuss the bill, because there were concerns at that committee about this bill. Why is she pushing this bill forward and denying the ability to speak to it not only to us but to her own members?",Conservative,Central Okanagan—Similkameen—Nicola,Dan Albas,http://www.parl.gc.ca/Parliamentarians/en/members/dan-albas(218764)
4747086,ca.proc.d.2018-05-31.10172195,2018-05-31,cee27afa-cdf8-4e99-ab22-22290f86aa3a,214082,Hon. Catherine McKenna,,Government Orders,"Budget Implementation Act, 2018, No. 1",Bill C-74—Time Allocation Motion,"Mr. Speaker, Bill C-74 is an important step in our plan to grow our economy by focusing on the middle class and helping those who are working hard to join it.
This bill has been debated extensively in the House and at committee. As I said, there have been four days of second reading debate, during which more than 45 members spoke at committee stage. We have seen 13 meetings, during which more than 106 witnesses have spoken.
We want to work collaboratively with all parties to ensure that Parliament works more efficiently. It is important to make every effort to reach a consensus about how much time is required by all parties to debate legislation in the House of Commons.",Liberal,Ottawa Centre,Catherine McKenna,http://www.parl.gc.ca/Parliamentarians/en/members/catherine-mckenna(214082)
4747087,ca.proc.d.2018-05-31.10172198,2018-05-31,eb417798-95f7-45a0-b1e9-ca3a6526d4db,237155,"Mr. Alistair MacGregor (Cowichan—Malahat—Langford, NDP)",,Government Orders,"Budget Implementation Act, 2018, No. 1",Bill C-74—Time Allocation Motion,"Mr. Speaker, I would like to correct the minister when she said that Canadians voted for the Liberals. Actually, 39% of Canadians voted for the Liberals, and many of those Canadians voted for the Liberals because they made promises to do things differently, to treat Parliament with respect, and to make sure that every member here has their say. Instead we are here on the 40th occurrence of time allocation or closure as the government tries to make up for a slow parliamentary agenda. The government realizes that it is under a time crunch, so it is just going to ram things down Parliament's throat. 
I cry shame on the government and my Liberal colleagues for abusing the trust of Canadians and for misleading them, because this is not how to treat Parliament with respect. This absolutely goes against all the promises the Liberals made. 
Would the minister not agree that it is precisely this type of action that breeds cynicism in Canadian politics?",New Democratic Party,Cowichan—Malahat—Langford,Alistair MacGregor,http://www.parl.gc.ca/Parliamentarians/en/members/alistair-macgregor(237155)
4747088,ca.proc.d.2018-05-31.10172225,2018-05-31,cee27afa-cdf8-4e99-ab22-22290f86aa3a,214082,Hon. Catherine McKenna,,Government Orders,"Budget Implementation Act, 2018, No. 1",Bill C-74—Time Allocation Motion,"Mr. Speaker, this bill has been debated extensively in the House and at committee. We remain committed to ensuring that members on all sides have sufficient and reasonable time to debate legislation in the House of Commons. Of course, we also recognize our responsibility to ensure that we deliver on our commitments to Canadians. 
Let us talk about this. Through this bill, we are taking the next step in our ambitious plan to grow our economy by focusing on the middle class and helping those working hard to join it. Since November 2015, we have worked with Canadians to create more good jobs, almost 600,000, which helps those who need it most. It also means more money for people to save, invest, and spend in their communities.",Liberal,Ottawa Centre,Catherine McKenna,http://www.parl.gc.ca/Parliamentarians/en/members/catherine-mckenna(214082)
4747089,ca.proc.d.2018-05-31.10172230,2018-05-31,07cf5767-802c-406c-92a7-7dc92af79b40,229526,"Mr. Kevin Lamoureux (Parliamentary Secretary to the Leader of the Government in the House of Commons, Lib.)",,Government Orders,"Budget Implementation Act, 2018, No. 1",Bill C-74—Time Allocation Motion,"Mr. Speaker, it seems what we have witnessed from the opposition members is a will and desire to prevent any legislation from passing through the House. They want to continue to play games. We saw that yesterday when they attempted to adjourn the House because they were done working for the day. Yesterday they moved concurrence on a report, yet we have hundreds of reports. They will do anything to avoid debate.
My question to my colleague is this. Would she not agree that there is a responsibility of the government to move legislation forward that is going to have such a positive impact on Canadians in all regions of our country?",Liberal,Winnipeg North,Kevin Lamoureux,http://www.parl.gc.ca/Parliamentarians/en/members/kevin-lamoureux(229526)
4747090,ca.proc.d.2018-05-31.10172237,2018-05-31,cee27afa-cdf8-4e99-ab22-22290f86aa3a,214082,Hon. Catherine McKenna,,Government Orders,"Budget Implementation Act, 2018, No. 1",Bill C-74—Time Allocation Motion,"Mr. Speaker, it is extremely important that we deliver on this ambitious agenda, because we are delivering for Canadians. We are helping to grow the economy. We are helping to create jobs in communities. We are making sure we are supporting the middle class, as well as those who are working hard to join it.
As I said, we wish we did not have to do this. However, we need to advance legislation. The opposition is deliberately delaying the government's agenda, and we have a duty to Canadians to ensure that all legislation is brought to a vote.
We remain committed to ensuring that members on all sides have sufficient and reasonable time to debate legislation, but we have a responsibility to deliver on our commitments to Canadians.",Liberal,Ottawa Centre,Catherine McKenna,http://www.parl.gc.ca/Parliamentarians/en/members/catherine-mckenna(214082)
4747091,ca.proc.d.2018-05-31.10172240,2018-05-31,61c83e21-f9a3-4e4b-b881-4b2d1ce33c43,234471,"Mr. John Brassard (Barrie—Innisfil, CPC)",,Government Orders,"Budget Implementation Act, 2018, No. 1",Bill C-74—Time Allocation Motion,"Mr. Speaker, I can honestly say that I think all members on this side believe that our Confederation is in chaos right now. Never before have we seen an government so heavy-handed. Liberals can draw all the comparisons to the previous government that they want, but I will remind everyone that this government said it was going to do things differently. It was going to allow members to speak. This budget implementation bill has a $7-billion slush fund in it. It also has a carbon tax, and Liberals are not telling us the price of that tax or how it is going to affect Canadians. Canadians deserve to know that price, and the opposition deserves to be able to ask and to honestly debate these questions. 
This Confederation is in chaos for multiple reasons. Why are Liberals doing this? Why are they thwarting the voices of Canadians?",Conservative,Barrie—Innisfil,John Brassard,http://www.parl.gc.ca/Parliamentarians/en/members/john-brassard(234471)
4747092,ca.proc.d.2018-05-31.10172246,2018-05-31,cee27afa-cdf8-4e99-ab22-22290f86aa3a,214082,Hon. Catherine McKenna,,Government Orders,"Budget Implementation Act, 2018, No. 1",Bill C-74—Time Allocation Motion,"Mr. Speaker, I would like to point out that the member for York—Simcoe himself moved 100 closure motions.
In terms of putting a price on pollution, once again it is really important to note that putting a price on pollution works as part of our overall climate plan. Let us talk about our climate plan. It is putting a price on pollution and also making historic investments in public transportation. We know we can do better by investing in cleaner transportation, which saves time and money for Canadians and also reduces pollution. We are making historic investments in clean technologies, which are critically important. This is a $23-trillion economic opportunity that we want to take advantage of.
There are many other reasons we need to take climate action, and we would hope the party opposite would support us.",Liberal,Ottawa Centre,Catherine McKenna,http://www.parl.gc.ca/Parliamentarians/en/members/catherine-mckenna(214082)
4747093,ca.proc.d.2018-05-31.10172266,2018-05-31,4c0122f7-7958-4cbd-b99e-9d70a4dca1e8,230115,"Mr. Pierre-Luc Dusseault (Sherbrooke, NDP)",,Government Orders,"Budget Implementation Act, 2018, No. 1",Bill C-74—Time Allocation Motion,"Mr. Speaker, this morning, we are seeing a prime example of Liberal arrogance. The Minister of Environment and Climate Change wants to push through a time allocation motion on her 550-page bill.
She keeps referring to debates that took place at second reading and in committee, but the bill before us is an entirely new document. The bill changed and was reprinted as amended by the Standing Committee on Finance. That reset the clock.
Yesterday, we got an hour and a half to debate this bill, from 10:30 p.m. to midnight. This morning, we were told that there are five hours remaining for debate at report stage on a 550-page bill. If we do the math, we find that parliamentarians will have had less than a minute par page to debate and make a decision at report stage. How unbelievably arrogant.
Why is the minister so determined to ram through a bill that it is 550 pages long and amends 44 acts?
How does she think parliamentarians can do their job under these conditions?",New Democratic Party,Sherbrooke,Pierre-Luc Dusseault,http://www.parl.gc.ca/Parliamentarians/en/members/pierre-luc-dusseault(230115)
4747094,ca.proc.d.2018-05-31.10172283,2018-05-31,cee27afa-cdf8-4e99-ab22-22290f86aa3a,214082,Hon. Catherine McKenna,,Government Orders,"Budget Implementation Act, 2018, No. 1",Bill C-74—Time Allocation Motion,"Mr. Speaker, Canadians elected us to carry out an ambitious agenda. The budget implementation act, 2018, No. 1, provides the legislative framework to fulfill some key campaign commitments, which were reiterated in the 2018 budget.
Bill C-57 has been extensively debated in the House of Commons and in committee. We had four days of debate at second reading. More than 45 members spoke at that stage, including 13 Conservative Party members, six NDP members, and one Green Party member. There were 13 committee meetings, and no fewer than 106 witnesses testified.",Liberal,Ottawa Centre,Catherine McKenna,http://www.parl.gc.ca/Parliamentarians/en/members/catherine-mckenna(214082)
4747095,ca.proc.d.2018-05-31.10172290,2018-05-31,eaa6694f-1e20-4aae-ad3b-e694b0e12c59,224170,"Ms. Elizabeth May (Saanich—Gulf Islands, GP)",,Government Orders,"Budget Implementation Act, 2018, No. 1",Bill C-74—Time Allocation Motion,"Mr. Speaker, it is all too common to rise in this place as a member of a smaller party that does not have the status to get onto speaking rosters early, and so on, to protest the use of time allocation time and time again. What is unusual about this debate today is the absence of a minister to defend this action that carries the bill through the House. 
The Minister of Finance is not defending taking a budget bill to time allocation. Somehow the Minister of Environment and Climate Change and pipelines has drawn the short straw, and I wonder how on earth, with everything else on her plate, she thinks it is worthwhile to come here to tell members they do not have time to debate a budget bill.",Green Party,Saanich—Gulf Islands,Elizabeth May,http://www.parl.gc.ca/Parliamentarians/en/members/elizabeth-may(224170)
4747096,ca.proc.d.2018-05-31.10172299,2018-05-31,cee27afa-cdf8-4e99-ab22-22290f86aa3a,214082,Hon. Catherine McKenna,,Government Orders,"Budget Implementation Act, 2018, No. 1",Bill C-74—Time Allocation Motion,"Mr. Speaker, I am very proud to rise in this House. I am a member of cabinet, I am a member of this government, and I am very proud to defend what we are doing to grow the economy, to support the middle class, and to deliver on our agenda, and that is exactly what Bill C-74 would do. 
We have an ambitious agenda. It is to grow the economy and help the middle class and those working hard to join it, but let me be clear that it is also delivering over 600,000 jobs for Canadians and that hundreds of thousands of children are no longer living in poverty. 
This bill has been debated extensively in the House and at committee, and I know the member opposite has had a chance to speak at second reading debate. It is important that we figure out how to move forward, but it is also important to deliver the agenda that Canadians expect.",Liberal,Ottawa Centre,Catherine McKenna,http://www.parl.gc.ca/Parliamentarians/en/members/catherine-mckenna(214082)
4747097,ca.proc.d.2018-05-31.10172333,2018-05-31,38f0d8dc-9c1c-4c89-be68-08ebe484b50b,218752,"Mrs. Sylvie Boucher (Beauport—Côte-de-Beaupré—Île d'Orléans—Charlevoix, CPC)",,Government Orders,"Budget Implementation Act, 2018, No. 1",Bill C-74—Time Allocation Motion,"Mr. Speaker, I appreciate the opportunity to ask a question. 
During the election campaign in 2015, the Liberals promised to be squeaky clean and as pure as the driven snow in terms of transparency. 
Here is the reality today. With respect to free votes, they promised to make it the norm in the House—false. They said they would not resort to legislative tricks to avoid parliamentary scrutiny—false. They said they would not interfere with the work of government watchdogs—false. They promised to bring transparency to the appointment of Supreme Court judges—again, false. They promised to give the Parliamentary Budget Officer greater autonomy—false.
I would like to know why the Liberals are muzzling us in the House.",Conservative,Beauport—Côte-de-Beaupré—Île dOrléans—Charlevoix,Sylvie Boucher,http://www.parl.gc.ca/Parliamentarians/en/members/sylvie-boucher(218752)
