basepk,hid,speechdate,pid,opid,speakeroldname,speakerposition,maintopic,subtopic,subsubtopic,speechtext,speakerparty,speakerriding,speakername,speakerurl
4747305,ca.proc.d.2018-05-31.10175754,2018-05-31,8826a32c-2e29-49be-b6e2-c1f10363639b,218836,"Ms. Irene Mathyssen (London—Fanshawe, NDP)",,Government Orders,"Budget Implementation Act, 2018, No. 1",,"Mr. Speaker, the Liberals had an opportunity with this implementation act to build an economy that would lift everyone up, people who counted on them, instead of just the wealthy few at a top with their tax havens. Unfortunately, the Liberals decided instead to defend the interests of their corporate and privileged, consigning the rest of Canada to the back seat.
Budget 2018 and Bill C-74 reveal once again the Liberals' true nature.
I remember in 2004 the damage done to our country after 13 years of Liberal rule, most of those years in majority governments that accomplished little to nothing in the way of fairness and equity for working Canadians. Those Liberals made the most drastic cuts to our public broadcaster, did little to nothing in the way of implementing a universal child care program, nothing to reverse the devastating effects of colonialism on indigenous peoples, except as a last ditch effort to stay in power, and undermined the health care system with cuts to transfer payments to the provinces. 
We hoped for more progress than setting the bar at red book promises unfulfilled. For close to three years now, the NDP caucus has been calling on the Liberals to actually be the progressive, positive government they promised us in 2015. 
This bill betrays all women who believed the so-called “gender budget” would include much anticipated pay equity legislation, because it does not. The Liberals promised pay equity 40 years ago, again in 2016, and again a month ago in the budget speech. Canadians want to know when the Liberals will finally deliver pay equity.
Despite the smearing of its image by right-wing ideologues, the fact is that the public service has done more than the private sector in achieving gender equity in Canada. While there is still work to do on the equity front, women and men from historically disadvantaged groups, such as disabled persons, indigenous peoples, single parents, seniors, young people, and people of colour, are all represented in the public service workforce in greater percentages than they occur in Canada's population. They are employed at all levels of management and labour in the workforce more proportionately than in the private sector.
Labour researchers and academics have pointed out that this advantage is at least in part the result of the fact workers in the Canadian public service have union representation guaranteed under our Constitution. However, recent reports indicate that the equity and fairness established in the public service is eroding as a result of austerity measures, privatization, and contracting out. The effect of this offloading, besides being inefficient, is that public sector workers are beginning to experience greater levels of workplace precarity. We know too that this precarity impacts diverse members of the workforce who can least afford it.
We need to consider the legacy we are leaving to future generations, those who leave post-secondary and graduate schools with a burden of debt that is insurmountable only to face a world where jobs are scarce. When work can be found, it is more often than not part-time, underpaid, without benefits, and short-term. We need to give future generations more than the finance minister's statement, telling them to suck it up and get used to a lifetime of precarious work.
Future generations will need a robust economy because they will incur the burden of supporting us in our dotage with their tax dollars. We need to seriously consider the legacy we leave. However, we also know it is bigger than that.
We need to take care of each other for everyone to thrive. We need to create a Canada where no one experiences the isolation and degrading health consequences of homelessness, poverty, or mental illness, a Canada with free and equal access to education, health care, child care, pharmacare, housing, clean air, and clean water.
We know what works and what does not. If what we want is to create a healthy sustainable equitable economy where every citizen has equal access to opportunity and is able to thrive and prosper, the Canada we know is possible, the Canada that can be, the work begins now, with federal budgets. Sadly, the Liberals' budget implementation act is even more timid than the budget. It offers no real plan to reduce inequities or build an economy that would benefit all Canadians.
I would like to take this opportunity today to speak about the ways in which Bill C-74 could have addressed inequalities and build an economy that would benefit all Canadians.
This legislation could have contained provisions to assist rural communities. It does not. The Liberals had an opportunity in their 2018 budget to help rural communities, but instead chose to focus on the interests of their rich friends and their own ridings. In the meantime, they tell people in rural communities to wait for improved employment insurance, cellular infrastructure, and broadband Internet access.
In just the past few days, we have seen announcements from big banks about closing branches in Burford, Blyth, and Clifford in Ontario, and Kipling and Preeceville in Saskatchewan. These closures will leave Blyth and Kipling with no local banking options. In Saskatchewan, the nearest TD branch to Preeceville is an hour to an hour and 45 minutes away.
All of these communities have post offices. A postal banking system would allow members of this community access to banking services that are affordable and competitive, not to mention profitable for Canada Post. In the U.K., corporate banks have actually reversed their opposition to postal banking, because they know it absolves them from the community ire they would experience when they close branches in rural and remote communities, which these banks say do not reap enough profit. 
When will the government see the postal banking light? We will have an opportunity in that regard later this session when my motion M-166 comes to the floor of the House for a vote. I urge every member here to support it. We have the opportunity to make effective and progressive change, even if the government avoids it in budget implementation acts. We will have that opportunity very shortly.
A postal banking system would address inequality in this country, something Bill C-74 does not do, even though that should be the goal of government in a social democracy such as ours. Instead we see Canadians who live in rural and remote communities, Canadians with low income, and first nations peoples living on reserve forced to use predatory lenders or to rely on the whim of a local business person or local variety store to access their own money.
A universal pharmacare program would create equal access to life-saving and life-enhancing medications for all Canadians as well. I see nothing in this legislation that addresses that need. In fact, we continue with a patchwork system of access to abortion and birth control that creates inequality and forces Canadians who require those services to either pay exorbitant out-of-pocket costs or travel unreasonable hours to access these services. Monday was International Birth Control Day. It is the federal government's responsibility to ensure equal access for all Canadians needing birth control, but the government has failed. Access is neither universal, equal, nor affordable across this country.
I give the the following by way of example: the NuvaRing is available on public formularies in five provinces and one territory, but not the others; IUDs are available in 3 provinces, but not everywhere; emergency contraceptives are covered only in Alberta; and Quebec covers the patch, but no other province or territory does.
Canada has a human rights obligation to ensure that everyone in every province or territory has the same access to the highest quality medications. Why then does a woman in Manitoba and Quebec have access to more birth control methods than a woman in Saskatchewan? Making all birth control and all sexual and reproductive medications free for all of us is about fairness and gender equality. That is the reason I introduced M-65 to continue the push for equal access to birth control for all Canadians.
My constituents in London-Fanshawe do not believe the economy is working for them. What they see instead is an uneven playing field, where only the few at the top can benefit, at the expense of everyone else. They struggle to pay their bills and care for their parents and children in a community gutted by the loss of well-paid jobs moving offshore as a result of globalization, with no protection from either Liberal or Conservative governments.
Finally, this 556 page-long bill amends 44 pieces of legislation. During the last election campaign, the Liberals promised to abolish omnibus bills because they are undemocratic, yet they chose to restrict the length of debate on this substantial bill at the finance committee. This is not democracy and it is a far cry from the sunny ways promised to Canadians in 2015. 
We can do better. We are here to do better. Canadians demand better. Do not let the Liberals tell us it cannot be done.",New Democratic Party,London—Fanshawe,Irene Mathyssen,http://www.parl.gc.ca/Parliamentarians/en/members/irene-mathyssen(218836)
4747306,ca.proc.d.2018-05-31.10175997,2018-05-31,9fb311fc-3875-4698-b13c-014f0d819393,217587,"Mr. Colin Carrie (Oshawa, CPC)",,Government Orders,"Budget Implementation Act, 2018, No. 1",,"Mr. Speaker, my colleague from London—Fanshawe came up with a number of really important points. The bill we are debating is putting in place a brand new carbon tax, which has been deemed to be one of the biggest taxes ever put on Canadian businesses and job creators. Like her riding, my riding has a lot of manufacturers, and today we heard the horrible news about tariffs being put on Canadian steel and aluminum. Companies want certainty. They want to know how much it is going to cost them to do business in Canada, yet the Liberals are putting in this tax without letting Canadians how much it is going to cost. They know, but they will not release the information.
I had a motion on the table to allow the carbon tax to be transparent so that Canadians and job creators would know how much it is going to cost them. Could the member comment on whether she supports having this new carbon tax and information on how much it would cost Canadian job creators and Canadians in their day-to-day activities? Moreover, does she support its being transparent before it is implemented on the Canadian public?",Conservative,Oshawa,Colin Carrie,http://www.parl.gc.ca/Parliamentarians/en/members/colin-carrie(217587)
4747307,ca.proc.d.2018-05-31.10176024,2018-05-31,8826a32c-2e29-49be-b6e2-c1f10363639b,218836,Ms. Irene Mathyssen,,Government Orders,"Budget Implementation Act, 2018, No. 1",,"Mr. Speaker, I absolutely agree that all taxation and all of the work of the government should be transparent. Unfortunately, we have not seen that. I would like transparency with regard to tax shelters. There is $199 billion that goes out the door because corporations do not pay their fair share of taxes. 
We are in the middle of a trade war. We have a government that does not fully support small business as it should. Things are extremely difficult. 
A little transparency would go a long way, the kind of transparency proposed by my colleague from Victoria in the last session and in a bill he plans to introduce very shortly that would compel the Government of Canada to eliminate the loopholes available to those with huge incomes and the sham of businesses using tax havens to undercut what they owe, not just to the government but to all of the people of Canada in terms of support for the services and things we need as a democratic, safe, secure, and beneficial community.",New Democratic Party,London—Fanshawe,Irene Mathyssen,http://www.parl.gc.ca/Parliamentarians/en/members/irene-mathyssen(218836)
4747308,ca.proc.d.2018-05-31.10176051,2018-05-31,3c3ee442-a873-4845-84d0-7da07a66ce61,217244,"Mr. Alexandre Boulerice (Rosemont—La Petite-Patrie, NDP)",,Government Orders,"Budget Implementation Act, 2018, No. 1",,"Mr. Speaker, I would like to thank my colleague and congratulate her on her comments, which are very relevant, as usual, and in the interest of workers, as well as families in her region in Ontario and across the country.
There is something in the budget implementation bill that I cannot understand. The Liberal government will be taxing medical marijuana. In some cases, marijuana is the only medication that can ease regular, permanent, and intense pain. Other drugs do not work. These people are very worried, because they have just learned that they will probably have to pay much more for their medical marijuana.
I do not understand the Liberal government’s decision. I would like to hear my colleague's opinion on the subject and his comments on how this decision could have an impact on people who, because of the tax, may have to think twice before using medication.",New Democratic Party,Rosemont—La Petite-Patrie,Alexandre Boulerice,http://www.parl.gc.ca/Parliamentarians/en/members/alexandre-boulerice(217244)
4747309,ca.proc.d.2018-05-31.10176077,2018-05-31,8826a32c-2e29-49be-b6e2-c1f10363639b,218836,Ms. Irene Mathyssen,,Government Orders,"Budget Implementation Act, 2018, No. 1",,"Mr. Speaker, that is an important question. The reality is that there are many Canadians who rely on medical marijuana, and I am thinking of our veterans first and foremost and the service they gave to this country. The injuries they returned home with need to be addressed, and their service needs to be respected. Therefore, they deserve the very best with respect to medical support, and that includes medical marijuana.
One of the things we are very concerned about is the fact that indigenous people who require medical marijuana are being taxed, and those taxes very often put that medication out of reach.
More to the point, we need to look at pharmacare and how it could alleviate financial pressures, not just on those who need medical marijuana but on all Canadians. There are people across this country who cannot afford life-saving and life-improving medications. That should never happen in a country like this. When Tommy Douglas spoke of universal health care, he said the first step would be to support hospitals and doctors, and the next step to make sure that people have access to medications and support services in their homes. I ask the government to take the next step: let us have pharmacare, let us fulfill Douglas's dream, and let us make this a truly fair and supportive country.",New Democratic Party,London—Fanshawe,Irene Mathyssen,http://www.parl.gc.ca/Parliamentarians/en/members/irene-mathyssen(218836)
4747310,ca.proc.d.2018-05-31.10176104,2018-05-31,4626b9b7-420c-456d-9c7b-dea3794cb1c5,218548,"Mr. Alupa Clarke (Beauport—Limoilou, CPC)",,Government Orders,"Budget Implementation Act, 2018, No. 1",,"Mr. Speaker, thank you for recognizing me. First of all, I would like to say hello to all the people of Beauport—Limoilou, many of whom are listening today, and to thank them for all their work. They are definitely listening. When I go door to door, many of them tell me that they watch CPAC. 
I would like to say something about what the hon. Liberal member for Hamilton West—Ancaster—Dundas said in response to the speech of my colleague from Sherwood Park—Fort Saskatchewan. She engaged in the usual Liberal demagoguery. She asked if we believed in climate change. I really would like my constituents to listen closely, because I want to make this clear to them and to all Canadians: we, the Conservatives, believe so strongly in climate change that, in 2007, Mr. Harper held a joint press conference with Mr. Charest to announce the implementation of the new Canada ecotrust program, supported by a total investment of $1.5 billion. The aim of the program was to give each province hundreds of millions of dollars to help with their respective climate change plans. It is easy to look this up on Google by entering “ecoTrust,” “2007,” “Harper,” “Charest.” Not only did Mr. Charest commend the Conservative government’s initiative, but even Steven Guilbeault from Greenpeace at the time—and I am certain that my colleague from Mégantic—L’Érable will find this hard to believe—saluted the initiative as something unheard of. 
There is a reason why greenhouse gas emissions decreased by 2% under the decade-long Conservative reign. We had a plan, a plan with bold targets that the Liberals made their own. 
Now let us talk a bit about the 2018-19 budget, which continues in the same vein as the other two budgets presented so far by the hon. member for Papineau's Liberal government. I would like to begin by saying that the government has been in reaction mode for the past three years and almost never in action mode. 
It is in reaction mode when it comes to the softwood lumber crisis, although we do not hear much about it because the softwood lumber rates are still pretty attractive. However, the fact remains that this is a crisis and that, right now, industrial producers in the U.S. are collecting billions of dollars that they will eventually recover, as they do in every softwood lumber crisis. 
The Liberal government is in reaction mode when it comes to NAFTA. They will say that they are not the ones who put Mr. Trump in office, but this is yet another major issue that has been taking up their time in the past year, and they are still in reaction mode. They are also in reaction mode when it comes to the imminent tariffs on aluminum and steel.
The Liberals are in reaction mode when it comes to almost every major issue in Canada. They are in reaction mode when it comes to natural resources development, for example with regard to Kinder Morgan’s Trans Mountain pipeline. Once again they were in reaction mode, because Kinder Morgan said that it would walk if the government could not assume responsibility and tell British Columbia in no uncertain terms that this was a matter of federal jurisdiction.
All of this shows that the Prime Minister is not the great diplomat he pretends to be across the globe, and in celebrity news and other media. He is such a poor diplomat that he was unable to avoid the softwood lumber crisis with Obama. He is such a poor diplomat that he has supposedly had a wonderful relationship with Mr. Trump for the past year and a half. He speaks to him on the telephone I do not know how many times a month, but that did not prevent Mr. Trump from taking deliberate action against Canada, as we saw today with the tariffs on steel and aluminum. 
I would like to make a comparison. We, the Conservatives, were a government of action. We negotiated 46 free-trade agreements. We sent Canadian troops to Kandahar to demonstrate our willingness to co-operate with NATO and the G7 and to make a show of military force. We invested hugely in national defence, increasing our investments from 0.8% to almost 1.2% of the GDP following the dark days of Jean Chrétien’s Liberal government. We settled the softwood lumber issue in 2007, during the last crisis. We implemented the national shipbuilding strategy, investing more than $30 billion to renew our military fleet, to renew the Canadian Coast Guard’s exploration fleet in the Canadian Arctic, and to renew the fleet of icebreakers. The first of these icebreakers, the majestic Diefenbaker, will soon be under construction. 
Let us not forget that we also told Mr. Putin to get out of Ukraine. There is no doubt that we were a government of action.
When the budget was tabled, several journalists said that it was more of a political platform than a budget. I find that interesting. In their opinion, the political platform contained no concrete fiscal measures to prepare Canada for tomorrow, for the next 10 years, or for the next century, as our founding fathers intended in 1867. Rather, it contained proposals, in particular concerning social housing. The NDP must be very happy. The Liberals promised billions of dollars if the provinces gave their assent. That was a promise. 
The Liberals also made proposals concerning pharmacare. Once again, they were conditional on studies demonstrating the usefulness of such a plan. That, too, was a promise. The promises go on page after page in the budget, and it is obvious that it is a political platform. That is why the Liberals used the word “woman” more than 400 times, 30 times on each page. That is just demagoguery and totally abusive. 
I would like to quote a very interesting CBC journalist, Chris Hall. Since he works at the CBC, the Liberals will surely believe him. He said that the government recently spent $233,000 to organize round table discussions to find out whether Canadians understood the message, and not the content, of their budget. I will quote Mr. Hall:
 In particular, the report said the findings suggest middle-class Canadians—the very demographic the Liberals have been courting since their election with both policy initiatives and political messaging—don't feel their lives are getting better. 
They are correct in thinking that their lives are not getting better. Even Chris Hall concluded, in light of these studies, that the 2018-19 budget is not a document that provides guidelines, includes concrete measures, or outlines actual achievements in progress. It is a political document that proposes ideologies. 
The budget also contains a number of disappointments and shortcomings, precisely because it does not contain any actions. It does not respond to the fiscal reforms enacted by U.S. President Trump that give American companies an undue competitive advantage.
The 2018-19 federal budget does not address the tariffs on aluminum and steel either, although we all saw them coming. It does not specify what measures will be taken to implement carbon pricing. Most of all, it does not say how much it will cost every single Canadian. You would think it would at least do that. Some analysts say that it will cost approximately $2,500 per Canadian per year. 
This budget is full of proposals but has no concrete measures, and it perpetuates broken promises. Instead of $10-billion deficits for two consecutive years, we have $19-billion deficits accumulating year over year until 2045. This year, we were supposed to have a deficit of $6 billion, but it has reached almost $20 billion. The Liberals also broke their promise to balance the budget. This is the first time that the federal government has not had a concrete plan to balance the budget. 
We were supposed to run up deficits in order to invest in the largest infrastructure program in history, because with the Liberals everything is historic. Only $7 billion of the $180 billion of this program has been injected into the Canadian economy.
This is a very disappointing budget and, unfortunately, dear people of Beauport—Limoilou, taxes keep going up and the Liberal carbon tax is just the start.",Conservative,Beauport—Limoilou,Alupa Clarke,http://www.parl.gc.ca/Parliamentarians/en/members/alupa-clarke(218548)
4747311,ca.proc.d.2018-05-31.10176286,2018-05-31,fe08cc31-44b1-466e-a0c6-1b0c61c8bf97,215973,"Mr. Mark Gerretsen (Kingston and the Islands, Lib.)",,Government Orders,"Budget Implementation Act, 2018, No. 1",,"Mr. Speaker, unfortunately I could not agree less with the member's comments, specifically with respect to the government always taking a reactionary approach to things. As a matter of fact, our signature policies are the exact opposite. They are policies that are taking a proactive approach to things, such as what we are doing with our environment and how we are going to protect the environment for future generations. We have made sure that the Canada child benefit is indexed moving forward. We have made sure that the worker credit is available to those who are on social assistance and want to get back into the workforce. 
When it comes to things like that, would the member not agree that there are at least a couple of things in this budget that are progressive and forward-looking?",Liberal,Kingston and the Islands,Mark Gerretsen,http://www.parl.gc.ca/Parliamentarians/en/members/mark-gerretsen(215973)
4747312,ca.proc.d.2018-05-31.10176306,2018-05-31,4626b9b7-420c-456d-9c7b-dea3794cb1c5,218548,Mr. Alupa Clarke,,Government Orders,"Budget Implementation Act, 2018, No. 1",,"Mr. Speaker, it is quite funny. The hon. member spoke about the Canada child benefit and the income tax for workers. The CBC report I spoke about previously said that at the round tables, Canadians said they do not know how much that helped them, and they do not even know that this is going on right now. 
People I meet in my riding, Beauport—Limoilou, say they are aware that the Canada child benefit is a way to buy votes, and that is it. That is the basic thing the Liberals are doing with that. It is hard for people to make the choice. Of course, it is a lot of money, but they know that it is a lot of money that their kids will have to pay in 30 years, so it is a poison gift. That is all it is about. 
Most of the Liberals' measures are not in action but in reaction, and when they are in action, as some surely are, it is a poison gift for the future. How can the government be proud of those kinds of measures, when that is the case?",Conservative,Beauport—Limoilou,Alupa Clarke,http://www.parl.gc.ca/Parliamentarians/en/members/alupa-clarke(218548)
