basepk,hid,speechdate,pid,opid,speakeroldname,speakerposition,maintopic,subtopic,subsubtopic,speechtext,speakerparty,speakerriding,speakername,speakerurl
4743016,ca.proc.d.2018-05-03.10107514,2018-05-03,d013e8ca-fdd5-4eb4-a0e4-b5f0782a8f6d,217247,Mr. Fin Donnelly,,Government Orders,Oil Tanker Moratorium Act,,"Mr. Speaker, I know my colleague has been on the fisheries committee in past Parliaments. I know the work she does privately to restore our forests in British Columbia. I know her past work as a provincial minister. Therefore, I appreciate her question and her interest. I think she brings up a good point about the difference between the two coasts.
What is so incredibly magnificent about the west coast is we enjoy an abundance of biodiversity, both marine and terrestrial. We have whales. Some are threatened, such as the resident whales, but we have seen the recovery of some other species of whales. We have salmon and halibut. We have an incredible variety of species of fish and shellfish that are in abundance from the south coast up to the north coast. It is what has developed our local economies. There have been 10,000 to 15,000 years of development of these economies by our first peoples. They tell us about how they have lived off of these resources, the products of the ocean, for thousands and thousands of years. There are so many today in coastal fishing communities who rely on this abundance. They want to see these resources protected. That is why they are so passionate, as am I, about protecting, preserving, and conserving these resources.",New Democratic Party,Port Moody—Coquitlam,Fin Donnelly,http://www.parl.gc.ca/Parliamentarians/en/members/fin-donnelly(217247)
4743017,ca.proc.d.2018-05-03.10107534,2018-05-03,6da8653f-692f-4bbc-acb2-86e088f0d60d,219035,"Mr. Pierre Nantel (Longueuil—Saint-Hubert, NDP)",,Government Orders,Oil Tanker Moratorium Act,,"Mr. Speaker, I want to commend my colleague on his speech, his intense passion for the environment, as well his commitment in this crusade to bring awareness to the significance of the challenges we face. Honestly, I did not know that he engaged in the athleticism it takes to spend three weeks in cold water. I congratulate him. I am impressed at his unwavering convictions. I think he does a great job representing the people of his riding for whom these issues are crucial and vital.
In the House, we are having a societal debate and he is right to say that we have run out of choices, we have to identify what is hurting our planet. Obviously this is awful for a province whose economic growth is tied to developing its fossil fuels.
I would like to know whether my colleague believes that it would be a good idea to devote some energy to the task of looking into other job prospects for workers in the oil sands sector.",New Democratic Party,Longueuil—Saint-Hubert,Pierre Nantel,http://www.parl.gc.ca/Parliamentarians/en/members/pierre-nantel(219035)
4743018,ca.proc.d.2018-05-03.10107551,2018-05-03,d013e8ca-fdd5-4eb4-a0e4-b5f0782a8f6d,217247,Mr. Fin Donnelly,,Government Orders,Oil Tanker Moratorium Act,,"Mr. Speaker, yes, we are at a crossroads. I am glad he learned of the story of my three-week swim down the Fraser, which was a life-changing event for me. I have done that twice. I did it in 1995 and again in 2000. The only effect that I have suffered as a result of that is I got into politics, which I feel passionate about. 
His question about the world and the country being at a crossroads in our energy use is critical, and we must shift. Our science, information, and local knowledge are all converging and telling us that we have to shift now, that we are beyond the point of knowing that we cannot avoid this shift and that we have to make it. It is not a future issue; it is now. We have to look at developing, supporting, and turning to a just transition in renewables, moving to geothermal, solar, wind, and hydro. We need to invest in these projects. 
We need to work with municipalities, provinces, territories, and with working people to make the transition. We need to have jobs and work. We need them to make our communities and economies thrive. We also need to have a planet that is livable and sustainable, one that we can pass on and feel proud, as a society and national government, that we did the most we could to pass on a sustainable way of living.
 That is why Bill C-48 is a move in the right direction. We need to make an even greater move in the direction of a sustainable way of living, support it, invest in it, and make the needed transition happen today.",New Democratic Party,Port Moody—Coquitlam,Fin Donnelly,http://www.parl.gc.ca/Parliamentarians/en/members/fin-donnelly(217247)
4743019,ca.proc.d.2018-05-03.10107567,2018-05-03,86fed1de-3861-4448-8242-ad414073ef2e,234734,"Ms. Joyce Murray (Parliamentary Secretary to the President of the Treasury Board, Lib.)",,Government Orders,Oil Tanker Moratorium Act,,"Mr. Speaker, I am very grateful for the opportunity to speak today about the importance of B.C.'s north coast and why we are seeking to protect it with Bill C-48.
The area targeted by the tanker moratorium goes from the southern border of Alaska to the tip of continental British Columbia, to the north end of Vancouver Island, and it includes Haida Gwaii.
I will begin by reading from a document written eight years ago:
 [This bill] legislates a crude oil tanker ban in the dangerous inland waters around Haida Gwaii known as Dixon Entrance, Hecate Strait and Queen Charlotte Sound. It will protect our oceans and communities from the risk of a major oil spill and promote a sustainable economy – one that supports B.C.’s growing fisheries and tourism sectors. 
 [This] bill responds to the clear voices of British Columbians, [the majority]...of whom support a permanent tanker ban on B.C.’s north coast. First Nations, B.C. municipalities and thousands of businesses whose growth and sustainability depend on a healthy ocean and coastal ecosystem are united in their call for a permanent ban. 
 To be clear, [this bill] does not apply to natural gas products and will not affect existing deliveries of condensate into Kitimat, B.C. It will not prevent the continued transport of diesel and other oil products to local B.C. communities or in any way affect current or future shipments of oil to Asia and the United States through the Port of Vancouver. The bill does not limit growth in exports of Canadian crude to expanding international markets. And finally, it allocates no new ministerial ability to close other shipping areas in Canada, as these powers already exist under the Canada Shipping Act. 
 [The bill] does acknowledge that Canadians want communities and wildlife protected and [they want] prosperity. This can be achieved by making smart choices about where and how development takes place. 
 We have witnessed the environmental, economic and social devastation caused by the Exxon Valdez and BP catastrophes [in the Gulf of Mexico]. One major spill along B.C.’s shorelines would threaten fragile ecosystems, endanger wildlife, harm lives and communities, and jeopardize many of our...[tens of thousands of] coastal jobs. It is simply not worth the risk. 
I am reading from a letter that was written to my colleagues when I tabled Bill C-606 back in 2010. Today, I am so grateful and appreciative to our Minister of Transport for having tabled this bill, Bill C-48, which would do exactly what I called for with my bill, Bill C-606.
I had a chance to visit 15 communities up and down our coast, hosting events to hear from community members, including the chambers of commerce, indigenous people, and citizens. There was an overwhelming consensus that the Pacific north coast was a very important internationally-significant area that we must protect and defend from the risk of a major oil spill.
I spoke with individuals who showed me pictures of themselves wearing gumboots as they cleaned up oil from sea life and shorelines up in Prince William Sound in Alaska after the Exxon Valdez spill of 10.8 million U.S. gallons of oil back in 1989. Some of those ecosystems have never recovered from that spill, and it affects the economy and ecology of those areas today. I certainly understood the concern the people in the north coast had.
 I will explain why that area is so unique, actually risky, and why in my letter I talked about this risk British Columbians did not believe was worth it with respect to the benefits to our province. 
I want to give credit to the environmental advocacy groups that raised awareness about the risk of oil tanker traffic and spills in our north coast related to a pipeline that was proposed for the area. It has since been determined not permissible by our government. I want to also thank our Prime Minister for recognizing that our Pacific north coast is not the right route for pipelines and oil tankers.
I was privileged to successfully ensure that the ban on oil traffic in the Pacific north coast was included in two Liberal platforms, one in 2011 and one in 2015: promise made, promise kept.
The marine ecosystems that span the northern coast of British Columbia are unique. The coastline itself with its rugged cliffs and inlets provides an abundant environment for its ecologically rich and diverse animal populations. It is dotted with thousands of islands and etched with deep fjords. The coastal rainforests are places of stunning biological prosperity and diversity, and an environment that deserves protection.
 Not only is the north coast geographically complex, it also supports a wide range of distinct marine ecosystems. These ecosystems provide spawning and schooling areas for fish, and is important for a variety of sea birds, marine mammals, and other marine fauna, like humpback and killer whales, and that says nothing about the region's rich flora.
I had a chance to travel in this area as the environment minister for the province of British Columbia. I spent a week on a B.C. Park's boat touring the isolated inlets and shorelines as we sought to discuss with local indigenous peoples the possibility of creating a provincial park and reserve in the Great Bear Rainforest. I had a chance to see just how little human impact there had been on that part of our coast and how it really was a virgin ecosystem, which is expressed in the rich variety of the ecosystem I spoke about.
It was not just the marine areas that were so important to protect, but also the area on land, which a pipeline was proposing to traverse. The pipeline would have crossed hundreds of fish and salmon-bearing streams. It would have crossed wilderness, mountain, and valley areas with virgin forests and ecosystems, which are almost impossible to even hike through as they are so remote and uncivilized, and I say that in the technical sense. So few people live there in such vast areas that are uneroded. It is very important for grizzly bears and other wildlife to live without the impacts of human civilization, which have caused challenges to their abundance in other parts of our province and country.
In the northern coastal area, salmon still runs in the rivers, trees hundreds of years old loom over vast landscapes, and predators and prey keep the delicate balance necessary for these ecosystems to thrive. Our government is committed to ensure that this coast remains a vibrant ecosystem for generations to come. Ecotourism in this area is growing year by year as people from around the world recognize how internationally unique the area is. 
The government recognizes that indigenous groups have inhabited the north coast for millennia and continue to rely on its bountiful ecosystems as foundations for their cultures and economies. As I travelled around Haida Gwaii and Gwaii Haanas National Park Reserve in a sailboard a few years ago, I spoke to many indigenous people from Haida Gwaii. They were completely and utterly determined that their precious area would not be subject to the risk of a major oil spill by oil tanker traffic. Therefore, this moratorium is very important to those members of the Haida Gwaii community.
Bill C-48 is a significant step being taken by our government to enhance environmental protection for this pristine and important coastline.
The minister also travelled from coast to coast to coast to hear from people about this particular project. From Haida Gwaii to Iqaluit and St. John's, he wanted to hear their perspectives on the oil tanker moratorium and improving marine safety. 
Our government has met with stakeholders, non-governmental organizations, other levels of government, and indigenous groups to listen and gather input. I have to recognize that the Minister of Transport has done a full and deep job of consulting with people across the country. As the proponent of Bill C-606 in 2010, which was up for debate in March 2011, I was not able to do quite that thorough a job of consulting, but certainly the majority of people I spoke with felt that this was an important initiative. The minister heard a diversity of views, and the importance of these environmental protections was made abundantly clear. 
Coastal communities and industries everywhere in Canada understand the importance of healthy ecosystems to protect the way of life and livelihoods of those areas. In fact, there is a wide range of economic activity that feeds and sustains the Pacific north coast region's economic life cycle. For over a hundred years, we have had logging, mining, fisheries, and canning and processing facilities. Those activities have been important and have supported many communities along the coast.
 I want to acknowledge that the Province of British Columbia has really worked hard to consult with stakeholders from environmental groups, communities, indigenous communities, and industy to make sure that its land use planning process reflects where there should be more intensive use of the land and waters, and where there should be more protection of the land and waters. That balance has been found in our province. It can always be improved, but there has been a great deal of emphasis on proper management of the lands and waters in British Columbia since the 1990s, including the government I was part of in the early 2000s.
It is not something our government takes lightly, to ensure that a particular activity, such as a pipeline or oil tanker traffic, will not be permitted there. The jobs that would have been created, I would point out, were not an enormous number. The building of the pipeline would have created some jobs for sure, but once it was built, the number of ongoing jobs would have been far less. 
The moratorium would protect the livelihoods of communities on British Columbia's north coast by providing a heightened level of environmental protection, while continuing to allow for community and industry resupply by small tanker, which was an important part of the bill I proposed as well, Bill C-606. We know that these communities and the industry rely on marine shipments of critical petroleum products to sustain their livelihoods. That is why our government will continue to allow shipments of crude or persistent oil products below a certain level, which is 12,500 metric tons. 
The moratorium would protect the northern coastline, that whole area and its delicate ecosystems, including Haida Gwaii, from accidents that could upset this fragile region via a major oil spill. 
We know that the vast majority of citizens in this area do not believe the risk of that kind of major spill, which we have seen before on our west coast, is worth it. We understand that should something like this happen, our coast would never be the same. On the north coast, there are far fewer services to prevent a spill, to act quickly if a major oil tanker were in difficulty, and to prevent the damage.
This tanker moratorium does not tell the whole story of our protection of the coast and the precautionary approach that we are building in to help safeguard the marine environment in this region. I want to mention the oceans protection plan, which adds another set of protections. The oceans protection plan is a $1.5-billion initiative on which there was wide consultation. I know many members of the Pacific caucus, the B.C. members of Parliament, were asked to provide input into what should be in the oceans protection plan.
It will improve our incident prevention and response regime and address environmental concerns in the event of a marine accident. The oceans protection plan will lift the liability cap for defraying the costs of cleanup, should there be a spill, to unlimited liability. I am referring now to smaller ships. My colleague from Port Moody—Coquitlam read into the record some concerns about the smaller ships that were underneath the cap. There would be unlimited liability and the government would implement a levy on oil shipments to fund compensation, as well as to speed it up, so communities would not be not stuck footing the bill for the cleanup of smaller spills.
In the bill, we recognize that when the delicate balance of this coastline becomes threatened, it upsets relationships between the environment and its inhabitants. It is not just about today's coastal communities. It is also about inhabitants that have spanned thousands of years. The Musqueam first nation, for example, which is on a different part of the coast, the south coast, has a record of habitation and its traditional areas for over 4,000 years. We know there are deep historical and cultural ties to the Pacific north coast that support cultural practices and social structures, and that is also what makes this area worth protecting. 
Clearly, the oil tanker moratorium is just one of many initiatives in our comprehensive plan to protect the marine environment, to begin restoring some of the species that have been impacted by human activities over the years, and changes to our oceans, like acidification and warming from climate change, and the warming of streams that are necessary for our salmon cycle. There is so much work to be done, but this is a key part of it for a key part of our country, which is the Pacific north coast.
I hope we will have the full support of all members present for the passage of this bill, to take this important step in protecting one of the world's most diverse and rich regions anywhere on the planet.",Liberal,Vancouver Quadra,Joyce Murray,http://www.parl.gc.ca/Parliamentarians/en/members/joyce-murray(234734)
4743020,ca.proc.d.2018-05-03.10107801,2018-05-03,02c2cb20-f27d-46a5-8e78-ab4b405bf07b,214864,The Deputy Speaker,,Government Orders,Oil Tanker Moratorium Act,,"It is my duty, pursuant to Standing Order 38, to inform the House that the questions to be raised tonight at the time of adjournment are as follows: the hon. member for Saanich—Gulf Islands, Rail Transportation; the hon. member for Beauport—Côte-de-Beaupré—Île d'Orléans—Charlevoix, Employment.",Conservative,Simcoe North,Bruce Stanton,http://www.parl.gc.ca/Parliamentarians/en/members/bruce-stanton(214864)
4743021,ca.proc.d.2018-05-03.10107811,2018-05-03,1ad00957-54b5-494d-8773-b530fbe4967b,217599,"Mr. Mel Arnold (North Okanagan—Shuswap, CPC)",,Government Orders,Oil Tanker Moratorium Act,,"Mr. Speaker, I have many questions for the member, but I will try to keep my comments short. The member might be able to work around some of these questions. 
She talked about the ecotourism that is building in the areas where the pipelines may go through. How do the international ecotourists get there from other countries, from foreign lands? Surely they do not row a boat or pedal a bike. How does the fuel get to the planes that get them there? It is from other countries that produce oil with less environmental safeguards than we have here in Canada, but the Liberals are going to restrict Canadian oil from getting into those planes to get those ecotourists here.
The member did not talk about it, but the Liberal government has said that the Kinder Morgan pipeline expansion will be built. It is interesting to see the member try to work around that, and yet say that another pipeline that would serve another portion of the country with greater economic benefits for that portion of the country, and a portion of her province and my province, is being basically punished for where they are. How can the member explain her way out of that conundrum?",Conservative,North Okanagan—Shuswap,Mel Arnold,http://www.parl.gc.ca/Parliamentarians/en/members/mel-arnold(217599)
4743022,ca.proc.d.2018-05-03.10107831,2018-05-03,86fed1de-3861-4448-8242-ad414073ef2e,234734,Ms. Joyce Murray,,Government Orders,Oil Tanker Moratorium Act,,"Mr. Speaker, I welcome questions about this initiative which, as I have said, I was proud to champion starting in 2009, travelling up the coast and to coastal communities to hear from people and understand how important it is to have this oil tanker moratorium in that area. 
Tourists get there by arriving in a number of ways. Cruise ships stop in Prince Rupert. People can bike from Prince George to Prince Rupert, if they choose. There are many ways. Prince Rupert has an airport, and yes, communities do use oil products and will for many decades to come. However, that is not an excuse for putting a pipeline through an essentially untravelled and unimpacted wilderness area of the northern part of our province and impacting 750 streams that are important for salmon.
 It is not a reason to say that this is an area where we are going to have massive supertankers in a geography that is very dangerous in terms of the shoals and the storms. No, we have to choose where it makes sense to move our oil products to market—",Liberal,Vancouver Quadra,Joyce Murray,http://www.parl.gc.ca/Parliamentarians/en/members/joyce-murray(234734)
4743023,ca.proc.d.2018-05-03.10107857,2018-05-03,02c2cb20-f27d-46a5-8e78-ab4b405bf07b,214864,The Deputy Speaker,,Government Orders,Oil Tanker Moratorium Act,,"Order. I did notice at the outset of questions and comments about four or so members standing. We will try to get all of them in, but I will try to ask members to keep their interventions to around a minute or so. Most members, if not all, are pretty good at doing that. It is just the same length of time as a Standing Order 31 statement, and we have had good practice with that.
The hon. member for Courtenay—Alberni.",Conservative,Simcoe North,Bruce Stanton,http://www.parl.gc.ca/Parliamentarians/en/members/bruce-stanton(214864)
4743024,ca.proc.d.2018-05-03.10107866,2018-05-03,e7d4b944-1d3e-4f87-a7df-cdbd4fe7ca2b,237062,"Mr. Gord Johns (Courtenay—Alberni, NDP)",,Government Orders,Oil Tanker Moratorium Act,,"Mr. Speaker, I want to thank my hon. colleague from Vancouver Quadra for her long-time advocacy for a ban on the north coast. I want to commend her for that, but I also want to thank her for her description of the sensitive ecosystems that we have in coastal British Columbia and the importance of that for jobs and our economy. The member also cited the spill of the Exxon Valdez in the north coast and how some of the ecosystems still have not survived.
In fact, the Prime Minister said, “Crude oil supertankers just have no place on B.C.'s north coast.” The member talked about that being a promise that the Liberals made, and that they have followed through with that promise. She said that it is a promise made and a promise kept.
Where I have concerns is that with the same ecosystems we have on the south coast, the member supports a pipeline project, Kinder Morgan, that is going to increase supertanker traffic by sevenfold. This was a promise made—the Liberals were going to have a renewed process—and it is a promise broken. 
Maybe the member can square with people at home how she can support this project, in light of the fact that we have southern resident killer whales and we have the same ecosystem that will be affected by this project, and what is at stake.",New Democratic Party,Courtenay—Alberni,Gord Johns,http://www.parl.gc.ca/Parliamentarians/en/members/gord-johns(237062)
4743025,ca.proc.d.2018-05-03.10107903,2018-05-03,86fed1de-3861-4448-8242-ad414073ef2e,234734,Ms. Joyce Murray,,Government Orders,Oil Tanker Moratorium Act,,"Mr. Speaker, it is not surprising that the NDP members opposite just cannot take yes to heart as a solution to an important challenge and say that they appreciate it. They need to tie it into other things they would like.
Let us recall the incredible outpouring of concern about the ecosystems of our north coast area with the possibility of having a greenfield pipeline, which means a pipeline that crosses areas that are almost unnavigable or impossible to hike, they are so mountainous, treed, and full of important species that have a refuge in that area. That is just the pipeline route.
The coastal route is one that is extremely concerning in terms of the danger of navigation. There is always the risk of human error. As good as the—",Liberal,Vancouver Quadra,Joyce Murray,http://www.parl.gc.ca/Parliamentarians/en/members/joyce-murray(234734)
4743026,ca.proc.d.2018-05-03.10107922,2018-05-03,02c2cb20-f27d-46a5-8e78-ab4b405bf07b,214864,The Deputy Speaker,,Government Orders,Oil Tanker Moratorium Act,,"Questions and comments, the hon. member for Saanich—Gulf Islands.",Conservative,Simcoe North,Bruce Stanton,http://www.parl.gc.ca/Parliamentarians/en/members/bruce-stanton(214864)
