basepk,hid,speechdate,pid,opid,speakeroldname,speakerposition,maintopic,subtopic,subsubtopic,speechtext,speakerparty,speakerriding,speakername,speakerurl
4742928,ca.proc.d.2018-05-03.10106253,2018-05-03,1a1a9dee-c228-40fc-b926-42f8441d84f0,214405,"Hon. Ralph Goodale (Minister of Public Safety and Emergency Preparedness, Lib.)",,Oral Questions,"Immigration, Refugees and Citizenship",,"Mr. Speaker, the issue of human trafficking is one that we have raised not only with the G7, but also in the context of the policies of the Government of Canada in relation to violence against women, both domestically and internationally. 
In broadening out the scope of this very serious topic, it is not only focused upon trafficking, which is in itself serious, but a broad range of issues, which is the topic or the series of topics being addressed by the gender equality advisory council.",Liberal,Regina—Wascana,Ralph Goodale,http://www.parl.gc.ca/Parliamentarians/en/members/ralph-goodale(214405)
4742929,ca.proc.d.2018-05-03.10106255,2018-05-03,68bad047-6aec-43e2-b870-7bc501110873,218373,"Mr. Ziad Aboultaif (Edmonton Manning, CPC)",,Oral Questions,"Immigration, Refugees and Citizenship",,"Mr. Speaker, over 45,000 privately sponsored refugees are waiting in the backlog to come to Canada.
Instead of prioritizing the world's most vulnerable, people crossing into Canada from one of the safest countries in the world are getting bumped ahead of the line. The Prime Minister has opened the door wide open to illegal border crossers with his tweet, but will not lift a finger to help those playing by the rules.
Could the Prime Minister explain to those who have been waiting in refugee camps for years how this is fair?",Conservative,Edmonton Manning,Ziad Aboultaif,http://www.parl.gc.ca/Parliamentarians/en/members/ziad-aboultaif(218373)
4742930,ca.proc.d.2018-05-03.10106259,2018-05-03,7e23c9e2-cce8-4cd0-b5ed-200a809748cb,229497,"Mr. Serge Cormier (Parliamentary Secretary to the Minister of Immigration, Refugees and Citizenship, Lib.)",,Oral Questions,"Immigration, Refugees and Citizenship",,"Mr. Speaker, the member opposite knows full well that we are talking about two completely different systems. I would appreciate it if he were more truthful with Canadians.
We have taken meaningful action when it comes to illegal border crossings. We invested $173 million in the last budget. That is quite a contrast from the previous government, which cut more than $400 million from border management budgets. 
We have also taken steps with our partners, including the different provinces, such as Quebec and Ontario, to ensure that people who cross the border irregularly are processed as soon as possible.",Liberal,Acadie—Bathurst,Serge Cormier,http://www.parl.gc.ca/Parliamentarians/en/members/serge-cormier(229497)
4742931,ca.proc.d.2018-05-03.10106262,2018-05-03,844f3193-503d-479c-a776-5f343b6bd267,234878,"Hon. Alice Wong (Richmond Centre, CPC)",,Oral Questions,"Immigration, Refugees and Citizenship",,"Mr. Speaker, we have heard from vulnerable Syrian refugees. They lack resources, such as language training or the ability to find a job in Canada. One woman was begging for someone who could teach her English, and many more are using food banks.
We know these resources will be stretched further with the influx of illegal border crossers who also use these services. How is that fair?",Conservative,Richmond Centre,Alice Wong,http://www.parl.gc.ca/Parliamentarians/en/members/alice-wong(234878)
4742932,ca.proc.d.2018-05-03.10106265,2018-05-03,7e23c9e2-cce8-4cd0-b5ed-200a809748cb,229497,"Mr. Serge Cormier (Parliamentary Secretary to the Minister of Immigration, Refugees and Citizenship, Lib.)",,Oral Questions,"Immigration, Refugees and Citizenship",,"Mr. Speaker, once again, we are talking about two completely different systems.
We are very proud of the commitment our government made to welcome 50,000 Syrian refugees to Canada. We will ensure that these Syrian refugees adapt to our reality and to our country. We will give them every means to succeed in our society. We need these people and we know that they actively contribute to our society. We will do everything we can to ensure that they have the services they need to succeed in our society.",Liberal,Acadie—Bathurst,Serge Cormier,http://www.parl.gc.ca/Parliamentarians/en/members/serge-cormier(229497)
4742933,ca.proc.d.2018-05-03.10106268,2018-05-03,53435570-da9e-42e1-a195-e5475a2f8b13,217110,"Ms. Georgina Jolibois (Desnethé—Missinippi—Churchill River, NDP)",,Oral Questions,Indigenous Affairs,,"Mr. Speaker, there is a significant concern from members of the Assembly of First Nations that the Liberals' planned indigenous rights legislation will come far too late to matter, and that there will not be enough involvement from first nations people in Canada. 
The minister has said that laws in Canada must fully respect the rights of first nations people. Therefore, can the minister tell us when the Liberals are meeting with every first nation and when their legislation will be introduced?",New Democratic Party,Desnethé—Missinippi—Churchill River,Georgina Jolibois,http://www.parl.gc.ca/Parliamentarians/en/members/georgina-jolibois(217110)
4742934,ca.proc.d.2018-05-03.10106271,2018-05-03,f470e27a-a074-4b16-8304-960ffe8c9289,233806,"Hon. Carolyn Bennett (Minister of Crown-Indigenous Relations and Northern Affairs, Lib.)",,Oral Questions,Indigenous Affairs,,"Mr. Speaker, I am very proud to report on the progress to date and the engagement on the recognition of indigenous rights and the implementation framework.
In over 67 round tables, we have met with over 1,000 people, and 500 of those were women. It is very interesting that, as the member pointed out, some want this done today, because it is all there in volume 2 of RCAP, and some want us to take longer. We are going to do this the right way, and we are going to do it as soon as we can. ",Liberal,Toronto—St. Paul's,Carolyn Bennett,http://www.parl.gc.ca/Parliamentarians/en/members/carolyn-bennett(233806)
4742935,ca.proc.d.2018-05-03.10106275,2018-05-03,13a21d52-bc44-4a96-a206-f18432ef9191,228735,"Mr. Romeo Saganash (Abitibi—Baie-James—Nunavik—Eeyou, NDP)",,Oral Questions,Indigenous Affairs,,"Mr. Speaker, one of the many promises the Liberals made to indigenous peoples was indigenous languages legislation. 
This announcement was made to the chief of the Assembly of First Nations nearly two years ago. Yes, it has been two years. A few days ago, a request for tenders showed up on the government's site to draft this legislation to promote and preserve indigenous languages.
Can the Prime Minister assure us that this legislation will not be doomed to the same fate as his promise on electoral reform?",New Democratic Party,Abitibi—Baie-James—Nunavik—Eeyou,Romeo Saganash,http://www.parl.gc.ca/Parliamentarians/en/members/romeo-saganash(228735)
4742936,ca.proc.d.2018-05-03.10106284,2018-05-03,83cd3ab5-7dc7-414e-ab8b-e0dbc16b4c4a,214117,"Hon. Mélanie Joly (Minister of Canadian Heritage, Lib.)",,Oral Questions,Indigenous Affairs,,"Mr. Speaker, our relationship with indigenous peoples and nations is our government's most important relationship. I know that the topic of indigenous languages is very important to my colleague, and I would be happy to work with him to ensure that we have solid legislation on indigenous languages.
As he knows, and as you know, Mr. Speaker, we are developing original legislation on indigenous languages that will protect, promote, and revitalize our country's 90 indigenous languages.",Liberal,Ahuntsic-Cartierville,Mélanie Joly,http://www.parl.gc.ca/Parliamentarians/en/members/melanie-joly(214117)
4742937,ca.proc.d.2018-05-03.10106288,2018-05-03,8433b4ed-0aa1-4609-bc70-6348fd323a11,224978,"Mr. Shaun Chen (Scarborough North, Lib.)",,Oral Questions,Housing,,"Mr. Speaker, the national housing strategy is a 10-year, $40-billion plan to give more Canadians, particularly the most vulnerable Canadians, a place to call home.
Yesterday in Toronto, #TorontoStrong, the government announced the details of one of the key pillars of the national housing strategy: the national housing co-investment fund.
Could the minister responsible for housing tell the House how this co-investment fund will help the federal government work with its partners to move forward on the housing priorities that matter to Canadians?",Liberal,Scarborough North,Shaun Chen,http://www.parl.gc.ca/Parliamentarians/en/members/shaun-chen(224978)
4742938,ca.proc.d.2018-05-03.10106293,2018-05-03,d67a49c2-65bd-411e-8bb4-29ff759c5829,214003,"Hon. Jean-Yves Duclos (Minister of Families, Children and Social Development, Lib.)",,Oral Questions,Housing,,"Mr. Speaker, I would like to commend the member for Scarborough North for his great work in helping give more Canadians a safe place to call home. I would also like to congratulate him on his French.
The $17 billion announced yesterday is going to create wonderful partnership opportunities for all levels of government, as well as the private and social sectors. It is also going to help construct or renovate homes for 300,000 families.
Working together, we will provide more safe and affordable housing to middle-class families and those working hard to join it.",Liberal,Québec,Jean-Yves Duclos,http://www.parl.gc.ca/Parliamentarians/en/members/jean-yves-duclos(214003)
4742939,ca.proc.d.2018-05-03.10106296,2018-05-03,AD6E8838-A6D5-4D6D-94F7-25180A163C59,234363,"Mr. Glen Motz (Medicine Hat—Cardston—Warner, CPC)",,Oral Questions,Public Safety,,"Mr. Speaker, last week, an unknown number of ISIS computer servers were seized in Canada. According to the Minister of Public Safety's own department, terrorists such as ISIS “continue to use the internet to recruit new members and radicalize people”.
It is therefore shocking that the Liberals have actually removed criminal penalties for promoting terrorism in their new national security bill. When the threat on Canadian soil is so real, why are the Liberals removing criminal penalties for the promotion of terrorism?",Conservative,Medicine Hat—Cardston—Warner,Glen Motz,http://www.parl.gc.ca/Parliamentarians/en/members/glen-motz(234363)
4742940,ca.proc.d.2018-05-03.10106300,2018-05-03,1a1a9dee-c228-40fc-b926-42f8441d84f0,214405,"Hon. Ralph Goodale (Minister of Public Safety and Emergency Preparedness, Lib.)",,Oral Questions,Public Safety,,"Mr. Speaker, I think the hon. gentleman misunderstands the effect of the legislation.
What is in the existing law is a provision that is virtually impossible to enforce. What we have done is propose wording that would change that to more familiar criminal procedures that have a greater likelihood of success in stopping the very conduct he complains about.",Liberal,Regina—Wascana,Ralph Goodale,http://www.parl.gc.ca/Parliamentarians/en/members/ralph-goodale(214405)
4742941,ca.proc.d.2018-05-03.10106302,2018-05-03,4626b9b7-420c-456d-9c7b-dea3794cb1c5,218548,"Mr. Alupa Clarke (Beauport—Limoilou, CPC)",,Oral Questions,Public Safety,,"Mr. Speaker, they can enforce what they want. It is a question of political will. That is it. 
Canada recently took part in a joint police operation with its allies to combat international terrorism, specifically that perpetrated by ISIS. The purpose of the operation was to undermine the power of the terrorist group's propaganda machine by seizing countless software programs and Internet servers all over the world. The operation was laudable and necessary, but in matters of counterterrorism, we must attack on all fronts.
Why is the Liberal government eliminating criminal penalties for terrorists right here on Canadian soil in Bill C-59?",Conservative,Beauport—Limoilou,Alupa Clarke,http://www.parl.gc.ca/Parliamentarians/en/members/alupa-clarke(218548)
4742942,ca.proc.d.2018-05-03.10106305,2018-05-03,1a1a9dee-c228-40fc-b926-42f8441d84f0,214405,"Hon. Ralph Goodale (Minister of Public Safety and Emergency Preparedness, Lib.)",,Oral Questions,Public Safety,,"Mr. Speaker, that line of reasoning is quite simply Conservative propaganda. The fact of the matter is that we are changing the wording of the legislation to make it more effective, to put in place an offence that is more familiar within our criminal justice system and has a greater likelihood of success in terms of proving the offence and getting a conviction. We want success on that front, not just bafflegab. ",Liberal,Regina—Wascana,Ralph Goodale,http://www.parl.gc.ca/Parliamentarians/en/members/ralph-goodale(214405)
4742943,ca.proc.d.2018-05-03.10106307,2018-05-03,bd2068aa-74c7-430a-bdf5-6f17b14ca140,218228,"Mr. Tom Kmiec (Calgary Shepard, CPC)",,Oral Questions,Foreign Investment,,"Mr. Speaker, the chair of Aecon and one of its chief financiers wrote an editorial in The Globe and Mail praising the Aecon takeover by a Chinese state-owned enterprise. They said it would be as amazing as the takeover of Australia's John Holland Group, the same John Holland Group that has been involved in the botched construction of a children's hospital in Australia, with asbestos in the roof, shoddy construction, lead in the water, and inexperienced contractors. 
Will the Prime Minister listen to his corporate insiders, who would gain from this takeover, or will he listen to Canadian national security officials and cancel the deal?",Conservative,Calgary Shepard,Tom Kmiec,http://www.parl.gc.ca/Parliamentarians/en/members/tom-kmiec(218228)
4742944,ca.proc.d.2018-05-03.10106311,2018-05-03,18e36567-4082-4ce3-a35b-d4aba65560ca,234557,"Mr. David Lametti (Parliamentary Secretary to the Minister of Innovation, Science and Economic Development, Lib.)",,Oral Questions,Foreign Investment,,"Mr. Speaker, our government welcomes international investment that will benefit the Canadian economy, but not at the expense of national security. The Investment Canada Act contains a multistep review process that includes a national security review, which we always follow for all international investments in Canada. It is a rigorous process. It is undertaken with the government's national security agencies, and we rely on their very good advice. ",Liberal,LaSalle—Émard—Verdun,David Lametti,http://www.parl.gc.ca/Parliamentarians/en/members/david-lametti(234557)
4742945,ca.proc.d.2018-05-03.10106314,2018-05-03,bd2068aa-74c7-430a-bdf5-6f17b14ca140,218228,"Mr. Tom Kmiec (Calgary Shepard, CPC)",,Oral Questions,Foreign Investment,,"Mr. Speaker, when Australian construction firm John Holland was bought by a Chinese state-owned enterprise, the result was a children's hospital built with asbestos in the roof and lead in the water. Despite this, China's envoy to Canada said that it would be immoral for Canadians to question the takeover of Aecon by the same Chinese state-owned enterprise that built the botched hospital. 
Does the industry minister agree that it is immoral to question the takeover of Aecon, or will he take the concerns of Canadians seriously?",Conservative,Calgary Shepard,Tom Kmiec,http://www.parl.gc.ca/Parliamentarians/en/members/tom-kmiec(218228)
4742946,ca.proc.d.2018-05-03.10106316,2018-05-03,18e36567-4082-4ce3-a35b-d4aba65560ca,234557,"Mr. David Lametti (Parliamentary Secretary to the Minister of Innovation, Science and Economic Development, Lib.)",,Oral Questions,Foreign Investment,,"Mr. Speaker, our government listens to Canadians at every step of the way. We have done it since we were elected, and we will continue to do it. 
As regards the Investment Canada Act, there is a multistep process in place that includes a national security review. We will never compromise national security, and investments are accepted in Canada at this level only when they are a net benefit to the Canadian economy. All of those principles will abide. ",Liberal,LaSalle—Émard—Verdun,David Lametti,http://www.parl.gc.ca/Parliamentarians/en/members/david-lametti(234557)
4742947,ca.proc.d.2018-05-03.10106318,2018-05-03,e7d4b944-1d3e-4f87-a7df-cdbd4fe7ca2b,237062,"Mr. Gord Johns (Courtenay—Alberni, NDP)",,Oral Questions,The Environment,,"Mr. Speaker, plastics are entering our waters, entering our food chain, and ending up on our dinner plates. This is a global issue, but Canada has no national policy, and the Liberals' oceans protection plan does not even mention the word “plastic”. How can the Prime Minister say he wants to lead the G7 discussion on ocean plastics, when he has done nothing about it? 
My motion, Motion No. 151, addresses this regulatory and legislative gap. Will the Prime Minister support my motion and take immediate action to clean up plastic pollution in our waters?",New Democratic Party,Courtenay—Alberni,Gord Johns,http://www.parl.gc.ca/Parliamentarians/en/members/gord-johns(237062)
4742948,ca.proc.d.2018-05-03.10106321,2018-05-03,cee27afa-cdf8-4e99-ab22-22290f86aa3a,214082,"Hon. Catherine McKenna (Minister of Environment and Climate Change, Lib.)",,Oral Questions,The Environment,,"Mr. Speaker, I absolutely agree. We need to do more to reduce single-use plastics, which are ending up in our oceans. It is a travesty. I have gone to the High Arctic, and I have actually seen birds with pieces of plastic inside them. 
 We know we need to do better. We need to be doing that in conjunction with provinces and territories. We are convening a meeting with provinces and territories to make advances so we can have a robust regime to stop this from happening. ",Liberal,Ottawa Centre,Catherine McKenna,http://www.parl.gc.ca/Parliamentarians/en/members/catherine-mckenna(214082)
4742949,ca.proc.d.2018-05-03.10106324,2018-05-03,363e30d6-e47b-4c39-91ad-667deb63009c,217115,"Ms. Sheila Malcolmson (Nanaimo—Ladysmith, NDP)",,Oral Questions,Fisheries and Oceans,,"Mr. Speaker, marine plastic pollution needs action, not meetings.
As another busy boating season begins in B.C., the abandoned vessel problem remains unsolved. Coastal communities have been calling for a comprehensive solution for a decade. They are done waiting. Following the NDP's lead, Parliament agreed to fast-track Bill C-64 to committee. However, since it was sent back to the House on March 2, the government has dropped anchor on the bill. Will the minister commit to amending the bill to include what coastal communities actually want, and stop stalling?",New Democratic Party,Nanaimo—Ladysmith,Sheila Malcolmson,http://www.parl.gc.ca/Parliamentarians/en/members/sheila-malcolmson(217115)
4742950,ca.proc.d.2018-05-03.10106326,2018-05-03,bc2e82f3-02f1-46e2-b9be-7d5f04ddddc9,214106,"Hon. Marc Garneau (Minister of Transport, Lib.)",,Oral Questions,Fisheries and Oceans,,"Mr. Speaker, we are extremely proud of Bill C-64. We are the first government to take concrete action to deal with the issue of abandoned and wrecked vessels. In fact, I went to British Columbia, to my colleague's riding of Ladysmith, if I am not mistaken, and announced that nine boats are going to be removed from the water there. We will be doing this on a regular basis. 
We are also going to ratify the Nairobi convention, which is another powerful tool to deal with owners so they take responsibility for their vessels.",Liberal,Notre-Dame-de-Grâce—Westmount,Marc Garneau,http://www.parl.gc.ca/Parliamentarians/en/members/marc-garneau(214106)
4742951,ca.proc.d.2018-05-03.10106329,2018-05-03,62bfd797-8d32-425b-91b1-1422ca16694f,237138,"Mr. Blake Richards (Banff—Airdrie, CPC)",,Oral Questions,Democratic Reform,,"Mr. Speaker, first the Prime Minister tried to change Canadians' electoral system without letting them have a say. Then he tried to silence the opposition in Parliament. Now he is trying to change the elections law to benefit the Liberal Party. He wants to use voter information cards as a proof of address when, in the last election, nearly one million erroneous cards were mailed out. Canadians have seen through his tricks before, and they will once again.
Why does the Prime Minister want to see Canadians show ID to buy marijuana, but not in order to vote?",Conservative,Banff—Airdrie,Blake Richards,http://www.parl.gc.ca/Parliamentarians/en/members/blake-richards(237138)
4742952,ca.proc.d.2018-05-03.10106332,2018-05-03,6d680702-120b-4bcf-8da9-aae3e38ca0cf,214346,"Hon. Scott Brison (President of the Treasury Board, Lib.)",,Oral Questions,Democratic Reform,,"Mr. Speaker, with Bill C-76, our government is making it easier for Canadians to vote, and tougher to break the rules. The defeated Harper Conservatives, on the other hand, made it tougher for Canadians to vote, and they broke the rules. We will not take lessons from the defeated Harper Conservatives—",Liberal,Kings—Hants,Scott Brison,http://www.parl.gc.ca/Parliamentarians/en/members/scott-brison(214346)
4742953,ca.proc.d.2018-05-03.p5381418,2018-05-03,,,,intervention,Oral Questions,Democratic Reform,," Hear, hear!",,,Some hon. members,
4742954,ca.proc.d.2018-05-03.p5381419,2018-05-03,6d680702-120b-4bcf-8da9-aae3e38ca0cf,214346,Hon. Scott Brison,,Oral Questions,Democratic Reform,," Mr. Speaker, Canadians applauded, too, when the Conservatives were defeated.
We will not take lessons from a party that paid a $250,000 fine for breaking the law, that used robocalls to send people to the wrong polls—",Liberal,Kings—Hants,Scott Brison,http://www.parl.gc.ca/Parliamentarians/en/members/scott-brison(214346)
4742955,ca.proc.d.2018-05-03.10106333,2018-05-03,3176068f-62ee-4b2f-aacd-1131201c6db1,214707,The Speaker,,Oral Questions,Democratic Reform,,The hon. member for Banff—Airdrie.,Liberal,Halifax West,Geoff Regan,http://www.parl.gc.ca/Parliamentarians/en/members/geoff-regan(214707)
4742956,ca.proc.d.2018-05-03.10106334,2018-05-03,62bfd797-8d32-425b-91b1-1422ca16694f,237138,"Mr. Blake Richards (Banff—Airdrie, CPC)",,Oral Questions,Democratic Reform,,"Mr. Speaker, leave it to the Liberals to claim to fix a problem but instead make it worse. There have been numerous claims about millions of dollars in foreign funding being funnelled into third party groups in the last election. Conservatives have raised this problem time and time again. What do the Liberals do? They do absolutely nothing. Under their new legislation, foreign funds can still flow into Canada to influence our elections.
Why do the Liberals not do something that is not just window dressing and actually protect the integrity of our elections?",Conservative,Banff—Airdrie,Blake Richards,http://www.parl.gc.ca/Parliamentarians/en/members/blake-richards(237138)
4742957,ca.proc.d.2018-05-03.10106336,2018-05-03,6d680702-120b-4bcf-8da9-aae3e38ca0cf,214346,"Hon. Scott Brison (President of the Treasury Board, Lib.)",,Oral Questions,Democratic Reform,,"Mr. Speaker, I am awfully glad the hon. member had a supplementary question, because there are so many things the Conservatives did to attack our electoral system that I needed more time. In fact, the parliamentary secretary to their prime minister went to jail for breaking election rules. The Conservatives attacked our democratic system; the Liberals are strengthening it. That is what Bill C-76 would do, making it easier for Canadians to vote, while strengthening our democratic system. More people voting is good for our democratic system.",Liberal,Kings—Hants,Scott Brison,http://www.parl.gc.ca/Parliamentarians/en/members/scott-brison(214346)
4742958,ca.proc.d.2018-05-03.10106339,2018-05-03,38f0d8dc-9c1c-4c89-be68-08ebe484b50b,237024,"Mrs. Sylvie Boucher (Beauport—Côte-de-Beaupré—Île d'Orléans—Charlevoix, CPC)",,Oral Questions,Democratic Reform,,"Mr. Speaker, I will take no lessons from the Liberals on democratic reform. They will not listen to anyone. The Canada Elections Act has been working just fine so far. What do the Liberals do whenever something is working just fine? They find a way to mess it up. With the election just 18 months away, they are only too happy to confuse voters. Across the country, Canadians must identify themselves with at least one piece of official identification, with no exceptions and not excluding anyone.
Why are the Liberals—",Conservative,Beauport—Côte-de-Beaupré—Île dOrléans—Charlevoix,Sylvie Boucher,http://www.parl.gc.ca/Parliamentarians/en/members/sylvie-boucher(237024)
4742959,ca.proc.d.2018-05-03.10106344,2018-05-03,3176068f-62ee-4b2f-aacd-1131201c6db1,214707,The Speaker,,Oral Questions,Democratic Reform,,The hon. President of the Treasury Board.,Liberal,Halifax West,Geoff Regan,http://www.parl.gc.ca/Parliamentarians/en/members/geoff-regan(214707)
4742960,ca.proc.d.2018-05-03.10106345,2018-05-03,6d680702-120b-4bcf-8da9-aae3e38ca0cf,214346,"Hon. Scott Brison (President of the Treasury Board, Lib.)",,Oral Questions,Democratic Reform,,"Mr. Speaker, we are strengthening Canada's democratic institutions with Bill C-76, and we are increasing Canadians' trust and participation in our electoral process. We are increasing the transparency of the electoral process. We are making elections more accessible to Canadians, including Canadians with disabilities. We are making the electoral process more secure and ensuring that political parties protect the privacy of Canadian citizens. Our government is strengthening the democratic institutions that the Conservatives actually attacked throughout their time in government.",Liberal,Kings—Hants,Scott Brison,http://www.parl.gc.ca/Parliamentarians/en/members/scott-brison(214346)
