basepk,hid,speechdate,pid,opid,speakeroldname,speakerposition,maintopic,subtopic,subsubtopic,speechtext,speakerparty,speakerriding,speakername,speakerurl
4747158,ca.proc.d.2018-05-31.10174598,2018-05-31,fe08cc31-44b1-466e-a0c6-1b0c61c8bf97,215973,Mr. Mark Gerretsen,,Government Orders,"Budget Implementation Act, 2018, No. 1",Report Stage,"Mr. Speaker, I rise on a point of order. I might be interrupting the clip that the member can use on on YouTube, but the truth is that he said “your government”, as if he were speaking to me directly, so perhaps we can correct that.",Liberal,Kingston and the Islands,Mark Gerretsen,http://www.parl.gc.ca/Parliamentarians/en/members/mark-gerretsen(215973)
4747159,ca.proc.d.2018-05-31.10174602,2018-05-31,16c839d3-0183-4ed6-892a-8d7bdc37c474,214972,The Assistant Deputy Speaker (Mr. Anthony Rota),,Government Orders,"Budget Implementation Act, 2018, No. 1",Report Stage,"I am sure the hon. member knows that he has to speak through the Chair, and that it was not my government, as I am perfectly neutral, I guarantee him that.
I will let the hon. member for Barrie—Springwater—Oro-Medonte respond.",Liberal,Nipissing—Timiskaming,Anthony Rota,http://www.parl.gc.ca/Parliamentarians/en/members/anthony-rota(214972)
4747160,ca.proc.d.2018-05-31.10174606,2018-05-31,9ad0ff66-1598-45e6-b146-6dd0eefb9cd0,234879,Mr. Alexander Nuttall,,Government Orders,"Budget Implementation Act, 2018, No. 1",Report Stage,"Mr. Speaker, I would at least hope that the Canadian government would be our government. However, the fact is, that is not the case anymore.",Conservative,Barrie—Springwater—Oro-Medonte,Alex Nuttall,http://www.parl.gc.ca/Parliamentarians/en/members/alex-nuttall(234879)
4747161,ca.proc.d.2018-05-31.10174609,2018-05-31,08f8d23a-fbea-4e7b-ba41-34c9f62dde9e,239944,"Ms. Anne Minh-Thu Quach (Salaberry—Suroît, NDP)",,Government Orders,"Budget Implementation Act, 2018, No. 1",Report Stage,"Mr. Speaker, I would like to ask my colleague the following question. We have before us an omnibus bill. During the election campaign, the Liberals solemnly promised to never again introduce an omnibus bill because they did not want to follow in the Conservatives' footsteps. Now we are dealing with a 556-page bill that amends 44 laws to implement the budget, which was supposedly the most gender-balanced budget, but fails to put in place pay equity legislation, among other things.
I wonder whether my Conservative colleague believes that, after 40 years of Liberal promises to enact pay equity legislation and after making the same promise during the 2015 election campaign, in 2016, and again in the past two months, it was high time they followed through when the budget was tabled. In this budget, there is no mention of pay equity legislation, but there is still a huge gap between men and women, and a gap for youth. This is unacceptable in 2018 from a Prime Minister who calls himself a feminist and goes around the world patting himself on the back. We have yet to see such a bill in 2018.",New Democratic Party,Salaberry—Suroît,Anne Minh-Thu Quach,http://www.parl.gc.ca/Parliamentarians/en/members/anne-minh-thu-quach(239944)
4747162,ca.proc.d.2018-05-31.10174625,2018-05-31,9ad0ff66-1598-45e6-b146-6dd0eefb9cd0,234879,Mr. Alexander Nuttall,,Government Orders,"Budget Implementation Act, 2018, No. 1",Report Stage,"Mr. Speaker, the member brought up a few things about omnibus bills, and so forth, and the promise made by the Liberals not to bring forth such bills to the House. I know it will leave everybody exasperated to hear that the Liberals made a promise and then abandoned it. I cannot believe it. It is incredible.
On the second point the member made with respect to the promise not to imitate the Conservatives, I can guarantee her that the current government is not imitating the Conservatives. If it were imitating the Conservatives, it would be bringing forth a budget to help those in society who have the least. It would be doing something to create jobs in this country, not taking money out of the economy constantly. It would be ensuring that people in this country have a right to earn a fair wage, not leaving us with lesser jobs, with the government picking up the pile it created in the beginning. Therefore, with all due respect, it is not imitating the Conservatives. I hope one day it will learn from us and start to.",Conservative,Barrie—Springwater—Oro-Medonte,Alex Nuttall,http://www.parl.gc.ca/Parliamentarians/en/members/alex-nuttall(234879)
4747163,ca.proc.d.2018-05-31.10174638,2018-05-31,16c839d3-0183-4ed6-892a-8d7bdc37c474,214972,The Assistant Deputy Speaker (Mr. Anthony Rota),,Government Orders,"Budget Implementation Act, 2018, No. 1",Report Stage,"Resuming debate. The hon. member for Calgary Shepard will have approximately five minutes, and will have the other five minutes of his debate after we return from question period.
The hon. member for Calgary Shepard.",Liberal,Nipissing—Timiskaming,Anthony Rota,http://www.parl.gc.ca/Parliamentarians/en/members/anthony-rota(214972)
4747164,ca.proc.d.2018-05-31.10174642,2018-05-31,bd2068aa-74c7-430a-bdf5-6f17b14ca140,218228,"Mr. Tom Kmiec (Calgary Shepard, CPC)",,Government Orders,"Budget Implementation Act, 2018, No. 1",Report Stage,"Mr. Speaker, I appreciate your giving me this time so I can speak on behalf of my constituents of Calgary Shepard, as well as the warning that I unfortunately have only five minutes before we begin question period.
I am thinking about what to say about the third budget bill I have had a chance to debate in the House. I sit on the finance committee that was taken with this matter earlier in the month when it considered the contents of the legislation, as well as its implications for the Canadian economy and jobs in Canada. At the end of the day, the great hope is that every single budget will build on a plan or some type of goal or end journey that the government wants to get to in order to improve the situation of Canadian families, and of job-seekers as well. I just do not see that in this budget. I did not see this in the last budget and I did not see it in the budget before that. What I have seen is a series of failures to have a coherent plan on what they are trying to achieve. A lot of the time I think the government is simply making it up as it goes along.
One thing I will point out is that in this particular budget there was no chapter on defence spending. That was a big portion of the announced spending in the past two and a half years, but that is all it has really been. There was a bunch of news releases, a bunch of tweets, and maybe some Facebook posts, but there is nothing inside the budget that specifically talks about procurement. Over the next five to 10 years, procurement is expected to be one of the largest expenditures in our budget. We are seeing a continuous increase in the budgeted numbers for defence spending, with the same amount of equipment coming back to us, or actually less equipment, so the per-unit value of our spending is actually going down. Spending on defence is an important component, but we are always expecting to get something in return: equipment that the Canadian Forces can use to replace the equipment it now has, which is sometimes antiquated and other times has served out its proper life cycle.
They say that money is round and it rolls away. It is a Yiddish proverb. The chamber knows that I love Yiddish proverbs, and it is true in this case as well. In three consecutive budgets, we have seen deficits completely out of control, and the government is simply letting these roll away. It is money out the door and interest payments on debt that keeps going up. We have an $18.1 billion deficit expected this year. The government and its caucus members will say, “Everything is going so great: Look how we have juiced up the economy, look how good the GDP growth numbers are”. 
However, what we have seen in the first quarter of this year, as is being reported in the media now, is that the economy has taken a serious hit. The housing market has drastically slowed down because of a successive series of changes, almost 20, to mortgage rules, including the latest one on January 1. The B20 mortgage rule changes have had a severe impact on new entrants in the market, those who want to buy a townhouse, a house, or who want to move up on the property ladder and expand because they need a bigger place to live, and those who want to downsize because they are coming to the end of their working lives and they want something simpler to live in and to have an easier means of taking care of their homes. All of those have been hit because, at mortgage-renewal time, they will now be facing a stress test. We know that the housing market in Canada and the different real estate markets in our small communities as well as our large metropolitan centres drive the economy. If we remove real estate growth and the construction of homes from our GDP numbers, we find that we do not have any growth. It is so critical. This mortgage stress test is expected to have an impact on job losses and reduce mortgage demand and housing by about 15%. Fifteen per cent translates into about 100,000 to 150,000 jobs that could disappear. These are well-paying jobs, not just brokers and real estate agents, but a lot of tradespeople who are in the business of building new homes, new condominiums, and new townhouses for Canadians to purchase, and for permanent residents to purchase as well. These people will be impacted by the successive series of mortgage rule changes. It is going to have an impact in the budget, something the budget has not planned for. The budget does not address this in any way. As I said, money is round and it is rolling away.
The government simply has no plan. This budget does not build on any type of long-term vision for the future. The Liberals have not set us up for success anywhere past 2019. It is as if the government is only thinking about the period between now and the next election. Planning from election to election is a bad way to set fiscal policy and public budgetary policy. Therefore, in the budget we will have accumulated, by the expected time frames in the forecast, nearly $100 billion in new debt.
I see the signal to stop now, but I look forward to continuing my intervention after question period.",Conservative,Calgary Shepard,Tom Kmiec,http://www.parl.gc.ca/Parliamentarians/en/members/tom-kmiec(218228)
4747165,ca.proc.d.2018-05-31.10174720,2018-05-31,16c839d3-0183-4ed6-892a-8d7bdc37c474,214972,The Assistant Deputy Speaker (Mr. Anthony Rota),,Government Orders,"Budget Implementation Act, 2018, No. 1",Report Stage,The hon. member for Calgary Shepard will have five minutes coming to him when we resume debate.,Liberal,Nipissing—Timiskaming,Anthony Rota,http://www.parl.gc.ca/Parliamentarians/en/members/anthony-rota(214972)
4747166,ca.proc.d.2018-05-31.10174726,2018-05-31,9e05a099-6a0b-4fe2-9e9b-0a8b91b7807b,214054,"Ms. Monique Pauzé (Repentigny, GPQ)",,Statements By Members,Pipelines,,"Mr. Speaker, the Liberals were elected on a promise to put an end to the Harper era and the golden age of the oil industry. However, they are doing much worse by nationalizing the Trans Mountain pipeline with our money just to overrule British Columbia, which is against the pipeline. It is a dangerous precedent because Quebec has its own sword of Damocles, energy east.
We came very to close to being in the same boat as British Columbia and having a pipeline forced on us. The public was right to rally to stop the project. However, now that Ottawa is nationalizing pipelines and imposing them on the provinces, the energy east supporters are coming out of the woodwork. They are calling on Ottawa to do the same thing that it did in British Columbia, in other words take action without considering how Quebeckers feel about it.
We have to be just as concerned about the Liberals as we were about the Conservatives, and today we must still consider energy east as a real threat.",GPQ (ex-Bloc),Repentigny,Monique Pauzé,http://www.parl.gc.ca/Parliamentarians/en/members/monique-pauze(214054)
4747167,ca.proc.d.2018-05-31.10174739,2018-05-31,3da57866-49d8-42d1-9f5b-c78561f67c9d,215963,"Mr. Sukh Dhaliwal (Surrey—Newton, Lib.)",,Statements By Members,Charitable Organizations in Surrey—Newton,,"Mr. Speaker, the strength of our communities is their people, who commit themselves to helping others. This past month, I attended events where inspiring leadership has been on full display. The Mannkind Charity Foundation was founded by Rani and Dave Mann, whose dedication to giving back has made a difference around the world through many projects, including a donation of $1 million to the Peace Arch Hospital and help for victims of the 2015 earthquake in Nepal. The Sahaara Canada Wellness Society fundraiser for mental health was organized by Deljit Bains and Bindi Bains Mackoruk, and the fundraiser for the Shakti Society, which empowers women, was organized by Sonia Andhi.
All these represent the very best Canada has to offer: compassion, generosity, and a commitment to making their communities better.
All members, please join me in thanking these organizations.",Liberal,Surrey—Newton,Sukh Dhaliwal,http://www.parl.gc.ca/Parliamentarians/en/members/sukh-dhaliwal(215963)
4747168,ca.proc.d.2018-05-31.10174751,2018-05-31,55c46957-54e9-422a-8afd-7c709bcf16a0,217975,"Mr. John Barlow (Foothills, CPC)",,Statements By Members,Cross-Canada Run,,"Mr. Speaker, I rise in the House today for an outstanding constituent in my riding of Foothills, someone I hope my colleagues will have the opportunity to meet later this summer. On June 27, Dave Proctor will start an important journey, a 7,200-kilometre run across Canada. He will run more than 100 kilometres each day for 66 days, running for a Guinness world record.
Why would anyone take on such a gruelling challenge? David is doing this because he is a dad. This incredible father of three is a world-renowned runner, but this run is for his nine-year-old son Sam, who suffers from a rare disease. Through his determination, his strength, and his love, David hopes to raise $1 million to help Canadians suffering with rare diseases, those searching for support and a cure.
I am looking forward to running beside Dave when he comes through Alberta, but let us be honest: I will probably be well behind him when he is running through Alberta.
I encourage all my colleagues to do the same when he comes through their communities. All of us in this chamber wish him all the best, and I know Canadians will be cheering for him every step of the way.",Conservative,Foothills,John Barlow,http://www.parl.gc.ca/Parliamentarians/en/members/john-barlow(217975)
4747169,ca.proc.d.2018-05-31.10174757,2018-05-31,17da20d7-35e1-4618-8c84-00a00dd88d4f,219763,"Mr. Rémi Massé (Avignon—La Mitis—Matane—Matapédia, Lib.)",,Statements By Members,Mont-Joli Rotary Club,,"Mr. Speaker, I am delighted to rise in the House today to mark the 75th anniversary of the Mont-Joli Rotary Club. Since 1943, its members have been passionately committed to serving the interests of Mont-Joli and the surrounding area. They actively work to help those who get involved, in order to revitalize Mont-Joli and the surrounding area, and they also help people in need.
In 75 years, Mont-Joli Rotarians have helped inject more than $2.5 million into the community. They have made a significant impact on Mont-Joli's social, cultural, sport, and economic development. 
I want to thank all of the current and former members of the club for everything they have done over the past seven decades. Their desire to improve the lives of the people of Mont-Joli is a true positive force in the community.",Liberal,Avignon—La Mitis—Matane—Matapédia,Rémi Massé,http://www.parl.gc.ca/Parliamentarians/en/members/remi-masse(219763)
4747170,ca.proc.d.2018-05-31.10174761,2018-05-31,95ed53a7-7538-4c0f-85a4-64af76065f95,218942,"Mr. Don Davies (Vancouver Kingsway, NDP)",,Statements By Members,ALS Awareness Month,,"Mr. Speaker, we have 30 remarkable days, 30 inspirational stories, and 30 chances to seize the day. That is what ALS Awareness Month is all about. From fundraising events like the Richmond-Vancouver Walk for ALS to breathtaking journeys around the top of the CN Tower, this June I challenge all parliamentarians to push the limits and seize the day for ALS Canada.
More than 3,000 Canadians live with ALS, and at least three succumb to it every day. No community is untouched. Here in Parliament, our hearts were broken when we lost our colleague Mauril Bélanger to ALS. His legacy now lives on every time our national anthem is sung.
This month, let us make every moment count. Let us work together to find a cure for ALS and use our voices to advocate for change on behalf of the ALS community. Let us share our story, spread the word about ALS, donate, volunteer, and participate. Whatever we do, let us take no moment for granted.",New Democratic Party,Vancouver Kingsway,Don Davies,http://www.parl.gc.ca/Parliamentarians/en/members/don-davies(218942)
4747171,ca.proc.d.2018-05-31.10174780,2018-05-31,5836b275-89f1-49ce-9b8c-7de46b261c3d,229480,"Hon. Pablo Rodriguez (Honoré-Mercier, Lib.)",,Statements By Members,Amyotrophic Lateral Sclerosis,,"Mr. Speaker, on behalf of the 3,000 Canadian families living with amyotrophic lateral sclerosis, or ALS, I want to point out that June is ALS Awareness Month.
ALS is a disease that gradually paralyzes people because the brain is no longer able to communicate with the muscles of the body. A movement that was simple yesterday becomes impossible. It is important to note that 80% of people with ALS die within two to five years of being diagnosed, which is what happened to our late colleague Mauril Bélanger.
There is no cure for ALS and few treatment options are available. Those with ALS fight with courage and determination, and I am thinking here of Nancy Roch in particular, for whom I have the utmost respect and admiration.
Canada must play a leading role in ALS research because research is what will enable us to look forward to a future without this terrible disease. I encourage people to support this cause, to wear a blue cornflower, and to participate in one of the walks that will take place across the country.
Let's work together to fight this disease.",Liberal,Honoré-Mercier,Pablo Rodriguez,http://www.parl.gc.ca/Parliamentarians/en/members/pablo-rodriguez(229480)
4747172,ca.proc.d.2018-05-31.10174788,2018-05-31,3a48d31a-42fc-4320-a84f-da61c251bccd,237026,"Mr. Blaine Calkins (Red Deer—Lacombe, CPC)",,Statements By Members,Canada Post,,"Mr. Speaker, today I rise in the House in support of the Town of Bentley, which just two weeks ago was told its retail postal services would be discontinued as of June l. The very next day, parcels stopped coming to this small rural community, forcing residents to drive a minimum of 50 kilometres round trip to receive their items.
Canada Post has an obligation to provide a standard of postal service that meets the needs of the people of Canada. When seniors who do not drive or live on a fixed income cannot receive their medications or other essentials in the town where they live, their needs are clearly not being met. When small businesses and farmers are forced to leave their place of work for more than an hour to pick up or drop off parcels, their needs are not being met. 
How are the residents of Bentley supposed to heed the Prime Minister's calls for Canadians to reduce their carbon footprint when they must travel so far just to pick up their mail? 
The Minister of Public Services and Procurement must immediately take action to right this wrong and restore full postal services in Bentley. Bentley deserves better.",Conservative,Red Deer—Lacombe,Blaine Calkins,http://www.parl.gc.ca/Parliamentarians/en/members/blaine-calkins(237026)
4747173,ca.proc.d.2018-05-31.10174792,2018-05-31,3378437f-1669-4fcb-9c2e-0c7c12626a1e,219102,"Mrs. Deborah Schulte (King—Vaughan, Lib.)",,Statements By Members,Environmental Protection Act,,"Mr. Speaker, the Canadian Environmental Protection Act is the primary law governing pollution prevention and the management of toxic chemicals. In 2017, after almost a year of work, the Standing Committee on Environment and Sustainable Development submitted a report with 87 recommendations to strengthen and modernize the act, and we look forward to the government's response in June. A strengthened CEPA would protect the environment, the economy, and the health of Canadians. 
In the meantime, I am proud to have sponsored a petition calling on the government to modernize and strengthen CEPA, submitted by Kerry Meuller. It can be accessed online through the House of Commons e-petitions website. In just three weeks, over 10,000 Canadians have signed on. It is the biggest e-petition on environmental protection ever, with support from every province and territory. I urge everyone concerned about toxins in Canada to sign the petition.",Liberal,King—Vaughan,Deb Schulte,http://www.parl.gc.ca/Parliamentarians/en/members/deb-schulte(219102)
4747174,ca.proc.d.2018-05-31.10174796,2018-05-31,fa57da4d-d6e1-44ed-9449-b5b1f6361a5c,219935,"Ms. Sonia Sidhu (Brampton South, Lib.)",,Statements By Members,Boys and Girls Clubs of Canada,,"Mr. Speaker, today I would like to welcome the Boys and Girls Clubs of Canada to Ottawa as it hosts its first annual Unplug to Connect event. The Boys and Girls Clubs organization does incredible work in communities across Canada. Its life-changing programs focus on community-based service and on building relationships for children with their peers and volunteers so that our youth have the skills they need for the future. 
The local Peel chapter is located in my riding of Brampton South, and I have had the chance to get to know some of the amazing youth who are involved with the club. I applaud the outstanding work done by Michael Gyovai and the entire team at the Peel branch, who dedicate themselves to breaking down barriers and providing youth in Peel with a place to grow and thrive.",Liberal,Brampton South,Sonia Sidhu,http://www.parl.gc.ca/Parliamentarians/en/members/sonia-sidhu(219935)
4747175,ca.proc.d.2018-05-31.10174874,2018-05-31,96924c12-efff-4de2-9f9e-578fe5434342,218606,"Hon. Erin O'Toole (Durham, CPC)",,Statements By Members,National Defence,,"Mr. Speaker, it is my honour today to pay tribute to the 60,000 Canadians who work in the defence and security industries. These are the jobs equipping our military and first responders. Many of them are here for the CANSEC annual conference in Ottawa, and many of these employees are also veterans. 
I was also proud to meet with Janna and the volunteers from Women in Defence &amp; Security yesterday. It now has over 2,000 members working across this country in aerospace, defence, and security in high-skilled, highly trained jobs. They are our leaders. They are our builders in these sectors. I congratulate WIDS.
One of its members is a classmate of mine from military college, Christyn Cianfarani, a former naval officer, veteran, and now president of the Canadian Association of Defence and Security Industries. Christyn is leading this conference and bringing together great industry and great jobs for Canadians. 
I want to thank them for kitting out our military with the equipment it needs. 
Best wishes for the rest of the CANSEC conference.",Conservative,Durham,Erin O'Toole,http://www.parl.gc.ca/Parliamentarians/en/members/erin-otoole(218606)
4747176,ca.proc.d.2018-05-31.10174808,2018-05-31,7cff4486-6787-493d-a4ee-a59d48f68ab3,219527,"Hon. Denis Paradis (Brome—Missisquoi, Lib.)",,Statements By Members,Brome—Missisquoi in Ottawa Day,,"Mr. Speaker, today I am pleased to welcome many representatives from the municipalities, organizations, and businesses in my riding to “Brome—Missisquoi in Ottawa day”. It is a great networking opportunity for various stakeholders from my region and senior officials from several departments.
Representatives from Accueil Notre-Dame, Club de la Bonne Humeur de Lac-Brome, Appalachian Corridor, Le Saint-Armand newspaper, the Knowlton Literary Association, Renaissance Brome Lake, Villas des Monts de Sutton, and Pettes Memorial Library, as well as representatives from the municipalities of Bedford, Eastman, Bolton-Est, Brigham, Bromont, Saint-Georges-de-Clarenceville, Dunham, Farnham, Frelighsburg, Brome Lake, Magog, Notre-Dame-de-Stanbridge, Orford, Saint-Armand, Sutton, and Venise-en-Québec all jumped at the chance.
I have no doubt that today's event will serve to advance a number of projects in Brome—Missisquoi. Our region boasts many entrepreneurs, visionaries, and engaged individuals who want to contribute to the prosperity of our riding. 
I invite my fellow parliamentarians to join us for a happy hour— ",Liberal,Brome—Missisquoi,Denis Paradis,http://www.parl.gc.ca/Parliamentarians/en/members/denis-paradis(219527)
4747177,ca.proc.d.2018-05-31.10174809,2018-05-31,3176068f-62ee-4b2f-aacd-1131201c6db1,214707,The Speaker,,Statements By Members,Brome—Missisquoi in Ottawa Day,,Order. The hon. member for Châteauguay—Lacolle.,Liberal,Halifax West,Geoff Regan,http://www.parl.gc.ca/Parliamentarians/en/members/geoff-regan(214707)
