basepk,hid,speechdate,pid,opid,speakeroldname,speakerposition,maintopic,subtopic,subsubtopic,speechtext,speakerparty,speakerriding,speakername,speakerurl
4754283,ca.proc.d.2018-10-01.10274232,2018-10-01,330c0119-cf49-4e85-9407-539367825c2b,234610,"Mr. Chris Bittle (St. Catharines, Lib.)",,Government Orders,National Defence Act,,"Mr. Speaker, I have had the opportunity over the past few years to substitute on the defence committee a few times and I know that the hon. member is a passionate advocate for members for the Canadian Armed Forces. I want to thank him for bringing up the story of a corporal to show us some of the issues that may exist in the bill. I appreciate his support of the bill. It sounds as though in his mind he thinks there is still a little work that needs to be done.
Could the member address this place on how best to get the bill to committee so we can get to work on the important issues that still remain?",Liberal,St. Catharines,Chris Bittle,http://www.parl.gc.ca/Parliamentarians/en/members/chris-bittle(234610)
4754284,ca.proc.d.2018-10-01.10274234,2018-10-01,f4efade5-e605-4926-b4d9-cea84ef76f14,217136,Mr. Randall Garrison,,Government Orders,National Defence Act,,"Mr. Speaker, I cited the case of Corporal Langridge, but there are 130 cases since 2010 that are equally tragic and equally important.
How can we best do this? I am expecting there have been discussions among the parties that this debate may finish today and therefore will have a vote within a couple of days to send this on to committee. I know that we have a commitment of the chair of the defence committee that this bill will be dealt with expeditiously.
I am confident that we can make good progress in a very short time.",New Democratic Party,Esquimalt—Saanich—Sooke,Randall Garrison,http://www.parl.gc.ca/Parliamentarians/en/members/randall-garrison(217136)
4754285,ca.proc.d.2018-10-01.10274236,2018-10-01,72dace30-741a-4877-8c1c-31b5dc3e4a8e,218755,"Mr. James Bezan (Selkirk—Interlake—Eastman, CPC)",,Government Orders,National Defence Act,,"Mr. Speaker, I want to thank my colleague for the work he is doing with military family members who have dealt with the loss of someone because of self-harm. It is something that we have to address and this is the time to do it.
My colleague mentioned the Beaudry ruling and how that is going to impact on the armed forces. We are looking at a stay of proceedings in the interim, but would this be the time that we could address some of those concerns that have been raised by the courts including the Court Martial Appeal Court and provide more clarity within the bill on how we deal with sexual misconduct? If these cases all get transferred to civilian court, and there are over 40 of them, it will not only bog down civilian courts, but it will not be dealt with in an appropriate amount of time under the military justice system. 
Should we amend the bill to provide greater clarity and direction to ensure that the exemption under the charter in section 11(f) is respected and is very well articulated so that judges and lawyers within the court martial system will understand what Parliament's desire is on this piece of legislation?",Conservative,Selkirk—Interlake—Eastman,James Bezan,http://www.parl.gc.ca/Parliamentarians/en/members/james-bezan(218755)
4754286,ca.proc.d.2018-10-01.10274239,2018-10-01,f4efade5-e605-4926-b4d9-cea84ef76f14,217136,Mr. Randall Garrison,,Government Orders,National Defence Act,,"Mr. Speaker, it is a pleasure to work with the member for Selkirk—Interlake—Eastman as the Conservative spokesperson on the defence committee. While we do not always agree, we certainly both have the best interests of the serving members of the Canadian Armed Forces and of Canada at heart. I trust him on that implicitly.
As to his question on the Beaudry decision, this just happened on Friday, so I believe, although I do not know for sure, that a stay would be granted and this case will be heard by the Supreme Court.
Today, I have to say that I am not sure that this is a good time for us to try to amend Bill C-77, until we see what the Supreme Court of Canada has to say. 
I agree with the member for Selkirk—Interlake—Eastman. Because it was a split decision, it is not inevitable that the Supreme Court would reach the same conclusions that the military court of appeal did. I would be cautious at this point about taking legislative action until we hear from the Supreme Court.",New Democratic Party,Esquimalt—Saanich—Sooke,Randall Garrison,http://www.parl.gc.ca/Parliamentarians/en/members/randall-garrison(217136)
4754287,ca.proc.d.2018-10-01.10274241,2018-10-01,07cf5767-802c-406c-92a7-7dc92af79b40,229526,"Mr. Kevin Lamoureux (Parliamentary Secretary to the Leader of the Government in the House of Commons, Lib.)",,Government Orders,National Defence Act,,"Mr. Speaker, it is really encouraging to the New Democrat and Conservative sides' recognition of the importance of this legislation. For those participating in the debate and those watching and listening in, it has been a while since we have seen these type of changes. We have seen wide support for it demonstrated. I would like my colleague's thoughts on how important it is to advance this to the committee stage where we can start to hear more details and possible amendments. Does he have any suggestions for amendments to the legislation once it gets to committee? ",Liberal,Winnipeg North,Kevin Lamoureux,http://www.parl.gc.ca/Parliamentarians/en/members/kevin-lamoureux(229526)
4754288,ca.proc.d.2018-10-01.10274243,2018-10-01,f4efade5-e605-4926-b4d9-cea84ef76f14,217136,Mr. Randall Garrison,,Government Orders,National Defence Act,,"Mr. Speaker, I am not sure what changes the hon. member is referring to, because I have been in the House since 2011 demanding that we move expeditiously in making changes to the military justice system. My position has never changed. This should have been done by the Conservative government before, and it should have been done before now by this government. Therefore, I certainly will not stand in the way of this getting to committee as soon as possible. ",New Democratic Party,Esquimalt—Saanich—Sooke,Randall Garrison,http://www.parl.gc.ca/Parliamentarians/en/members/randall-garrison(217136)
4754289,ca.proc.d.2018-10-01.10274245,2018-10-01,661a3062-86d1-4ba3-9e70-81c866aa2fc3,216864,"Mr. David Anderson (Cypress Hills—Grasslands, CPC)",,Government Orders,National Defence Act,,"Mr. Speaker, I would like to ask my colleague the same question I asked the minister a little earlier. The minister talked a bit about the summary hearings and their importance. He felt they would speed up hearings and allow military discipline to proceed more quickly than it has in the past. Does the member feel that that is accurate? I am also interested in asking him the same question about the evidentiary requirements for the summary hearings. What level does he feel they should be at in order to protect a soldier so that we do not find innocent people being charged and held accountable for things they are not responsible for? ",Conservative,Cypress Hills—Grasslands,David Anderson,http://www.parl.gc.ca/Parliamentarians/en/members/david-anderson(216864)
4754290,ca.proc.d.2018-10-01.10274268,2018-10-01,f4efade5-e605-4926-b4d9-cea84ef76f14,217136,Mr. Randall Garrison,,Government Orders,National Defence Act,,"Mr. Speaker, what we have here are important reforms that would restrict the use of summary trials and require better investigation and better production of evidence to be used in the more formal proceedings that are likely to occur. 
There are good things in Bill C-77. These measures were originally proposed by the previous Conservative government, and I am not sure why it took this government three years to get them before the House. ",New Democratic Party,Esquimalt—Saanich—Sooke,Randall Garrison,http://www.parl.gc.ca/Parliamentarians/en/members/randall-garrison(217136)
4754291,ca.proc.d.2018-10-01.10274292,2018-10-01,b37cad30-26f6-40c6-8e4c-dd3a0ba841bb,217477,"Mrs. Cheryl Gallant (Renfrew—Nipissing—Pembroke, CPC)",,Government Orders,National Defence Act,,"Mr. Speaker, I have a question for my colleague on the defence committee. One of the things that would be amended is the protection of the privacy and security of victims and witnesses involving certain sexual offences. What is being proposed in the process is protection in summary convictions. With the hiding of the name of the predator, not letting other people in the same community know the name or the fact that one of these investigations is going on, does my colleague have concerns about the victims in these circumstances? ",Conservative,Renfrew—Nipissing—Pembroke,Cheryl Gallant,http://www.parl.gc.ca/Parliamentarians/en/members/cheryl-gallant(217477)
4754292,ca.proc.d.2018-10-01.10274296,2018-10-01,f4efade5-e605-4926-b4d9-cea84ef76f14,217136,Mr. Randall Garrison,,Government Orders,National Defence Act,,"Mr. Speaker, I have enjoyed working with the member on the defence committee. I am not sure I understand her particular question. Within the military, as such a close community, until there is some resolution of sexual assault or harassment kinds of cases, there may be good reasons why names are not made public to the larger community. It could be for the coherence of the military or for the necessity of working as a team. However, I believe there are provisions in the bill that would allow military judges to make those kinds of decisions. That is one of the improvements in the bill. ",New Democratic Party,Esquimalt—Saanich—Sooke,Randall Garrison,http://www.parl.gc.ca/Parliamentarians/en/members/randall-garrison(217136)
4754293,ca.proc.d.2018-10-01.10274298,2018-10-01,61c83e21-f9a3-4e4b-b881-4b2d1ce33c43,234471,"Mr. John Brassard (Barrie—Innisfil, CPC)",,Government Orders,National Defence Act,,"Mr. Speaker, I thank my hon. colleague for his advocacy on behalf of veterans and serving military members. How would the bill, in his opinion, improve the chain of command's ability to address minor breaches of discipline? ",Conservative,Barrie—Innisfil,John Brassard,http://www.parl.gc.ca/Parliamentarians/en/members/john-brassard(234471)
4754294,ca.proc.d.2018-10-01.10274300,2018-10-01,f4efade5-e605-4926-b4d9-cea84ef76f14,217136,Mr. Randall Garrison,,Government Orders,National Defence Act,,"Mr. Speaker, in the military context, minor breaches of discipline are still breaches of discipline. That is one of the instances where the military context differs from the civilian context. We have to make sure that the system is fair in dealing with those. We have to ensure that appropriate disciplinary measures are taken, but also keep in mind that the military context is somewhat different from the broader public context. ",New Democratic Party,Esquimalt—Saanich—Sooke,Randall Garrison,http://www.parl.gc.ca/Parliamentarians/en/members/randall-garrison(217136)
4754295,ca.proc.d.2018-10-01.10274302,2018-10-01,0460b90d-6936-4178-9c1b-f2de6a79ef7b,237019,"Mr. Earl Dreeshen (Red Deer—Mountain View, CPC)",,Government Orders,National Defence Act,,"Mr. Speaker, I am pleased to speak today on Bill C-77, an act to amend the National Defence Act and to make related and consequential amendments to other Acts. I will be sharing my time with the member for Simcoe—Grey. 
Canada and its justice system are renowned around the world. The previous Conservative government continually showed its resolve to support victims of crime by steadfastly taking actions that ensured that those victims had a more effective voice in the criminal justice system. How did we do that? 
I think the important point is that the previous Conservative government enacted the Victims Bill of Rights. It did so to assure victims of crime that they would be assured that their government had their backs. As Conservatives we chose to listen to our constituents when it came to keeping our streets safe, because the public's safety then and always will be our number one concern.
During that time we also recognized the importance of enshrining victims' rights in the military justice system, which is why we introduced Bill C-71 in the previous Parliament. I assume that as Conservatives we should be flattered that the Liberals are copying many of our initiatives with Bill C-77. After all, it is the right thing to do.
When it comes to military justice reform, the previous Conservative government focused on restoring victims to their rightful place at the heart of our justice system. That is why we introduced legislation that mirrored the Victims Bill of Rights and put it into military law. It was the result of several years of work, and took into account hundreds of submissions and consultations held with victims and groups concerned about victims' rights.
 Standing up for victims means helping to ensure that they have a more effective voice in the justice system and are treated with the courtesy, compassion and respect they deserve at every stage of the criminal process. Conservative are committed to keeping our streets and communities safe for Canadians and their families. We took decisive, concrete steps to hold offenders accountable for their actions, which are sadly being slowly eroded by the actions of these Liberals. However, it also means that we need to have a fair system for the accused.
 The intention of this bill is to make changes to the Canadian military justice system. This bill is similar in many respects to our previous Conservative government's military justice reform Bill C-71. The purpose of Bill C-71 was to align the military justice system of Canada with the Criminal Code of Canada. It would have enshrined victims' rights into the National Defence Act, as well as put a statute of limitations on summary trial cases and clarified what cases should be handled by summary trial. Bill C-77 will institute these changes as well. 
However, there are other differences between Bill C-71 and Bill C-77. The first difference is the addition of the Gladue decision in relation to paragraph 718.2(e) of the Criminal Code of Canada, putting it into the National Defence Act. Members of the Canadian Armed Forces should not be discriminated against based on their race, gender, creed or culture. However, special consideration for indigenous members in the Gladue decision that would result in sentences that are less harsh for them than other Canadian Armed Forces members could undermine operational discipline, morale and anti-racism policies. It is important that we reflect on this issue by considering the global context of the engagement of our men and women of the Canadian Armed Forces.
Most countries with effective armed forces use some kind of court martial or other military court system. These court or military court systems can vary significantly from one country to another. However, they all tend to have one thing in common: They provide for trials of charges where there are allegations that military personnel have committed offences.
The Canadian miliary justice system was essentially identical to the British military justice system until the end of World War II. In 1950, new Canadian legislation known as the National Defence Act, or the NDA, was enacted, which provided for a single Code of Service Discipline. The NDA also provided for trials by two different types of service tribunals: court martials and summary trials.
Since the enactment of the Canadian Charter of Rights and Freedoms in 1982, the courts martial system has evolved and now offers more protections for the charter rights of accused persons, particularly at court martials. However, court martials are distinctly military. The judge is a legally trained officer in the Canadian Armed Forces who is appointed by the Governor in Council. The prosecutor is a uniformed legal officer who acts on behalf of the DMP. The trial involves customary military formalities, such as saluting the military judge when he or she enters the court.
Court martials have jurisdiction to deal with military personnel for any offence under the Code of Service Discipline, including uniquely military offences such as desertion and insubordination, as well as other underlying federal offences such as theft under the Criminal Code and possession of a drug under the Controlled Drugs and Substances Act.
Even though members of the Canadian Armed Forces are held to the highest standards of conduct, they do not give up the rights afforded to them under Canadian law, including under the Constitution. Nonetheless, an individual's rights can be limited where they are inconsistent with the basic obligations of military service.
The charter recognizes the existence of a separate system of military justice within the Canadian legal system. Section 11of the charter states:
 Any person charged with an offence has the right 
 ...(f) Except in the case of an offence under military law tried before a military tribunal, to the benefit of trial by jury where the maximum punishment for the offence is imprisonment for five years or a more severe punishment. 
Our Canadian Armed Forces, as they work shoulder to shoulder with our allies, must be consistent. Special consideration for indigenous members that could result in sentences that are less harsh versus for them versus for Canadian Armed Forces members could undermine operational discipline, morale, and anti-racism policies.
As we think of potential amendments, I hope there will be an opportunity at during committee stage to amend the language regarding the addition of the Gladue decision into the National Defence Act.
It should be stated that the Supreme Court of Canada has directly addressed the validity of a separate, distinct military justice system in three decisions wherein the requirement for a separate justice system for the Canadian Armed Forces has been upheld.
We support our Canadian justice system as defined by our charter and Constitution, and do not support a parallel justice system that would contravene our existing rights and freedoms and would have the potential of creating issues among our own Canadian Forces members and our allies. ",Conservative,Red Deer—Mountain View,Earl Dreeshen,http://www.parl.gc.ca/Parliamentarians/en/members/earl-dreeshen(237019)
4754296,ca.proc.d.2018-10-01.10274306,2018-10-01,b4442fcd-62cf-456e-a49b-625ea35069b5,219808,"Mr. Lloyd Longfield (Guelph, Lib.)",,Government Orders,National Defence Act,,"Mr. Speaker, the hon. member across the way and I have served on committees together. I have always found his comments to be very thoughtful.
Along those lines, I am looking at the sentencing of indigenous people under civil law and their having the same rights under military law as under civil law, such that indigenous rights at the time of sentencing would take into account some of the provisions we have for indigenous peoples in terms of the types of sentencing they might fall under according to their traditions and culture.
Would the member not agree that we should have the same type of rights in civil society as we do in military society when we are working with indigenous peoples?",Liberal,Guelph,Lloyd Longfield,http://www.parl.gc.ca/Parliamentarians/en/members/lloyd-longfield(219808)
4754297,ca.proc.d.2018-10-01.10274310,2018-10-01,0460b90d-6936-4178-9c1b-f2de6a79ef7b,237019,Mr. Earl Dreeshen,,Government Orders,National Defence Act,,"Mr. Speaker, I too have enjoyed working with my colleague on various committees.
A key point of this is that we are dealing with culture. I understand and respect the position that the Gladue decision has made in the general public, but we are talking about a military culture. That was the point I was stressing.
Our men and women work shoulder to shoulder with armed forces around the world when they are on operational duties, and it is critical that everyone that is with them is subject to the same set of rules. That means that we have to make sure that we have cohesion. That is the respect that we need to consider.",Conservative,Red Deer—Mountain View,Earl Dreeshen,http://www.parl.gc.ca/Parliamentarians/en/members/earl-dreeshen(237019)
4754298,ca.proc.d.2018-10-01.10274312,2018-10-01,fe08cc31-44b1-466e-a0c6-1b0c61c8bf97,215973,"Mr. Mark Gerretsen (Kingston and the Islands, Lib.)",,Government Orders,National Defence Act,,"Mr. Speaker, my colleague is absolutely right that this has been a long time in the making and has taken quite a while to get us to where we are today. If credit is due, then I would congratulate the former Conservative government for getting this to the point where at least it can be picked up and continued. 
Would he agree that it is in the best interests of the House to pass this bill through this stage so that it can go to committee to be studied, reported back and moved along the legislative process quickly so that this bill can be enshrined in law as soon as possible?",Liberal,Kingston and the Islands,Mark Gerretsen,http://www.parl.gc.ca/Parliamentarians/en/members/mark-gerretsen(215973)
4754299,ca.proc.d.2018-10-01.10274314,2018-10-01,0460b90d-6936-4178-9c1b-f2de6a79ef7b,237019,Mr. Earl Dreeshen,,Government Orders,National Defence Act,,"Mr. Speaker, it is extremely important, since we have an opportunity today, in whatever length of time this discussion is going to take place, to talk about the issues of concern so that when it gets to committee, we will be able to build upon that. I know there has been a lot of consultation over the years to make sure that we deal with the issues, some that I have presented. I know that the hon. member from the NDP presented issues that were important to New Democrats as well. As we move through the process, I am sure those at committee will be able to succinctly do what they need to do to get this particular bill out of committee and back to the House.",Conservative,Red Deer—Mountain View,Earl Dreeshen,http://www.parl.gc.ca/Parliamentarians/en/members/earl-dreeshen(237019)
4754300,ca.proc.d.2018-10-01.10274316,2018-10-01,61c83e21-f9a3-4e4b-b881-4b2d1ce33c43,234471,"Mr. John Brassard (Barrie—Innisfil, CPC)",,Government Orders,National Defence Act,,"Mr. Speaker, my hon. friend spoke specifically about consistency as it relates to the potential of undermining discipline with our allies and the view on that. What are some of the things he is going to be looking for when the bill goes to committee in terms of the types of changes required for this piece of legislation?",Conservative,Barrie—Innisfil,John Brassard,http://www.parl.gc.ca/Parliamentarians/en/members/john-brassard(234471)
4754301,ca.proc.d.2018-10-01.10274318,2018-10-01,0460b90d-6936-4178-9c1b-f2de6a79ef7b,237019,Mr. Earl Dreeshen,,Government Orders,National Defence Act,,"Mr. Speaker, I have learned a lot by listening to my hon. colleague with regard to the military and veterans, and that is really important. The summary talks about the declaration of victims rights, which is a paramount issue, and also about a dozen different items to protect privacy and the security of victims and witnesses and factors the military judges have to take into consideration. I believe that the good people at committee will be able to look at that and bring all of this discussion together, keeping in mind the significance of the fact that our Canadian Armed Forces serve around the world to protect everyone.",Conservative,Red Deer—Mountain View,Earl Dreeshen,http://www.parl.gc.ca/Parliamentarians/en/members/earl-dreeshen(237019)
