basepk,hid,speechdate,pid,opid,speakeroldname,speakerposition,maintopic,subtopic,subsubtopic,speechtext,speakerparty,speakerriding,speakername,speakerurl
4758078,ca.proc.d.2018-10-25.10330809,2018-10-25,00000000-0000-0000-0000-000000000000,234492,"Mrs. Stephanie Kusie (Calgary Midnapore, CPC)",,Government Orders,Elections Modernization Act,Bill C-76—Time Allocation Motion,"Mr. Speaker, I am surprised to see the government propose such an undemocratic measure on a bill that deals with democracy. What a joke.
We have a time allocation motion and an undemocratic action on a bill regarding democracy. This is just absolutely silly. I can certainly understand why the Liberals do not want to allow us the opportunity to talk more about this bill, and that is because it is so incredibly flawed and does a lot to prohibit democracy within our lovely nation. 
Sadly, I see it more as a public relations exercise by the government than as an attempt to impede fraudulent action, foreign interference and foreign influence. It is certainly understandable that the Liberals would not want to continue discussion on a democracy bill that is, in fact, not democratic. 
They are trying to appear to be saying that actions that impede democracy are bad, but sadly, the bill does not have the mechanisms to prevent fraud and interference. It does not go far enough, I am very sorry to say.
We put forward many amendments, on this side of the House, in an attempt to make the bill more watertight and to provide better electoral processes for Canadians, such as third parties having segregated bank accounts, as was recommended by the Chief Electoral Officer. However, this was another suggestion that was passed over by the government, unfortunately. In addition, there was third-party reporting between elections. These are the types of safeguards we, as the official opposition, tried to provide the Canadian public in an attempt to safeguard our democratic processes. 
As for foreign influence, this bill would do essentially nothing to avoid the possibility of foreign influence. We have seen dire and negative consequences in other jurisdictions, such as the United States and in the Brexit outcome. Our very own Prime Minister said that he thought there was not much foreign influence or interference during the last federal election. How could we hope for much better, when the starting point of the Prime Minister's thinking is that there was not much, when in fact, not much was too much?
In addition, Conservatives had concerns with regard to non-residency voting requirements. We pleaded for the five-year requirement, the oath to return to Canada, and the place of residency, in addition to mentioning—",Conservative,Calgary Midnapore,Stephanie Kusie,http://www.parl.gc.ca/Parliamentarians/en/members/stephanie-kusie(234492)
4758079,ca.proc.d.2018-10-25.10330814,2018-10-25,16c839d3-0183-4ed6-892a-8d7bdc37c474,214972,The Assistant Deputy Speaker (Mr. Anthony Rota),,Government Orders,Elections Modernization Act,Bill C-76—Time Allocation Motion,The hon. member for Elmwood—Transcona is rising on a point of order.,Liberal,Nipissing—Timiskaming,Anthony Rota,http://www.parl.gc.ca/Parliamentarians/en/members/anthony-rota(214972)
4758080,ca.proc.d.2018-10-25.10330815,2018-10-25,ea197684-00f6-458f-a46b-5bea7db6f7f3,240374,Mr. Daniel Blaikie,,Government Orders,Elections Modernization Act,Bill C-76—Time Allocation Motion,"Mr. Speaker, we have only half an hour to debate time allocation, and I believe a number of members would like to participate. I am wondering about the time allocated to particular members and if we could ensure that other members have an opportunity to participate in this limited debate.",New Democratic Party,Elmwood—Transcona,Daniel Blaikie,http://www.parl.gc.ca/Parliamentarians/en/members/daniel-blaikie(240374)
4758081,ca.proc.d.2018-10-25.10330818,2018-10-25,16c839d3-0183-4ed6-892a-8d7bdc37c474,214972,The Assistant Deputy Speaker (Mr. Anthony Rota),,Government Orders,Elections Modernization Act,Bill C-76—Time Allocation Motion,"That is a very good point by the hon. member for Elmwood—Transcona. There was a change in Chairs, and the time ran a little long. 
If the hon. member will wrap it up very quickly, we will get the minister's answer.",Liberal,Nipissing—Timiskaming,Anthony Rota,http://www.parl.gc.ca/Parliamentarians/en/members/anthony-rota(214972)
4758082,ca.proc.d.2018-10-25.10330819,2018-10-25,00000000-0000-0000-0000-000000000000,234492,Mrs. Stephanie Kusie,,Government Orders,Elections Modernization Act,Bill C-76—Time Allocation Motion,"Mr. Speaker, I am not surprised to hear the hon. member from the NDP say that, because the NDP worked every step of the way with the government in impeding democracy in moving this bill forward, denying Canadians the opportunity to have their voice and the right to fair democratic processes.
I would ask the Minister of Democratic Institutions why Liberals do not want to see democracy served.",Conservative,Calgary Midnapore,Stephanie Kusie,http://www.parl.gc.ca/Parliamentarians/en/members/stephanie-kusie(234492)
4758083,ca.proc.d.2018-10-25.10330822,2018-10-25,69e429cb-3bd3-4744-95a0-701e3b95c115,229218,"Hon. Karina Gould (Minister of Democratic Institutions, Lib.)",,Government Orders,Elections Modernization Act,Bill C-76—Time Allocation Motion,"Mr. Speaker, I think Canadians know that it is neither the Liberals nor the New Democrats who are working to impede democracy, considering it was the previous government that introduced Bill C-23. In fact, most of the amendments my hon. colleague and opposition members proposed were to return this bill to Bill C-23, in which, unfortunately, the previous government went out of its way to limit the ability of Canadians to participate in our democracy. Therefore, it is a bit rich, and slightly laughable, to hear from Conservatives on the other side how strongly they value democracy and democratic participation in our country, when they did things to impede that process.
Bill C-76 would do much to repeal all those unfair elements in Bill C-23. It would ensure that the election in 2019 had the integrity Canadians deserve and expect and that the process would be fair and protected.",Liberal,Burlington,Karina Gould,http://www.parl.gc.ca/Parliamentarians/en/members/karina-gould(229218)
4758084,ca.proc.d.2018-10-25.10330829,2018-10-25,031462db-8f61-48ed-bf9f-b033eb8312bb,217323,"Mr. Nathan Cullen (Skeena—Bulkley Valley, NDP)",,Government Orders,Elections Modernization Act,Bill C-76—Time Allocation Motion,"Mr. Speaker, Canadians can tolerate quite a bit from our politics sometimes, whether they have a left or centre or right perspective. One of the things I have noticed that they cannot tolerate is straight-up hypocrisy. 
I am looking at the member for Winnipeg North, who has now joined us here. 
The member for Coast of Bays—Central—Notre Dame, who was here moments ago, moved a motion a couple of years ago in this place. That motion said we should never use the guillotine of time allocation to shut down debate in Parliament on any bills that deal with our democracy, because they are so fundamental. 
One would have to ask the Liberals: How did we get here? There must have been some massive impediment that made them have to go back on their word and force time allocation on Parliament. 
The bill to fix the unfair elections act, which New Democrats support, was introduced almost two years ago. They must have been working hard in those two years in the hope of getting this legislation through in time for the next election. 
We have now found out that they did not work on the bill. They sat on the bill month after month. We pleaded with them to show us the bill so we could debate it and pass it through the House.
The Liberals introduced Bill C-76 so late that the Chief Electoral Officer has told them they blew the deadline. A bunch of things in the bill will not even happen for the 2019 election.
Canadians are very frustrated with the Liberals, especially with respect to issues around voting and democracy. They broke their sacred promise to make 2015 the last election under first past the post. We really thought they would have learned a lesson that the urgency of now is incredibly important. It was not important to them.
Now the Liberals are introducing the exact same motion, word for word, that Stephen Harper used to ram his bill through Parliament. They want to use it to force their legislation through Parliament and are looking around for someone to blame. They cannot find anyone.
My question for the minister is simple. We had an opportunity to fix privacy rules in Canada to ensure that our democracy and our voting are free and fair. Why did the Liberals choose to ignore all the evidence that the committee heard, which screwed up elections in England and the U.S.? Why did they choose to expose Canadian elections to hacking and tampering by foreign influences because parties will not have to follow any privacy rules whatsoever under this legislation?",New Democratic Party,Skeena—Bulkley Valley,Nathan Cullen,http://www.parl.gc.ca/Parliamentarians/en/members/nathan-cullen(217323)
4758085,ca.proc.d.2018-10-25.10330866,2018-10-25,69e429cb-3bd3-4744-95a0-701e3b95c115,229218,Hon. Karina Gould,,Government Orders,Elections Modernization Act,Bill C-76—Time Allocation Motion,"Mr. Speaker, it is always a pleasure to work with my colleague on this file. It has been great having him as the critic for democratic institutions, particularly with respect to this piece of legislation. New Democrats are supportive of the bill and most of the elements in it. We are working hard to get this done.
As was noted, it is important to get this done in time for the 2019 election. Unfortunately, every time members went to move to clause-by-clause at committee, the Conservative members decided to filibuster. Therefore we find ourselves in a time crunch. However, I am very optimistic about moving the bill forward so we can ensure that our elections are protected.
When it comes to privacy and the issues the member raised, I would note that the particular examples he is talking about are private companies that fall under PIPEDA. The ethics committee is currently undertaking a study on this, and I look forward to hearing the results.
This is an important issue, but it requires a bit more study and I think we can find the right solutions.",Liberal,Burlington,Karina Gould,http://www.parl.gc.ca/Parliamentarians/en/members/karina-gould(229218)
4758086,ca.proc.d.2018-10-25.10330875,2018-10-25,775ebcdb-4561-4bd0-8c84-d14531f2c726,234611,"Mr. John Nater (Perth—Wellington, CPC)",,Government Orders,Elections Modernization Act,Bill C-76—Time Allocation Motion,"Mr. Speaker, here we are once again with time allocation on an electoral reform bill, on a bill that would change how we run our elections. 
I wish I could say I am surprised by the Liberals, but this is yet another failure on their part. They failed when they tried to do electoral reform. When they did not get what they wanted, they left it. Bill C-33, introduced in November 2016, was left unmoved and unloved on the Order Paper for the last two years.
The Chief Electoral Officer and the former chief electoral officer both said they needed legislation passed with royal assent by April 30 of this year, yet this legislation was not even introduced in this place until April 30. This was yet another failure on the part of the Liberals.
Why will they not just admit this is another attempt to game the system in their favour?",Conservative,Perth—Wellington,John Nater,http://www.parl.gc.ca/Parliamentarians/en/members/john-nater(234611)
4758087,ca.proc.d.2018-10-25.10330879,2018-10-25,69e429cb-3bd3-4744-95a0-701e3b95c115,229218,Hon. Karina Gould,,Government Orders,Elections Modernization Act,Bill C-76—Time Allocation Motion,"Mr. Speaker, Canadians know this legislation is important for our democracy. When it comes to important elements like vouching, and when it comes to ensuring that the most vulnerable among us can cast a ballot, this legislation would make that happen.
Experts across the country have called for the passage of the bill. Let us all work together and get this done. I sincerely hope that my colleagues on the other side of this place will recognize the important underlying democratic values and principles that are encompassed in Bill C-76 and will work with us to pass the bill in a timely way, because it is important for Canadians and it is important for Canadian democracy.",Liberal,Burlington,Karina Gould,http://www.parl.gc.ca/Parliamentarians/en/members/karina-gould(229218)
4758088,ca.proc.d.2018-10-25.10330884,2018-10-25,dbb0dd7c-287c-4115-9424-4b2c55652877,234506,"Mr. Robert-Falcon Ouellette (Winnipeg Centre, Lib.)",,Government Orders,Elections Modernization Act,Bill C-76—Time Allocation Motion,"Mr. Speaker, the people of Winnipeg believe that the strength of our democracy depends on the participation of as many Canadians as possible. This bill would undo many of the unfair aspects of the Harper government's unfair elections act, as we would be making it easier and more convenient for Canadians to vote. We would be making the electoral process more accessible to Canadians with disabilities, caregivers and members of the Canadian Armed Forces, and we would be restoring voting rights to more than one million Canadians living abroad. This bill would strengthen our laws, close loopholes, bring in a more robust enforcement regime and would make it more difficult for bad actors to influence our elections.
After the 2015 election, the Chief Electoral Officer made over 130 recommendations on ways to improve how our democracy functions. After careful study and consideration by parliamentary committees both in the House and the Senate, and with the input of experts from across Canada, the Government of Canada introduced the elections modernization act. Could the minister speak about the deadline we face with the next election, as well as the 130 recommendations made by the Chief Electoral Officer and how we have implemented most of them?",Liberal,Winnipeg Centre,Robert-Falcon Ouellette,http://www.parl.gc.ca/Parliamentarians/en/members/robert-falcon-ouellette(234506)
4758089,ca.proc.d.2018-10-25.10330887,2018-10-25,69e429cb-3bd3-4744-95a0-701e3b95c115,229218,Hon. Karina Gould,,Government Orders,Elections Modernization Act,Bill C-76—Time Allocation Motion,"Mr. Speaker, I thank my hon. colleague Winnipeg Centre for the important information contained in his excellent question. He did a very good job of summarizing some of the most important elements of in this bill.
With regard to implementation, it is extraordinarily important that we pass this bill quickly. This bill has been before the House for almost six months now. The committee has conducted an extensive study of it and has brought forward important comments and amendments. We have accepted amendments to this bill by both of the main opposition parties, which is important. Of course, these are amendments that would improve the bill and not return it to its former state with the Canada Elections Act.
As my colleague noted, the former CEO of Elections Canada brought forward over 100 recommendations for how we could improve the Canada Elections Act. Bill C-76 would implement 85% of those recommendations. I think we can all agree that the CEO of Elections Canada has the best interest of Canadians and Canadian democracy at heart, and this bill would do exactly that.",Liberal,Burlington,Karina Gould,http://www.parl.gc.ca/Parliamentarians/en/members/karina-gould(229218)
4758090,ca.proc.d.2018-10-25.10330899,2018-10-25,ea197684-00f6-458f-a46b-5bea7db6f7f3,240374,"Mr. Daniel Blaikie (Elmwood—Transcona, NDP)",,Government Orders,Elections Modernization Act,Bill C-76—Time Allocation Motion,"Mr. Speaker, in the last Parliament, the previous government made a lot changes to the Elections Act that were controversial. Our party ran to repeal those changes. The Liberal Party ran to repeal those changes. We are three years into this Parliament and we still have not seen those changes made, and we had a pretty clear deadline from the elections commissioner for when those changes had to be made. We knew at the very beginning of the Parliament what it would take to repeal the changes that were made in the last Parliament. There was agreement between our party and the party currently in government, as well as a broad base of Canadians, that those changes needed to be repealed.
I am wondering how we got to where we are three years later. I will spare the partisan jabs. Why should a typical Canadian who was concerned about the integrity of the elections process, who felt that those changes made in the last Parliament needed to be repealed, not feel disappointed? The government had three years, two ministers of democratic institutions, three if we count an interim minister, who could not deliver just a basic repeal of the nefarious changes made in the last Parliament. That is the lowest bar it had to meet, and it had almost three years to get it done by April 30 of this year. It failed to do it. Why should Canadians not look at this as a major failure? Why should they not feel disappointed that at least those changes were not made by April 30 of this year to make sure that their intended repeal, as discussed in the last election, was on time and implemented by the next election? There are important issues that could have been addressed in a separate bill.",New Democratic Party,Elmwood—Transcona,Daniel Blaikie,http://www.parl.gc.ca/Parliamentarians/en/members/daniel-blaikie(240374)
4758091,ca.proc.d.2018-10-25.10330912,2018-10-25,69e429cb-3bd3-4744-95a0-701e3b95c115,229218,Hon. Karina Gould,,Government Orders,Elections Modernization Act,Bill C-76—Time Allocation Motion,"Mr. Speaker, I am glad to hear that my hon. colleague and I can agree on the contents of the bill and its importance to Canadians. Therefore, I would urge all members, particularly the New Democrats, to support us in this effort to ensure that we are doing what is right for Canadians.
His comments also allow me to take a moment to thank my hon. colleague, the President of the Treasury Board, who stepped into this portfolio while I had my first child and I took brief maternity leave. I am very grateful to him taking on part of this responsibility. I am very appreciative of all the colleagues in the House who were able to support me in this process.
I am very excited about the forward momentum this piece of legislation has. I am encouraged that we will work together, particularly with my colleagues from the New Democratic Party, to ensure that this bill is in place ahead of the next election and that we can assure Canadians that their elections will be safeguarded, protected, and will have the integrity we all expect and trust to have in our democracy.",Liberal,Burlington,Karina Gould,http://www.parl.gc.ca/Parliamentarians/en/members/karina-gould(229218)
4758092,ca.proc.d.2018-10-25.10330918,2018-10-25,831322ab-9fa6-437e-92ba-1b4525f8242d,216505,"Mr. Pat Kelly (Calgary Rocky Ridge, CPC)",,Government Orders,Elections Modernization Act,Bill C-76—Time Allocation Motion,"Mr. Speaker, returning to the matter right now, namely the time allocation motion, how on earth could the current government possibly justify invoking time allocation on a democratic reform bill that has a number of amendments to be debated in the House? Voters send their members of Parliament here to be their voice. Therefore, how can the Liberals possibly justify bringing time allocation on a democratic reform bill with substantial amendments to be debated?",Conservative,Calgary Rocky Ridge,Pat Kelly,http://www.parl.gc.ca/Parliamentarians/en/members/pat-kelly(216505)
4758093,ca.proc.d.2018-10-25.10330922,2018-10-25,69e429cb-3bd3-4744-95a0-701e3b95c115,229218,Hon. Karina Gould,,Government Orders,Elections Modernization Act,Bill C-76—Time Allocation Motion,"Mr. Speaker, it is ironic to hear that from my colleague across the way, because when his party was in government it used time allocation to move forward a piece of legislation that further limited democracy.
What is also of note is that since this bill was introduced, the official opposition has taken every opportunity possible to obstruct the progress of this piece of legislation. Even yesterday it put forward 177 spurious amendments that would return this piece of legislation to what was in Bill C-23, which, as we heard from experts and Canadians across the country, limited people's ability to participate in democracy.
This piece of legislation is incredibly important. It expands the franchise. It ensures that every Canadian citizen who has the right to vote will be able to vote.
On this side of the House, we firmly believe that our democracy is strongest when all Canadians participate in it. I understand that that is not the case with my colleagues on the opposite side. However, for us, democracy should be available to all Canadians and we are working diligently to ensure that is the case in 2019.",Liberal,Burlington,Karina Gould,http://www.parl.gc.ca/Parliamentarians/en/members/karina-gould(229218)
4758094,ca.proc.d.2018-10-25.10330925,2018-10-25,2490b23e-4439-4513-9d54-6fceb6320267,217149,"Ms. Cheryl Hardcastle (Windsor—Tecumseh, NDP)",,Government Orders,Elections Modernization Act,Bill C-76—Time Allocation Motion,"Mr. Speaker, in my riding of Windsor—Tecumseh, Canadians see right through this. We call it “Eddie Haskell politics”, because what we have here are a lot of smiling faces and earnest declarations, as the minister just said, to ensure that we are doing what is right. Therefore, let us make it clear. After a mere two hours of debate, the current government has called time allocation on an exercise of electoral reform that every Canadian has a vested interest in, no matter their age, because of the legacy of it. I just wanted to make that clear to Canadians.",New Democratic Party,Windsor—Tecumseh,Cheryl Hardcastle,http://www.parl.gc.ca/Parliamentarians/en/members/cheryl-hardcastle(217149)
4758095,ca.proc.d.2018-10-25.10330927,2018-10-25,69e429cb-3bd3-4744-95a0-701e3b95c115,229218,Hon. Karina Gould,,Government Orders,Elections Modernization Act,Bill C-76—Time Allocation Motion,"Mr. Speaker, I am glad to know that the New Democrats support the principles and clauses in this bill. We look forward to working with them to ensure that this can be in place for the 2019 election, because we share so many of the important values that underpin this legislation. I know that we all want this to be in place so that it will benefit all Canadians ahead of 2019.",Liberal,Burlington,Karina Gould,http://www.parl.gc.ca/Parliamentarians/en/members/karina-gould(229218)
4758096,ca.proc.d.2018-10-25.10330929,2018-10-25,0bd5970c-e4c2-4044-8344-8123b16d75bd,218230,"Hon. Peter Kent (Thornhill, CPC)",,Government Orders,Elections Modernization Act,Bill C-76—Time Allocation Motion,"Mr. Speaker, my hon. colleagues on this side of the House have addressed the fact that this piece of legislation has come to the House extraordinarily and unacceptably late. This should have been presented a year ago. The fact that it was so clumsily assembled is reflected in the fact that the Liberal government put forward almost six dozen amendments of its own to try to correct this clumsily written piece of legislation. Now, after only two and a half speeches by members on the opposition side of the House on this deeply flawed bill, the government has imposed the legislative guillotine of time allocation, enabled by its parliamentary majority, to cut off debate.
I know that my hon. colleagues on the government side of the House love to invoke Peter Van Loan's name. However, when this same legislation was passed by the previous government, our Harper government, a very similar piece of legislation from which, regrettably, many elements have been stripped in Bill C-76, there were many more hours and days of debate than are being allowed here today. Only three opposition speakers have risen on this side of the House and, all of a sudden, time allocation has been imposed. 
How can the current government possibly look Canadians in the face with any sort of respect and say that it is working to properly defend the Canadian electoral process? ",Conservative,Thornhill,Peter Kent,http://www.parl.gc.ca/Parliamentarians/en/members/peter-kent(218230)
