basepk,hid,speechdate,pid,opid,speakeroldname,speakerposition,maintopic,subtopic,subsubtopic,speechtext,speakerparty,speakerriding,speakername,speakerurl
4756455,ca.proc.d.2018-10-17.10306619,2018-10-17,6519cfba-0080-419d-baa9-8ae6e56d032f,232946,"Hon. Andrew Scheer (Leader of the Opposition, CPC)",,Oral Questions,Government Accountability,,"Mr. Speaker, I want to put the Prime Minister's mind at ease. I am not asking him to comment on the case. I am asking him to explain why he has chosen not to release documents to the court.
 If he truly believes in an independent judiciary, if he truly believes in the right of a Canadian admiral to a just defence, then he will do what previous prime ministers have done and make these documents available. If he does not, then what on earth is he trying to hide?",Conservative,Regina—Qu'Appelle,Andrew Scheer,http://www.parl.gc.ca/Parliamentarians/en/members/andrew-scheer(232946)
4756456,ca.proc.d.2018-10-17.10306622,2018-10-17,b8c04eca-f237-48a8-8975-374ccd40d1a9,214115,"Right Hon. Justin Trudeau (Prime Minister, Lib.)",,Oral Questions,Government Accountability,,"Mr. Speaker, I will always uphold the independence of our judicial system and that is why I will not comment on this ongoing court case. ",Liberal,Papineau,Justin Trudeau,http://www.parl.gc.ca/Parliamentarians/en/members/justin-trudeau(214115)
4756457,ca.proc.d.2018-10-17.10306624,2018-10-17,e39c6a4d-cac9-4e3e-b8d5-528f15a76519,214282,"Mr. Mario Beaulieu (La Pointe-de-l'Île, BQ)",,Oral Questions,Marijuana,,"Mr. Speaker, the legalization of cannabis was botched. The Government of Quebec had just been elected and barely had the time to introduce its own legislation when pot became legal. The result is that an 18-year-old can buy it today, but by all indications will no longer be able to do so in three months.
Is it one, two or four plants? We do not know. Will there be a legal challenge? We do not know. That is what happens when we do not have sovereignty.
What was the point of legalizing pot on October 17 when, clearly, no one was ready?",Bloc Québécois,La Pointe-de-l'Île,Mario Beaulieu,http://www.parl.gc.ca/Parliamentarians/en/members/mario-beaulieu(214282)
4756458,ca.proc.d.2018-10-17.10306630,2018-10-17,b8c04eca-f237-48a8-8975-374ccd40d1a9,214115,"Right Hon. Justin Trudeau (Prime Minister, Lib.)",,Oral Questions,Marijuana,,"Mr. Speaker, we have been working with experts across the country, the provinces and municipalities for three years in anticipation of this day. 
The provinces, including Quebec, asked for eight to 12 weeks to legalize cannabis after the entry into force of the bill, and we gave them 17 weeks. We continue to work with them on this process, but we know that protecting our youth and preventing organized crime from profiting is everyone's priority.",Liberal,Papineau,Justin Trudeau,http://www.parl.gc.ca/Parliamentarians/en/members/justin-trudeau(214115)
4756459,ca.proc.d.2018-10-17.10306635,2018-10-17,3176068f-62ee-4b2f-aacd-1131201c6db1,214707,The Speaker,,Routine Proceedings,Parliamentary Procedure,," I have the honour to table, in both official languages, the Selected Decisions of Speaker Andrew Scheer. This reference work on parliamentary procedure is the ninth volume in a collection of Speakers' decisions and contains 101 decisions.
Mr. Scheer brought considerable experience to the position of Speaker. First elected to Parliament in 2004, he served as Assistant Deputy Chair of Committees of the Whole during the 39th Parliament and Deputy Speaker and Chair of Committees of the Whole during the 40th Parliament. He was the fourth Speaker to be elected by a secret ballot of his peers. At the age of 32, he became the youngest Speaker of the House of Commons, as well as the first Speaker to represent a Saskatchewan riding. 
Many of his rulings have already become firm precedents for the House, and I enjoy citing them.
In addition to a print copy which members will receive, the volume will also be accessible online.
I would like to thank the dedicated individuals from across the House administration who contributed to the drafting and publication of this book. This truly collaborative effort stands as a proud example of the dedication and expertise of those who, on a daily basis, support the work of members.
On this auspicious occasion, I am also pleased to announce the unveiling of the official painted portrait of Mr. Scheer by Saskatchewan artist Juan Martinez. Note that we do not speak of the hanging of Speakers, thank goodness. This work will take its place in the collection of portraits of the Speakers of the House of Commons.
 I invite all hon. members to join me in room 237-C at 4:00 p.m. for the unveiling ceremony, followed by a reception in honour of the Hon. Andrew Scheer, the 35th Speaker of the House of Commons.",Liberal,Halifax West,Geoff Regan,http://www.parl.gc.ca/Parliamentarians/en/members/geoff-regan(214707)
4756460,ca.proc.d.2018-10-17.10306688,2018-10-17,eed67a03-db05-4376-89b3-8e038fa83728,229507,"Hon. Andrew Leslie (Parliamentary Secretary to the Minister of Foreign Affairs (Canada-U.S. Relations), Lib.)",,Routine Proceedings,Foreign Affairs,,"‘Mr. Speaker, pursuant to Standing Order 32(2) I have the honour to table, in both official languages, the treaty amendments, entitled “Amendments to Annex I of the International Convention against Doping in Sport”, notified on October 1, 2018; and “Amendments to Annex II of the International Convention against Doping Sport”, notified on October 1, 2018.",Liberal,Orléans,Andrew Leslie,http://www.parl.gc.ca/Parliamentarians/en/members/andrew-leslie(229507)
4756461,ca.proc.d.2018-10-17.10306692,2018-10-17,07cf5767-802c-406c-92a7-7dc92af79b40,229526,"Mr. Kevin Lamoureux (Parliamentary Secretary to the Leader of the Government in the House of Commons, Lib.)",,Routine Proceedings,Government Response to Petitions,,"Mr. Speaker, pursuant to Standing Order 36(8) I have the honour to table, in both official languages, the government's response to three petitions.",Liberal,Winnipeg North,Kevin Lamoureux,http://www.parl.gc.ca/Parliamentarians/en/members/kevin-lamoureux(229526)
4756462,ca.proc.d.2018-10-17.10306694,2018-10-17,,,,,Routine Proceedings,Crown-Indigenous Relations,,"Mr. Speaker, pursuant to Standing Order 32(2) I have the honour to table, in both official languages, copies of the new Inuvialuit Final Agreement Consolidated Report of the Implementation Coordinating Committee, 2013-2014 to 2015-2016.
At the same time, pursuant to Standing Order 32(2) I have the honour to table, in both official languages, copies of the annual report of the Tlicho Implementation Committee: Tlicho Land Claims and Self-Government Agreement, 2010-2011 to 2014-2015.",,,"Mr. Marc Miller (Parliamentary Secretary to the Minister of Crown-Indigenous Relations, Lib.)",
4756463,ca.proc.d.2018-10-17.10306696,2018-10-17,93d34552-e08f-449a-86bf-d0cac6a69f23,232967,"Mr. Bryan May (Cambridge, Lib.)",,Routine Proceedings,Committees of the House,"Human Resources, Skills and Social Development and the Status of Persons with Disabilities","Mr. Speaker, I have the honour to present, in both official languages, the 12th report of the Standing Committee on Human Resources, Skills and Social Development and the Status of Persons with Disabilities, entitled “Experiential Learning and Pathways to Employment for Canadian Youth”.
Pursuant to Standing Order 109 the committee requests that the government table a comprehensive response to this report.",Liberal,Cambridge,Bryan May,http://www.parl.gc.ca/Parliamentarians/en/members/bryan-may(232967)
4756464,ca.proc.d.2018-10-17.10306699,2018-10-17,3b00808c-6ef4-44a2-8204-dc48574a870e,216517,"Mr. Ted Falk (Provencher, CPC)",,Routine Proceedings,Committees of the House,"Human Resources, Skills and Social Development and the Status of Persons with Disabilities","Mr. Speaker, the Conservatives are pleased to support the final report from the HUMA committee on Experiential Learning and Pathways to Employment for Canadian Youth. Also, the Conservatives have further contributed to the work of the committee through the addition of a supplementary opinion.
For a 2018 iteration of the Canada summer jobs program, the Liberal government added an attestation requirement for all applicants, a values test, that drew significant backlash from Canadians from all walks of life. Many Canadians agree with the positions of the Liberal Party as a condition of receiving federal funding represents a marked departure from previous practice, whereby all Canadians would have equal opportunity for a public benefit regardless of their personal beliefs or values. The Conservatives believe that the rights of freedom, thought, belief, opinion and expression must be respected by the federal government and not undermined.
 The Liberal government deemed 1,559 applications incomplete in relation to the attestation, a twelvefold increase in rejections the previous year. Therefore, students across the country were deprived of their opportunity to gain work experience in upwards of 1,500 potential job placements as a direct result of the Liberal government's values test.
 We urge the Minister of Employment, Workforce Development and Labour to ensure that employer attestation is not a requirement of an application in the Canada summer jobs program going forward and not a requirement for application in developing new programs to support youth employment in Canada.",Conservative,Provencher,Ted Falk,http://www.parl.gc.ca/Parliamentarians/en/members/ted-falk(216517)
4756465,ca.proc.d.2018-10-17.10306702,2018-10-17,7cff4486-6787-493d-a4ee-a59d48f68ab3,219527,"Hon. Denis Paradis (Brome—Missisquoi, Lib.)",,Routine Proceedings,Committees of the House,Official Languages,"Mr. Speaker, I have the honour to present, in both official languages, the 13th report of the Standing Committee on Official Languages entitled, “French as a Second Language Learning Programs in Western Canada: Enhancing Availability”.
I would like to thank the clerk, Christine Holke, the analyst, Lucie Lecomte, and my colleagues from all parties for their contributions and the wonderful chemistry we enjoy.
Pursuant to Standing Order 109, the committee requests that the government table a comprehensive response to the report.",Liberal,Brome—Missisquoi,Denis Paradis,http://www.parl.gc.ca/Parliamentarians/en/members/denis-paradis(219527)
4756466,ca.proc.d.2018-10-17.10306704,2018-10-17,fc02fe5c-f4bc-451c-b921-86c4794d1d1d,234722,"Hon. John McKay (Scarborough—Guildwood, Lib.)",,Routine Proceedings,Committees of the House,Public Safety and National Security,"Mr. Speaker, I have the honour to present, in both official languages, the 26th report of the Standing Committee on Public Safety and National Security entitled, “M-124, Automated External Defibrillators”.
Pursuant to Standing Order 109, the committee requests that the government table a comprehensive response to the report.",Liberal,Scarborough—Guildwood,John McKay,http://www.parl.gc.ca/Parliamentarians/en/members/john-mckay(234722)
4756467,ca.proc.d.2018-10-17.10306706,2018-10-17,89dabae0-bc5d-4af0-babb-7104d4ee1742,219699,"Hon. Larry Bagnell (Yukon, Lib.)",,Routine Proceedings,Committees of the House,Procedure and House Affairs,"Mr. Speaker, I have the honour to present, in both official languages, the 71st report of the Standing Committee on Procedure and House Affairs.
The committee advises that, pursuant to Standing Order 91.1(2), the subcommittee on private members' business met to consider the order for the second reading of a private member's bill originating in the Senate and recommended that the item listed herein, which it has determined should not be designated non-votable, be considered by the House: Bill S-234, an act to amend the Parliament of Canada Act with regard to the parliamentary visual artist laureate.",Liberal,Yukon,Larry Bagnell,http://www.parl.gc.ca/Parliamentarians/en/members/larry-bagnell(219699)
4756468,ca.proc.d.2018-10-17.10306707,2018-10-17,3176068f-62ee-4b2f-aacd-1131201c6db1,214707,The Speaker,,Routine Proceedings,Committees of the House,Procedure and House Affairs,"Pursuant to Standing Order 91.1(2), the report is deemed adopted. 
(Motion agreed to)",Liberal,Halifax West,Geoff Regan,http://www.parl.gc.ca/Parliamentarians/en/members/geoff-regan(214707)
4756469,ca.proc.d.2018-10-17.10306708,2018-10-17,78336f0e-962c-47d2-a5b8-b59a26592789,217320,Mr. Matthew Dubé,,Routine Proceedings,Committees of the House,Procedure and House Affairs,"Mr. Speaker, in light of the discussions that occurred during question period, I seek the unanimous consent of the House to move a motion.
That given the important difference between record suspension, also known as pardons, and expungement and recognizing the government wishes to address this issue through legislation, that notwithstanding any standing order or usual practice of the House, Bill C-415, an act to establish a procedure for expunging certain cannabis-related convictions, be deemed to have been read a second time and referred to a committee of the whole, deemed considered in committee of the whole, deemed reported without amendment, deemed concurred in at the report stage and deemed read a third time and passed.",New Democratic Party,Beloeil—Chambly,Matthew Dubé,http://www.parl.gc.ca/Parliamentarians/en/members/matthew-dube(217320)
4756470,ca.proc.d.2018-10-17.10306710,2018-10-17,3176068f-62ee-4b2f-aacd-1131201c6db1,214707,The Speaker,,Routine Proceedings,Committees of the House,Procedure and House Affairs,Does the hon. member have the unanimous consent of the House to move the motion?,Liberal,Halifax West,Geoff Regan,http://www.parl.gc.ca/Parliamentarians/en/members/geoff-regan(214707)
4756471,ca.proc.d.2018-10-17.p5583614,2018-10-17,,,,intervention,Routine Proceedings,Committees of the House,Procedure and House Affairs, No.,,,Some hon. members,
4756472,ca.proc.d.2018-10-17.10306711,2018-10-17,bd2068aa-74c7-430a-bdf5-6f17b14ca140,218228,"Mr. Tom Kmiec (Calgary Shepard, CPC)",,Routine Proceedings,Petitions,Maternity Benefits,"Mr. Speaker, I have two petitions to table today. The first one has 2,070 signatures. It is by my constituent, Lindsey Salloway, who is an adoptive mom.
She points out in the petition, as signed by the petitioners, that adoptive parents in Canada face a 15-week difference in eligible benefits compared with those who give birth to their children. The petitioners are asking for equal treatment for all parents, newborn or adoptive. The petitioners are also asking for benefits for adoptive parents to be equal to those currently received by biological parents. The petitioners are calling on the Government of Canada to allow adoptive parents to be eligible for an equivalent amount of maternity benefits and leave to bond with their children.",Conservative,Calgary Shepard,Tom Kmiec,http://www.parl.gc.ca/Parliamentarians/en/members/tom-kmiec(218228)
4756473,ca.proc.d.2018-10-17.10306783,2018-10-17,bd2068aa-74c7-430a-bdf5-6f17b14ca140,218228,"Mr. Tom Kmiec (Calgary Shepard, CPC)",,Routine Proceedings,Petitions,Health,"Mr. Speaker, my second petition is on behalf of two of my constituents, Shailynn and Jessica Olstad. It is signed by 2,599 petitioners.
The petitioners are asking for equal treatment for those suffering from SMA. The petitioners are drawing the attention of Health Canada to the fact that 50 other countries, such as the U.S., France, Germany, Sweden, Italy, have already approved Spinraza for the treatment of SMA.
The petitioners are calling on the Government of Canada to support overturning the decision of CADTH and to ensure that Spinraza is approved for all types of SMA, so that provincial governments can negotiate a price for all Canadians suffering from this rare chronic condition.",Conservative,Calgary Shepard,Tom Kmiec,http://www.parl.gc.ca/Parliamentarians/en/members/tom-kmiec(218228)
4756474,ca.proc.d.2018-10-17.10306715,2018-10-17,85738a00-0a16-4a6f-89c7-9f045782d1fd,217185,"Mr. Richard Cannings (South Okanagan—West Kootenay, NDP)",,Routine Proceedings,Petitions,The Environment,"Mr. Speaker, I am rising today to present a petition from citizens who point out that the federally owned Chalk River Laboratories are releasing radioactive and other toxic substances into the Ottawa River, in particular from the Perch Lake Basin, where three reactor cores and other radioactive toxic waste has been dumped in the sand, and that a multinational consortium contracted by the federal government to operate the Chalk River Laboratories proposes to create a giant mound of radioactive waste in the Perch Lake Basin that would be exposed to rain and snow, and would release additional contaminants, and that technical criticisms of this proposal are causing major delays in the environmental assessment process.
The petitioners are calling on the Government of Canada to abandon the project to build a radioactive waste mound at Chalk River, identify a site for a new facility that could protect the Ottawa River, and prioritize putting into this new facility the waste of radioactive releases into the Ottawa River.",New Democratic Party,South Okanagan—West Kootenay,Richard Cannings,http://www.parl.gc.ca/Parliamentarians/en/members/richard-cannings(217185)
4756475,ca.proc.d.2018-10-17.10306717,2018-10-17,4437c848-d8c7-4a39-a948-1539969f3a90,234764,"Ms. Marilyn Gladu (Sarnia—Lambton, CPC)",,Routine Proceedings,Petitions,Justice,"Mr. Speaker, I rise to present a petition about Bill C-75, which proposes to lighten the sentences on some very serious crimes.
The petitioners are calling on the Prime Minister to defend the safety and security of all Canadians, and to withdraw Bill C-75.",Conservative,Sarnia—Lambton,Marilyn Gladu,http://www.parl.gc.ca/Parliamentarians/en/members/marilyn-gladu(234764)
4756476,ca.proc.d.2018-10-17.10306720,2018-10-17,d9a6cad1-b3b6-4393-afc5-7c897fb638e6,229654,"Hon. MaryAnn Mihychuk (Kildonan—St. Paul, Lib.)",,Routine Proceedings,Petitions,Parks Canada,"Mr. Speaker, I have two petitions today. The first one is calling on the government to commit to keeping historic objects in their context, so that they can be readily available to scholars, scientists, and the members of the originating communities; cancel plans to centralize the historic artifacts and resources held by Parks Canada in one facility; and to commit to maintaining regional facilities for artifact storage and curation in Manitoba.",Liberal,Kildonan—St. Paul,MaryAnn Mihychuk,http://www.parl.gc.ca/Parliamentarians/en/members/maryann-mihychuk(229654)
4756477,ca.proc.d.2018-10-17.10306987,2018-10-17,d9a6cad1-b3b6-4393-afc5-7c897fb638e6,229654,"Hon. MaryAnn Mihychuk (Kildonan—St. Paul, Lib.)",,Routine Proceedings,Petitions,Ukraine,"Mr. Speaker, my second petition is related to Ukrainian nationals who have biometric passports, and allowing visa-free travel to Canada for periods of stays up to 90 days, given Canada's longstanding relationship with Ukraine.",Liberal,Kildonan—St. Paul,MaryAnn Mihychuk,http://www.parl.gc.ca/Parliamentarians/en/members/maryann-mihychuk(229654)
4756478,ca.proc.d.2018-10-17.10306725,2018-10-17,53eb10e4-f8e7-4ef7-9448-b4a10ec1dba3,216366,"Mrs. Cathay Wagantall (Yorkton—Melville, CPC)",,Routine Proceedings,Petitions,The Environment,"Mr. Speaker, I have five petitions today, all directed to the Hon. Jane Philpott, Minister of Indigenous Services—",Conservative,Yorkton—Melville,Cathay Wagantall,http://www.parl.gc.ca/Parliamentarians/en/members/cathay-wagantall(216366)
4756479,ca.proc.d.2018-10-17.10306726,2018-10-17,3176068f-62ee-4b2f-aacd-1131201c6db1,214707,The Speaker,,Routine Proceedings,Petitions,The Environment,"Order, I would remind the member, and I think she knows, not to use the names of members in the House.",Liberal,Halifax West,Geoff Regan,http://www.parl.gc.ca/Parliamentarians/en/members/geoff-regan(214707)
4756480,ca.proc.d.2018-10-17.10306727,2018-10-17,53eb10e4-f8e7-4ef7-9448-b4a10ec1dba3,216366,Mrs. Cathay Wagantall,,Routine Proceedings,Petitions,The Environment,"Mr. Speaker, the petitioners, who are residents, business owners, and cottage owners of Round Lake, Saskatchewan, and those concerned for the well-being of the body of water known as Round Lake wish to draw attention to the extreme low water level of the lake due to the uncontrolled outflow of water.
 The uncontrolled outflow is affecting business, the environment, families and the future of Round Lake. The uncontrolled outflow of water from the lake is the result of a disagreement between the Government of Canada and the first nations of Ochapowace and Piapot. Controlled structures and compensation agreements were reached between the Government of Canada and first nations communities on lakes upstream in the Qu'Appelle Valley. The Round Lake issue has remained unresolved since 2008.
The petitioners are calling on the minister to use her authority to re-establish communication with Ochapowace and Piapot first nations to work towards a resolution on this matter.",Conservative,Yorkton—Melville,Cathay Wagantall,http://www.parl.gc.ca/Parliamentarians/en/members/cathay-wagantall(216366)
4756481,ca.proc.d.2018-10-17.10306729,2018-10-17,ab30a165-2ce2-4465-af10-19ae0fc1aec0,217227,"Ms. Sheri Benson (Saskatoon West, NDP)",,Routine Proceedings,Petitions,Canada Post,"Mr. Speaker, I have two petitions to table today. The first is from petitioners drawing the attention of the House of Commons to the nearly two million Canadians in desperate need of alternative to payday lenders, whose crippling lending rates affect poor, marginalized, rural and indigenous communities, whereas 3,800 Canada Post outlets exist in rural areas where there are few banks and credit unions. Canada Post already has the infrastructure to make a rapid transition to include postal banking. These petitioners are calling on the government to enact Motion No. 166 to create a committee to study and propose a plan for postal banking under the Canada Post Corporation Act.",New Democratic Party,Saskatoon West,Sheri Benson,http://www.parl.gc.ca/Parliamentarians/en/members/sheri-benson(217227)
4756482,ca.proc.d.2018-10-17.10306871,2018-10-17,ab30a165-2ce2-4465-af10-19ae0fc1aec0,217227,"Ms. Sheri Benson (Saskatoon West, NDP)",,Routine Proceedings,Petitions,Vision Care,"Mr. Speaker, the second petition is from petitioners who are asking the government to table a national framework for action to promote eye health and vision care. They call attention to the expected doubling in the number of Canadians with vision loss in the next 20 years. There is an emerging crisis in eye health and vision care, which affects all segments of the Canadian population, but Canada's most vulnerable populations, children, seniors and indigenous people, are at particular risk. Therefore, they are calling on the government to commit to acknowledging this and to tabling the development of a national framework for action to promote eye health and vision care in Canada.",New Democratic Party,Saskatoon West,Sheri Benson,http://www.parl.gc.ca/Parliamentarians/en/members/sheri-benson(217227)
4756483,ca.proc.d.2018-10-17.10306732,2018-10-17,26a7c39b-6a77-446a-8986-1d3086f156fe,217623,"Mrs. Shannon Stubbs (Lakeland, CPC)",,Routine Proceedings,Petitions,"Immigration, Refugees and Citizenship","Mr. Speaker, I am tabling the final petition, with 2,600 signatures, on the Liberals' unilateral decision to close the immigration processing office in Vegreville. In June, I asked the Prime Minister to reconsider and stop the cold-hearted closure because of its massive impact on workers, families, the town and the region, but the Liberals proceeded with that closure on September 1.
The workers want Canadians to know that contrary to the Prime Minister's suggestion that processing times were not up to par, the fact is that Vegreville employees consistently far exceeded targets and backed up other offices. It will cost millions more to operate in the new office, for little gain. Even after the office's closure, thousands of signatures from across Alberta and Canada have kept arriving in support. open. Vegreville workers, Albertans and rural Canadians know that the Prime Minister failed them, and they will not forget it.",Conservative,Lakeland,Shannon Stubbs,http://www.parl.gc.ca/Parliamentarians/en/members/shannon-stubbs(217623)
4756484,ca.proc.d.2018-10-17.10306734,2018-10-17,e7d4b944-1d3e-4f87-a7df-cdbd4fe7ca2b,237062,"Mr. Gord Johns (Courtenay—Alberni, NDP)",,Routine Proceedings,Petitions,The Environment,"Mr. Speaker, I am honoured to table a petition on behalf of constituents from Nanoose Bay, Qualicum Beach and Parksville, calling on the government to work with the provinces, municipalities and indigenous communities to develop a national strategy to combat plastic pollution in and around aquatic environments. In light of the threat plastic pollution poses to our waterways, they are looking for regulations aimed at reducing plastic debris discharge from stormwater outfalls, industrial use of microplastics, consumer and industrial use of single-use plastics, permanent dedicated and annual funding for the cleanup of derelict and ghost fishing gear, community-led projects to clean up plastics and debris from our shores, education and outreach campaigns on the root causes and, of course, to redesign the plastic economy.",New Democratic Party,Courtenay—Alberni,Gord Johns,http://www.parl.gc.ca/Parliamentarians/en/members/gord-johns(237062)
