basepk,hid,speechdate,pid,opid,speakeroldname,speakerposition,maintopic,subtopic,subsubtopic,speechtext,speakerparty,speakerriding,speakername,speakerurl
4755198,ca.proc.d.2018-10-04.10287991,2018-10-04,002b9ee7-5ecd-4727-96bb-ca4d1e06766d,234524,"Mr. Ali Ehsassi (Willowdale, Lib.)",,Government Orders,Justice,,"Mr. Speaker, I will first thank the hon. member for Surrey Centre for focusing on the question of violence and how this bill would allow us to address that. I, on the other hand, will be taking a more general overview of this legislation, which I am incredibly proud of.
As we know, the first substantial update to Canadian family law in 20 years is occurring. Bill C-78 represents a landmark in strengthening and enshrining the best interests of the child and would make federal family law more responsive to the modern-day needs of Canadian families. Family law, as has been noted by all of the speakers today, is both complex and broad and as a result, there are significant gaps and inefficiencies, which existing laws have not adequately addressed. Bill C-78 seeks to remedy these gaps through a wide-ranging series of common-sense adjustments.
Today I will focus on six key elements of Bill C-78: strengthening the best interests of the child provisions, enshrining primary consideration into family law, important changes to terminology, modernizing the Divorce Act, creating contact orders and setting new relocation guidelines. 
Allow me to start with the best interests of the child test. The best interests of the child test has been a fundamental part of family law in Canada and in many other countries for decades. Under the Divorce Act, courts must consider only a child's best interests when making decisions about who may care for or make decisions about a child. The Divorce Act, however, gives surprisingly little guidance regarding this test.
In 1998, the Special Joint Committee on Child Custody and Access called for the Divorce Act to include a list of criteria considered to be in the best interests of the child. Many others have added to this call, including academics, child advocates and the Canadian Bar Association. With Bill C-78, our government is answering their calls and taking important steps to address existing gaps and inefficiencies in the family law system.
The proposed criteria for the best interests of the child would emphasize critical elements of a child's life. They include a child's stage of development, ties to loved ones, cultural identity, and personal views and preferences. However, the list is not closed or exhaustive. If a particular factor in a child's life is especially relevant—for example, if the child has medical needs or participates in competitive sporting events—courts could consider these factors where appropriate and relevant. 
Adding definitional certainty to the best interests of the child test in the Divorce Act promotes children's interests. It also promotes another one of the bill's key goals: improving access to justice. In some Canadian jurisdictions, over three-quarters of family law litigants are self-represented. Also, a list of best interests of the child criteria in the Divorce Act would help parents better understand their legal responsibilities. It would assist them to better frame their negotiations on arrangements for their children and more often come to agreements outside the court system. Alternatively, if parents cannot agree on their own, this clarity would help self-represented litigants to better frame their arguments in legal proceedings.
Allow me now to move to the second point, which is primary consideration. The reference to “primary consideration” is crucial to the values embodied in Bill C-78. Emphasizing primary consideration would ensure that courts prioritize a child's physical, emotional and psychological safety, security and well-being. Courts would weigh all other criteria in regard to this primary consideration. Doing so would ensure that the best interests of the child remain paramount in protecting families from the negative outcomes often related to separation and divorce. 
I will move to the third point, updates to terminology. Bill C-78 would make important and, frankly, long-overdue changes in family law terminology. “Custody” and “access” are now archaic legal terms. 
The term “custody” traces its origins to property law, which for hundreds of years has essentially treated children as possessions. The term “access”, meanwhile, refers to a right to use or pass over property. This is not how we should describe responsibilities for children in 2018. In addition, litigation over “custody” and “access” has created additional labels whereby custodial parents are viewed as winners of parenting disputes and access parents the losers. Bill C-78  would move away from such confrontational language, as Alberta, B.C. and several international jurisdictions have done. 
Going to the issue of modernizing the Divorce Act, Bill C-78  would replace orders for custody and access in the Divorce Act with parenting orders. A parenting order addresses parenting time and decision-making responsibility for each parent. Specifically, “parenting time” refers to the time a child spends in a parent's care. This includes all time when a parent is responsible for a child, even when the child is at school. Each parent would have as much parenting time as is consistent with the best interests of the child. 
On the other hand, “decision-making responsibility” refers to making important decisions on issues such as health, education, language, religion and significant extracurricular activities. BillC-78  would allow the courts to allocate this responsibility to one or both parents, or, alternatively, to divide elements between the parents.
 Furthering the goal of improving access to justice, the bill includes a parenting plan provision, referring to agreements between parents that sets out a road map for the care of the child moving forward. The bill encourages courts to incorporate a parenting plan that is in the child's best interest. This provision recognizes that parents are generally best placed to make decisions about their child. 
Moving to the fifth element, Bill C-78  also proposes a contact order, in keeping with the best practices already established by several provincial courts. Contact orders carve out time in a child's schedule with a person other than a parent, such as a grandparent. I would like to clarify that a contact order would not usually be necessary in order for grandparents and other loved ones to spend time with a child. It would only be necessary where, because of conflict, parents do not agree to let grandparents or other loved ones spend time with the child. In such cases, Bill C-78  would allow courts to make contact orders. These orders could help preserve a child's relationship with his or her loved ones, where appropriate. As with parenting orders, courts would make a contact order if it is in the best interest of the child. 
Finally, the issue of relocation has challenged parents, lawyers, and courts for many years. Relocation involves moving a child after separation and divorce. It is one of the most litigated family law issues in existence. In a 2016 survey of lawyers and judges, for example, over 98% of respondents indicated that disputes are harder to settle when relocation is involved. Bill C-78  creates relocation guidelines to address this conflict. Parents would now be required to give notice if they want to relocate either themselves or their children. An assessment would be conducted using best interest criteria when considering such a request. These would include factors such as the reasons for relocation, the impacts of relocation on the child, and how reasonable the relocation request is.",Liberal,Willowdale,Ali Ehsassi,http://www.parl.gc.ca/Parliamentarians/en/members/ali-ehsassi(234524)
4755199,ca.proc.d.2018-10-04.10288158,2018-10-04,,,,,Government Orders,Justice,,"Mr. Speaker, the hon. member for Willowdale, who happens to be an old high school classmate, gave us a very comprehensive overview of Bill C-78. He touched on many different facets, so I would ask if he could zoom out a bit and provide us with his insight on how the bill fits in with some of the broader initiatives our government is pursuing. There are two I would ask him about.
 We heard about how the bill impacts on child poverty. How does that fit with some of the government's broader objectives of addressing child poverty in Canada? We heard about how the bill would address family violence in a more direct way. How does that work with Bill C-75, which is before the justice committee, which my colleague is a member of, and the provisions that are being put in place in that bill to deal with intimate partner violence in the context of things such as bail conditions? Perhaps he could elaborate on the broader impact of what we are doing as a government. ",,,"Mr. Arif Virani (Parliamentary Secretary to the Minister of Justice and Attorney General of Canada, Lib.)",
4755200,ca.proc.d.2018-10-04.10288173,2018-10-04,002b9ee7-5ecd-4727-96bb-ca4d1e06766d,234524,Mr. Ali Ehsassi,,Government Orders,Justice,,"Mr. Speaker, I am much obliged to the parliamentary secretary for bringing to the fore two significant issues that are very much at the heart of this bill. 
The first issue is on reducing poverty. As was noted, I think this is a huge step in the right direction. First of all, it should be noted that this particular bill simplifies and streamlines processes that relate to family support. Second, it will allow for the release of CRA information which can be critical in these types of disputes. Last, insofar as the issue of poverty is concerned, it is important that we are implementing the 2007 Hague child support convention. 
The second issue the parliamentary secretary has raised is that of family violence. I think we can all agree that we should be very much concerned about the high incidence of violence. This bill does an incredible job of addressing this priority.
Looking at the bill, one of the things to note is that there is a definition for family violence in the Divorce Act, which for the first time would include any conduct that is violent, threatening, a pattern of coercive behaviour or behaviour which causes a family member to fear for his or her safety. In addition, it requires courts to consider family violence in determining the best interests of the children. I would like to highlight the fact that improving safeguards to account for family violence is very much a part of this bill.",Liberal,Willowdale,Ali Ehsassi,http://www.parl.gc.ca/Parliamentarians/en/members/ali-ehsassi(234524)
4755201,ca.proc.d.2018-10-04.10288206,2018-10-04,e849cb7a-82f0-49eb-aea4-573c06169a5d,237017,"Mr. Jim Eglinski (Yellowhead, CPC)",,Government Orders,Justice,,"Mr. Speaker, I do not think there is anybody here in this House who can deny that Bill C-78 is well overdue and is needed.
I listened in depth to the conversation about separation, families relocating, the court sitting down and evaluating a mechanism to look at both sides, and that body deciding if it is appropriate for the parties to move from one location to another.
I was reading through the bill and I am wondering if there is a mechanism of repeal if the court were to say that one party could not move. Is there an appeal mechanism built into this bill that would allow people to appeal that decision?",Conservative,Yellowhead,Jim Eglinski,http://www.parl.gc.ca/Parliamentarians/en/members/jim-eglinski(237017)
4755202,ca.proc.d.2018-10-04.10288232,2018-10-04,002b9ee7-5ecd-4727-96bb-ca4d1e06766d,234524,Mr. Ali Ehsassi,,Government Orders,Justice,,"Mr. Speaker, as the hon. member kindly noted, this is a huge step because this is 20 years overdue. It is great to see that the members are focused on this significant priority.
Insofar as relocation provisions are concerned, I think the emphasis here is to make sure that when a court is considering such a significant issue that it actually consider the best interests of the child. The court considers it and hears from both parties. This is not an issue that is brushed aside. It is something that is at the centre of it. That is precisely why this bill provides guidelines for judges to consider such a significant issue.",Liberal,Willowdale,Ali Ehsassi,http://www.parl.gc.ca/Parliamentarians/en/members/ali-ehsassi(234524)
4755203,ca.proc.d.2018-10-04.10288244,2018-10-04,53eb10e4-f8e7-4ef7-9448-b4a10ec1dba3,216366,"Mrs. Cathay Wagantall (Yorkton—Melville, CPC)",,Government Orders,Justice,,"Mr. Speaker, I will be sharing my time with the member for Banff—Airdrie.
 I am pleased to rise today to speak to Bill C-78. I do not come at this from a legal perspective—I am not a lawyer—and I do not come at it from the perspective of actually having experienced this directly. I was raised in a home with six children, a very happy, very busy home, and then when my parents were much older in life and I was a grown woman myself, they faced a difficult time when they came very close to divorcing. I have to say that even then, as an adult and with my own children, it was extremely unnerving and disturbing to me, which just raises the realization of how important it is that we have systems in place to assist children. I cannot imagine what it would have been like to actually be dealing with those circumstances as a young child in my home. Fortunately, things worked out well.
That being said, in regard to Bill C-78, I appreciate the four key objectives that are listed: to promote the best interests of the child; to address family violence; to help reduce child poverty; and to streamline various definitions and processes but, more important, to require legal professionals to encourage clients to use alternative ways to resolve disputes.
The Conservative Party has always had this perspective that we believe that in the event of a marital breakdown, the Divorce Act should grant joint custody and/or shared parenting, unless it is clearly demonstrated not to be in the best interests of the child. Both parents and all grandparents should be allowed to maintain a meaningful relationship with their children and grandchildren, unless it is demonstrated not to be in the best interests of the child. In every case where it is possible, the influence of both parents, and grandparents as well and siblings, is so key to making sure that the family unit is able to survive as best as it can through these difficult circumstances. We understand very well how traumatic divorces are on families.
We are overall pleased with the intentions of Bill C-78, especially the promotion of child welfare and the measures to combat family violence. We have always stood up for and believed in the safety and well-being of children and of families. 
However, where this goes off the tracks for me is in the fact that the counterintuitive implementation of Bill C-75 is here as well. I know that Canadians' heads are spinning quite often when trying to determine, if this is a whole-of-government approach to things, how it is on the one hand we can be saying we are so concerned about children and then on the other hand be bringing in Bill C-75, which would reduce sentences for very serious crimes, including abduction of a child under the age of 14, participating in activities of a criminal organization, forced marriages, marriage under the age of 16, and concealing the body of a child. These are very serious crimes and impact children, yet the government seems prepared to bring in something that seems so contrary to me.
I want to quote something from the Lawyer's Daily, written by David Frenkel:
 The impetus in the fights between parents does not begin when spouses read the terms “custody” and “access” in the Divorce Act. Therefore, unless there are additional provisions added to the proposed amendments, the family conflicts will likely continue even with the replacement of the terms “custody and access” with “parenting” as introduced by Bill C-78. 
I appreciate what is being attempted there with the terminology being changed, but at the same time that is a good point, that simply changing the terminology will not in the end make a huge difference. Mr. Frenkel continues:
 [A] “parenting order” will replace the traditionally named “custody and access” order. 
That needs to be done, but actually it has already been taking place. He says:
 The significant change in wording likely arose to answer the concerns from the courts over the years that awarding one parent the status of “custody” and the other “access” created unnecessary winners and losers.... [A]s early as 1975 Justice Robert Furlong...wrote as follows: “The time is long past when the Courts disposed of the custody of a child as a reward to a well-behaved parent or as a punishment to one who misbehaved. The custody of their children is not a prize to be contended for by parents as an award for their good behaviour.” 
He continues:
 In 1986, the Manitoba Court of Appeal upheld a decision to refrain from using the words “custody” and “access” because the trial judge thought “those are destructive to a child”. 
He also states that perhaps the more important focus of this discussion should be the issue of “control”, as that, unfortunately, quite often is what the fights are about in these circumstances.
He continues:
 Litigants, in time, will become sophisticated in understanding the effect of a future “parenting order” and couples that previously fought incessantly over the term custody will now fight over who will have “decision-making responsibility.” 
In other words, although that is part of it, how can we come to a point where the extreme difficulties in making these decisions are not fought out in such a confrontational way?
He goes on to say:
 Therapy and assessment orders for litigants will not solve all the problems in custody battles, but they may expose the underlying factors contributing to unreasonable positions taken by them. Therefore, in addition to a change in language to the Divorce Act, it may be necessary for a court to have the jurisdiction to order trained professionals to determine and opine whether a parent's desire for custody or a ”parenting” order is based on healthy motives or not. And if such information cannot be readily available when needed, then simply repealing the terms “custody” and “access” may not achieve the intended consequences we all have been waiting for with Bill C-78's introduction. 
In other words, efforts need to be made to ensure that the individuals who are involved in these circumstances have the necessary tools at their disposal to assist them in the process more effectively. There is no question that this is probably one of the most trying and difficult circumstances to be in for a couple who at one point married because of their desire to see their life as a long-term commitment and to have children. Yes, sometimes there are very violent circumstances. Other times there is an inability to communicate. However, there needs to be a process in place to assist them.
Further to that, I read an article by Robert Harvie, a family lawyer, mediator and arbitrator with Huckvale LLP, an advisory board member for the national self-represented litigants project, and a past Law Society of Alberta bencher. Harvie comes at this from a very well-rounded perspective. He states:
 The unveiling of Bill C-78 received almost uniform praise from the media and legal profession as the “first major amendment of the Divorce Act in 20 years.” 
Indeed, it is.
He continues:
 My opinion is less effusive. Perhaps it's the cynicism of a lawyer who has been working in family law for 32 years. Having sat as a bencher with the Law Society of Alberta, and in fact, chaired their Access to Justice Committee for two years, I have seen much promise and very little delivery in improving access to justice. As a result, I opened up the 190 pages of Bill C-78 with less optimism than many of my colleagues. 
He says it is “similar to the excitement over the maiden voyage of the Titanic”, which piqued my interest. With respect to the Titanic, he talked about all of its amazing additions to improve its amenities and necessities, such as squash racquets courts, baths, a gymnasium, a swimming pool, electric passenger lifts, all these of different services, including more deck chairs, to make the trip better. However, the reality was that they did not have what they truly needed.
He indicates that, at its core, Bill C-78 is devoid of change to the overall resolution process, that lawyers charge too much money, that law societies appear focused on reducing complaints rather than caring for them, that litigation is antiquated and cumbersome, and that we need to fund and support more alternative forms of resolution.
 I have a good friend who settled many divorce and custody cases for his law firm out of court and without expensive litigation. However, he lost his job. Why? It was because he did not have enough billables and was not productive enough for the firm. In other words, he did not make enough money for the firm. He was encouraged to work for legal aid, because that was where he belonged.
Our legal system needs to change so that firms invest in litigating these cases through mediation and arbitration. Yes, we can tell people that they should go and do this, that they should make this choice, but they usually first find themselves at a law firm. I would like to see this concern addressed within the legal profession in Canada, where we make this a priority and prepare our lawyers, who are clearly willing to take on this type of roll to serve Canada, and especially to serve children.",Conservative,Yorkton—Melville,Cathay Wagantall,http://www.parl.gc.ca/Parliamentarians/en/members/cathay-wagantall(216366)
4755204,ca.proc.d.2018-10-04.10288349,2018-10-04,,,,,Government Orders,Justice,,"Mr. Speaker, I confess I find the member's comments quite puzzling. To draw an analogy between this legislation and the Titanic  is preposterous, because we had widespread consultations and have since received vociferous support from coast to coast to coast for this legislation. The Conservative government in Alberta is the very government that initiated the concept of changing the terminology from “custody and access” to “contact and parenting” orders.
The member raised Bill C-75 and some of the provisions in it that she finds logically inconsistent with what we are doing in Bill C-78. It is quite the contrary. In Bill C-75, we are doing exactly the same as we are doing in Bill C-78 in two important respects. One, intimate partner violence is at the heart of what we are doing in Bill C-75. We are addressing it and would make it a prerequisite to deal with that as a condition on bail. What we are doing here is making family violence something that a judge would have to consider, including criminal orders or proceedings, in determining the best interests of the child.
The other conceptual component that is exactly the same between the two pieces of legislation is that in each instance we are trying to reduce the very backlog in our court system that my friend opposite laments, our over-reliance on the court system, the over-litigiousness of Canadian society. We would be reducing that with Bill C-75, and exactly what we would be doing here with this provision. Two cases in point are the ADR mechanisms for calculating support.
Could I have the member opposite's comments on how improving ADR mechanisms addresses the very problem she has identified?",,,"Mr. Arif Virani (Parliamentary Secretary to the Minister of Justice and Attorney General of Canada, Lib.)",
