basepk,hid,speechdate,pid,opid,speakeroldname,speakerposition,maintopic,subtopic,subsubtopic,speechtext,speakerparty,speakerriding,speakername,speakerurl
4755376,ca.proc.d.2018-10-04.10290093,2018-10-04,78cd5419-2f3c-4798-9c5b-0e55843ef9fb,234721,"Mrs. Kelly Block (Carlton Trail—Eagle Creek, CPC)",,Government Orders,Divorce Act,,"Mr. Speaker, I am very pleased to rise today to speak to Bill C-78. The bill would amend three different acts and modernizes divorce proceedings. There is much in the bill that I am very pleased to see, however, as with any bill, there is room for improvement. I hope that my hon. colleagues across the way will be willing to hear and implement helpful suggestions in the same spirit of co-operation that the bill recommends for divorce proceedings.
Before I go any further, I will be sharing my time with my colleague from Edmonton Griesbach.
Much has changed in the legal realm over the past 30 years, including a growing understanding of the impact that our current legal framework for divorce has on children and their parents. That understanding has led courts toward a less adversarial and more co-operative framework for divorce proceedings.
Bill C-78 amends the statute to bring it in line with the prevailing legal thoughts as delineated by our courts. I want to expand on that. Marriage is a societal institution on which our society is built. A key aspect of marriage is the creation of a stable structure in which children can grow and learn. When a marriage dissolves for whatever reason it is important that the welfare of the child be placed in the highest priority. I am pleased to see that Bill C-78 has placed an emphasis on children.
Bill C-78 makes strides toward the recognition of the rights and considerations of children. An example of this change in focus can be found in the adjustments of the language used throughout the process. Bill C-78 does away with the dichotomy of winning custody versus visitation. The current language creates an adversarial situation wherein one parent is defined as the winner of the proceedings, making the other parent the loser of those same proceedings.
Bill C-78 adjusts the focus from a winner-and-loser mentality wherein the child is a prize to be fought for to that of parenting wherein the child is to be protected and cared for. This may seem like an inconsequential change, but the evidence of the past 30 years shows that this is not the case. This is not to say that we can fully understand or predict precisely how these changes will play out in the emotionally fraught experience of a divorce.
Nevertheless, this is a positive step toward the protection of children. While clearly changing terminology is only one step along the path, the change of language denotes an underlying change in the framework of a divorce proceeding.
This is further advanced by the emphasis placed on the use and encouragement of alternative dispute resolution mechanisms to avoid costly and damaging litigation. Litigation over children is costly, hurtful and often very damaging for children. 
 I mentioned before that divorces are emotionally fraught proceedings. Nowhere is this more evidenced than in litigation over children. Often parents, faced with the prospect of losing the adversarial contest delineated in the current statute, resort to litigation.
Rarely is this in the best interests of the child. ln fact, I am sure that many of us can point to examples within our own spheres of friendship and family wherein children have become pawns in the litigation process by parents who unwittingly acted against their own children's best interests. 
Furthermore, as a Conservative, I am uncomfortable with the thought of a court deciding the best interests of a child between two opposed parents. While it may at times be necessary, I believe we can all agree that it ought to be a last resort rather than a first option. I believe it is far better if the parents work together to come to an arrangement that properly addresses the concerns, rights and responsibilities of each parent while protecting the rights and considerations of the child or children.
 For this reason, I applaud Bill C-78 for the move away from exposing children to litigation and instead directing the proceedings to alternative dispute mechanisms. These mechanisms may include counsellors, mediators, mental health experts and parenting experts.
The dispute resolution mechanisms require parents to work together for the good of their children and head off potential adversity by placing the welfare of the child as the goal rather than winning custody of that child. This results in the parents being in a position of working together rather than on opposing sides. However, I also have a concern that Bill C-78 perhaps does not address this to the degree that it could. 
As I mentioned earlier, I appreciate the focus that this act places on alternative dispute resolution mechanisms, as they create a co-operative framework rather than an adversarial one. However, I believe it should be clear to everyone that divorces are often, despite best efforts, adversarial and emotionally charged. One or both parents could and often do choose to proceed directly to litigation in order to win. As positive a step as the revised language in the introduction of the dispute mechanism is, it is not enough to address this issue.
I believe the government considered this issue while drafting Bill C-78, as it put in place the requirement for legal professionals to encourage clients to use the alternative dispute resolution mechanisms. Nevertheless, I would argue that this amounts to slightly more than a “requirement to inform”. While it is sure to make a difference, there will be many cases where one or both parents write off resolution mechanisms immediately without a second thought.
 Would my colleagues on the other side consider the possibility of including arbitration as a clearly defined provision within the dispute resolution options? Having this in place would allow the courts to have more leeway in requiring that the divorcing parties go through a resolution process before resorting to litigation. At the least, I would encourage the justice committee to consider this issue to ensure that the processes put in place would indeed be as effective as intended.
Another concern I have is with the lack of a default position wherein both parents share equal parental responsibility. Critics of this bill point to results of research within the social sciences, which suggests equal shared parenting as the best outcome for children in a divorce proceeding. Of course, this may not always be ideal, which is why it would certainly have to be rebuttable. However, as a default position, it would require disproving in order to be changed. Given what we know from the social sciences, I believe that adding an assumption of equal shared parenting is worth serious consideration at the committee stage of this bill and worthy of some discussion.
 I would like to pause for a moment here to reiterate that my criticisms of this bill, if my concerns can even be called that, come from a place of goodwill.
 As I mentioned earlier in my remarks, and as so many others have stated, this bill is the first major amendment to the Divorce Act in 30 years, and indeed only the second amendment in 50 years. I believe it is very important that we get this right, as it will likely be the divorce framework for many years to come. 
There are many other points that I could address about this bill. Unfortunately, I know that I am out of time. Instead, what I will say is that I am pleased to support this bill through to committee, where I hope it is closely reviewed and ardently debated, and where I hope to see my concerns addressed. ",Conservative,Carlton Trail—Eagle Creek,Kelly Block,http://www.parl.gc.ca/Parliamentarians/en/members/kelly-block(234721)
4755377,ca.proc.d.2018-10-04.10290179,2018-10-04,,,,,Government Orders,Divorce Act,,"Mr. Speaker, I want to add something to the debate and then present a question to the member opposite.
What we know from the statistics is that this bill highlights some of the things that were mentioned by my friend opposite. She highlighted the issue of making court a last resort. One of the reasons why that is important is because court is costly. We know that the entire system is costly. We know that there are defaults on payments and a lot of payments in arrears. There is more than $1 billion worth of payments in arrears. That disproportionately affects women.
What I would ask my friend opposite is this. There are specific measures in this bill that make for an access-to-justice argument about how we can ensure justice for families by ensuring they would not have to go to court. They would no longer have to go to court, as they could pursue an administrative procedure for recalculating an income support payment. Also, there are incentives put in place to ensure that if legal assistance is necessary, those lawyers would need to provide them with ADR alternatives. Are those the types of measures that my friend opposite believes will help address the court backlogs, the court costs and also the costs that are being borne disproportionately by women in the legal system?",,,"Mr. Arif Virani (Parliamentary Secretary to the Minister of Justice and Attorney General of Canada, Lib.)",
4755378,ca.proc.d.2018-10-04.10290193,2018-10-04,78cd5419-2f3c-4798-9c5b-0e55843ef9fb,234721,Mrs. Kelly Block,,Government Orders,Divorce Act,,"Mr. Speaker, as many other colleagues have said already today, I am not a lawyer and I certainly appreciate the work that has been done by the members of the justice committee to date and by the Minister of Justice in presenting the bill. I know that one of the stated intentions of the bill is to help reduce child poverty by providing more tools to establish and enforce child support, so I hope this is a main point of discussion during the committee's debate on the bill.",Conservative,Carlton Trail—Eagle Creek,Kelly Block,http://www.parl.gc.ca/Parliamentarians/en/members/kelly-block(234721)
4755379,ca.proc.d.2018-10-04.10290199,2018-10-04,113d2f8f-bc0d-4db5-86e8-99f31c86216f,234406,"Mr. Martin Shields (Bow River, CPC)",,Government Orders,Divorce Act,,"Mr. Speaker, my colleague has pointed out many positive aspects of the legislation, but she has also suggested that she has some concerns, and she briefly mentioned them. I wonder if my colleague would like to return to that part of her speech on those concerns and expand on them.",Conservative,Bow River,Martin Shields,http://www.parl.gc.ca/Parliamentarians/en/members/martin-shields(234406)
4755380,ca.proc.d.2018-10-04.10290206,2018-10-04,78cd5419-2f3c-4798-9c5b-0e55843ef9fb,234721,Mrs. Kelly Block,,Government Orders,Divorce Act,,"Mr. Speaker, as I said in my remarks, I know there is significant research within the social sciences that suggests that equal shared parenting is the best outcome for children involved in a divorce. I think that we would all agree that parents having equal access to their children would be in their best interest.
 However, I also said that I fully recognized that this may not always be in the best interest of the child or children. That was why I suggested it would have to be rebuttable. This is one of the concerns I raised and I raised it to highlight an issue that I feel the justice committee could look at more closely during its deliberations.",Conservative,Carlton Trail—Eagle Creek,Kelly Block,http://www.parl.gc.ca/Parliamentarians/en/members/kelly-block(234721)
4755381,ca.proc.d.2018-10-04.10290215,2018-10-04,,,,,Government Orders,Divorce Act,,"Further on that point, Mr. Speaker, it is critical to understand that this legislation would be entrenching specific provisions in law for the first time: a definition of family violence that is expansive, that includes the impact it can have on children even in observing family violence. Insofar as it relates to the position being articulated on the opposite side of the House about an equal parenting provision, it is family violence that is so critical in understanding why a best interest of the child analysis should not have an equal parenting presumption.
 In the evidence we have seen, which has informed the development of the bill, what has been resoundingly approved of from members of the bar, stakeholders and parents from coast to coast to coast is that looking at each case in its uniqueness is the critical approach. It can account for family violence in a way that hitherto was not possible. That is why the presumption has changed and moved away from equal parenting.
How does the member opposite reconcile those two? A rebuttal of presumption is not enough. We have to put family violence and the best interest of the children square and frontal in our analysis here. That is what the legislation would do.",,,"Mr. Arif Virani (Parliamentary Secretary to the Minister of Justice and Attorney General of Canada, Lib.)",
4755382,ca.proc.d.2018-10-04.10290231,2018-10-04,78cd5419-2f3c-4798-9c5b-0e55843ef9fb,234721,Mrs. Kelly Block,,Government Orders,Divorce Act,,"Mr. Speaker, I am not here to rebut that. It is simply something I mentioned that I would like to see discussed. If there are those concerns and reasons for why the legislation does not include that, I would certainly hope there would be robust discussion around that. The Conservatives have always stood up for the safety and well-being of children and families. Therefore, I would suggest that a good discussion around the issue should be held when the committee studies it.",Conservative,Carlton Trail—Eagle Creek,Kelly Block,http://www.parl.gc.ca/Parliamentarians/en/members/kelly-block(234721)
4755383,ca.proc.d.2018-10-04.10290237,2018-10-04,02c2cb20-f27d-46a5-8e78-ab4b405bf07b,214864,The Deputy Speaker,,Government Orders,Divorce Act,,"It is my duty pursuant to Standing Order 38 to inform the House that the question to be raised tonight at the time of adjournment is as follows: the hon. member for Bow River, The Environment.
Resuming debate, the hon. member for Edmonton Griesbach.",Conservative,Simcoe North,Bruce Stanton,http://www.parl.gc.ca/Parliamentarians/en/members/bruce-stanton(214864)
4755384,ca.proc.d.2018-10-04.10290241,2018-10-04,c4b4aef5-eca1-416d-b2b0-ad4a1a2b5fc9,218055,"Mr. Kerry Diotte (Edmonton Griesbach, CPC)",,Government Orders,Divorce Act,,"Mr. Speaker, we all know that divorce is a very terrible thing. It can be a traumatic experience for families, children and parents. However, when it does occur, it really is imperative that the best interests of children should be at the heart of any divorce proceeding they may be caught up in.
According to the 2016 census, more than two million Canadian children are now living in separated or divorced families and 38% of the five million separations and divorces in Canada between 1991 and 2011 involved a child. Therefore, divorce has, sadly, become a regular part of the lives of everyday Canadians. With this legislation, we really have a duty to try to minimize the trauma of divorce as much as possible, especially on children.
Overall, the intention of Bill C-78 is good. I am especially glad to hear the legislation will be centred on the child. Too often, children become pawns in bitter divorces. We have all heard those heart-wrenching horror stories.
 A woman near and dear to my heart has been going through a living hell, battling to get what is best for her daughter for years after her divorce. Under shared custody, the daughter was succeeding in school and attending regularly, especially when she was at her mother's home. However, at subsequent family court appearances, the daughter's dad managed to convince the family court it would be in the best interest to have the daughter spend all of her time at his residence. After that happened, the teenage daughter's marks plummeted. She missed a ridiculous amount of school and got into trouble with police. It is a very sad story.
Despite fighting tirelessly in family court, this woman's daughter is now hopelessly alienated because one parent wanted to punish the other. This child was used as a weapon and essentially brainwashed by one parent to punish the other parent. This daughter will now no longer speak to her mother, her grandmother, her aunts, uncles or young nieces and nephews, who absolutely adore her.
 Alienation is one of the most terrible things that can be inflicted upon a child. It is something that can literally ruin a person's life and could take years of psychological help to overcome.
Part of the problem I have witnessed in family court is people who appear there do not even testify under oath. Remarkably, there is no requirement to actually tell the truth. Therefore, how can a judge truly make a correct decision in the best interests of the child if there is little or no ability to compel people to tell the truth? It is really quite ludicrous and it is no wonder that some people criticize family courts as kangaroo courts.
That is also why subsection 16(10) of the act is an important first step and states the principle that children should have as much contact with each parent within the confines of their best interest. It also takes into account the willingness of the parent to facilitate visitation as a consideration in custody disputes. It is a move that will penalize parents who, for petty reasons, try to limit visitation and access of the child or children to the other parent. It is a positive first step to ensure that even in acrimonious divorces, the best interests of the child are always first and foremost, and that is as it should be.
Promoting the use of alternative dispute resolutions, such as divorce mediation, to settle divorce cases is also an encouraging move. It should help make divorce proceedings as amicable as possible in very bitter situations at times.
 Being caught up in the middle of an acrimonious divorce is never in the best interests of children. Therefore, taking steps to create a valuable alternative to litigation in family court is a sensible idea. It obviously would not solve the worst of cases, like the case I mentioned, but it is a start. If done correctly, it could have a meaningful impact for millions of Canadians.
 Ultimately, Canadian children are best served when the custody and divorce proceedings are as harmonious as possible, with both parents having a meaningful relationship with their children. 
A third important part of the legislation is the introduction of measures on combatting domestic violence and child abuse. That is a laudable goal. Having dispute mechanisms and courts taking into consideration domestic violence and child abuse is imperative, considering the move to a more dual parenting framework.
As I stated before, it is always in the best interests of the child to have both of their parents having meaningful relationships. That, however, is definitely not the case in situations where one of the parents is violent, neglectful or abusive. I see the government is committed to creating 39 new judicial positions in Alberta, Ontario, Nova Scotia and Newfoundland and Labrador. That is another positive step, especially considering the extraordinarily slow pace the current government has taken in appointing badly needed new justices and judges. Let us certainly hope they appoint them a lot faster than they have been filling other judicial vacancies.
Unfortunately, my colleagues across the aisle's support of the best interests of children rings somewhat hollow. Let us talk about another case from the headlines about which everybody is talking.
 It is the case of Terri-Lynn McClintic, a convicted child murderer who is now living at a healing lodge. Canadians are saying, loudly and clearly, that she should be back behind bars. The Liberals are refusing to act on that, saying that the Conservatives are ambulance chasers, that we are just creating this whole controversy and that it is very low of us. However, all we are doing is reflecting on what the father wants. He has spoken about it very clearly on CBC and other media.
 For instance, I just am not sure how it can be said that promoting the best interests of the child is best served. She was murdered. The Liberals talk about promoting the best interests of the child in this legislation, yet her murderer is not even behind bars. She is in a healing lodge. Would Tori's best interests not be ensured by her murderer being held behind bars?
I also do not see how having a child murderer at a healing lodge is in the best interests of the children who are often present there, yet this is the position the members across the way supported in votes. It is really enraging Canadians. One day there is what seems to be a flippant disregard for what is Tori Stafford's best interests and the best interests of children at that healing lodge. Then on the next day we hear the Liberals' talking points about this bill and how much they care about children. It is rather shameful, to be honest.
This is also the case with Bill C-75, the government's new crime bill. Again, l am not sure how many parts of that bill mesh with the priority of the best interests of the child, which my colleagues across the aisle seem to believe today. How is giving a mere fine in the best interests of children who are forced into marriage, or marriage under the age of 16 or the abduction of a child under the age of 16? How does that act in the best interests of the child? I fail to see that. 
How do any of these reforms put the interests of the child first? Very simply put, I do not believe they do and that it is not the government's position. If the minister would like to truly put children first, as she should, I recommend she do so in a consistent manner and go forward from there.",Conservative,Edmonton Griesbach,Kerry Diotte,http://www.parl.gc.ca/Parliamentarians/en/members/kerry-diotte(218055)
4755385,ca.proc.d.2018-10-04.10290370,2018-10-04,,,,,Government Orders,Divorce Act,,"Mr. Speaker, I want to ask a question that relates to the member's statement, if I heard it correctly, that family courts resemble kangaroo courts. It prompted me to think about the problems we have with overly litigious family law matters, that people are prompted to get to court far too quickly and far too often and it has acrimonious consequences, including the ones on children outlined by my friend.
What we have here is a goal which is twofold. One part of it is to reduce the necessity of going to court. We have established that in law by making provisions such that one could have an income support calculation or recalculation out of court. In fact, lawyers would be required under this new law to encourage people not to go to court. When the case would get to court, the court would need to facilitate the parties' needs and be a one-stop shop. This brings us to unified family court.
My friend did mention this in the latter part of his speech, saying that he is in approval of that provision because there used to be confusion between the provincial and federal jurisdictions. People were forced to go to not just one court but two. We would be changing that by creating unified family courts, including in the province my friend opposite represents. It is a step in the right direction, and I believe he said that he agrees with that. These are all laudable goals.
Does keeping people out of court, through the measures I have just outlined about income calculation and recalculation that would be entrenched in this bill, conform with keeping the best interests of the child at heart? ",,,"Mr. Arif Virani (Parliamentary Secretary to the Minister of Justice and Attorney General of Canada, Lib.)",
4755386,ca.proc.d.2018-10-04.10290392,2018-10-04,c4b4aef5-eca1-416d-b2b0-ad4a1a2b5fc9,218055,Mr. Kerry Diotte,,Government Orders,Divorce Act,,"Mr. Speaker, as I have said about the bill, it is largely laudable. The unified court is a good thing. 
Again, we have to hold the interests of the child at heart. That is the best part of the bill. Divorces can absolutely ruin children for life. I think we are on the right track, but we should also be consistent. If we are looking out for the interests of the child, let us look out for the interests of the child not just in this bill but also in Bill C-75.",Conservative,Edmonton Griesbach,Kerry Diotte,http://www.parl.gc.ca/Parliamentarians/en/members/kerry-diotte(218055)
4755387,ca.proc.d.2018-10-04.10290398,2018-10-04,ff7a7f13-0558-4282-8cfc-9bfdfcbf6a1a,216774,"Mr. Michael Cooper (St. Albert—Edmonton, CPC)",,Government Orders,Divorce Act,,"Mr. Speaker, I appreciate my colleague's comments regarding Bill C-75. 
in the course of the member's speech, he talked about the fact that in most circumstances it is in the best interests of the child to have both parents involved in the child's development and for there to be ongoing contact and support with both parents. One of the criticisms some have put forward with respect to Bill C-78 is it would not provide for a presumption of shared parenting. As the hon. member for Carlton Trail—Eagle Creek noted, sometimes shared parenting is not in the interests of the child. Would the member agree that perhaps one flaw of the bill is that it does not contain a provision for a rebuttable presumption for shared parenting?",Conservative,St. Albert—Edmonton,Michael Cooper,http://www.parl.gc.ca/Parliamentarians/en/members/michael-cooper(216774)
