basepk,hid,speechdate,pid,opid,speakeroldname,speakerposition,maintopic,subtopic,subsubtopic,speechtext,speakerparty,speakerriding,speakername,speakerurl
4754407,ca.proc.d.2018-10-01.10274627,2018-10-01,c80fcb28-a347-4594-9e11-63ac3c37e428,214017,"Mr. Simon Marcil (Mirabel, BQ)",,Oral Questions,International Trade,,"Mr. Speaker, a year ago almost to the day the House unanimously called on the government to ensure that there would be no breaches in supply management if a new NAFTA deal were reached.
Instead of telling the Americans that Parliament had agreed no concessions would be made, the government gave up its negotiating power, contradicted the House, reneged on its word and completely caved. 
Knowing that Donald Trump's threats were nothing but hot air because Congress did not support tearing up NAFTA, why did the government once again sacrifice Quebec?",Bloc Québécois,Mirabel,Simon Marcil,http://www.parl.gc.ca/Parliamentarians/en/members/simon-marcil(214017)
4754408,ca.proc.d.2018-10-01.10274630,2018-10-01,3dd9162a-4763-4000-8c8a-706a788f7e50,229209,"Hon. Chrystia Freeland (Minister of Foreign Affairs, Lib.)",,Oral Questions,International Trade,,"Mr. Speaker, we fully support our dairy producers, their families and their communities. It was a Liberal government that created the supply management system and it is a Liberal government that is preserving it.
This agreement will provide access to markets, but the most important thing is that the future of supply management is not in question.",Liberal,University—Rosedale,Chrystia Freeland,http://www.parl.gc.ca/Parliamentarians/en/members/chrystia-freeland(229209)
4754409,ca.proc.d.2018-10-01.10274632,2018-10-01,f45e86b7-f192-4692-9889-6b57283fc3b0,224178,"Mr. Gabriel Ste-Marie (Joliette, BQ)",,Oral Questions,International Trade,,"Mr. Speaker, that is not the case for diafiltered milk. 
In both the agreement with Europe and the TPP, Quebec's farmers were sacrificed to make gains for Canada. When Donald Trump withdrew from the TPP, the government did not renegotiate anything. It left the same breach in supply management. It told everyone not to worry about it and that the Americans would have to re-enter the TPP to have access to the concessions. The truth of the matter is that Quebec is paying three times: once for Europe, once for the TPP and once for NAFTA. After three strikes, we are out.
What good are the 40 Liberal MPs from Quebec when all they do is trample on Quebec's interests?",Bloc Québécois,Joliette,Gabriel Ste-Marie,http://www.parl.gc.ca/Parliamentarians/en/members/gabriel-ste-marie(224178)
4754410,ca.proc.d.2018-10-01.10274636,2018-10-01,3dd9162a-4763-4000-8c8a-706a788f7e50,229209,"Hon. Chrystia Freeland (Minister of Foreign Affairs, Lib.)",,Oral Questions,International Trade,,"Mr. Speaker, our government worked very hard to defend Canadians' interests. Our government defended our supply management system from the U.S. government's determined attempts to dismantle it. We were able to preserve, protect and defend our supply management system throughout the CETA, TPP and NAFTA negotiations. ",Liberal,University—Rosedale,Chrystia Freeland,http://www.parl.gc.ca/Parliamentarians/en/members/chrystia-freeland(229209)
4754411,ca.proc.d.2018-10-01.10274640,2018-10-01,07cf5767-802c-406c-92a7-7dc92af79b40,229526,"Mr. Kevin Lamoureux (Parliamentary Secretary to the Leader of the Government in the House of Commons, Lib.)",,Oral Questions,Points of Order,Decorum,"Mr. Speaker, I am sure all members of the House are aware that while the House is in session, they are not allowed to take pictures. I note that there has been at least one member of the New Democratic Party who has done so. I believe it has been posted. I just wanted to raise it as a point of order, and perhaps that individual would take down the picture if it is on social media.
Also, Mr. Speaker, perhaps you could just remind members that while we are in session, they are not supposed to be taking pictures with their smart phones. ",Liberal,Winnipeg North,Kevin Lamoureux,http://www.parl.gc.ca/Parliamentarians/en/members/kevin-lamoureux(229526)
4754412,ca.proc.d.2018-10-01.10274641,2018-10-01,3176068f-62ee-4b2f-aacd-1131201c6db1,214707,The Speaker,,Oral Questions,Points of Order,Decorum,"I thank the hon. member for raising the point. Members should be aware that they are not allowed to take photographs in the House while it is in session. Certainly I would look very dimly on such activity, so I would encourage them to remove any such photographs. 
Does the hon. member for Longueuil—Saint-Hubert wish to respond to this point of order?",Liberal,Halifax West,Geoff Regan,http://www.parl.gc.ca/Parliamentarians/en/members/geoff-regan(214707)
4754413,ca.proc.d.2018-10-01.10274642,2018-10-01,6da8653f-692f-4bbc-acb2-86e088f0d60d,219035,Mr. Pierre Nantel,,Oral Questions,Points of Order,Decorum,"Mr. Speaker, I will take down the picture, but I have no regrets about drawing attention to the fact that dairy farmers in Quebec— ",New Democratic Party,Longueuil—Saint-Hubert,Pierre Nantel,http://www.parl.gc.ca/Parliamentarians/en/members/pierre-nantel(219035)
4754414,ca.proc.d.2018-10-01.10274643,2018-10-01,3176068f-62ee-4b2f-aacd-1131201c6db1,214707,The Speaker,,Oral Questions,Points of Order,Decorum,"Order. Apparently, the hon. member does not want to obey the rules of the House of Commons. He should think about that and consider apologizing to me personally.
The hon. member for Montcalm on a point of order.",Liberal,Halifax West,Geoff Regan,http://www.parl.gc.ca/Parliamentarians/en/members/geoff-regan(214707)
4754415,ca.proc.d.2018-10-01.10274644,2018-10-01,530dc476-c9bf-477c-83e7-6efc545f2bf8,224177,Mr. Luc Thériault,,Oral Questions,Points of Order,Decorum,"Mr. Speaker, I rise on a question of privilege. On September 26, 2017, the House unanimously adopted the following motion: 
 That the House reiterate its desire to fully preserve supply management during the NAFTA renegotiations. 
Everyone knows that, yesterday, the government concluded a new agreement with the United States. By so doing, the government dismissed out of hand the unanimous will—",Bloc Québécois,Montcalm,Luc Thériault,http://www.parl.gc.ca/Parliamentarians/en/members/luc-theriault(224177)
4754416,ca.proc.d.2018-10-01.10274645,2018-10-01,3176068f-62ee-4b2f-aacd-1131201c6db1,214707,The Speaker,,Oral Questions,Points of Order,Decorum,"Order. I must remind the hon. member for Montcalm that, according to the Standing Orders and practices of the House, prior notice of at least one hour must be given to raise a question of privilege. Since I have still not received any such notice, we must move on to other things for the time being. The hon. member will have the opportunity to raise his question of privilege later if he provides notice.
The hon. member for Montcalm on another point of order.",Liberal,Halifax West,Geoff Regan,http://www.parl.gc.ca/Parliamentarians/en/members/geoff-regan(214707)
4754417,ca.proc.d.2018-10-01.10274650,2018-10-01,530dc476-c9bf-477c-83e7-6efc545f2bf8,224177,Mr. Luc Thériault,,Oral Questions,Points of Order,Decorum,"Mr. Speaker, a question of privilege must be raised as soon as the breach occurs. I could not inform you a day or an hour in advance because I did not hear the government confirm what was reported in the media. Then I had to wait until question period to have the opportunity to rise today. It was therefore impossible to give an hour's notice. You are the guardian of parliamentarians' speaking time, and independent members get very little of that. It seems to me that you could at least wait until the end of my remarks, which are not even a minute long.",Bloc Québécois,Montcalm,Luc Thériault,http://www.parl.gc.ca/Parliamentarians/en/members/luc-theriault(224177)
4754418,ca.proc.d.2018-10-01.10274654,2018-10-01,3176068f-62ee-4b2f-aacd-1131201c6db1,214707,The Speaker,,Oral Questions,Points of Order,Decorum,"The hon. member has not given me any indication that it was something that occurred during question period. Perhaps it has to do with issues addressed during question period, but not something that occurred during that time. I understand that the matter is urgent to the member, but the rules and practices of the House require prior notice of at least one hour. I therefore maintain the same position.",Liberal,Halifax West,Geoff Regan,http://www.parl.gc.ca/Parliamentarians/en/members/geoff-regan(214707)
4754419,ca.proc.d.2018-10-01.10274655,2018-10-01,030c04f1-a5d5-4ba8-b5f2-cd412d43e4bf,220120,"Ms. Julie Dabrusin (Toronto—Danforth, Lib.)",,Routine Proceedings,Committees of the House,Canadian Heritage,"Mr. Speaker, I have the honour to present, in both official languages, the 13th report of the Standing Committee on Canadian Heritage, entitled “A Vision for Cultural Hubs and Districts in Canada”. This is an important step moving forward in building our cultural communities and cultural industries across our country.",Liberal,Toronto—Danforth,Julie Dabrusin,http://www.parl.gc.ca/Parliamentarians/en/members/julie-dabrusin(220120)
4754420,ca.proc.d.2018-10-01.10274658,2018-10-01,eb53bf99-e3d5-44b9-a15e-6c295470cdd4,216052,"Hon. Kevin Sorenson (Battle River—Crowfoot, CPC)",,Routine Proceedings,Committees of the House,Public Accounts,"Mr. Speaker, I have the honour to present, in both official languages, the 50th report of the Standing Committee on Public Accounts, entitled “Report 7, Consular Services to Canadians Abroad—Global Affairs Canada, of the 2018 Spring Reports of the Auditor General of Canada”. 
Pursuant to Standing Order 109 the committee requests that the government table a comprehensive response to the report. ",Conservative,Battle River—Crowfoot,Kevin Sorenson,http://www.parl.gc.ca/Parliamentarians/en/members/kevin-sorenson(216052)
4754421,ca.proc.d.2018-10-01.10274660,2018-10-01,eaa6694f-1e20-4aae-ad3b-e694b0e12c59,224170,"Ms. Elizabeth May (Saanich—Gulf Islands, GP)",,Routine Proceedings,Petitions,Human Rights,"Mr. Speaker, it is my honour to present a petition on the subject of human rights.
Human rights are routinely violated in the People's Republic of China, particularly of those who practise Falun Gong. These petitioners ask for the government to act and condemn the illegal arrest of a Canadian citizen, Sun Qian, for her practice of Falun Gong and call for her immediate release. She was illegally kidnapped in the People's Republic of China in February 2017. ",Green Party,Saanich—Gulf Islands,Elizabeth May,http://www.parl.gc.ca/Parliamentarians/en/members/elizabeth-may(224170)
4754422,ca.proc.d.2018-10-01.10274664,2018-10-01,8826a32c-2e29-49be-b6e2-c1f10363639b,218836,"Ms. Irene Mathyssen (London—Fanshawe, NDP)",,Routine Proceedings,Petitions,Canada Post,"Mr. Speaker, I have two petitions today. The first is a petition in support of postal banking because nearly two million Canadian desperately need an alternative to payday lenders because of the crippling lending rates that affect poor, marginalized, rural and indigenous communities. We have 3,800 Canada Post outlets already in existence in these rural areas, where there are few or no banks and credit unions. Moreover, Canada Post has infrastructure that could make a rapid transition to include postal banking.
The petitioners call upon the Government of Canada to enact my motion, Motion No. 166, to create a committee to study and propose a plan for postal banking under the Canada Post Corporation.",New Democratic Party,London—Fanshawe,Irene Mathyssen,http://www.parl.gc.ca/Parliamentarians/en/members/irene-mathyssen(218836)
4754423,ca.proc.d.2018-10-01.10274766,2018-10-01,8826a32c-2e29-49be-b6e2-c1f10363639b,218836,"Ms. Irene Mathyssen (London—Fanshawe, NDP)",,Routine Proceedings,Petitions,Housing,"Mr. Speaker, my second petition is in regard to the affordability crisis Canadians are facing with housing and other costs in their daily lives. First and foremost, Canadians are indeed struggling with unaffordable housing, child care, precarious and unreliable work, and shrinking opportunities, particularly among our young. Household debt is at a terrible high and costs keep rising. Instead of helping people, the Liberal government has continued to invest in the wealthy and well-connected.
The petitioners call on the Government of Canada to invest in affordable housing now, not at some distant time, and to take concrete measures to address out-of-control housing markets, protect good-paying jobs and take actions that will support and benefit those who are struggling.",New Democratic Party,London—Fanshawe,Irene Mathyssen,http://www.parl.gc.ca/Parliamentarians/en/members/irene-mathyssen(218836)
4754424,ca.proc.d.2018-10-01.10274666,2018-10-01,04c68597-7211-414e-b0f0-da12d212bd3f,234530,"Mrs. Eva Nassif (Vimy, Lib.)",,Routine Proceedings,Petitions,Language Professions,"Mr. Speaker, I have the honour to present petition e-1540, initiated by Vladyslav Pashynskyy on behalf of members of the community of language professionals, students, colleagues and allies working in various fields.
 They are seeking the government's help to improve working conditions for language professionals. This would be achieved through the creation of internships and jobs and by promoting respect for the profession from clients and employers. 
This petition was launched in February 2018 and has more than 500 signatures.",Liberal,Vimy,Eva Nassif,http://www.parl.gc.ca/Parliamentarians/en/members/eva-nassif(234530)
4754425,ca.proc.d.2018-10-01.10274668,2018-10-01,363e30d6-e47b-4c39-91ad-667deb63009c,217115,"Ms. Sheila Malcolmson (Nanaimo—Ladysmith, NDP)",,Routine Proceedings,Petitions,The Environment,"Mr. Speaker, because bulk commercial anchorages anchored endlessly in the southern Salish Sea are risking oil spills, creating noise and light pollution, risking migratory bird species and herring spawn by dragging anchor, petitioners from across the region from Whistler, Pemberton, Vancouver, Qualicum, Ladysmith, Nanaimo and Gabriola urge the House not to establish new bulk commercial anchorages. These messages were reinforced at a round table I hosted with the MP for Cowichan—Malahat—Langford on Friday. Many many coastal communities are urging the House to take action.",New Democratic Party,Nanaimo—Ladysmith,Sheila Malcolmson,http://www.parl.gc.ca/Parliamentarians/en/members/sheila-malcolmson(217115)
4754426,ca.proc.d.2018-10-01.10274670,2018-10-01,e7d4b944-1d3e-4f87-a7df-cdbd4fe7ca2b,237062,"Mr. Gord Johns (Courtenay—Alberni, NDP)",,Routine Proceedings,Petitions,The Environment,"Mr. Speaker, I am honoured to table a petition on behalf of Vancouver Islanders from Nanoose Bay, Parksville, Qualicum Beach and Coombs, who are seeing more and more plastic washing upon our shores and infecting the very marine species we rely on for our food security and to sustain ourselves. 
I am honoured to table this petition. Petitioners are calling on the government to create regulations aimed at reducing plastic debris discharge, industrial use of microplastics; permanent, dedicated and annual funding for the cleanup of derelict fishing gear; community-led projects to clean up plastics and marine debris on our shores to mitigate the impact this plastic is having on our ecosystem; education and outreach campaigns on the root causes and negative environmental effects of plastic pollution; and most of all, to redesign the plastic economy. They are calling on the Government of Canada to adopt my motion, Motion No. M-151, to establish a national strategy to combat plastic pollution from entering our waterways.",New Democratic Party,Courtenay—Alberni,Gord Johns,http://www.parl.gc.ca/Parliamentarians/en/members/gord-johns(237062)
4754427,ca.proc.d.2018-10-01.10274672,2018-10-01,07cf5767-802c-406c-92a7-7dc92af79b40,229526,"Mr. Kevin Lamoureux (Parliamentary Secretary to the Leader of the Government in the House of Commons, Lib.)",,Routine Proceedings,Questions on the Order Paper,,"Mr. Speaker, I ask that all questions be allowed to stand at this time. ",Liberal,Winnipeg North,Kevin Lamoureux,http://www.parl.gc.ca/Parliamentarians/en/members/kevin-lamoureux(229526)
4754428,ca.proc.d.2018-10-01.10274674,2018-10-01,3176068f-62ee-4b2f-aacd-1131201c6db1,214707,The Speaker,,Routine Proceedings,Questions on the Order Paper,,Is that agreed? ,Liberal,Halifax West,Geoff Regan,http://www.parl.gc.ca/Parliamentarians/en/members/geoff-regan(214707)
4754429,ca.proc.d.2018-10-01.p5543246,2018-10-01,,,,intervention,Routine Proceedings,Questions on the Order Paper,, Agreed.,,,Some hon. members,
4754430,ca.proc.d.2018-10-01.p5543247,2018-10-01,,,,stagedirection,Government Orders,National Defence Act,,"The House resumed consideration of the motion that Bill C-77, an act to amend the National Defence Act and to make related and consequential amendments to other Acts, be read the second time and referred to a committee.",,,,
4754431,ca.proc.d.2018-10-01.10274678,2018-10-01,3176068f-62ee-4b2f-aacd-1131201c6db1,214707,The Speaker,,Government Orders,National Defence Act,,The hon. member for Barrie—Innisfil has 13 minutes remaining.,Liberal,Halifax West,Geoff Regan,http://www.parl.gc.ca/Parliamentarians/en/members/geoff-regan(214707)
4754432,ca.proc.d.2018-10-01.10274679,2018-10-01,61c83e21-f9a3-4e4b-b881-4b2d1ce33c43,234471,"Mr. John Brassard (Barrie—Innisfil, CPC)",,Government Orders,National Defence Act,,"Mr. Speaker, I would like to make a correction. Just before question period I referred to the situation in Truro, Nova Scotia. I referred to Constable Campbell as “Christine” and not “Catherine”. It is easy to get confused, as a good friend of mine—",Conservative,Barrie—Innisfil,John Brassard,http://www.parl.gc.ca/Parliamentarians/en/members/john-brassard(234471)
4754433,ca.proc.d.2018-10-01.10274680,2018-10-01,02c2cb20-f27d-46a5-8e78-ab4b405bf07b,214864,The Deputy Speaker,,Government Orders,National Defence Act,,"I think the interpretation is not working. We will wait until the audio interpretation is working on both channels. 
The hon. member for Barrie—Innisfil.",Conservative,Simcoe North,Bruce Stanton,http://www.parl.gc.ca/Parliamentarians/en/members/bruce-stanton(214864)
