basepk,hid,speechdate,pid,opid,speakeroldname,speakerposition,maintopic,subtopic,subsubtopic,speechtext,speakerparty,speakerriding,speakername,speakerurl
4755132,ca.proc.d.2018-10-04.10287145,2018-10-04,9d3d2220-818c-494e-8d58-29f7cee7b65d,216537,"Hon. Candice Bergen (Portage—Lisgar, CPC)",,,Points of Order,Alleged Comments of the Prime Minister," Mr. Speaker, I am rising on a point of order. I have two very brief points to make regarding the use of language by the Prime Minister yesterday in the House following question period.
First, I want to add to the point of order regarding the statement by the Prime Minister when he referred to the member for Milton as an ambulance chaser, which is described in the Canadian Oxford Dictionary as a derogatory term meaning, “a person who strives to profit from the misfortune of others”. Page 619 of Bosc and Gagnon reads:
 Remarks which question a Member's integrity, honesty or character are not in order. A Member will be requested to withdraw offensive remarks, allegations, or accusations of impropriety directed towards another Member. 
The Prime Minister's statement of yesterday clearly breaches the rules of order and decorum. I trust that you will request he withdraw those offensive remarks as soon as possible.
It would appear that the member for Milton was not the Prime Minister's only target yesterday. My second point will address the rules regarding reflections on the chair. Pages 620 and 621 of Bosc and Gagnon state:
 It is unacceptable to question the integrity and impartiality of a Presiding Officer and, if such comments are made, the Speaker may interrupt the Member and request that the remarks be withdrawn or immediately give the floor to another Member. Only by means of a substantive motion, for which 48 hours' written notice has been given, may the actions of the Chair be challenged, criticized and debated. Reflections on the character or actions of the Speaker or other Presiding Officers have been ruled to be breaches of privilege. 
As you know, I raised a point of order regarding a question by my deputy House leader. In response to the Prime Minister's behaviour toward you, the member for Grande Prairie—Mackenzie asked the Prime Minister, “Are you in charge of the Speaker?” The Prime Minister replied, “Yes, I am,” suggesting that you are not impartial.
Now, a number of members witnessed that. According to our practices, this is clearly unacceptable, and the Prime Minister is obligated to withdraw those remarks. If the Prime Minister refuses to withdraw those remarks, I reserve the right to return to the House with a question of privilege.
I expect the Prime Minister to have a bit more respect for this House, its members and for you, Mr. Speaker. The Prime Minister must take responsibility for his actions and return to the House as soon as possible to withdraw the insults to the member for Milton and his slur against the integrity of you, the Speaker.
This is not the first time the Prime Minister has shown such disrespect for this institution and those who serve it. I do not have time to necessarily read into the record his complete list, but you will recall when the Prime Minister once called the member for Thornhill a piece of s-h-i-t. That was the word, Mr. Speaker. He then had to apologize. 
His contemptuous attitude was also on display when he lost his temper on the floor of the House, ending in another member being injured. Again, he had to stand and apologize for that.
The Prime Minister is insulting members, and again, he is doing this and bringing into question the impartiality of the chair. It is an important matter, and I look forward to your ruling.",Conservative,Portage—Lisgar,Candice Bergen,http://www.parl.gc.ca/Parliamentarians/en/members/candice-hoeppner(216537)
4755133,ca.proc.d.2018-10-04.10286803,2018-10-04,3176068f-62ee-4b2f-aacd-1131201c6db1,214707,The Speaker,,,Points of Order,Alleged Comments of the Prime Minister,"I thank the hon. opposition House leader for adding her arguments on this subject. I will be coming back to the House in relation to the first matter, to begin with.
As well, I should say that I did not hear the exchange that is spoken of. Obviously, we will have to take this under consideration as well and review the record, including the audio, to see if we can find any indication of this.
The hon. member for Grande Prairie—Mackenzie is rising on the same point of order.",Liberal,Halifax West,Geoff Regan,http://www.parl.gc.ca/Parliamentarians/en/members/geoff-regan(214707)
4755134,ca.proc.d.2018-10-04.10286813,2018-10-04,ebbfc235-08c5-44f8-8c22-a60c671db398,218374,"Mr. Chris Warkentin (Grande Prairie—Mackenzie, CPC)",,,Points of Order,Alleged Comments of the Prime Minister,"Mr. Speaker, yesterday, the words of the Prime Minister called into question the independence of your office. I assure you there are over a dozen members of the Conservative caucus who can testify to the exact words the Prime Minister spoke. They are exactly as our House leader has indicated. We would be happy to meet with you and give testimony to the fact that the Prime Minister uttered those exact words.
This is a grave concern to our caucus. It should be a grave concern to every member of Parliament to understand that we have a Prime Minister, who sits in the highest office in this country, indicating that he controls what absolutely must be an independent office. 
If in fact the words that were spoken by the Prime Minister are true, then every Canadian would have concern about the institution we sit in.
It is your responsibility, and we leave it to you, to defend the integrity of your office. The Prime Minister has attacked that independence and that integrity and suggested probably the most unbelievable thing one could suggest about the Speaker and the role you play. 
We believe this is a grave concern. We would ask that you review all of what has been said and come back with a ruling. We seek your guidance, but we will respond accordingly. ",Conservative,Grande Prairie—Mackenzie,Chris Warkentin,http://www.parl.gc.ca/Parliamentarians/en/members/chris-warkentin(218374)
4755135,ca.proc.d.2018-10-04.10286836,2018-10-04,3176068f-62ee-4b2f-aacd-1131201c6db1,214707,The Speaker,,,Points of Order,Alleged Comments of the Prime Minister,"I thank the hon. member for Grande Prairie—Mackenzie. I will review the arguments and the recordings and come back to the House in due course.
The hon. member for Barrie—Innisfil.",Liberal,Halifax West,Geoff Regan,http://www.parl.gc.ca/Parliamentarians/en/members/geoff-regan(214707)
4755136,ca.proc.d.2018-10-04.10286840,2018-10-04,61c83e21-f9a3-4e4b-b881-4b2d1ce33c43,234471,"Mr. John Brassard (Barrie—Innisfil, CPC)",,,Points of Order,Alleged Comments of the Prime Minister,"On the same point of order, Mr. Speaker, as the member for Grande Prairie—Mackenzie stated, I and probably, I would say, upward of a dozen members of our caucus heard exactly what the Prime Minister said.
 I will go one step further: When the member for Grande Prairie—Mackenzie asked the Prime Minister, “Are you telling us that you control the Speaker?”, the Prime Minister's response to that, as I think you might hear if you check the record, was, “As a matter of fact, I do.” Those were the words of the Prime Minister.
I will be glad to meet with you, Mr. Speaker, and with other members of our caucus to discuss this further.",Conservative,Barrie—Innisfil,John Brassard,http://www.parl.gc.ca/Parliamentarians/en/members/john-brassard(234471)
4755137,ca.proc.d.2018-10-04.10286854,2018-10-04,3176068f-62ee-4b2f-aacd-1131201c6db1,214707,The Speaker,,,Points of Order,Alleged Comments of the Prime Minister,I thank the hon. member for Barrie—Innisfil for adding his further comments on this matter.,Liberal,Halifax West,Geoff Regan,http://www.parl.gc.ca/Parliamentarians/en/members/geoff-regan(214707)
4755138,ca.proc.d.2018-10-04.10287307,2018-10-04,3176068f-62ee-4b2f-aacd-1131201c6db1,214707,The Speaker,,Routine Proceedings,Information Commissioner,,"I have the honour to lay upon the table the 2017-18 annual reports of the Information Commissioner of Canada concerning the Access to Information Act and the Privacy Act. Pursuant to Standing Order 108(3)(h), these reports are deemed permanently referred to the Standing Committee on Access to Information, Privacy and Ethics.",Liberal,Halifax West,Geoff Regan,http://www.parl.gc.ca/Parliamentarians/en/members/geoff-regan(214707)
4755139,ca.proc.d.2018-10-04.10287312,2018-10-04,3176068f-62ee-4b2f-aacd-1131201c6db1,214707,The Speaker,,Routine Proceedings,Commissioner of Official Languages,,"I have the honour to lay upon the table the annual reports on the Access to Information and Privacy Acts of the Office of the Commissioner of Official Languages for the year 2017-18. These reports are deemed to have been permanently referred to the Standing Committee on Access to Information, Privacy and Ethics.",Liberal,Halifax West,Geoff Regan,http://www.parl.gc.ca/Parliamentarians/en/members/geoff-regan(214707)
4755140,ca.proc.d.2018-10-04.10286897,2018-10-04,eb53bf99-e3d5-44b9-a15e-6c295470cdd4,216052,"Hon. Kevin Sorenson (Battle River—Crowfoot, CPC)",,Routine Proceedings,Committees of the House,Public Accounts,"Mr. Speaker, I have the honour to present, in both official languages, the 51st report of the Standing Committee on Public Accounts. The members heard correctly: I said 51. Our committee is doing some work here. The 51st report of the Standing Committee on Public Accounts is entitled “Report 4, Replacing Montréal’s Champlain Bridge—Infrastructure Canada, of the 2018 Spring Reports of the Auditor General of Canada”.
Pursuant to Standing Order 109, the committee requests that the government table a comprehensive response to this report.",Conservative,Battle River—Crowfoot,Kevin Sorenson,http://www.parl.gc.ca/Parliamentarians/en/members/kevin-sorenson(216052)
4755141,ca.proc.d.2018-10-04.10286914,2018-10-04,aaf26c99-85fb-4ea0-aaf2-5e56a16ed7ba,219477,"Mr. James Maloney (Etobicoke—Lakeshore, Lib.)",,Routine Proceedings,Committees of the House,Natural Resources,"Mr. Speaker, I have the honour to present, in both official languages, the 10th report of the Standing Committee on Natural Resources, entitled “Rethinking Canada’s Energy Information System: Collaborative Models in a Data-Driven Economy”.
Pursuant to Standing Order 109, the committee requests that the government table a comprehensive response to this report.",Liberal,Etobicoke—Lakeshore,James Maloney,http://www.parl.gc.ca/Parliamentarians/en/members/james-maloney(219477)
4755142,ca.proc.d.2018-10-04.10286925,2018-10-04,0c9d00b0-a035-46d3-ba51-0db3e8da19b8,237005,"Mr. Murray Rankin (Victoria, NDP)",,Routine Proceedings,Expungement of Certain Cannabis-related Convictions Act,," moved for leave to introduce Bill C-415, an act to establish a procedure for expunging certain cannabis-related convictions.
Mr. Speaker, I am very proud to introduce today a bill that would expunge the records of certain cannabis-related convictions. Over 500,000 Canadians have a criminal record for cannabis possession. That is 500,000 Canadians who may be barred from finding employment, from volunteering in their communities and from finding a place to rent, all for non-violent action that will soon be perfectly legal. 
I also emphasize that not all Canadians have been treated equally under our cannabis laws. In Toronto, black people without a criminal record were three times more likely to be arrested for cannabis possession than white people. In Halifax, they were five times as likely to be arrested, and in Regina it happens nine times more often to indigenous people.
This bill would allow people to wipe from their records all cannabis convictions for things that will be perfectly legal within two weeks. Under the current broken pardons system, Canadians have to wait several years and pay $631 just to apply. Under my bill, they would not have to wait several years, and it would be completely free. 
This bill is about righting past wrongs, and it would help hundreds of thousands of Canadians to get on with their lives.
 (Motions deemed adopted, bill read the first time and printed) ",New Democratic Party,Victoria,Murray Rankin,http://www.parl.gc.ca/Parliamentarians/en/members/murray-rankin(237005)
4755143,ca.proc.d.2018-10-04.10286973,2018-10-04,9f0040ba-a9d7-4aa4-b2e4-f3213a4e024f,217922,"Hon. Deepak Obhrai (Calgary Forest Lawn, CPC)",,Routine Proceedings,Hindu Heritage Month,," moved for leave to introduce Bill C-416, an act to designate the month of October as Hindu heritage month.
Mr. Speaker, I would first like to thank my colleague from Barrie—Innisfil for seconding this bill.
I rise today to introduce my private member's bill to designate the month of October of every year as Hindu heritage month. The bill recognizes the importance of the role played by Hindu Canadians in our country's multicultural social fabric and economic growth. 
Hindus across the world celebrate significant festivals, such as Diwali, hosted here on Parliament Hill since 1998. It was in Ottawa when the first Diwali took place in the national legislature in the western world. I invite you, Mr. Speaker, on October 30, to please come to the 18th Diwali celebration.
By proclaiming the month of October as Hindu heritage month, the Government of Canada would recognize the contributions of Hindu Canadians as part of the success story that has made Canada the best country in the world.
 (Motions deemed adopted, bill read the first time and printed) ",Conservative,Calgary Forest Lawn,Deepak Obhrai,http://www.parl.gc.ca/Parliamentarians/en/members/deepak-obhrai(217922)
4755144,ca.proc.d.2018-10-04.10287006,2018-10-04,b37cad30-26f6-40c6-8e4c-dd3a0ba841bb,217477,"Mrs. Cheryl Gallant (Renfrew—Nipissing—Pembroke, CPC)",,Routine Proceedings,Petitions,Firearms,"Mr. Speaker, I am pleased to present a petition signed by Canadians from several ridings, including St. Catharines and Niagara Centre. They call on the House of Commons to respect the rights of law-abiding firearms owners and reject the Prime Minister's plan to waste taxpayers' money studying a ban on guns, which are already banned.",Conservative,Renfrew—Nipissing—Pembroke,Cheryl Gallant,http://www.parl.gc.ca/Parliamentarians/en/members/cheryl-gallant(217477)
4755145,ca.proc.d.2018-10-04.10287016,2018-10-04,16ec30ba-16f2-4777-ab8d-db372238e239,235144,"Mrs. Karen Vecchio (Elgin—Middlesex—London, CPC)",,Routine Proceedings,Petitions,Summer Jobs Program,"Mr. Speaker, I am pleased to present a petition signed by residents of Elgin—Middlesex—London, as well as residents from the riding of Avalon, regarding the government's proposed attestation regarding Canada summer jobs and its views on the contravention of the Canadian Charter of Rights and Freedoms.
The petitioners call on the Prime Minister to defend the rights of conscience, thought and belief and withdraw the attestation requirements for applicants to the Canada summer jobs program.",Conservative,Elgin—Middlesex—London,Karen Vecchio,http://www.parl.gc.ca/Parliamentarians/en/members/karen-vecchio(235144)
4755146,ca.proc.d.2018-10-04.10287029,2018-10-04,8826a32c-2e29-49be-b6e2-c1f10363639b,218836,"Ms. Irene Mathyssen (London—Fanshawe, NDP)",,Routine Proceedings,Petitions,Canada Post,"Mr. Speaker, I have two petitions to present today.
The first is a petition in support of postal banking. Nearly two million Canadians desperately need an alternative to payday lenders, whose crippling and predatory rates affect the poor, marginalized, rural and indigenous communities most. There are 3,800 Canada Post outlets already in rural areas, where there are few or even no banks at all. 
Canada Post has the infrastructure to make a rapid transition to include postal banking. Therefore, the petitioners call upon the Government of Canada to enact my motion, Motion No. 166, to create a committee to study and propose a plan for postal banking under the Canada Post Corporation.",New Democratic Party,London—Fanshawe,Irene Mathyssen,http://www.parl.gc.ca/Parliamentarians/en/members/irene-mathyssen(218836)
4755147,ca.proc.d.2018-10-04.10287540,2018-10-04,8826a32c-2e29-49be-b6e2-c1f10363639b,218836,"Ms. Irene Mathyssen (London—Fanshawe, NDP)",,Routine Proceedings,Petitions,The Environment,"Mr. Speaker, my second petition is in regard to the Thames River. The petitioners are concerned that the Conservative government stripped away environmental regulations covered in the Navigable Waters Protection Act, leaving hundreds of rivers vulnerable, rivers like the Thames, which is a heritage river. The Liberal government has failed to keep its promise to reinstate environmental protections gutted from the original act. 
Therefore, the petitioners ask the Government of Canada to support my bill, Bill C-355, which would commit the government to prioritizing the protection of the Thames River by amending the Navigation Protection Act.",New Democratic Party,London—Fanshawe,Irene Mathyssen,http://www.parl.gc.ca/Parliamentarians/en/members/irene-mathyssen(218836)
4755148,ca.proc.d.2018-10-04.10287054,2018-10-04,9e05a099-6a0b-4fe2-9e9b-0a8b91b7807b,214054,"Ms. Monique Pauzé (Repentigny, BQ)",,Routine Proceedings,Petitions,Labour," Mr. Speaker, today I have the honour to present petition e-1568, which was signed by 1,312 people calling for better working conditions for domestic workers. Specifically, the petitioners are asking the government to ratify the International Labour Organization's Domestic Workers Convention No. 189 and to invite provincial and territorial governments to harmonize their laws with the International Labour Organization's Recommendation No. 201, which accompanies the convention. Several hundred more signatures will soon be arriving on paper. 
I congratulate the Centre international de solidarité ouvrière and its member organizations, who are the driving force behind this commendable initiative.",Bloc Québécois,Repentigny,Monique Pauzé,http://www.parl.gc.ca/Parliamentarians/en/members/monique-pauze(214054)
4755149,ca.proc.d.2018-10-04.10287066,2018-10-04,62bfd797-8d32-425b-91b1-1422ca16694f,237138,"Mr. Blake Richards (Banff—Airdrie, CPC)",,Routine Proceedings,Petitions,Infant Loss,"Mr. Speaker, Canadian parents are often left to suffer alone after they have experienced the tragedy of pregnancy or infant loss and, worse, government programs are often causing them undue financial or emotional hardship.
That is why Motion No. 110 was put forward. It asked the human resources committee to study the issue of pregnancy and infant loss on parents. It was passed unanimously, with all-party support, in June. However, loss parents expect more than symbolism, they expect action.
Therefore, I table this petition, signed by hundreds of Canadians, calling on the government to immediately introduce legislation, following the committee report to provide better compassion and more support for parents of pregnancy and infant loss.",Conservative,Banff—Airdrie,Blake Richards,http://www.parl.gc.ca/Parliamentarians/en/members/blake-richards(237138)
4755150,ca.proc.d.2018-10-04.10287391,2018-10-04,62bfd797-8d32-425b-91b1-1422ca16694f,237138,"Mr. Blake Richards (Banff—Airdrie, CPC)",,Routine Proceedings,Petitions,Marijuana,"Mr. Speaker, while I have the floor, I have one other petition I would like to table. It is in regard to the cannabis legislation coming into effect in less than two weeks.
There are still many questions surrounding how marijuana use will affect driving, and how it will impact the health of Canadians. These are serious concerns that I have heard from constituents. Unfortunately, we are not any closer to getting answers.
I am tabling this petition today calling on the government to address these and other concerns that Canadians have.",Conservative,Banff—Airdrie,Blake Richards,http://www.parl.gc.ca/Parliamentarians/en/members/blake-richards(237138)
4755151,ca.proc.d.2018-10-04.10287079,2018-10-04,3176068f-62ee-4b2f-aacd-1131201c6db1,214707,The Speaker,,Routine Proceedings,Petitions,Marijuana,I would remind hon. members that presenting petitions is not the time to engage in their arguments about a matter but to tell us what the petitioners have to say. I think members can manage to frame their comments about presenting petitions in a way that focuses on what petitioners are saying.,Liberal,Halifax West,Geoff Regan,http://www.parl.gc.ca/Parliamentarians/en/members/geoff-regan(214707)
4755152,ca.proc.d.2018-10-04.10287083,2018-10-04,07cf5767-802c-406c-92a7-7dc92af79b40,229526,"Mr. Kevin Lamoureux (Winnipeg North, Lib.)",,Routine Proceedings,Petitions,Pharamacare,"Mr. Speaker, it is with pleasure that I table a petition today that has been signed by hundreds of residents of Winnipeg North.
The petitioners are asking for the Prime Minister and members of Parliament to reflect on how important it is that we have a national pharmacare program. The petitioners are calling on the federal government to work with provinces and different stakeholders to put in a place a single system that would allow for a national pharmacare program for prescribed medicines.",Liberal,Winnipeg North,Kevin Lamoureux,http://www.parl.gc.ca/Parliamentarians/en/members/kevin-lamoureux(229526)
4755153,ca.proc.d.2018-10-04.10287095,2018-10-04,eaa6694f-1e20-4aae-ad3b-e694b0e12c59,224170,"Ms. Elizabeth May (Saanich—Gulf Islands, GP)",,Routine Proceedings,Petitions,Status of Women,"Mr. Speaker, I am honoured to rise today to present two petitions. The first petition calls for this Parliament to consider very closely the continuing problem of violence against women, particularly that violence against women disproportionately impacts indigenous women.",Green Party,Saanich—Gulf Islands,Elizabeth May,http://www.parl.gc.ca/Parliamentarians/en/members/elizabeth-may(224170)
4755154,ca.proc.d.2018-10-04.10287520,2018-10-04,eaa6694f-1e20-4aae-ad3b-e694b0e12c59,224170,"Ms. Elizabeth May (Saanich—Gulf Islands, GP)",,Routine Proceedings,Petitions,The Environment,"Mr. Speaker, the second petition is from youth in Canada and, as the petitioners frame it, those who care about youth.
It calls our attention to the increasing urgency of action on the climate crisis, and that unless action is taken very soon in the interests of these youth, the window on achieving 1.5° average global temperature increase and staying well below 2° will close, and close permanently, without swift action.",Green Party,Saanich—Gulf Islands,Elizabeth May,http://www.parl.gc.ca/Parliamentarians/en/members/elizabeth-may(224170)
4755155,ca.proc.d.2018-10-04.10287288,2018-10-04,07cf5767-802c-406c-92a7-7dc92af79b40,229526,"Mr. Kevin Lamoureux (Parliamentary Secretary to the Leader of the Government in the House of Commons, Lib.)",,Routine Proceedings,Questions on the Order Paper,,"Mr. Speaker, I ask that all questions be allowed to stand.",Liberal,Winnipeg North,Kevin Lamoureux,http://www.parl.gc.ca/Parliamentarians/en/members/kevin-lamoureux(229526)
4755156,ca.proc.d.2018-10-04.p5552731,2018-10-04,3176068f-62ee-4b2f-aacd-1131201c6db1,214707,The Speaker,,Routine Proceedings,Questions on the Order Paper,, Is that agreed?,Liberal,Halifax West,Geoff Regan,http://www.parl.gc.ca/Parliamentarians/en/members/geoff-regan(214707)
4755157,ca.proc.d.2018-10-04.p5552732,2018-10-04,,,,intervention,Routine Proceedings,Questions on the Order Paper,, Agreed. ,,,Some hon. members,
4755158,ca.proc.d.2018-10-04.10287125,2018-10-04,03fec1f2-5bf7-4f22-8a1f-0a48e4b70a4e,215890,"Ms. Linda Lapointe (Rivière-des-Mille-Îles, Lib.)",,Routine Proceedings,Privilege,Supply Management,"Mr. Speaker, I rise today to respond to the question of privilege raised on October 2 by the hon. member for Montcalm regarding the supposed contempt of Parliament pertaining to supply management.
In his statement, the hon. member indicated that the USMCA constitutes contempt of Parliament. The Bloc Québécois member's argument is twofold. The first point that he made was that the negotiation of the agreement opened 3.59% of the Canadian milk and dairy products market to American producers. The second was that, on September 26, 2017, the House unanimously adopted a motion in which it reiterated its desire to fully preserve supply management during the NAFTA renegotiations. As a result, my hon. colleague believes that the USMCA constitutes contempt of Parliament.
I would like to demonstrate that the matter before us today is not a question of privilege but a matter of debate.
Pages 536 and 537 of House of Commons Procedure and Practice, 3rd edition, clearly state the following: “A resolution of the House is a declaration of opinion or purpose; it does not require that any action be taken, nor is it binding.” 
I therefore believe that it is impossible for the provisions of the agreement to be found in contempt of Parliament. Consequently, I respectfully submit that this is a matter of debate and not a question of privilege.",Liberal,Rivière-des-Mille-Îles,Linda Lapointe,http://www.parl.gc.ca/Parliamentarians/en/members/linda-lapointe(215890)
4755159,ca.proc.d.2018-10-04.10287154,2018-10-04,3176068f-62ee-4b2f-aacd-1131201c6db1,214707,The Speaker,,Routine Proceedings,Privilege,Supply Management,I thank the hon. member for Rivière-des-Mille-Îles for her comments on the question of privilege. I will come back to the House with a ruling in due course.,Liberal,Halifax West,Geoff Regan,http://www.parl.gc.ca/Parliamentarians/en/members/geoff-regan(214707)
