basepk,hid,speechdate,pid,opid,speakeroldname,speakerposition,maintopic,subtopic,subsubtopic,speechtext,speakerparty,speakerriding,speakername,speakerurl
4758113,ca.proc.d.2018-10-25.10331161,2018-10-25,22a96405-bed6-45e9-811a-69d055416803,234948,"Hon. Steven Blaney (Bellechasse—Les Etchemins—Lévis, CPC)",,Private Members' Business,Filipino Heritage Month,,"Madam Speaker, I am pleased to rise to speak this afternoon on behalf of the Conservative Party in support of this motion, designating June as Filipino heritage month.
My colleagues and I in the Conservative Party of Canada are pleased to support this motion to designate June as Filipino heritage month. 
The Philippines is a country in southeast Asia with more than 105 million inhabitants. Canada is home to one of the largest, if not the largest, Philippine diaspora communities in the world.
I was just speaking with my colleague from Abbotsford while my hon. colleague from the other side was speaking. He reminded me that over the course of the last year we have seen a large wave of Filipino citizens coming into Canada. At one point, they were even the largest number of immigrants our country was welcoming. In that regard, it is more than suited to support and recognize the contributions of these new fellow Canadian citizens of Filipino heritage.
It is indeed a growing community, something to which my colleague just referred. It is a community with a rich and vibrant culture and a community made up of hard-working Canadian citizens. It is certainly one of their traits. In all, it is a community that contributes to strengthening the social fabric of Canada. Through its contributions, it is a community which makes our country the best in the world.
I had the privilege of sitting in the Conservative caucus with an honourable colleague who has passed away, the late Senator Tobias Enverga. I would like to take a few moments to pay tribute to this great man, who would be very proud on this day. He was a proud member of the Canadian Filipino community.
Senator Enverga was born in the Philippines, and like many other Filipinos, he chose Canada as his new home. After arriving in Canada, he worked hard to support his family and his children and build a better life for them, while also throwing himself wholeheartedly into Canadian life. 
In 2010, Tobias Enverga was elected as a City of Toronto school board trustee, becoming the first Canadian of Filipino origin to be elected to this municipal position in Toronto. He was a passionate advocate of high-quality education for Canadian youth. He held this trustee position until 2012.
In 2012, Tobias Enverga was again to make history for the Canadian Filipino community. He was appointed to the Senate of Canada by the Right Hon. Stephen Harper. He became the first Canadian of Filipino origin to serve in the Senate. I am sure colleagues from the other place and from here acknowledge he served with great honour. He was a source of pride not only for members of my party, but for all parliamentarians and Canadians.
Senator Enverga also launched the Philippine Canadian Charitable Foundation, which focused on bringing together the Filipino Canadian community to promote the spirit of charity. The senator was a kind soul, someone of whom the Filipino community and all Canadians can be proud. Again, on this very day, he would be very proud to see his welcoming country acknowledging not only his contributions, but the contributions of all members of the Filipino community.
Hopefully, when the motion is passed and adopted, in June we will have an opportunity to acknowledge the great contribution of the Filipino community to our country.
One way in which this community is contributing to our country is through the outstanding entrepreneurial spirit of the Filipino members. Canadians of Filipino origin have founded several businesses and even brought some businesses from the Philippines to Canada. This includes the Philippine National Bank and several food businesses, such as Goldilocks bake shop, Max's of Manila, the Seafood City Supermarket and Jollibee, which recently made the news after announcing it would be setting up shops in several Canadian cities like Winnipeg. Hopefully, we will get one in Quebec City and even in Lévis.
Speaking of Winnipeg, I mentioned there was a large diaspora of Filipino people in Canada. I discovered. while preparing for this speech with my team. that Filipino Canadians represent almost 9% of the city of Winnipeg's population and about 7% of Manitoba's population. Therefore, it is a large and significant footprint on the landscape of many of these western provinces and is certainly helping their prosperity.
About 25,000 Canadians of Filipino heritage work in Montreal, and there are nearly 10,000 more right here in the Ottawa-Gatineau region.
The Filipino community also contributes to our media, through Filipino Canadian publications like the Filipino Canadian Magazine and Juan Radio 96.1 FM, which is Vancouver's first Filipino radio program.
If people are willing to discover and encounter the amazing Filipino culture, they can experience the food by checking out one of the many Filipino food festivals hosted throughout Canada, like Toronto's Taste of Manila, which is attended by about 350,000 people every year. 
My colleague, the parliamentary secretary for heritage, mentioned a lot of the contributions made by Filipino members to the Canadian cultural landscape, especially in the emerging media scene. He referred to very prominent people of whom we are very proud. Filipino Canadians are also contributing to Canadian sports. 
Take, for example, Filipino-Canadian hockey player Matt Dumba, who now plays for the Minnesota Wild.
We have Olympians, such as Olympic archer Crispin Duenas, Olympic skater Gilmore Junio and Olympic boxer Rey Fortaleza. Maybe we will have the privilege of having those people in this very place when we welcome all the Olympic sports athletes. It is certainly a source of pride for all Canadians.
If we look at soccer, which we know is a very popular sport there, the de Guzman brothers have made us proud. Julian and Jonathan de Guzman made it to Europe's elite soccer leagues, which is quite an accomplishment, including the Bundesliga and the Premier League.
We can be proud of all these people, who left the Philippines for Canada and who contribute to our prosperity. I just want to say that we support the motion. We will be pleased to support the motion through the next steps and send a message of openness to the Filipino community.",Conservative,Bellechasse—Les Etchemins—Lévis,Steven Blaney,http://www.parl.gc.ca/Parliamentarians/en/members/steven-blaney(234948)
4758114,ca.proc.d.2018-10-25.10331180,2018-10-25,ab30a165-2ce2-4465-af10-19ae0fc1aec0,217227,"Ms. Sheri Benson (Saskatoon West, NDP)",,Private Members' Business,Filipino Heritage Month,,"Madam Speaker, with pleasure I rise today in full support of the motion to designate June as Filipino heritage month in Canada. As the member for Saskatoon West, I am proud to represent many constituents of Filipino descent. The Filipino community in Saskatoon, indeed in Saskatchewan and all throughout Canada, has enriched our cultural diversity. Its members have worked and volunteered beside us, contributed to our joint community-building projects, generously offered their leadership in times of need, and have become our friends and neighbours.
In fact, the 2016 Canadian census tells us that Saskatchewan has over 20,000 Tagalog speakers, one of the official languages of the Philippines, an increase of over 123% since 2011. Specifically, in Saskatoon, of the residents who identified themselves as immigrants in that census, nearly one quarter hailed from the Philippines. That is 10,000 strong and growing. 
The 2016 census shows the Tagalog language as the immigrant language most commonly spoken on the Prairies: 20,000-plus people list it as their mother tongue, 2% of the population, and over 11,000 people say it is the language they most commonly speak at home. In Saskatoon, Tagalog now ranks behind English as the second most common mother tongue. 
According to the most recent annual report of the IRCC, the Philippines is Canada's top source country for new permanent residents with over 42,000, almost 14% of new permanent residents. This has been the case every year since 2013. I am extremely proud of the Filipino Canadian community in my riding. Its members have contributed so much to our shared economic prosperity in Saskatchewan while at the same time building a better life for themselves and their families. 
I am proud to represent the residents of the Saskatoon Confederation Park neighbourhood, and it is with extra pride that I say this neighbourhood includes the largest population of Filipinos in my city. Of course, at one time, the community was much smaller, but that did not deter Rose Lacsamana and her family who, 10 years ago, opened a Filipino store targeted at the small but growing Filipino community. It is this type of leadership and forward thinking and risk taking, by Rose and many others, who built up a business and while doing so, built up our community. It is through these efforts of local Filipino Canadian business owners that Saskatoon was able to welcome newcomers from the Philippines with open arms. I thank Rose and her husband JR for their venture, the Global Pinoy Food Store, and for believing in our community to grow and prosper. I congratulate them for 10 years of service to our community.
One of my favourite things to do as an MP is to attend citizenship ceremonies in my riding. During my constituency week in October, I attended not one but two ceremonies. Both were, of course, very special, but one was extra special for a couple of reasons. First, it was Citizenship Week in Canada. Second, we were gathered at the wonderful Saskatoon Farmers Market and I want to thank Erika Quiring, operations manager at the Saskatoon Farmers Market, for hosting us. Third, the Institute for Canadian Citizenship organized an opportunity for me and other community leaders to host table conversations with our brand new citizens. 
I met lvan and his family from Iran and Rachel who was there with her sister. Rachel was nervous and shy, but very happy to be getting her citizenship and happy to be together again with her sister and other extended family. Rachel came to Canada from the Philippines as a live-in caregiver. She had waited many years to get her citizenship. It was wonderful to share that day with her. It reminded me of the many women who come to my constituency office for help, who are raising other people's children, having come to Canada, many from the Philippines, as live-in caregivers, the women whose children are growing up without their mother, the women who are working hard to earn money so that one day they can be reunited with their own children, the women who, like Rachel, dream of one day attending their own citizenship ceremony.
The members of the NDP have long been champions for the Filipino community and my colleague from Vancouver East has continued those efforts. One of the most important yet invisible contributions of Filipino Canadians is the many ways in which Filipino caregivers help raise our children and run our households.
Since 1992, some 75,000 Filipinos have become permanent residents of Canada through the federal government's caregiver program. The sales pitch was hard to resist. They would help raise our children for two years, and we would reunite them with theirs and give everyone a shot at permanent residency. Last year alone, some 23,000 Filipinos came to Canada under the program, but it has become a victim of its own success.
In 2015, the backlog of applications for permanent residency was 17,600 names long. Citizenship and Immigration Canada promised swift action and announced plans to expedite the approval process, but for many, the wait, which now averages over 50 months, and that is after two years of employment, is torture. At home, their kids are growing up without them, and with rock-bottom wages in the Philippines, going back is not a viable option. With the recent announcement by the federal government that the program will end in 2019, these women are understandably very concerned.
It is not a secret that women who are employed through the caregiver program are vulnerable and sometimes face harsh working conditions for very little pay. At the same time, they are isolated and far away from their homes and families. Most of them do not get to see their children for many years. They come and work under conditions that most of us would find trying, all for a chance at a better life. The least we can do is offer them better workplace protections and a pathway to permanent residency in a process that is clear, stable and not fraught with delays or uncertainty. 
Currently, the average application processing time for live-in caregivers is four and a half years. The NDP is calling on the government to take immediate action to end the backlog and processing delays that are keeping an estimated 40,000 live-in caregivers from reuniting with their families. 
We have always believed that if one is good enough to work here, one is good enough to stay. I hope that in addition to celebrating Filipino heritage month next year, the federal government will also be modernizing our immigration policies and processes and giving priority to reuniting families.
All around my community I see the good work brought about by members of the Filipino community, and their efforts are supported by residents of all different backgrounds.
I was proud to participate in the Flores de Mayo Fiesta celebration, which last year raised funds for the Filipino Heritage School in Saskatoon, which celebrated its 25th anniversary in 2017. Founded in 1996, the Filipino Heritage School is dedicated to preserving the Filipino language and culture, strengthening unity within the community and promoting intercultural understanding. The school's success is the collaborative effort of parents, families and teachers collectively working together to teach the Filipino language and culture.
The Filipino-Canadian Association of Saskatoon, or FILCAS, is a vibrant community organization serving as sort of the mother of all Filipino organizations in the city. It is the leading organizer of major Filipino Canadian activities, such as Philippine Independence Day on June 12, the sports tournament and the Filipino Canadian annual Christmas party.
Since the inception of the Saskatoon Folkfest over 36 years ago, FILCAS has hosted the Filipino pavilion, showcasing Filipino arts and culture and promoting Filipino heritage for all of us to enjoy.
I want to take this opportunity to acknowledge this year's Filipino Folkfest pavilion ambassadors, Hilbert and Grace Macadaeg, and youth pavilion ambassadors, Julenne Florida and Jayda Ho, for their warm welcome on my visit to the pavilion this year.
It has been an honour for me, as the member of Parliament for Saskatoon West, to attend the ANCOP, or Answering the Cry of the Poor, fundraising walk for the past two years. This year it celebrated its fifth walk in Saskatoon and its 15th in Canada. The money raised in Saskatoon walks has supported 35 sponsored children in going to school and has built 30 houses in the Saskatchewan Village in the Philippines.
My community and I are proud to honour the many contributions of Filipino Canadians in Saskatoon.
In closing, I must continue the accolades for the Filipino community in Saskatoon. I only wish I had more time, as the list is longer than my time allows.
I want to congratulate the University of Saskatchewan Filipino Student Association, which was honoured this year with the prestigious University of Saskatchewan Vera Pezer Award for Student Enhancement as the campus group of the year.
Last, but certainly not least, I want to send a special shout-out to the many Filipino Canadians working, and caring, as health care workers in my community, many of whom are proud members of the Service Employees International Union, SEIU-West. President Barb Cape and the members of SEIU-West are not only members of a great union but are also outstanding community partners, supporting many local Filipino events and cultural celebrations.
I look forward--",New Democratic Party,Saskatoon West,Sheri Benson,http://www.parl.gc.ca/Parliamentarians/en/members/sheri-benson(217227)
4758115,ca.proc.d.2018-10-25.10331208,2018-10-25,cedf1659-ebb1-4f26-b723-5c7c5353988b,214948,The Assistant Deputy Speaker (Mrs. Carol Hughes),,Private Members' Business,Filipino Heritage Month,,"Unfortunately, the time is up.
Resuming debate, the hon. member for Winnipeg Centre.",New Democratic Party,Algoma—Manitoulin—Kapuskasing,Carol Hughes,http://www.parl.gc.ca/Parliamentarians/en/members/carol-hughes(214948)
4758116,ca.proc.d.2018-10-25.10331210,2018-10-25,dbb0dd7c-287c-4115-9424-4b2c55652877,234506,"Mr. Robert-Falcon Ouellette (Winnipeg Centre, Lib.)",,Private Members' Business,Filipino Heritage Month,,"Madam Speaker, I would like to share my time with the hon. member for Steveston—Richmond East. ",Liberal,Winnipeg Centre,Robert-Falcon Ouellette,http://www.parl.gc.ca/Parliamentarians/en/members/robert-falcon-ouellette(234506)
4758117,ca.proc.d.2018-10-25.10331214,2018-10-25,cedf1659-ebb1-4f26-b723-5c7c5353988b,214948,The Assistant Deputy Speaker (Mrs. Carol Hughes),,Private Members' Business,Filipino Heritage Month,,"By sharing his time, the hon. member knows that he will only have five minutes and he would need unanimous consent of the House. Does the member have the unanimous consent of the House to share his time?",New Democratic Party,Algoma—Manitoulin—Kapuskasing,Carol Hughes,http://www.parl.gc.ca/Parliamentarians/en/members/carol-hughes(214948)
4758118,ca.proc.d.2018-10-25.10331215,2018-10-25,dbb0dd7c-287c-4115-9424-4b2c55652877,234506,Mr. Robert-Falcon Ouellette,,Private Members' Business,Filipino Heritage Month,,"Madam Speaker,
[Member spoke in Tagalog and provided the following translation:] 
[English]
Hello, I am the member for Winnipeg Centre. I am proud to represent my fellow Winnipeg citizens. They work hard. They make a difference. Filipinos are Winnipeg.
The first Filipinos immigrated to Canada in the 1930s. In the 1950s, 10 Filipinos were recorded in Manitoba. The first generation of Filipino Canadians were working as nurses, teachers and other professions in the health sector. By the 1970s, most Filipinos came to Winnipeg to work in health, clerical, sales and manufacturing fields. By the late 1970s, more Filipinos came to join relatives under the family unification programs the Canadian government had put forward.
During the 1980s, Canada saw another wave of Filipino contract workers, with many employed as live-in caregivers. 
The Filipino people have made an important contribution to the life of Manitoba and Canada. There are over 80,000 people of Filipino heritage in Winnipeg. These are our fellow citizens who make a difference each and every day to the people of Winnipeg and Winnipeg Centre. Around one out of 10 Filipino people in Canada call Winnipeg home.
The Filipino community has a centre in Winnipeg called the Philippine Canadian Centre of Manitoba. It provides services to the Filipino community and supports events, like Folkorama. The Filipino community is so important to Winnipeg because, for instance, Folkorama, a major cultural event, would not be able to go forward without the volunteerism and activism of the Filipino people. 
In Winnipeg, they are involved in the newspaper business, as journalists, reporting on local news but also international news. We have the Pilipino Express News Magazine, the Filipino Journal, the Ang Peryodiko and Artista. There is also a radio station, CKJS, which offers much Filipino information, broadcasting and servicing Filipino people in their language. 
I have had the opportunity, since being the member of Parliament for Winnipeg Centre, to stand next to my brothers and sisters from the Filipino community and to hear about their dreams and wishes. The Winnipeg Filipino population is largely concentrated in the north end of Winnipeg North and also the west end. In Winnipeg Centre, the neighbourhood around Sargent Avenue and Arlington is 45% Filipino. In the neighbourhood around Sargent Avenue and Wall Street, it is 47% Filipino.
I have held a town hall in my riding on Filipino issues. I have also had the opportunity of travelling to the Philippines to meet with senators and congressmen and women from there, learning about what we can do in Canada to work better together to ensure trade and jobs and ensure that more people can have a good and safe life in Canada.
The Filipino community contributes to the economy. They are hard workers. They are involved in our churches. They make a difference. The hardest workers come from the Philippines. It is an honour and I am proud to serve my fellow citizens of Filipino heritage. 
  Salamat. ",Liberal,Winnipeg Centre,Robert-Falcon Ouellette,http://www.parl.gc.ca/Parliamentarians/en/members/robert-falcon-ouellette(234506)
4758119,ca.proc.d.2018-10-25.10331232,2018-10-25,f9d84c5f-5f2a-4d2b-9a6a-ac01c1adccf3,219993,"Mr. Joe Peschisolido (Steveston—Richmond East, Lib.)",,Private Members' Business,Filipino Heritage Month,,"Madam Speaker, I would like to begin by congratulating the member of Parliament for Scarborough Centre for all her hard work and the dedication she has put forth to get this motion and, hopefully, this bill to this House.
I an blessed to come from a place called Steveston—East Richmond. One of the thriving communities in Steveston—East Richmond is the Filipino community. It is more than a community. It is made up of individuals who love their families and who, as has been stated, believe in faith, community and church.
I feel blessed to have gone to the birthday party of a granddaughter of one of my good friends. I saw the love and commitment to one another, but also the love and commitment to Canada and to the community. I was just chatting with my dear friend, Tony Rodriguez, who has just become the grand knight of the Knights of Columbus over at St. Paul's Church. When I asked him, “Why are you doing this? You're so busy”, he said, “Because I want to give back to the community”.
Members of the Filipino community are fiercely proud of their Filipino heritage or perhaps are even more fiercely Canadian. Every June 12th for the past 20 years or so, I have been over at city hall where we have a flag-raising ceremony where we are celebrating in Richmond, as I am sure is done all across the country, independence day for the Philippines. Beside that, we have the Canadian flag. We stand and we sing proudly. I do not sing that well but I do proudly sing both national anthems. That is a testament of a community that not only contributes here in Canada, but also acts as a bridge by deepening our links to the Philippines.
I mentioned earlier on the Knights of Columbus. The whole idea of giving back to the community is integral to the Filipino community. I had dinner a couple weeks back at Ed and Mercy's café and restaurant, Little Ongpin. When I go there, it is not just having a meal. It is sharing and talking to all folks in Richmond. It is not just folks of Filipino background who are there, but everyone. That is a testament that the Filipino community is not just celebrating Filipino culture but also Canadian culture. 
I am sure we will officially recognize the month of June every year as a celebration for the Filipino culture and heritage. However, I would argue that it is also a recognition of Canadian culture because, as time goes on, 800,000 Canadians of Filipino background are moulding and shaping our culture. That is a wonderful thing. As our Prime Minister always says, diversity is a strength, not a weakness. It is an ongoing process where Canadians, wherever they come from, come to Canada and contribute not only to benefit their own families but also contribute to benefit Canada. They change, I would argue, for the better the nature and the culture of Canada. There is no better community to be an example of that than the Filipino community.
It has been my great honour to stand here today and to support our bill that will make June the month to celebrate the heritage of the Filipino community.",Liberal,Steveston—Richmond East,Joe Peschisolido,http://www.parl.gc.ca/Parliamentarians/en/members/joe-peschisolido(219993)
