basepk,hid,speechdate,pid,opid,speakeroldname,speakerposition,maintopic,subtopic,subsubtopic,speechtext,speakerparty,speakerriding,speakername,speakerurl
4756359,ca.proc.d.2018-10-17.10306215,2018-10-17,3176068f-62ee-4b2f-aacd-1131201c6db1,214707,The Speaker,,,,,"We will now have the singing of the national anthem led by the hon. member for Hochelaga.
[Members sang the national anthem]",Liberal,Halifax West,Geoff Regan,http://www.parl.gc.ca/Parliamentarians/en/members/geoff-regan(214707)
4756360,ca.proc.d.2018-10-17.10306231,2018-10-17,c80fcb28-a347-4594-9e11-63ac3c37e428,214017,"Mr. Simon Marcil (Mirabel, BQ)",,Statements By Members,Supply Management,,"Mr. Speaker, the Conservatives would have us believe they stand by our dairy producers. They get all worked up in front of the cameras slamming any and every breach in supply management and saying what an abomination it is, but yesterday, they voted in favour of a breach in supply management.
That is right. They voted for the trans-Pacific partnership, which gives up as much of the dairy market to foreign interests as the pact with the Americans, which they are at such pains to condemn. They voted for it even though they all know Quebec producers will get no compensation. They will not get a penny, and furthermore, there is no plan to give them anything.
Not only did they vote for that, but they were in such a rush that they themselves suggested shutting up the opposition, including their own members, to put the question even sooner.
The Conservatives profess to be on our farmers' side, but we must never forget how two-faced they are. They say one thing in French when they are in Quebec and the exact opposite in English everywhere else.",Bloc Québécois,Mirabel,Simon Marcil,http://www.parl.gc.ca/Parliamentarians/en/members/simon-marcil(214017)
4756361,ca.proc.d.2018-10-17.10306235,2018-10-17,fe08cc31-44b1-466e-a0c6-1b0c61c8bf97,215973,"Mr. Mark Gerretsen (Kingston and the Islands, Lib.)",,Statements By Members,Lesa Zoerb,,"Mr. Speaker, I would like to share my deepest condolences to the family, friends and colleagues of Lesa Zoerb.
 Lesa served as a correctional officer and was killed in a motor vehicle accident on October 7. She was returning to a corrections institution in Saskatchewan after supervising an offender in hospital. 
Colleagues are remembering Lesa for her courage and depth of commitment to her profession and dedication to public safety. Ms. Zoerb's tireless 20 years of service to Correctional Service Canada is to be applauded.
 I add my appreciation for the difficult work she did every day to keep Canadians safe. I know she will be missed.",Liberal,Kingston and the Islands,Mark Gerretsen,http://www.parl.gc.ca/Parliamentarians/en/members/mark-gerretsen(215973)
4756362,ca.proc.d.2018-10-17.10306240,2018-10-17,2b5e6bf0-39d0-4d35-bcaa-dacd1834246d,218274,"Mr. Harold Albrecht (Kitchener—Conestoga, CPC)",,Statements By Members,Don McAllister,,"Mr. Speaker, this past weekend I was saddened to hear of the passing of Don McAllister.
 Don served valiantly with the Royal Canadian Air Force, nationally and internationally, from 1941-1972. His leadership skills continued in various positions with the Royal Canadian Legion, including speaking in schools about remembering veterans and championing the Legion poppy fund each year. As an exemplary member of our community, it was my honour to present Don with The Queen's Diamond Jubilee Medal in 2012, as well as a medal marking Canada's 150th last year. 
A strong family man, Don was married to Bessie since 1944. Don was a father of two, grandfather of two, great-grandfather of five and great-great-grandfather of six.
 I am grateful to have known Don and Bessie. I have had many opportunities to interact with them, and I consider them dear friends.
 I pray that Bessie and the family will experience God's peace and care as they walk this valley of grief. Don will be greatly missed.
 Lest we forget.",Conservative,Kitchener—Conestoga,Harold Albrecht,http://www.parl.gc.ca/Parliamentarians/en/members/harold-albrecht(218274)
4756363,ca.proc.d.2018-10-17.10306248,2018-10-17,ee06377a-6024-40ae-9fe4-a059508592a4,236941,"Mr. Wayne Long (Saint John—Rothesay, Lib.)",,Statements By Members,Small Business Week,,"Mr. Speaker, on this Small Business Week, it is time to take stock of some of the amazing things happening in my riding of Saint John—Rothesay. As anyone who has recently visited our uptown core will know, it is bustling, and not just during big events. This was even highlighted last week by the CBC.
Indeed, we are back in the game. Our economy is growing again. Since the spring, our riding's unemployment rate has fallen below the national average, our community has gained hundreds of jobs and hundreds of people have joined our workforce. This is a direct result of the growth of incredible small businesses in our uptown core. 
This private sector growth is also being complemented by historic federal and provincial investments, which are helping to jump-start the growth of these small businesses and our overall economy. Our riding starved for these sorts of federal investments for decades, and our government has delivered.
 We are back, we are thriving and our resurgence will continue to drive the economic and industrial heartbeat of New Brunswick. ",Liberal,Saint John—Rothesay,Wayne Long,http://www.parl.gc.ca/Parliamentarians/en/members/wayne-long(236941)
4756364,ca.proc.d.2018-10-17.10306254,2018-10-17,4bc128a9-b349-4867-a545-ad05122c0e46,217242,"Ms. Niki Ashton (Churchill—Keewatinook Aski, NDP)",,Statements By Members,International Day for the Eradication of Poverty,,"Mr. Speaker, today, on the International Day for the Eradication of Poverty, we recognize that poverty in Canada has many faces. Many of them indigenous, recent immigrants, racialized people and often women. 
While Canada is one of the wealthiest countries in the world, over one million children live in poverty. Shockingly, almost 40% of first nations children live in poverty.
 Today we recognize that poverty does not just happen. It is the result of a system that is broken, a system that seeks to enrich the wealthy and exploit the many, a system that is governed by Liberal or Conservative governments that time and time again prioritize profits over people.
 It does not need to be this way. We must push for system change; for true respect of indigenous rights; for housing; for universal programming like pharmacare, dental care and child care; for free tuition; for fair taxation, ensuring that the wealthy pay their fair share. 
Today, let us not just talk about poverty. Let us join those who are pushing for fundamental change, change so no one has to live in poverty again.",New Democratic Party,Churchill—Keewatinook Aski,Niki Ashton,http://www.parl.gc.ca/Parliamentarians/en/members/niki-ashton(217242)
4756365,ca.proc.d.2018-10-17.10306260,2018-10-17,af4d6069-8435-4361-9a6f-d38c96e9d50a,215916,"Mr. Francesco Sorbara (Vaughan—Woodbridge, Lib.)",,Statements By Members,James De Zen Centre of Abilities,,"Mr. Speaker, lights, colours, sounds and sensory objects to explore without risk and to learn how to adapt to the world around us are normalities that you, Mr. Speaker, or any MP in this chamber might take for granted. 
I rise today in honour to speak about the opening of the James De Zen Centre of Abilities in my riding of Vaughan—Woodbridge. Yesterday, this incredible forward-thinking centre opened its doors and arms to our community.
 Since 1992, the Meta Centre has been providing programming for adults with developmental disabilities and is now adding the James De Zen Centre of Abilities to its support services.
 James De Zen fiercely advocated and defended the inclusion of those challenged by developmental disabilities, and his compassion lives on through this centre. 
In honour of Mr. De Zen and his unique ability to push the envelope, I ask everyone to join me in congratulating all those involved in this project to build a world that values inclusion and compassion.",Liberal,Vaughan—Woodbridge,Francesco Sorbara,http://www.parl.gc.ca/Parliamentarians/en/members/francesco-sorbara(215916)
4756366,ca.proc.d.2018-10-17.10306263,2018-10-17,61c83e21-f9a3-4e4b-b881-4b2d1ce33c43,234471,"Mr. John Brassard (Barrie—Innisfil, CPC)",,Statements By Members,Canadian Citizenship Week,,"Mr. Speaker, last week was Canadian Citizenship Week. To celebrate, I delivered, as I often do, commemorative scrolls to the new Canadians in Barrie—lnnisfil who recently took the oath of citizenship.
 I love hearing their stories of where they came from, why they chose Canada, how they found the process of going through Canada's immigration system legally and legitimately and whether life in Canada was what they expected, and in every case it is.
 There are many groups who are active in Barrie—Innisfil to welcome newcomers, the Barrie-lnnisfil Russian speaking group, the Innisfil Latin organization, Latinos en Barrie, the Bayanihan Club of Simcoe County and the South Asian Association of Simcoe County to name a few. As proud as these groups are to be Canadian, they are also proud of their heritage, hosting many festivals and events that I am honoured to attend.
 In Barrie—Innisfil, we welcome new Canadian Citizens and we thank them for sharing the richness of their cultures and embracing their love of Canada and the values we cherish as Canadians. ",Conservative,Barrie—Innisfil,John Brassard,http://www.parl.gc.ca/Parliamentarians/en/members/john-brassard(234471)
4756367,ca.proc.d.2018-10-17.10306270,2018-10-17,3b9aadd7-086c-4788-8f4e-bbb6cc46f2c9,224996,"Mrs. Brenda Shanahan (Châteauguay—Lacolle, Lib.)",,Statements By Members,Marguerite D'Youville,,"Mr. Speaker, Marguerite D'Youville was certainly a forward-thinking woman. Born in the early 18th century, she founded the religious order of Grey Nuns, who ran the Montreal General Hospital, among other things.
Under her leadership and expertise, the Grey Nuns purchased the Saint-Bernard Island seigneury in Châteauguay in order to farm the land and run a mill, while at the same time respecting the environment and maintaining harmonious relationships with the first nations and the settlers.
In 1990, she was the first native-born Canadian to be declared a saint. In 2011, the Grey Nuns arranged, with the City of Châteauguay, for Île Saint-Bernard and its buildings to become an ecological and educational centre for all.
 All of this is because of an exceptional woman, Marguerite d'Youville, whose beautiful vision of life has left us with this wonderful legacy.",Liberal,Châteauguay—Lacolle,Brenda Shanahan,http://www.parl.gc.ca/Parliamentarians/en/members/brenda-shanahan(224996)
4756368,ca.proc.d.2018-10-17.10306275,2018-10-17,7cff4486-6787-493d-a4ee-a59d48f68ab3,219527,"Hon. Denis Paradis (Brome—Missisquoi, Lib.)",,Statements By Members,Lake Memphremagog,,"Mr. Speaker, Lake Memphremagog is one of two transboundary lakes in my riding of Brome—Missisquoi. Most of the lake's surface area is in Canada. Nearly 200,000 people, including residents of Sherbrooke and Magog, rely on it for their drinking water.
There is a huge landfill in Coventry, Vermont, in close proximity to Lake Memphremagog. Last Friday I was very disappointed to learn that the Vermont Agency of Natural Resources has granted final approval for the expansion of that facility by an additional 51 acres.
The waste disposal limit will increase from 250,000 to 600,000 tonnes annually over the next 20 years. If there were to be any leaks from the landfill, even 30 years from now, this could have very serious repercussions on the water quality of Lake Memphremagog.
I urge all levels of government, including authorities from the neighbouring municipalities, to work together to stop the project. It is high time that we recognized what a precious resource our lakes are.",Liberal,Brome—Missisquoi,Denis Paradis,http://www.parl.gc.ca/Parliamentarians/en/members/denis-paradis(219527)
4756369,ca.proc.d.2018-10-17.10306280,2018-10-17,9fe7bceb-dae2-4f26-b87b-2de1f38b4b84,234445,"Mr. Pierre Paul-Hus (Charlesbourg—Haute-Saint-Charles, CPC)",,Statements By Members,Legalization of Marijuana,,"Mr. Speaker, when the Prime Minister was a teen, he dreamed of leading our beautiful country, just like his father.
In 2015, he became leader of his party. As a federal election approached, his admirers were holding their breath waiting to hear this young leader's priorities. What would be his first proposal for Canadians? 
To the disappointment of many, he announced the legalization of marijuana, a bill that was rushed through for purely political reasons. We ended up with a law that makes marijuana more accessible to young people, when we were promised the opposite. We ended up with a law that does not reflect the concerns raised by those who will have to deal with the consequences of his decision. We ended up with a law that does not take into account the impact this legislation will have on occupational health and safety.
This bill will have an incalculable impact on the physical and mental health of Canadians, today and in the years to come.
Quebeckers, like all Canadians, remember Pierre Elliott Trudeau. In 2019, Quebeckers, like all Canadians, will remember his offspring. ",Conservative,Charlesbourg—Haute-Saint-Charles,Pierre Paul-Hus,http://www.parl.gc.ca/Parliamentarians/en/members/pierre-paul-hus(234445)
4756370,ca.proc.d.2018-10-17.10306284,2018-10-17,172813a0-1268-4f8b-9e5d-2e35761bef30,239609,"Mrs. Bernadette Jordan (South Shore—St. Margarets, Lib.)",,Statements By Members,Special Olympians,,"Mr. Speaker, this summer, Nova Scotia hosted the national Special Olympics at Saint Francis Xavier University University in Antigonish. Many athletes, coaches and volunteers from my riding of South Shore—St. Margarets spent days competing, making friends, having fun and saw plenty of success in the standings. 
I would like to highlight two athletes and two volunteers from my riding who have earned the opportunity of a lifetime. Ben Theriau in athletics; golfer Krista Stockman, along with caddie, Jim Stockman; and chef de mission, Mike Greek, have been chosen to be part of Team Canada at the 2019 World Special OIympic Games in Abu Dhabi.
I ask all members of the House to join me in wishing the best of luck to Ben, Krista, Jim and Mike as they compete in Abu Dhabi. We congratulate all the outstanding athletes and volunteers for a very successful summer games.",Liberal,South Shore—St. Margarets,Bernadette Jordan,http://www.parl.gc.ca/Parliamentarians/en/members/bernadette-jordan(239609)
4756371,ca.proc.d.2018-10-17.10306288,2018-10-17,782dab6a-6e60-4132-992b-4933293f30d4,219682,"Ms. Pam Goldsmith-Jones (West Vancouver—Sunshine Coast—Sea to Sky Country, Lib.)",,Statements By Members,Hospice Palliative Care,,"Mr. Speaker, I would like to commend Denis Fafard, Lura Osborne-Smulders and all the volunteers at the Sunshine Coast Hospice Society for their leadership and vision to increase access for those on the coast who are coping with grief, bereavement and their end of life. 
Home care and community care, and mental health and addiction services are top health priorities for Canadians, which is why our government invested an additional $11 billion over 10 years with our provincial and territorial counterparts.
From the great work of the medical assistance in dying panel, we learned that Canadians agree on the need for better access to palliative and end-of-life care, which the World Health Organization defines as meaning the best quality of life for people.
Canadians do not want to die in hospitals, but most do. Nearly half of Canadians receiving palliative care in a hospital die before they can be discharged for hospice support.
I thank all Canadians for making hospice support a health care priority and for our government's leadership in making it happen.",Liberal,West Vancouver—Sunshine Coast—Sea to Sky Country,Pam Goldsmith-Jones,http://www.parl.gc.ca/Parliamentarians/en/members/pam-goldsmith-jones(219682)
4756372,ca.proc.d.2018-10-17.10306291,2018-10-17,4437c848-d8c7-4a39-a948-1539969f3a90,234764,"Ms. Marilyn Gladu (Sarnia—Lambton, CPC)",,Statements By Members,Marijuana,,"Mr. Speaker, in a rush to meet his self-imposed political deadline, the Prime Minister failed to address the concerns of municipalities, law enforcement, employers, scientists and doctors about his cannabis legalization. 
 Last week, the government confirmed there is no scientific test to determine if someone is driving high. The safety concerns of employers, workers and indigenous communities have also not been addressed. Even worse, the Prime Minister has failed to explain how his plan will keep cannabis out of the hands of children and profits out of the hands of criminals. 
The lack of public education has left many Canadians unsure of the new rules and how this will impact border crossings between Canada and the United States. The consequences of the failure on the cannabis file have resulted in uneven rules for every province, municipality and territory, creating uncertainty and confusion from coast to coast. 
Thankfully, the Conservatives will protect public safety and our young people. We will come with a plan to clean up this mess and will continue to hold the Liberals accountable. ",Conservative,Sarnia—Lambton,Marilyn Gladu,http://www.parl.gc.ca/Parliamentarians/en/members/marilyn-gladu(234764)
4756373,ca.proc.d.2018-10-17.10306296,2018-10-17,7ee20ab9-2d43-420c-8027-f6403cb498a2,219955,"Mr. Emmanuel Dubourg (Bourassa, Lib.)",,Statements By Members,Association of Retired Quebeckers and Canadians of Haitian Origin,,"Mr. Speaker, a delegation from the association of retired Quebeckers and Canadians of Haitian origin, or AROHQC, is visiting the nation's capital today.
These retirees helped Quebec and Canada prosper. For more than 20 years, this association has fostered the social, economic, cultural and political advancement of seniors of Haitian origin. The association has an information service for its clients, organizes seniors' gatherings and promotes intergenerational exchanges. AROHQC also helps people who live alone.
I would like to take this opportunity to extend a warm welcome to the delegation led by Ms. Thérèse Dorsainvil and Mr. Edgard Belfort. I will tell them this:
[ Member spoke in Creole ]",Liberal,Bourassa,Emmanuel Dubourg,http://www.parl.gc.ca/Parliamentarians/en/members/emmanuel-dubourg(219955)
4756374,ca.proc.d.2018-10-17.10306300,2018-10-17,53435570-da9e-42e1-a195-e5475a2f8b13,217110,"Ms. Georgina Jolibois (Desnethé—Missinippi—Churchill River, NDP)",,Statements By Members,Indigenous Affairs,,"Mr. Speaker, today I stand to support the work of women in northern Saskatchewan who are doing great things to support at-risk women and children in my riding; women like Marilyn Mannix at Healthy Babies Right from the Start, and Benita Moccasin at North of 54 in Meadow Lake, or Karen Sanderson of the Piwapan Women's Center in La Ronge. While these people do great work, the Government of Canada can do so much more to support them. 
We must do better for the Athabasca Health Authority, which is still fighting for promised funding for a women's shelter in Black Lake. It has to fight bureaucracy at every level to get what it was promised. 
I call on the Liberals to listen to women's organizations and to create a national action plan so that northern and indigenous women can have access to well-funded shelter services wherever they are.",New Democratic Party,Desnethé—Missinippi—Churchill River,Georgina Jolibois,http://www.parl.gc.ca/Parliamentarians/en/members/georgina-jolibois(217110)
4756375,ca.proc.d.2018-10-17.10306306,2018-10-17,72dace30-741a-4877-8c1c-31b5dc3e4a8e,218755,"Mr. James Bezan (Selkirk—Interlake—Eastman, CPC)",,Statements By Members,Public Safety,,"Mr. Speaker, no one in recent memory has shown the same horrific disregard for human life as the so-called Islamic State.
These terrorists have revelled in torturing their victims, raping young girls, and launching mass atrocities in cities around the world. And now, the Liberal government is standing idly by as dozens of these terrorists return to Canada.
This past week, we learned that the Liberal government is not just coddling returning ISIS terrorists in Canada, but is actually helping imprisoned ISIS terrorists return to our communities from Syria.
These are terrorists who have gloated about playing soccer with the heads of their victims. These are barbaric terrorists who willfully travelled across the world to join a group of ISIS executioners, rapists and fanatics. And the Liberal government is asking them to fill out passport applications and helping them come back to Canada.
The Liberals have made a choice. They say welcome to Canada. Conservatives say no way. That is because we care more about the safety and security of Canadians and not the comfort of ISIS terrorists.",Conservative,Selkirk—Interlake—Eastman,James Bezan,http://www.parl.gc.ca/Parliamentarians/en/members/james-bezan(218755)
4756376,ca.proc.d.2018-10-17.10306315,2018-10-17,34585e7d-930f-472a-a618-495ca92cd6a9,215939,"Mr. Ramez Ayoub (Thérèse-De Blainville, Lib.)",,Statements By Members,World Day for Organ Donation and Transplantation,,"Mr. Speaker, on World Day for Organ Donation and Transplantation, let us acknowledge one of the greatest possible gestures of human solidarity, organ and tissue donation. Let us celebrate those who are alive today thanks to organ donation. Last week, I had the privilege of meeting with the families of organ donors and recipients in my riding, such as Carole Du Paul, whose husband died a few years ago and donated his lungs and liver, Joe Hajj, who was the recipient of a heart in 2009, and Yves LeBlanc, who has a new lease on life thanks to a tissue transplant. By talking with them, I realized once again how important it is for all Canadians to have access to an effective organ donation and transplantation system. That is what Motion No. 189, which I moved here in the House, seeks to accomplish.
On World Day for Organ Donation and Transplantation, let us be part of this life-giving chain.",Liberal,Thérèse-De Blainville,Ramez Ayoub,http://www.parl.gc.ca/Parliamentarians/en/members/ramez-ayoub(215939)
4756377,ca.proc.d.2018-10-17.10306326,2018-10-17,6519cfba-0080-419d-baa9-8ae6e56d032f,232946,"Hon. Andrew Scheer (Leader of the Opposition, CPC)",,Oral Questions,Government Accountability,,"Mr. Speaker, the Prime Minister's Office has wound up in court over its refusal to release documents that would give Vice-Admiral Mark Norman a fair trial. Charges have been laid, and both the prosecution and the defence have a job to do.
Why is the Prime Minister concealing potentially relevant documents? Why is he denying this distinguished officer his right to a full and fair defence?",Conservative,Regina—Qu'Appelle,Andrew Scheer,http://www.parl.gc.ca/Parliamentarians/en/members/andrew-scheer(232946)
4756378,ca.proc.d.2018-10-17.10306329,2018-10-17,b8c04eca-f237-48a8-8975-374ccd40d1a9,214115,"Right Hon. Justin Trudeau (Prime Minister, Lib.)",,Oral Questions,Government Accountability,,"Mr. Speaker, I thank the opposition leader for his question. However, as everyone knows, it would be inappropriate for me to comment on this affair because it is before the courts.",Liberal,Papineau,Justin Trudeau,http://www.parl.gc.ca/Parliamentarians/en/members/justin-trudeau(214115)
4756379,ca.proc.d.2018-10-17.10306334,2018-10-17,6519cfba-0080-419d-baa9-8ae6e56d032f,232946,"Hon. Andrew Scheer (Leader of the Opposition, CPC)",,Oral Questions,Government Accountability,,"Mr. Speaker, it was not inappropriate for the Prime Minister to comment to the media before the trial even began. He predicted that Vice-Admiral Norman would be charged and that this would be sorted out in court, so he had no problem commenting on this outside the House. All we are asking for is an explanation as to why he will not release documents that would give Vice-Admiral Mark Norman a fair trial. Why?",Conservative,Regina—Qu'Appelle,Andrew Scheer,http://www.parl.gc.ca/Parliamentarians/en/members/andrew-scheer(232946)
4756380,ca.proc.d.2018-10-17.10306336,2018-10-17,b8c04eca-f237-48a8-8975-374ccd40d1a9,214115,"Right Hon. Justin Trudeau (Prime Minister, Lib.)",,Oral Questions,Government Accountability,,"Mr. Speaker, as the member should well know, it would be inappropriate for me to comment on this affair because it is before the courts.",Liberal,Papineau,Justin Trudeau,http://www.parl.gc.ca/Parliamentarians/en/members/justin-trudeau(214115)
4756381,ca.proc.d.2018-10-17.10306338,2018-10-17,6519cfba-0080-419d-baa9-8ae6e56d032f,232946,"Hon. Andrew Scheer (Leader of the Opposition, CPC)",,Oral Questions,Government Accountability,,"Mr. Speaker, we are not asking the Prime Minister to comment on the case. We are asking him to release documents that would allow justice to be served.
Vice-Admiral Mark Norman has a right to a fair trial. His legal team needs to have access to documents that could prove or disprove his defence. Will the Prime Minister allow those documents to be released?",Conservative,Regina—Qu'Appelle,Andrew Scheer,http://www.parl.gc.ca/Parliamentarians/en/members/andrew-scheer(232946)
4756382,ca.proc.d.2018-10-17.10306342,2018-10-17,b8c04eca-f237-48a8-8975-374ccd40d1a9,214115,"Right Hon. Justin Trudeau (Prime Minister, Lib.)",,Oral Questions,Government Accountability,,"Mr. Speaker, as the member opposite well knows, it would be inappropriate for me to comment on an ongoing court case.",Liberal,Papineau,Justin Trudeau,http://www.parl.gc.ca/Parliamentarians/en/members/justin-trudeau(214115)
