basepk,hid,speechdate,pid,opid,speakeroldname,speakerposition,maintopic,subtopic,subsubtopic,speechtext,speakerparty,speakerriding,speakername,speakerurl
4755240,ca.proc.d.2018-10-04.10289383,2018-10-04,4626b9b7-420c-456d-9c7b-dea3794cb1c5,218746,Mr. Alupa Clarke,,Government Orders,Justice,,"Mr. Speaker, I appreciate my colleague's straightforward answer to my question.
My understanding was that a divorce had to involve a meeting with lawyers. Apparently that is not the case. However, what he said touched on other things I was wondering about.
He said that the Liberals wanted to simplify the process and keep matters out of the courts. He also said they wanted a way to review each parent's financial information.
Of course, in many cases, it is the father who handles the finances and the mother who looks after the children. My understanding is that the bill will enable the Canada Revenue Agency to systematically update or review both the father's and the mother's files if necessary.
This bill does not provide additional funding for the Canada Revenue Agency. If there is going to be more work, more paperwork, more investigations and more data, the Canada Revenue Agency should have a bigger budget.
If the Liberals are serious about this bill and if they want issues related to divorce to be resolved outside of the courts, then they are going to have to allocate more money to the Canada Revenue Agency in their 2019 budget. 
However, I have my doubts. This summer I heard an incredible number of horror stories from my constituents about the CRA. It is incredible to see everything that goes on at that institution. The minister absolutely must go see what is going on in the CRA buildings.
This summer, all my constituents told me their stories and I am happy to share those. They told me that when they call the CRA, no one answers or the lines are always busy. They told me that when they email the CRA, they never get a response. That is unacceptable.
When a member of the public tries to contact a member of the public service, at the very least they should get a response.",Conservative,Beauport—Limoilou,Alupa Clarke,http://www.parl.gc.ca/Parliamentarians/en/members/alupa-clarke(218746)
4755241,ca.proc.d.2018-10-04.10289393,2018-10-04,16c839d3-0183-4ed6-892a-8d7bdc37c474,214972,The Assistant Deputy Speaker (Mr. Anthony Rota),,Government Orders,Justice,,"Resuming debate, the hon. member for Elgin—Middlesex—London. I want to inform the hon. member that she will have approximately six minutes, and then we will break. Upon resuming debate, she will have four minutes coming to her to resume, and then have the questions asked.
The hon. member. ",Liberal,Nipissing—Timiskaming,Anthony Rota,http://www.parl.gc.ca/Parliamentarians/en/members/anthony-rota(214972)
4755242,ca.proc.d.2018-10-04.10289394,2018-10-04,16ec30ba-16f2-4777-ab8d-db372238e239,235144,"Mrs. Karen Vecchio (Elgin—Middlesex—London, CPC)",,Government Orders,Justice,,"Mr. Speaker, I am honoured to rise to speak to Bill C-78. I am not approaching this as a lawyer, as many of the others have done today. I am approaching this as a woman who has been divorced as well as a woman who has worked in a constituency office, dealing with people who have come from divorce and with different government departments.
I am going to begin with some of my experiences as a constituency assistant and how the Canada child benefit divvies out the money. The Canada Revenue Agency, under the leadership of the Conservative government, did an excellent job when it came to shared custody and shared parenting. That has become a nuance for many new families. If I was asked 20 years ago, when I look at that, shared parenting was not really an option. Now many families are looking at this. When the Canada Revenue Agency gave people the opportunity to divide their benefits, it became very beneficial for many of those families. 
The only question I will have for the government with respect to this, what does 40% mean? A lot of times when we look at those numbers, it can be very difficult. We have to recognize that when someone has custody of his or her child, is that child in school? Is that parent picking the child up from school? Is the child sleeping in that parent's home? So many factors have to be looked at. I want to ensure that when we talk about the 40% for parenting, that it is looked at with a microscope.
As a person who has had a divorce, I understands what it is like to raise children who have come from that situation. It has been very difficult. If we talk about child support, I am pleased to see in the bill that child support does not have to go in front of a judge or to a court and that it can be done at an administrative level. For many families, this is a huge barrier, whether it is having to pay the legal fees or having to go through the entire process. Making it easier for families is very important.
We have to understand that there are barriers to that as well. My colleagues have raised question on how we addressed some of those, such as when people are being paid under the table. Many parents, both fathers and mothers, across the country do not pay their child support. They and are trying to rip off their children. At the end of the day, the children are the ones who are most affected. Anything we can do to ensure we always put the best interests of our children forward is very important.
Let us talk about the psychology and the emotional issues that occur around a divorce. I fully support what is in the bill on child welfare. Children have to come first during a divorce. When I look at myself, I think of divorce as 20-20 hindsight. If I could have done things differently, I would have. However, at that time, the emotions, the anger, wanting revenge, all of those horrible things people feel during separation and divorce occur. We have to recognize that it is such an emotional issue. I apologize to all of the lawyers in the room, but sometimes it gets worse when people go to lawyers and they put themselves $20,000 behind the eight ball because of it.
 Brian Galbraith, a lawyer in Barrie, wrote this on his website:
 Depression can often follow separation and divorce. According to the National Population Health Survey, the two-year period after a divorce has high rate of serious psychological problems for the couple. This is not a surprising effect given the anxieties about children and the drastic life and income changes people experience during this time. 
In an issue of Psychology Today, it states:
 Divorce introduces a massive change into the life of a boy or girl no matter what the age. Witnessing loss of love between parents, having parents break their marriage commitment, adjusting to going back and forth between two different households, and the daily absence of one parent while living with the other, all create a challenging new family circumstance in which to live. In the personal history of the boy or girl, parental divorce is a watershed event. Life that follows is significantly changed from how life was before....The dependent child's short term reaction to divorce can be an anxious one. 
The government talks about child welfare, mediation and about the opportunities to have a lawyer assist children. If we to look at this, we have to ensure we have those resources for them.
When I went through my divorce 18 years ago, the opportunities for low-income women, as I was at that time, were not available. An appointment for my son to sit down and talk about it was not available to him. It took eight months.",Conservative,Elgin—Middlesex—London,Karen Vecchio,http://www.parl.gc.ca/Parliamentarians/en/members/karen-vecchio(235144)
4755243,ca.proc.d.2018-10-04.10289426,2018-10-04,16c839d3-0183-4ed6-892a-8d7bdc37c474,214972,The Assistant Deputy Speaker (Mr. Anthony Rota),,Government Orders,Justice,,The hon. member for Elgin—Middlesex—London will have 15 minutes coming to her when we resume debate plus 10 minutes of questions and comments.,Liberal,Nipissing—Timiskaming,Anthony Rota,http://www.parl.gc.ca/Parliamentarians/en/members/anthony-rota(214972)
4755244,ca.proc.d.2018-10-04.10289433,2018-10-04,e39c6a4d-cac9-4e3e-b8d5-528f15a76519,214282,"Mr. Mario Beaulieu (La Pointe-de-l'Île, BQ)",,Statements By Members,Interests of Quebec,,"Mr. Speaker, apparently the existence of the notwithstanding clause is news to the Prime Minister. Not only does it exist, but it is legitimate and useful.
The notwithstanding clause enables Quebec to opt out of certain provisions of the Constitution Act of 1982, which denies the identity of the Quebec people, and which the Government of Quebec never even signed. Decision-making powers rest with Quebec, not Supreme Court justices.
René Lévesque employed the notwithstanding clause in all of Quebec's laws. Since then, the notwithstanding clause has been used in 41 of Quebec's laws to protect our social measures and our unique national identity.
Let me make this crystal clear: if Canada wants to once again wage war over Quebec's societal choices, it will have to contend with the Bloc Québécois.",Bloc Québécois,La Pointe-de-l'Île,Mario Beaulieu,http://www.parl.gc.ca/Parliamentarians/en/members/mario-beaulieu(214282)
4755245,ca.proc.d.2018-10-04.10289448,2018-10-04,da91c83a-bab4-427f-b9e4-973025dbcab0,215879,"Mr. Darren Fisher (Dartmouth—Cole Harbour, Lib.)",,Statements By Members,Paddling,,"Mr. Speaker, I rise today to celebrate Dartmouth—Cole Harbour's beautiful Lake Banook and Dartmouth, Nova Scotia's paddling culture.
In Dartmouth, folks do not ask if people paddle, they ask where they paddle.
Last month, Lake Banook successfully hosted the 2018 Pan-American Canoe Sprint Championships. Over 350 elite paddlers from more than 16 countries competed on our world-recognized natural race course.
I want to thank and commend the folks in Atlantic Division CanoeKayak Canada, Banook Canoe Club, Mic Mac Amateur Aquatic Club, Abenaki Aquatic Club, Senobe Aquatic Club and all the incredible volunteers who worked so hard to make this event a success.
Paddling has always been a huge part of Dartmouth's identity and its culture, and Lake Banook is our world stage to showcase our pride in our community.
In 2020, Lake Banook will host the world championships for the third time.
 I invite all members to come to beautiful Dartmouth, Nova Scotia in 2020 to experience all that Lake Banook has to offer.",Liberal,Dartmouth—Cole Harbour,Darren Fisher,http://www.parl.gc.ca/Parliamentarians/en/members/darren-fisher(215879)
4755246,ca.proc.d.2018-10-04.10289461,2018-10-04,55c46957-54e9-422a-8afd-7c709bcf16a0,217975,"Mr. John Barlow (Foothills, CPC)",,Statements By Members,Mary Gillard,,"Mr. Speaker, she was a loving mother, grandmother, wife, but, most important, Mary Gillard was a beloved educator.
Mary passed away earlier this summer on her 95th birthday, but the impact she had on her community will be her long-lasting legacy.
Over the course of an outstanding 65-year teaching career, which lasted until she was 82, she inspired generations of Albertans. Mary believed that every one of her students had a unique gift. She taught them work ethics and the importance of community, but, most important, that respect must be earned. She was right.
A mentor and an educator, Mary was honoured multiple times for her teaching and her community support. She was given the Silver Falcon Award for outstanding service to the community and youth, the Integrity Award, presented by the Okotoks Rotary, and the school division gave her the outstanding teaching award when she was 87.
Mary shaped the hearts and minds of so many in our community, grandparents, parents, sons and daughters, including my own. For generations of Okotokians, Mary was a guiding light in the classroom and the community.
Together, we honour the life and legacy of this outstanding, inspiring woman.",Conservative,Foothills,John Barlow,http://www.parl.gc.ca/Parliamentarians/en/members/john-barlow(217975)
4755247,ca.proc.d.2018-10-04.10289465,2018-10-04,00000000-0000-0000-0000-000000000000,237232,"Mr. Gordie Hogg (South Surrey—White Rock, Lib.)",,Statements By Members,Politics,,"Mr. Speaker, how do we know what we know? Politician philosopher Daniel Patrick Moynihan once wisely said, “Everyone is entitled to his own opinion, but not to his own facts.”
However, often we deal with people who seem to enjoy using their own facts. It seems that anyone can find his or her own set of facts and then use those facts to reinforce his or her own opinions.
The great Stephen Colbert once termed the phrase “truthiness”, which is meant to denote how smart, sophisticated people, like all of us in the House, can go awry on questions of fact, ideas that just seem right without reference to logic or intellectual rigour, as hard as that may be to believe.
However, this is true in all walks of life, but especially true in politics. It seems that with increased politicization of debate, there comes increased public cynicism, which is probably why polling has recently shown that four out of five Canadians believe that when politicians make public statements, they tell the truth less than half the time. I trust that all of us in the House are exempt from that admonishment.
Whether it is facts, logic or some form of “truthiness”, it seems important that we consider the trust that Canadians place in each of us as their representatives when we choose which of our set of facts to embrace.",Liberal,South Surrey—White Rock,Gordie Hogg,http://www.parl.gc.ca/Parliamentarians/en/members/gordie-hogg(237232)
4755248,ca.proc.d.2018-10-04.10289469,2018-10-04,aa073ec9-d887-4192-a2ff-f3acbd6709b2,217276,"Mr. Scott Duvall (Hamilton Mountain, NDP)",,Statements By Members,Pensions,,"Mr. Speaker, after three years the government has done little to help Canadian seniors and retirees.
The Prime Minister promised during the election campaign to use every tool in the toolbox to fix Canada's flawed bankruptcy and insolvency law to protect workers' pensions, but so far has done nothing.
After news that 18,000 Sears retirees would lose 30% of their pensions, we still heard nothing from the government.
The government made a promise to consult in its last budget, but clearly Liberal promises are not worth the paper they are written on.
Changing the laws to protect workers' pensions is not hard. My Bill C-384 and Liberal Senator Art Eggleton's Bill S-253 lay out straightforward measures to fix the problems. Still, the government refuses to act.
For three years I have been asking the government to change the laws and protect Canadian pensioners. Every time I get back the same non-answers. This lack of respect is insulting to Canadian workers and retirees.
Let us stop the pension theft.",New Democratic Party,Hamilton Mountain,Scott Duvall,http://www.parl.gc.ca/Parliamentarians/en/members/scott-duvall(217276)
4755249,ca.proc.d.2018-10-04.10289478,2018-10-04,34585e7d-930f-472a-a618-495ca92cd6a9,215939,"Mr. Ramez Ayoub (Thérèse-De Blainville, Lib.)",,Statements By Members,Thanksgiving,,"Mr. Speaker, here is what people need to know about Thanksgiving other than the fact that it is a statutory holiday.
Thanksgiving has its roots in indigenous peoples' fall harvest celebrations dating back over 2,000 years. After the arrival of European settlers, an explorer by the name of Martin Frobisher celebrated the first Thanksgiving in 1578 in Newfoundland. 
I have just one piece of advice for turkeys: Run away! Run away! This weekend, three million turkeys will be eaten in Canada along with cranberries, which were traditionally harvested by Algonquins and used at celebrations as a sign of peace.
Thanksgiving is a celebration of life, family and peace. Happy Thanksgiving, everyone.",Liberal,Thérèse-De Blainville,Ramez Ayoub,http://www.parl.gc.ca/Parliamentarians/en/members/ramez-ayoub(215939)
4755250,ca.proc.d.2018-10-04.10289483,2018-10-04,661a3062-86d1-4ba3-9e70-81c866aa2fc3,216864,"Mr. David Anderson (Cypress Hills—Grasslands, CPC)",,Statements By Members,Cambodia,,"Mr. Speaker, the loss of democracy in any country should concern us. Cambodia is falling back into the darkness it experienced in the past. Prime Minister Hun Sen has destroyed democratic institutions and practices, he has outlawed the opposition and jailed opposition leader Kem Sokha. The July election was fixed and illegitimate.
Cambodia's history as a one-party state has had long-lasting consequences that the Cambodian people have worked hard to overcome. Democracy is foundational for the establishment of human rights. Exiled Cambodian leaders like Mu Sochua have addressed members of this House, calling on Canada to speak out.
Today, I call on the Liberal government to press for the restoration of democracy in Cambodia and call for Kem Sokha's immediate release. We call for the restoration of the rights of the opposition and the new election. Until then, we ask that the government not recognize the representatives of this illegitimate regime.",Conservative,Cypress Hills—Grasslands,David Anderson,http://www.parl.gc.ca/Parliamentarians/en/members/david-anderson(216864)
4755251,ca.proc.d.2018-10-04.10289487,2018-10-04,bbf2ffbd-6780-4792-8a0a-fae1bd72a6c4,220022,"Mr. Arif Virani (Parkdale—High Park, Lib.)",,Statements By Members,Sex Education Curriculum,,"Mr. Speaker, this Thanksgiving, I give thanks for the incredible young people in Parkdale—High Park, students who had the courage to stand up and be heard on something that is vital: their education. 
In 2015, Ontario revised its sexual education curriculum to bring it into the 21st century, to address things like same-sex families, gender identity, online bullying and consent, but the new Ontario government has seen fit to reverse that curriculum, to take it back to 1998 when things like the Internet and online sexual predatory activity were in their infancy. This reversion is not only unwelcome, it is unhelpful. It prevents our children from learning how to protect themselves. 
However, it is not just me who disagrees with the reversion. It is also hundreds of my young constituents from Parkdale Collegiate, Western Tech, Ursula Franklin Academy, TheStudentSchool and Humberside Collegiate who walked out of class on September 21 to say, “We do not consent to taking education backward”.
 Today, I lend my voice to theirs. Sex education must be modern and inclusive, and empower our young people about how to stay safe. ",Liberal,Parkdale—High Park,Arif Virani,http://www.parl.gc.ca/Parliamentarians/en/members/arif-virani(220022)
4755252,ca.proc.d.2018-10-04.10289490,2018-10-04,500229ce-460b-45f9-93ce-abf974f9787d,229492,"Ms. Kate Young (London West, Lib.)",,Statements By Members,Turner Drug Store,,"Mr. Speaker, small businesses make up 98% of Canadian businesses and employ over 10 million hard-working Canadians from coast to coast to coast. 
One such small business is Turner Drug Store, an independent pharmacy located in my riding of London West, which recently celebrated its 80th anniversary. Jeffrey Robb, a pharmacist and the current owner, has worked at Turner Drug Store since 1974, when he was just 14 years old. This small business holds a special place in the hearts of many Londoners as it has provided pharmaceutical, vitamin and herbal remedies to the community for eight decades. Our government knows the fundamental role that small businesses play in our economy and we will continue to support their growth and success.
I would like to extend my sincerest congratulations to Turner Drug Store for reaching this astounding milestone.",Liberal,London West,Kate Young,http://www.parl.gc.ca/Parliamentarians/en/members/kate-young(229492)
4755253,ca.proc.d.2018-10-04.10289529,2018-10-04,00000000-0000-0000-0000-000000000000,236972,"Mr. Dane Lloyd (Sturgeon River—Parkland, CPC)",,Statements By Members,Carbon Pricing,,"Mr. Speaker, this week LNG Canada approved a groundbreaking $40-billion investment in developing Canada's liquefied natural gas industry. The Liberals would like to claim that their carbon tax plan is working, but megaprojects like LNG Canada cannot move forward under the spectre of the Liberal carbon tax on everything. 
Provincial governments across Canada get it. We cannot grow the economy by adding new taxes. The Manitoba government is the latest to pull out of this Liberal carbon tax scam, and others are soon to follow. That is why the B.C. government gave LNG a pass on new carbon taxes. The project would not have gone forward otherwise. 
It is time for the Liberals to recognize that their carbon tax-and-spend agenda is failing Canadian businesses and Canadian families.",Conservative,Sturgeon River—Parkland,Dane Lloyd,http://www.parl.gc.ca/Parliamentarians/en/members/dane-lloyd(236972)
4755254,ca.proc.d.2018-10-04.10289533,2018-10-04,115aadf7-f4d7-4c9d-9537-860cf864ad0c,234499,"Mrs. Salma Zahid (Scarborough Centre, Lib.)",,Statements By Members,Royal Canadian Legion,,"Mr. Speaker, I recently had the privilege of attending a parade recognizing the 50th anniversary of the Royal Canadian Legion, Branch 617, in my riding of Scarborough Centre.
Branch 617 is proudly known as the “Dambusters” commemorating the iconic air raid of the Second World War. Colleagues may have seen the movie.
Since its founding, Branch 617 has served our veterans, providing a place for them to socialize with their peers. Their poppy campaign supports services for veterans who need help and the annual Remembrance Day ceremony at their cenotaph ensures that we will remember them. They also support Squadron 166 of the Royal Canadian Air Cadets and the NLCC Prince of Wales of the Navy League, helping to instill a spirit of responsibility, discipline and leadership in the next generation.
I would like to congratulate Branch 617 on its 50th anniversary and thank all of our legion branches across Canada. ",Liberal,Scarborough Centre,Salma Zahid,http://www.parl.gc.ca/Parliamentarians/en/members/salma-zahid(234499)
4755255,ca.proc.d.2018-10-04.10289537,2018-10-04,18e36567-4082-4ce3-a35b-d4aba65560ca,234557,"Mr. David Lametti (LaSalle—Émard—Verdun, Lib.)",,Statements By Members,LaSalle—Émard—Verdun,,"Mr. Speaker, it is my pleasure and my honour to welcome some of my constituents to Ottawa, for the third annual day on the Hill. I have been hosting this event since I was elected in 2015 as member for LaSalle—Émard—Verdun. We are elected to represent the interests of our constituents in the House to the best of our abilities. It is a real privilege for me to be able to welcome the people I am so proud to represent here in the House every day. 
I want to thank the people of LaSalle—Émard—Verdun for their confidence and for taking time to travel to the Hill today. I thank them for their interest, their passion and their hard work. It is what drives me to accomplish my duties as an MP.",Liberal,LaSalle—Émard—Verdun,David Lametti,http://www.parl.gc.ca/Parliamentarians/en/members/david-lametti(234557)
4755256,ca.proc.d.2018-10-04.10289541,2018-10-04,3a48d31a-42fc-4320-a84f-da61c251bccd,237026,"Mr. Blaine Calkins (Red Deer—Lacombe, CPC)",,Statements By Members,Canada Winter Games Torch Relay,,"Mr. Speaker, less than an hour ago, many of my colleagues including my good friend for Red Deer—Mountain View and myself, had the privilege of taking part in a torch-lighting ceremony at the Centennial Flame. This ceremony was the official start of the Canada Games Torch Relay in advance of the 2019 Canada Winter Games.
 The torch relay is an important part of the Canada Games and it will unite communities across our nation. This is the first time ever the torch relay will travel Canada-wide to mark the games with 48 communities from coast to coast participating. 
A huge thanks to MNP for sponsoring the torch relay, to the games committee, to staff and volunteers who are working tirelessly to organize this incredible event, and to all of the torchbearers who have been nominated to carry the torch on behalf of their communities.
 In 134 days the games will begin, and we are ready to welcome Canada to central Alberta to join the festivities and watch our amazing athletes perform. Red Deer is ready and everyone is invited.",Conservative,Red Deer—Lacombe,Blaine Calkins,http://www.parl.gc.ca/Parliamentarians/en/members/blaine-calkins(237026)
4755257,ca.proc.d.2018-10-04.10289547,2018-10-04,2e1280c7-9cb0-4dee-9db6-0a6b0d244592,215929,"Mr. Raj Saini (Kitchener Centre, Lib.)",,Statements By Members,Kitchener-Waterloo Oktoberfest,,"Mr. Speaker, Canadians of German origin are one of the largest ancestral groups in Canada. One out of 10 Canadians is of German ancestry, and one of every five lives where I do in Waterloo region. The Kitchener-Waterloo Oktoberfest, now marking its 50th anniversary, is the largest Oktoberfest celebration outside of Germany. It is a nine-day celebration of German heritage, filled with food, music and festivities.
 Colleagues should put on their lederhosen and dirndls and experience the gemütlichkeit as they polka the night away at one of our 17 Festhallen.
 On behalf of myself and the members for Kitchener South—Hespeler, Kitchener—Conestoga, Cambridge and Waterloo, it gives me great pleasure to invite all members to join us tomorrow at Kitchener City Hall for the official keg-tapping opening ceremony.",Liberal,Kitchener Centre,Raj Saini,http://www.parl.gc.ca/Parliamentarians/en/members/raj-saini(215929)
