basepk,hid,speechdate,pid,opid,speakeroldname,speakerposition,maintopic,subtopic,subsubtopic,speechtext,speakerparty,speakerriding,speakername,speakerurl
4766692,ca.proc.d.2018-12-13.10446693,2018-12-13,07cf5767-802c-406c-92a7-7dc92af79b40,229526,"Mr. Kevin Lamoureux (Parliamentary Secretary to the Leader of the Government in the House of Commons, Lib.)",,Routine Proceedings,Government Response to Petitions,,"Mr. Speaker, pursuant to Standing Order 36(8), I have the honour to table, in both official languages, the government's response to eight petitions.",Liberal,Winnipeg North,Kevin Lamoureux,http://www.parl.gc.ca/Parliamentarians/en/members/kevin-lamoureux(229526)
4766693,ca.proc.d.2018-12-13.10446697,2018-12-13,fc02fe5c-f4bc-451c-b921-86c4794d1d1d,234722,"Hon. John McKay (Scarborough—Guildwood, Lib.)",,Routine Proceedings,Committees of the House,Public Safety and National Security,"Mr. Speaker, I have the honour to table, in both official languages, the 30th report of the Standing Committee on Public Safety and National Security.
Pursuant to Standing Order 109, the committee requests that the government table a comprehensive response to its report.
Mr. Speaker, may I take this opportunity to wish you and yours a merry Christmas and a happy new year, and particularly to compliment the public safety committee, which has worked admirably throughout this entire year.",Liberal,Scarborough—Guildwood,John McKay,http://www.parl.gc.ca/Parliamentarians/en/members/john-mckay(234722)
4766694,ca.proc.d.2018-12-13.10446700,2018-12-13,fc02fe5c-f4bc-451c-b921-86c4794d1d1d,234722,"Hon. John McKay (Scarborough—Guildwood, Lib.)",,Routine Proceedings,Modern Slavery Act,," moved for leave to introduce Bill C-423, An Act respecting the fight against certain forms of modern slavery through the imposition of certain measures and amending the Customs Tariff.
Mr. Speaker, in the arc of Judeo-Christian history, the seminal event is the enslavement of the Israelites by the Egyptians, and the subsequent flight to freedom. That is embedded in the theology and psyche of Jews and Christians alike.
The gospel of Jesus talks about freedom throughout. Of course, unfortunately, the lineup of theology and practice does not always occur. Regrettably, the entire British Empire was built upon the notion of slavery, and its economic underpinnings were slavery.
It took possibly the most significant member of Parliament in the history of Westminster Parliament, namely William Wilberforce, to destroy the underpinnings of the British Empire by destroying slavery.
Unfortunately, slavery is still here. In fact, members will be shocked to know that there are more people enslaved now than there ever were at the height of the Atlantic slave trade.
This bill gives an opportunity for consumers to know whether, in fact, anywhere along the supply chain of the product they are buying or the service they are using, slave or forced labour conditions applied.
I am anticipating that this bill will receive both pan-Canadian support and cross-party support. It is my honour to introduce this bill and my hope that it moves through the process quickly.
 (Motions deemed adopted, bill read the first time and printed) ",Liberal,Scarborough—Guildwood,John McKay,http://www.parl.gc.ca/Parliamentarians/en/members/john-mckay(234722)
4766695,ca.proc.d.2018-12-13.10446709,2018-12-13,831322ab-9fa6-437e-92ba-1b4525f8242d,216505,"Mr. Pat Kelly (Calgary Rocky Ridge, CPC)",,Routine Proceedings,Canada Revenue Agency Act,," moved for leave to introduce Bill S-243, An Act to amend the Canada Revenue Agency Act (reporting on unpaid income tax).
Mr. Speaker, it is indeed my pleasure to introduce the fairness for all Canadian taxpayers act, measuring the tax gap to fight international tax evasion.
This bill is a common-sense measure that will help ensure accountability to parliamentarians as we fight tax evasion, in particular international tax evasion, something that I am sure is very important to all Canadians. Indeed, I hope I will have the support of all parties in this matter, because I am sure that most parliamentarians would take very seriously the issue of tax evasion and would like to see increased measures to ensure accountability for the agency as it combats international tax evasion and avoidance.
 (Motion agreed to and bill read the first time)",Conservative,Calgary Rocky Ridge,Pat Kelly,http://www.parl.gc.ca/Parliamentarians/en/members/pat-kelly(216505)
4766696,ca.proc.d.2018-12-13.10446717,2018-12-13,b37cad30-26f6-40c6-8e4c-dd3a0ba841bb,217477,"Mrs. Cheryl Gallant (Renfrew—Nipissing—Pembroke, CPC)",,Routine Proceedings,Petitions,Firearms,"Mr. Speaker, I am pleased to present a petition signed by Canadians from the ridings of Kanata—Carleton, Orléans, and Kingston and the Islands. They call on the House of Commons to respect the rights of law-abiding firearms owners and reject the Prime Minister's plan to waste taxpayers' money studying a ban on guns that are already banned.",Conservative,Renfrew—Nipissing—Pembroke,Cheryl Gallant,http://www.parl.gc.ca/Parliamentarians/en/members/cheryl-gallant(217477)
4766697,ca.proc.d.2018-12-13.10446720,2018-12-13,9fb311fc-3875-4698-b13c-014f0d819393,217587,"Mr. Colin Carrie (Oshawa, CPC)",,Routine Proceedings,Petitions,Canada Summer Jobs Initiative,"Mr. Speaker, I rise to present a petition from constituents in my riding of Oshawa that calls on the Prime Minister to defend the freedoms of conscious thought and belief and withdraw the attestation requirement for applicants to the Canada summer jobs program. There have been some changes, but the Liberals still have these requirements and people are very concerned. This is an issue of conscience and rights, and the Prime Minister needs to be told over and over again to do the right thing.",Conservative,Oshawa,Colin Carrie,http://www.parl.gc.ca/Parliamentarians/en/members/colin-carrie(217587)
4766698,ca.proc.d.2018-12-13.10446723,2018-12-13,661a3062-86d1-4ba3-9e70-81c866aa2fc3,216864,"Mr. David Anderson (Cypress Hills—Grasslands, CPC)",,Routine Proceedings,Petitions,Canada Summer Jobs Initiative,"Mr. Speaker, a number of citizens from Oshawa have been writing to me. They are concerned about section 2 of the Canadian Charter of Rights and Freedoms, which identifies freedom of conscience, thought and freedom of belief as fundamental freedoms. They say the government must defend the rights of all Canadians, regardless of whether the current government agrees with them. They believe the current government's attestation requiring Canada summer jobs program applicants to hold the same views as the government contravene the Canadian Charter of Rights and Freedoms. 
The petitioners call on the government to defend the freedoms of conscience, thought and belief by withdrawing the attestation requirement that still exists for applicants to the Canada summer jobs program.",Conservative,Cypress Hills—Grasslands,David Anderson,http://www.parl.gc.ca/Parliamentarians/en/members/david-anderson(216864)
4766699,ca.proc.d.2018-12-13.10446756,2018-12-13,363e30d6-e47b-4c39-91ad-667deb63009c,217115,"Ms. Sheila Malcolmson (Nanaimo—Ladysmith, NDP)",,Routine Proceedings,Petitions,Status of Women,"Mr. Speaker, because front-line domestic violence workers are saving women's lives, and because they are the most underfunded non-profit group in the country, petitioners from Nanaimo, Ladysmith and Ottawa call on the government to recognize the need for reliable, long-term core operations funding. Domestic violence shelters and feminist organizations are struggling to keep the lights on and to keep staff in place. They do not need program funding; they need core operations funding. 
The petitioners urge the government to direct federal funding to women's organizations and dedicate the political and financial support they need to keep women in our country alive.",New Democratic Party,Nanaimo—Ladysmith,Sheila Malcolmson,http://www.parl.gc.ca/Parliamentarians/en/members/sheila-malcolmson(217115)
4766700,ca.proc.d.2018-12-13.10446790,2018-12-13,cad621a1-daf5-4d48-b500-1fc5344b5646,217719,"Mr. David Sweet (Flamborough—Glanbrook, CPC)",,Routine Proceedings,Petitions,Canada Summer Jobs Initiative,"Mr. Speaker, similar to others that have been presented, I have a petition from dozens of Canadians who believe the government's attestation requiring Canada summer jobs program applicants to hold the same views as the government would contravene the Canadian Charter of Rights and Freedoms. They call upon the Prime Minister to defend the freedoms of conscience, thought and belief by withdrawing the attestation requirement for applicants to the Canada summer jobs program.",Conservative,Flamborough—Glanbrook,David Sweet,http://www.parl.gc.ca/Parliamentarians/en/members/david-sweet(217719)
4766701,ca.proc.d.2018-12-13.10446792,2018-12-13,07cf5767-802c-406c-92a7-7dc92af79b40,229526,"Mr. Kevin Lamoureux (Parliamentary Secretary to the Leader of the Government in the House of Commons, Lib.)",,Routine Proceedings,Questions on the Order Paper,,"Mr. Speaker, the following question will be answered today: No. 2026.",Liberal,Winnipeg North,Kevin Lamoureux,http://www.parl.gc.ca/Parliamentarians/en/members/kevin-lamoureux(229526)
4766702,ca.proc.d.2018-12-13.p5739863,2018-12-13,68bad047-6aec-43e2-b870-7bc501110873,218373,Mr. Ziad Aboultaif,,Routine Proceedings,Questions on the Order Paper,Question No. 2026,"With regard to the government's decision to resume funding of the United Nations Relief and Works Agency for Palestine Refugees in the Near East (UNRWA): (a) has the government put in place enhanced due diligence and accountability measures with respect to the educational needs of Palestinian children and youth, and the adopted curriculum; and (b) if the answer in (a) is affirmative, (i) when were the measures established, (ii) what are the measures, (iii) who is responsible within the government for oversight of the implementation of these enhanced due diligence and accountability measures?",Conservative,Edmonton Manning,Ziad Aboultaif,http://www.parl.gc.ca/Parliamentarians/en/members/ziad-aboultaif(218373)
4766703,ca.proc.d.2018-12-13.p5739864,2018-12-13,6e685d19-e124-452d-b395-5deedc595b4c,213943,"Hon. Marie-Claude Bibeau (Minister of International Development, Lib.)",,Routine Proceedings,Questions on the Order Paper,Question No. 2026,"Mr. Speaker, the following reflects a consolidated response approved on behalf of Global Affairs Canada ministers.
With regard to the government’s decision to resume funding of the United Nations Relief and Works Agency for Palestine Refugees in the Near East, UNRWA, and (a) specifically, Canada exercises enhanced due diligence for all international assistance funding for Palestinians, including UNRWA. All programming and funding mechanisms, including those for the West Bank and Gaza, are thoroughly examined to be consistent with Canadian values and legislation, and to meet the highest standards of accountability.
With regard to (b)(i), Canada has exercised enhanced due diligence and monitored accountability for funding for UNRWA since Canada resumed its support to the UN Agency in 2016.
With regard to (b)(ii), Canada’s enhanced due diligence activities include strong anti-terrorism provisions in funding agreements, ongoing oversight, regular site visits, and a systematic screening process.
Canada and UNRWA have agreed to a framework for cooperation that outlines shared commitments and Canada’s expectations regarding the implementation of UNRWA’s reform initiatives, regular monitoring and reporting, and compliance with Canadian anti-terrorism requirements. This framework for cooperation is publicly available on the Global Affairs Canada internet site: http://international.gc.ca/world-monde/issues_development-enjeux_developpement/priorities-priorites/where-ou/gac_un_unrwa-amc_nu_unrwa.aspx?lang=eng .
Canada’s funding also contributes to UNRWA’s neutrality activities, which include regular inspections of the agency’s facilities by specially trained UNRWA officers who can identify, report, and take action on violations of neutrality; training for UNRWA staff on neutrality, including in social media, and for senior staff on how to carry out effective installation inspections; promotion of students’ knowledge and skills reflecting United Nations, UN, values, including human rights, conflict resolution, gender equality and tolerance, through educational activities and materials; and UNRWA’s development, distribution and use of additional educational materials, as part of the agency’s approach to enable teachers to promote neutrality. This support also builds on funding Canada provided from 2017 to 2019 to hire a neutrality coordinator to monitor activities and respond promptly to allegations of neutrality violations.
This assistance demonstrates how Canada and UNRWA are working together to ensure respect for the humanitarian principles of humanity, neutrality, operational independence and impartiality. This is essential to the effective delivery of its work and to Canada’s continued support to UNRWA.
In addition, our funding enables us to be an active member of UNRWA’s advisory commission. We continue to work on a regular basis with UNRWA and other donor governments to advance reforms related to governance, effectiveness, monitoring and financial administration. Canada’s participation provides an opportunity for oversight, influence and engagement on key issues. Canada will continue to take all allegations of neutrality violations very seriously.
It is a long-standing policy for UNRWA to use the textbooks of the jurisdiction in which UNRWA schools operate. This allows students to sit for local exams. UNRWA has in place a formal framework to review all textbooks and, where needed, provides additional training for teachers to address any problematic issues related to neutrality, bias, gender equality or age appropriateness.
With regard to (b)(iii), monitoring and oversight are conducted by Global Affairs Canada officials and implementing partners. Each funding instrument requires partner organizations, including UNRWA, to provide regular reporting on work plans and activities, financial records, and results achieved. Global Affairs Canada officials reserve the right to request additional information or clarification from partners as needed, to ensure compliance with the terms of funding instruments, to manage risks, to assess results or to obtain further financial details.
Given that UNRWA has operations in the West Bank, Gaza, Jordan, Lebanon, and Syria, the Government of Canada officials based across the region closely monitor project activities and results.",Liberal,Compton—Stanstead,Marie-Claude Bibeau,http://www.parl.gc.ca/Parliamentarians/en/members/marie-claude-bibeau(213943)
4766704,ca.proc.d.2018-12-13.10446797,2018-12-13,07cf5767-802c-406c-92a7-7dc92af79b40,229526,"Mr. Kevin Lamoureux (Parliamentary Secretary to the Leader of the Government in the House of Commons, Lib.)",,Routine Proceedings,Questions Passed as Orders for Return,,"Mr. Speaker, if the government's response to Questions Nos. 2025 and 2027 to 2029 could be made orders for return, these returns would be tabled immediately.",Liberal,Winnipeg North,Kevin Lamoureux,http://www.parl.gc.ca/Parliamentarians/en/members/kevin-lamoureux(229526)
4766705,ca.proc.d.2018-12-13.p5739876,2018-12-13,,,,,Routine Proceedings,Questions Passed as Orders for Return,, Is that agreed?,,,The Speaker,
4766706,ca.proc.d.2018-12-13.p5739877,2018-12-13,,,,intervention,Routine Proceedings,Questions Passed as Orders for Return,, Agreed.,,,Some hon. members,
4766707,ca.proc.d.2018-12-13.p5739878,2018-12-13,16ec30ba-16f2-4777-ab8d-db372238e239,235144,Mrs. Karen Vecchio,,Routine Proceedings,Questions Passed as Orders for Return,Question No. 2025,"With regard to the government’s announcement on October 23, 2018, relating to how it will implement a federal carbon tax on provinces that do not want it: what are the government’s projected administration costs related to a federal carbon tax for each of the next five years, broken down by type of expenditure?",Conservative,Elgin—Middlesex—London,Karen Vecchio,http://www.parl.gc.ca/Parliamentarians/en/members/karen-vecchio(235144)
4766708,ca.proc.d.2018-12-13.p5739879,2018-12-13,,,,stagedirection,Routine Proceedings,Questions Passed as Orders for Return,Question No. 2025,(Return tabled),,,,
4766709,ca.proc.d.2018-12-13.p5739880,2018-12-13,a5da7604-b429-46d1-b702-0e3be1febcec,236946,Mr. Bob Saroya,,Routine Proceedings,Questions Passed as Orders for Return,Question No. 2027,"With regard to the February 2018 trip to India taken by the Prime Minister and other ministers: (a) what is the latest total of all costs incurred related to the trip; and (b) what are the details of all contracts and invoices related to the trip which were not previously revealed in the government’s response to Q-1835, including (i) date, (ii) vendor, (iii) amount, (iv) description of goods or services provided, (v) file number?",Conservative,Markham—Unionville,Bob Saroya,http://www.parl.gc.ca/Parliamentarians/en/members/bob-saroya(236946)
4766710,ca.proc.d.2018-12-13.p5739881,2018-12-13,,,,stagedirection,Routine Proceedings,Questions Passed as Orders for Return,Question No. 2027,(Return tabled),,,,
4766711,ca.proc.d.2018-12-13.p5739882,2018-12-13,16ec30ba-16f2-4777-ab8d-db372238e239,235144,Mrs. Karen Vecchio,,Routine Proceedings,Questions Passed as Orders for Return,Question No. 2028,"With regard to the response by the Parliamentary Secretary to the Minister of Public Safety and Emergency Preparedness in question period on October 26, 2018, that a matter was before the courts in response to a question about the date on which James Cudmore was offered a job by the Minister of National Defence: is it the government's position that the matter of the Minister's job offer to James Cudmore is an issue currently before the courts and, if so, what court is currently considering the matter?",Conservative,Elgin—Middlesex—London,Karen Vecchio,http://www.parl.gc.ca/Parliamentarians/en/members/karen-vecchio(235144)
4766712,ca.proc.d.2018-12-13.p5739883,2018-12-13,,,,stagedirection,Routine Proceedings,Questions Passed as Orders for Return,Question No. 2028,(Return tabled),,,,
4766713,ca.proc.d.2018-12-13.p5739884,2018-12-13,16ec30ba-16f2-4777-ab8d-db372238e239,235144,Mrs. Karen Vecchio,,Routine Proceedings,Questions Passed as Orders for Return,Question No. 2029,With regard to the impact of increased fuel cost as a result of the federal carbon tax on the Canadian Forces: (a) what was the total amount spent on fuel by the Canadian Forces in the 2017-18 fiscal year; (b) what is the projected increase in the amount spent on fuel by the Canadian Forces as a result of the carbon tax for each of the next five years; and (c) what are the projected total fuel expenditures for each of the next five years?,Conservative,Elgin—Middlesex—London,Karen Vecchio,http://www.parl.gc.ca/Parliamentarians/en/members/karen-vecchio(235144)
4766714,ca.proc.d.2018-12-13.p5739885,2018-12-13,,,,stagedirection,Routine Proceedings,Questions Passed as Orders for Return,Question No. 2029,(Return tabled),,,,
4766715,ca.proc.d.2018-12-13.10446947,2018-12-13,,,,,Routine Proceedings,Questions Passed as Orders for Return,,"Mr. Speaker, I ask that all remaining questions be allowed to stand.",,,Mr. Kevin Lamoureux,
4766716,ca.proc.d.2018-12-13.p5739887,2018-12-13,,,,,Routine Proceedings,Questions Passed as Orders for Return,, Is that agreed?,,,The Speaker,
4766717,ca.proc.d.2018-12-13.p5739888,2018-12-13,,,,intervention,Routine Proceedings,Questions Passed as Orders for Return,, Agreed.,,,Some hon. members,
4766718,ca.proc.d.2018-12-13.10446804,2018-12-13,48fc6e8f-3117-407b-bba3-bd6eede347ec,224672,"Hon. Bardish Chagger (Leader of the Government in the House of Commons, Lib.)",,Government Orders,Bill C-76—Time Allocation Motion,," moved:
 That in relation to the Senate amendment to Bill C-76, an Act to amend the Canada Elections Act and other Acts and to make certain consequential amendments, not more than one further sitting day shall be allotted to the consideration of the Senate amendment to the bill; and 
 That fifteen minutes before the expiry of the time provided for Government Orders on the day allotted to the consideration of the Senate amendment of said bill, any proceedings before the House shall be interrupted, if required for the purpose of this Order, and in turn every question necessary for the disposal of the stage of the bill then under consideration shall be put forthwith and successively without further debate or amendment. 
",Liberal,Waterloo,Bardish Chagger,http://www.parl.gc.ca/Parliamentarians/en/members/bardish-chagger(224672)
4766719,ca.proc.d.2018-12-13.10446808,2018-12-13,3176068f-62ee-4b2f-aacd-1131201c6db1,214707,The Speaker,,Government Orders,Bill C-76—Time Allocation Motion,,"Pursuant to Standing Order 67.1, there will now be a 30-minute question period. I invite hon. members who wish to ask questions to rise in their places so the Chair has some idea of the number of members who wish to participate in this question period.",Liberal,Halifax West,Geoff Regan,http://www.parl.gc.ca/Parliamentarians/en/members/geoff-regan(214707)
4766720,ca.proc.d.2018-12-13.10446811,2018-12-13,9d3d2220-818c-494e-8d58-29f7cee7b65d,216537,"Hon. Candice Bergen (Portage—Lisgar, CPC)",,Government Orders,Bill C-76—Time Allocation Motion,,"Mr. Speaker, I am so disappointed to see this happen yet again. I believe this is the 50th time the current government has shut down the ability of members of Parliament to speak, in only three short years. 
The Liberals came in on this self-righteous platform that they were going to be respecting Parliament and not moving time allocation and not shutting down debate, and this is the 50th time they have done it. They are doing it on a bill that would be rigging the system to help them in the next election. This is unbelievable to see yet again. 
We are in our last few days in this beautiful place, which will be shut down for a number of years. This is what the Liberals are leaving us to remember them by as we head off into the Christmas holidays: that this is the 50th time in only three years they are cutting off our ability to speak on behalf of our constituents.
How in the world can these Liberals say they respect Parliament, that they respect democracy and that they respect fairness? If this is their example, we really are in big trouble.",Conservative,Portage—Lisgar,Candice Bergen,http://www.parl.gc.ca/Parliamentarians/en/members/candice-hoeppner(216537)
4766721,ca.proc.d.2018-12-13.10446813,2018-12-13,69e429cb-3bd3-4744-95a0-701e3b95c115,229218,"Hon. Karina Gould (Minister of Democratic Institutions, Lib.)",,Government Orders,Bill C-76—Time Allocation Motion,,"Mr. Speaker, let us just be clear what we are debating today. We are debating a technical amendment made in the Senate that was a reflection of an all-party committee in the House of Commons. All political parties put forward this amendment, which would ensure the banning of foreign funding for partisan advertising at all times. This is very simply a technical amendment that would ensure this applies during the election period as well.
 There was a drafting error when the amendment was made in the procedure and House affairs committee, and this was an amendment all three political parties put forward. It is something that reflects the spirit of this place, because it is something we all agree on. 
That is why we are doing this. We need to make sure this is in place so that we do not have any foreign funding in the upcoming election.",Liberal,Burlington,Karina Gould,http://www.parl.gc.ca/Parliamentarians/en/members/karina-gould(229218)
4766722,ca.proc.d.2018-12-13.10446815,2018-12-13,2347a7b8-8e45-4c51-bdc6-f6c32375ad50,217233,"Mr. Brian Masse (Windsor West, NDP)",,Government Orders,Bill C-76—Time Allocation Motion,,"Mr. Speaker, it is important to ask the Minister of Democratic Institutions a question about democracy here in the House. Yesterday, there were Liberal members who did not show up to the industry committee because they were told to listen to the Prime Minister's speech. What ended up happening is we did not have quorum, and witnesses had to wait for over an hour. 
When we finally reconvened, the Liberal members said they were basically told by the whip to listen to the Prime Minister here in the chamber, instead of attending our committee.
We had people who had flown in and people on video conference for the meeting. The subsequent result was that we could only have five minutes each for rounds of questioning with the witnesses. One of them was Ticketmaster, which I had a particular interest in hearing from with regard to consumer rights and protection.
I would like to ask the Minister of Democratic Institutions why the whip would insist members stay to listen, and why the party would not even send one Liberal member so we could have quorum and hear from witnesses. I would like her to comment on the expenses and time associated with this sham.",New Democratic Party,Windsor West,Brian Masse,http://www.parl.gc.ca/Parliamentarians/en/members/brian-masse(217233)
