basepk,hid,speechdate,pid,opid,speakeroldname,speakerposition,maintopic,subtopic,subsubtopic,speechtext,speakerparty,speakerriding,speakername,speakerurl
4766874,ca.proc.d.2018-12-13.10447743,2018-12-13,bc2e82f3-02f1-46e2-b9be-7d5f04ddddc9,214106,"Hon. Marc Garneau (Minister of Transport, Lib.)",,Oral Questions,International Trade,,"Mr. Speaker, I have answered this question many times, so I will approach it differently.
 People taking new trains within the Quebec City–Windsor corridor will benefit from improved comfort, enhanced accessibility, better safety and cleaner travel. On top of this, with today's deal, Siemens aims to provide Canadian content of more than 20% in supplies and services.
The NDP says one thing in the House, but behind closed doors it admits that our trade deals work for Canadians.",Liberal,Notre-Dame-de-Grâce—Westmount,Marc Garneau,http://www.parl.gc.ca/Parliamentarians/en/members/marc-garneau(214106)
4766875,ca.proc.d.2018-12-13.10447746,2018-12-13,a71a1741-7ff2-4246-b0da-4622e96b10cf,235389,"Mr. Guy Caron (Rimouski-Neigette—Témiscouata—Les Basques, NDP)",,Oral Questions,International Trade,,"Mr. Speaker, I dare the Minister of Transport to go to La Pocatière and say that to Bombardier workers. 
 The United States requires guarantees of local content in bids for public transportation. China requires guarantees of local content in bids for public transportation. Here, the government says that we can do nothing and our hands are tied because of trade agreements. What a crock. The members of the Liberal caucus are worthless.",New Democratic Party,Rimouski-Neigette—Témiscouata—Les Basques,Guy Caron,http://www.parl.gc.ca/Parliamentarians/en/members/guy-caron(235389)
4766876,ca.proc.d.2018-12-13.p5740447,2018-12-13,,,,,Oral Questions,International Trade,, They are cowards.,,,Mr. Pierre Nantel,
4766877,ca.proc.d.2018-12-13.p5740448,2018-12-13,a71a1741-7ff2-4246-b0da-4622e96b10cf,235389,Mr. Guy Caron,,Oral Questions,International Trade,," They have no clout. The United States requires a minimum of 65% local content and requires that the final assembly be carried out in the U.S.
Why do the Liberals cave when the time comes to stand up for Canadian interests?",New Democratic Party,Rimouski-Neigette—Témiscouata—Les Basques,Guy Caron,http://www.parl.gc.ca/Parliamentarians/en/members/guy-caron(235389)
4766878,ca.proc.d.2018-12-13.10447750,2018-12-13,bc2e82f3-02f1-46e2-b9be-7d5f04ddddc9,214106,"Hon. Marc Garneau (Minister of Transport, Lib.)",,Oral Questions,International Trade,,"Mr. Speaker, the NDP clearly has no idea how a trade agreement works.
Speaking of Bombardier, we should talk about the $500-million AZUR contract awarded to La Pocatière.
Why does the NDP not point out that we have spent $154 million for VIA Rail in La Pocatière and that we have awarded contracts to CAD, in Montreal and Gaspé? These contracts were awarded in Quebec. The NDP has never mentioned those.",Liberal,Notre-Dame-de-Grâce—Westmount,Marc Garneau,http://www.parl.gc.ca/Parliamentarians/en/members/marc-garneau(214106)
4766879,ca.proc.d.2018-12-13.10447751,2018-12-13,3176068f-62ee-4b2f-aacd-1131201c6db1,214707,The Speaker,,Oral Questions,International Trade,,"Order. I would ask the hon. member for Longueuil—Saint-Hubert not to shout when someone else has the floor and, also, not to shout at all in the House.
The Hon. member for Sherbrooke.",Liberal,Halifax West,Geoff Regan,http://www.parl.gc.ca/Parliamentarians/en/members/geoff-regan(214707)
4766880,ca.proc.d.2018-12-13.10447752,2018-12-13,4c0122f7-7958-4cbd-b99e-9d70a4dca1e8,230115,"Mr. Pierre-Luc Dusseault (Sherbrooke, NDP)",,Oral Questions,Canada Revenue Agency,,"Mr. Speaker, two years after the Panama papers scandal, the Liberals have yet to do anything to tackle international tax evasion.
If someone earns $35,000 a year and owes $200 to the government, the CRA is super efficient. However, if someone hides millions of dollars in tax havens, the agency is unable to do anything at all and drags its feet.
The minister may say that her plan is working, but in the past three years she has had nothing to show Canadians. There have been no convictions, no charges and no recoveries related to international tax evasion.
Why do the Liberals always let the rich off the hook so easily?",New Democratic Party,Sherbrooke,Pierre-Luc Dusseault,http://www.parl.gc.ca/Parliamentarians/en/members/pierre-luc-dusseault(230115)
4766881,ca.proc.d.2018-12-13.10447754,2018-12-13,c58bb7da-2385-4bbf-a8f1-b781f634a80c,213875,"Hon. Diane Lebouthillier (Minister of National Revenue, Lib.)",,Oral Questions,Canada Revenue Agency,,"Mr. Speaker, the report by the Professional Institute of the Public Service of Canada confirms that the ill-considered cuts to the agency by the Harper government had devastating consequences.
Thanks to investments of more than $1 billion in the fight against tax evasion, our government has given the agency the resources it needed. Under our leadership, it hired 1,300 new auditors. We have done twice as many audits in three years as the Harper government did in 10 years.
Our plan is working and we are starting to see the results.",Liberal,Gaspésie—Les-Îles-de-la-Madeleine,Diane Lebouthillier,http://www.parl.gc.ca/Parliamentarians/en/members/diane-lebouthillier(213875)
4766882,ca.proc.d.2018-12-13.10447756,2018-12-13,b41c3b7e-c64f-4415-9f58-79d7462e5d8e,237464,"Mr. Peter Julian (New Westminster—Burnaby, NDP)",,Oral Questions,Canada Revenue Agency,,"What rubbish, Mr. Speaker. No charges have been laid. When regular people claim something on their taxes, they are given only 90 days to prove that it is a legal claim. It has been two years since the Panama papers revealed that many of the richest people in Canada had been stashing billions of dollars in illegal offshore tax havens, and still not a single charge has been laid. That is like playing Monopoly where the richest always get a get-out-of-jail-free card. 
This Christmas, instead of going after everyday people all the time, why does the Prime Minister not tell his minister to go after illegal offshore tax havens for a change?",New Democratic Party,New Westminster—Burnaby,Peter Julian,http://www.parl.gc.ca/Parliamentarians/en/members/peter-julian(237464)
4766883,ca.proc.d.2018-12-13.10447758,2018-12-13,c58bb7da-2385-4bbf-a8f1-b781f634a80c,213875,"Hon. Diane Lebouthillier (Minister of National Revenue, Lib.)",,Oral Questions,Canada Revenue Agency,,"Mr. Speaker, in our last three budgets, we invested over $1 billion to give the Canada Revenue Agency the tools it needs to go after tax cheats.
 With respect to the Panama papers, the CRA identified over 3,000 offshore entities associated with over 2,600 beneficial owners that have some link to Canada. The CRA has risk assessed over 80% of them. We also chose to tighten the rules for the voluntary disclosures program. The net is tightening.",Liberal,Gaspésie—Les-Îles-de-la-Madeleine,Diane Lebouthillier,http://www.parl.gc.ca/Parliamentarians/en/members/diane-lebouthillier(213875)
4766884,ca.proc.d.2018-12-13.p5740466,2018-12-13,,,,intervention,Oral Questions,Canada Revenue Agency,," Oh, oh!",,,An hon. member,
4766885,ca.proc.d.2018-12-13.10447759,2018-12-13,3176068f-62ee-4b2f-aacd-1131201c6db1,214707,The Speaker,,Oral Questions,Canada Revenue Agency,,"Order. I would remind the member for New Westminster—Burnaby that he had his chance to speak, and now it is time to listen.
The hon. member for Louis-Saint-Laurent.",Liberal,Halifax West,Geoff Regan,http://www.parl.gc.ca/Parliamentarians/en/members/geoff-regan(214707)
4766886,ca.proc.d.2018-12-13.10447760,2018-12-13,e277e13e-59ec-425f-a957-eb5e54d8cb62,217679,"Mr. Gérard Deltell (Louis-Saint-Laurent, CPC)",,Oral Questions,The Economy,,"Mr. Speaker, I am not sure if the net is tightening, but the deficit is certainly getting bigger.
Two days ago, the Parliamentary Budget Officer sounded the alarm once again: the next deficit could be as high as $30 billion.
Let us review the facts. Three years ago, these people were elected on a promise that there would be no deficit in 2019. A year ago, a $10-billion deficit was forecast. Six weeks ago, it was $20 billion. Now we are up to $30 billion.
The Liberals have completely lost control of the public purse. 
My question is very simple. When will we return to a balanced budget? ",Conservative,Louis-Saint-Laurent,Gérard Deltell,http://www.parl.gc.ca/Parliamentarians/en/members/gerard-deltell(217679)
4766887,ca.proc.d.2018-12-13.10447764,2018-12-13,d32cbf2b-5b28-4698-ba39-c1ac2f736c3e,234563,"Mr. Joël Lightbound (Parliamentary Secretary to the Minister of Finance, Lib.)",,Oral Questions,The Economy,,"Mr. Speaker, I thank my colleague for Louis-Saint-Laurent for giving me the opportunity to answer a question in this august chamber one last time before the holidays and the closing of Centre Block.
My colleague for Louis-Saint-Laurent is a history buff. He knows that in 2006, the Conservative government inherited the best fiscal position of any incoming government. The Conservatives were given impressive surpluses, but it took them only two years to squander those surpluses that the Paul Martin and Jean Chrétien Liberal governments had left them. 
The Conservatives are all about rhetoric and posturing. In 10 years, they gave Canadians the worst growth since the Second World War. We will take no lessons from that side of the House.",Liberal,Louis-Hébert,Joël Lightbound,http://www.parl.gc.ca/Parliamentarians/en/members/joel-lightbound(234563)
4766888,ca.proc.d.2018-12-13.10447792,2018-12-13,e277e13e-59ec-425f-a957-eb5e54d8cb62,217679,"Mr. Gérard Deltell (Louis-Saint-Laurent, CPC)",,Oral Questions,The Economy,,"Mr. Speaker, I thank my colleague from Louis-Hébert.
One does not need a history degree to know that three years ago Canada was the first country in the G7 to recover from the worst economic crisis since the Great Depression. That is the Conservative record, and we are proud of it.
As for the members opposite, they have been spending non-stop. They have completely lost control of the public purse. To make matters worse, they simply laugh it off when we tell them that they are going to rack up a $30-billion deficit.
I am giving the member for Louis-Hébert another chance to give Canadians a real answer, since this might be the last time he rises in the House this year. When will the Liberals balance the budget?",Conservative,Louis-Saint-Laurent,Gérard Deltell,http://www.parl.gc.ca/Parliamentarians/en/members/gerard-deltell(217679)
4766889,ca.proc.d.2018-12-13.10447797,2018-12-13,d32cbf2b-5b28-4698-ba39-c1ac2f736c3e,234563,"Mr. Joël Lightbound (Parliamentary Secretary to the Minister of Finance, Lib.)",,Oral Questions,The Economy,,"Mr. Speaker, speaking of history, the reason why Canada weathered the 2008 financial crisis relatively well is mainly that Paul Martin said no to Stephen Harper when he asked him to deregulate Canada's financial industry.
Despite all that, the Conservatives racked up $150 billion in debt and led us into a technical recession in 2015. Once again, Canadians had to bring in a Liberal government to clean up the Conservative government's mess. We created 800,00 jobs and lifted 300,000 people out of poverty. We have the strongest growth in the G7 and our debt-to-GDP ratio is on a downward track.",Liberal,Louis-Hébert,Joël Lightbound,http://www.parl.gc.ca/Parliamentarians/en/members/joel-lightbound(234563)
4766890,ca.proc.d.2018-12-13.p5740483,2018-12-13,,,,intervention,Oral Questions,The Economy,," Oh, oh!",,,An hon. member,
4766891,ca.proc.d.2018-12-13.10447799,2018-12-13,3176068f-62ee-4b2f-aacd-1131201c6db1,214707,The Speaker,,Oral Questions,The Economy,,"I would also ask the hon. member for Portneuf—Jacques-Cartier not to shout when someone else has the floor.
The hon. member for Aurora—Oak Ridges—Richmond Hill.",Liberal,Halifax West,Geoff Regan,http://www.parl.gc.ca/Parliamentarians/en/members/geoff-regan(214707)
4766892,ca.proc.d.2018-12-13.10447800,2018-12-13,6322565a-d236-4124-81f3-d869f865f7ef,237718,"Ms. Leona Alleslev (Aurora—Oak Ridges—Richmond Hill, CPC)",,Oral Questions,The Economy,,"Mr. Speaker, Canadians decided based on a promise that the Prime Minister made to balance the budget.
The other day the International Monetary Fund warned industrialized countries to “fix the roof while the sun shines” as the stars and clouds quickly amass over the global economy. However, the Prime Minister is doing the opposite. He continues to spend money we do not have with reckless abandon, which will ultimately lead to severe cuts of critical services when we need them the most.
When will the Prime Minister do the right thing, brace our economy for the storm and balance the budget?",Conservative,Aurora—Oak Ridges—Richmond Hill,Leona Alleslev,http://www.parl.gc.ca/Parliamentarians/en/members/leona-alleslev(237718)
4766893,ca.proc.d.2018-12-13.10447804,2018-12-13,d32cbf2b-5b28-4698-ba39-c1ac2f736c3e,234563,"Mr. Joël Lightbound (Parliamentary Secretary to the Minister of Finance, Lib.)",,Oral Questions,The Economy,,"Mr. Speaker, it is no wonder that now she is on that side, she knows a thing or two about cutting services. It is the Conservatives' side that cut services to veterans and cut pay specialists that led to the Phoenix pay system. It is their side that sent cheques to families of millionaires. That was their focus.
 I understand that they tried to cut their way to prosperity. It failed. We have taken a different approach that has been working for the last three years and that is working for Canadians from coast to coast to coast.",Liberal,Louis-Hébert,Joël Lightbound,http://www.parl.gc.ca/Parliamentarians/en/members/joel-lightbound(234563)
4766894,ca.proc.d.2018-12-13.10447807,2018-12-13,4626b9b7-420c-456d-9c7b-dea3794cb1c5,218746,"Mr. Alupa Clarke (Beauport—Limoilou, CPC)",,Oral Questions,The Economy,,"Mr. Speaker, I also really like history. During the financial crisis between 2008 and 2015, we released $80 billion from our economic action plan, we safeguarded 250,000 jobs and we posted the best performance of the OECD.
In 2015, the Prime Minister could not have been clearer when he said that the budget would be balanced in 2019. Not only did that not happen—which makes it a broken promise—but also the Liberals have no idea when the budget will be balanced. No government since 1867 has ever been so irresponsible with the public purse.
When will we see a balanced budget?",Conservative,Beauport—Limoilou,Alupa Clarke,http://www.parl.gc.ca/Parliamentarians/en/members/alupa-clarke(218746)
4766895,ca.proc.d.2018-12-13.10447810,2018-12-13,d32cbf2b-5b28-4698-ba39-c1ac2f736c3e,234563,"Mr. Joël Lightbound (Parliamentary Secretary to the Minister of Finance, Lib.)",,Oral Questions,The Economy,,"Mr. Speaker, no Conservative government since 1946 has posted a worse economic performance than Stephen Harper's Conservative government, which the member is so passionately defending. 
I invite him to review his history and check his facts. Under the Conservative government, Canada had the worst export growth in 69 years, as well as the worst job growth, because the Conservative approach failed. It focused on the wealthy by sending cheques to millionaires' families and increasing TFSA limits for the wealthy, thanks to boutique tax credits.
We took a completely different approach, which is working. We are reducing inequality and investing in Canadians.",Liberal,Louis-Hébert,Joël Lightbound,http://www.parl.gc.ca/Parliamentarians/en/members/joel-lightbound(234563)
4766896,ca.proc.d.2018-12-13.10447814,2018-12-13,ad4032f2-6bb1-497b-b146-f321cfb71ba9,218016,"Hon. Pierre Poilievre (Carleton, CPC)",,Oral Questions,The Economy,,"Mr. Speaker, in the early 2000s, the Conservative government paid off $40 billion of debt because we foresaw the difficult times that were ahead in the global economy.
By contrast, while the sun is shining in the global economy, the Liberal government is piling up record debt. Now Citigroup has produced a report saying that Canada us “flashing red warning lights” with respect to government debt. We go into this storm ahead more exposed now than ever before.
 When will the budget be balanced?",Conservative,Carleton,Pierre Poilievre,http://www.parl.gc.ca/Parliamentarians/en/members/pierre-poilievre(218016)
4766897,ca.proc.d.2018-12-13.10447817,2018-12-13,1a1a9dee-c228-40fc-b926-42f8441d84f0,214405,"Hon. Ralph Goodale (Minister of Public Safety and Emergency Preparedness, Lib.)",,Oral Questions,The Economy,,"Mr. Speaker, I know something of the era to which the gentleman was referring.
In 2006, the Conservative government inherited nine consecutive Liberal surpluses. It inherited $100 billion in fiscal flexibility. In less than two years, the Conservatives blew it all. Through reckless fiscal policy, it eliminated all the surplus and put the country back into deficit again, before, not because of, there was a recession in 2008. The recession made it worse.",Liberal,Regina—Wascana,Ralph Goodale,http://www.parl.gc.ca/Parliamentarians/en/members/ralph-goodale(214405)
4766898,ca.proc.d.2018-12-13.10447820,2018-12-13,3176068f-62ee-4b2f-aacd-1131201c6db1,214707,The Speaker,,Oral Questions,The Economy,,"Order, please. We all know it will get very quiet here soon, but perhaps not soon enough.",Liberal,Halifax West,Geoff Regan,http://www.parl.gc.ca/Parliamentarians/en/members/geoff-regan(214707)
4766899,ca.proc.d.2018-12-13.10447821,2018-12-13,ad4032f2-6bb1-497b-b146-f321cfb71ba9,218016,"Hon. Pierre Poilievre (Carleton, CPC)",,Oral Questions,The Economy,,"Mr. Speaker, that member is very upset, because that was back in the era where he helped defeat his government by bungling his way into an RCMP investigation of the income trusts.
In the first two years before the global economic crisis, the Conservative government paid off $40 billion of debt, which buffered us against the trouble which was ahead. We came out of the global recession before everyone else, and created a million jobs.
Why are the Liberals piling up so much debt now—",Conservative,Carleton,Pierre Poilievre,http://www.parl.gc.ca/Parliamentarians/en/members/pierre-poilievre(218016)
4766900,ca.proc.d.2018-12-13.10447822,2018-12-13,3176068f-62ee-4b2f-aacd-1131201c6db1,214707,The Speaker,,Oral Questions,The Economy,,The hon. Minister of Public Safety.,Liberal,Halifax West,Geoff Regan,http://www.parl.gc.ca/Parliamentarians/en/members/geoff-regan(214707)
4766901,ca.proc.d.2018-12-13.10447823,2018-12-13,1a1a9dee-c228-40fc-b926-42f8441d84f0,214405,"Hon. Ralph Goodale (Minister of Public Safety and Emergency Preparedness, Lib.)",,Oral Questions,The Economy,,"Mr. Speaker, I note the hon. gentleman omits the outcome of the investigation, which was complete vindication.
The Conservatives created the deficit before there was a recession. The recession made it worse, but they invented the deficit all by themselves and they never balanced the books ever again. The Conservatives added $150 billion in new debt. They put 216,000 more people on the unemployment rolls.",Liberal,Regina—Wascana,Ralph Goodale,http://www.parl.gc.ca/Parliamentarians/en/members/ralph-goodale(214405)
4766902,ca.proc.d.2018-12-13.10447830,2018-12-13,ac588301-cc6e-4f6e-9c58-84542c62c46b,217183,"Mr. François Choquette (Drummond, NDP)",,Oral Questions,The Environment,,"Mr. Speaker, speaking of the deficit, let's talk about the environmental deficit.
Everyone knows that Canada will fall well short of its greenhouse gas reduction targets.
According to an IPCC report, if Canada wanted to limit global warming to 1.5°C, it would have to double the planned reductions. 
UN Secretary General Antonio Guterres said that we were running out of time. He thinks that failing to act would be not only immoral, but also suicidal.
What are the Liberals waiting for? Will they stop posturing and actually do something about climate change? ",New Democratic Party,Drummond,François Choquette,http://www.parl.gc.ca/Parliamentarians/en/members/francois-choquette(217183)
4766903,ca.proc.d.2018-12-13.10447833,2018-12-13,,,,,Oral Questions,The Environment,,"Mr. Speaker, I am proud to be part of a government that takes the threat posed by climate change seriously. I am even prouder to see that we are actually taking action to put our commitment during the last election campaign into reality.
We are putting a price on pollution, which is going to bring emissions down and leave families better off. We are investing historically in Canada's public transit system, which will have a significant effect on emissions reduction. We are investing in green infrastructure and clean technology. Importantly, we are phasing out coal to get to a place where 90% of our electricity will be generated by renewable resources by 2030, which is 30 years ahead of when the Conservatives planned to reach this goal.",,,"Mr. Sean Fraser (Parliamentary Secretary to the Minister of Environment and Climate Change, Lib.)",
4766904,ca.proc.d.2018-12-13.10447835,2018-12-13,f40d602c-1ae6-414e-bac3-23a2f31f1cdf,224989,"Ms. Linda Duncan (Edmonton Strathcona, NDP)",,Oral Questions,The Environment,,"Mr. Speaker, auditors general and the United Nations have expressed concern that Canada is in danger of missing its 2030 Paris target by a wide margin. Canada is in no position to be asking others to act. Given weak greenhouse gas reduction targets and a growing number of provinces reneging on their measures, it has become evident that the much-touted pan-Canadian framework is just a legal fiction.
Instead of calling on other nations to act, will the government take concrete measures now to ensure Canada does its part?",New Democratic Party,Edmonton Strathcona,Linda Duncan,http://www.parl.gc.ca/Parliamentarians/en/members/linda-duncan(224989)
4766905,ca.proc.d.2018-12-13.10447837,2018-12-13,,,,,Oral Questions,The Environment,,"Mr. Speaker, I would like to assure the member that our government is working with Canadians as we transition to a clean energy future. We have a very serious plan to do our work at home while we are taking a leadership role on the international stage. That plan includes phasing out coal and, as I mentioned before, getting to 90% of our electricity generated from renewable resources by 2030. 
We are also improving public transit. We are investing in energy efficiency, with $56 million in my province of Nova Scotia alone. We are putting people to work in the green economy and bringing our emissions down at the same time. ",,,"Mr. Sean Fraser (Parliamentary Secretary to the Minister of Environment and Climate Change, Lib.)",
4766906,ca.proc.d.2018-12-13.10447840,2018-12-13,a10a55d4-becb-4b98-b780-9fa8cfd5aa12,234896,"Mr. Phil McColeman (Brantford—Brant, CPC)",,Oral Questions,National Defence,,"Mr. Speaker, air force Captain Kimberly Fawcett was deployed twice to Afghanistan. Now she is fighting the Liberals to pay for her prosthetic limb. She lost her limb in an accident that killed her infant son Keiran. Captain Fawcett was carrying out her family care plan with the approval of her commanding officer. She defended our country in Afghanistan, but the military and Veterans Affairs say they will not pay for her prosthesis. 
When will the Liberals do the right thing and cover the costs related to her injury?",Conservative,Brantford—Brant,Phil McColeman,http://www.parl.gc.ca/Parliamentarians/en/members/phil-mccoleman(234896)
4766907,ca.proc.d.2018-12-13.10447843,2018-12-13,f37d5cb2-a1ad-4ec9-a7de-ca265da02938,214560,"Hon. Harjit S. Sajjan (Minister of National Defence, Lib.)",,Oral Questions,National Defence,,"Mr. Speaker, first of all, I want to thank Captain Fawcett for her service to our country. Our hearts go out to her for the loss she has suffered. We are committed to making sure she gets the support she needs, including for the prosthetic leg. 
Due to the complexity of the decisions made some time ago, this file is very complex. However, we will not only make sure that she has the right support, but we will work through that complexity to make sure we do right by her.",Liberal,Vancouver South,Harjit S. Sajjan,http://www.parl.gc.ca/Parliamentarians/en/members/harjit-s-sajjan(214560)
4766908,ca.proc.d.2018-12-13.10447845,2018-12-13,9fe7bceb-dae2-4f26-b87b-2de1f38b4b84,234445,"Mr. Pierre Paul-Hus (Charlesbourg—Haute-Saint-Charles, CPC)",,Oral Questions,National Defence,,"Mr. Speaker, I am pleased to see that the minister finally decided to settle this case, but Captain Fawcett had to go to court to demand justice.
Why did the Minister of Defence, who has known about this for several months, wait for the case to end up in court and for the media to pick up the story before addressing the problem?",Conservative,Charlesbourg—Haute-Saint-Charles,Pierre Paul-Hus,http://www.parl.gc.ca/Parliamentarians/en/members/pierre-paul-hus(234445)
4766909,ca.proc.d.2018-12-13.10447847,2018-12-13,f37d5cb2-a1ad-4ec9-a7de-ca265da02938,214560,"Hon. Harjit S. Sajjan (Minister of National Defence, Lib.)",,Oral Questions,National Defence,,"Mr. Speaker, we are going to make sure that Captain Fawcett gets the support she needs. However, as I stated, the decisions made when the Harper government was in power have made this file extremely complex. I have spoken to members opposite about this. 
We have committed to and are working through the complexity of the file to make sure she has the support she needs.",Liberal,Vancouver South,Harjit S. Sajjan,http://www.parl.gc.ca/Parliamentarians/en/members/harjit-s-sajjan(214560)
