basepk,hid,speechdate,pid,opid,speakeroldname,speakerposition,maintopic,subtopic,subsubtopic,speechtext,speakerparty,speakerriding,speakername,speakerurl
4766810,ca.proc.d.2018-12-13.10447390,2018-12-13,,,,,Government Orders,Elections Modernization Act,,"Mr. Speaker, I am pleased to stand to speak for the final time in this particular chamber before it closes for a decade and further discuss the elections modernization act, Bill C-76.
This legislation was introduced in the House of Commons by the Minister of Democratic Institutions on April 30, 2018, and was referred to the House of Commons Standing Committee on Procedure and House Affairs last May.
I was proud to work on this piece of legislation during my time as parliamentary secretary to the Minister of Democratic Institutions, and I commend the work of my colleagues at committee and of the current Parliamentary Secretary to the Minister of Democratic Institutions, the very excellent member for South Shore—St. Margarets.
The amendments brought forward by committee have certainly strengthened Bill C-76. The elections modernization act would bring our electoral system into the 21st century and make it more secure, transparent and accessible. These improvements to the Canada Elections Act would contribute to restoring Canadians' trust in their democratic institutions after the debacle of the Conservative government's so-called Fair Elections Act, which we all know was anything but fair.
Today, I will focus on one key component of Bill C-76 that will be implemented for the first time in the next federal election, and that is the pre-election period.
The creation of a fixed date election contributes to a level playing field by providing more certainty to all political parties about the date of the next federal election. However, despite some of the positive aspects we have seen in past elections, a less positive consequence of the fixed date election is the extensive campaigning that begins well before the issuing of the writ, which we all know signals the commencement of the election period.
This is why the Prime Minister mandated the Minister of Democratic Institutions to “Review the limits on the amounts political parties and third parties can spend during elections, and propose measures to ensure that spending between elections is subject to reasonable limits as well.” With Bill C-76, we are delivering on that commitment.
The bill would see the creation of a regulated pre-election period that would begin on June 30 of the year of a fixed date election and would end with the issuing of the writ. The timing is important, since this would capture the core activities leading up to the actual campaign while at the same time not overlapping Parliament's session. 
The goal is not to limit Canadians' right to criticize the activities of those who represent them. The pre-election period will include rules that would guide the activities of third parties and political parties during that period.
First and foremost, spending limits will be imposed on third parties and political parties during the pre-election period. Spending limits are important to ensure a level playing field and that all can have their voices heard, and that parties and candidates can get to the starting line in a equitable way.
For political parties, Bill C-76, as amended by the Standing Committee on Procedure and House Affairs, will set a spending limit of $1.4 million. When applying the inflation factor, it is estimated that the limit will be approximately $2 million in the 2019 general election. This limit only applies to partisan advertising. It does not affect other regular activities of a political party.
The goal of this measure is not to unduly impede the ability of a party to reach out to Canadians and to engage with their ideas. Rather, the it is to allow for a level playing field to avoid a situation in which parties with more resources would be able to monopolize political debate. It will allow all voices to be heard. 
While still months away from polling day, these campaigns have a lasting impact on Canadian electors. 
With the same objective of limiting the potential harm to our democracy from the extensive and unregulated campaigning in the lead up to the election period, Bill C-76 would also impose a spending limit on third parties. For third parties, the limit would be $700,000. When adjusted for inflation, it is estimated that it would be about $1 million in 2019. Third parties will also have a limit of $7,000 per electoral district, which would be about $10,000 in 2019 when adjusted for inflation.
In the case of third parties, spending limits will include partisan activities, partisan advertising and election surveys. Take for example a third party that posts a large following with the stated purpose of tossing out select politicians from office, for example, Ontario Proud. Under these rules, third parties like it could not incur more than $1 million worth of expenses during the pre-election period. Under these rules, third parties like the one I described, could not incur more than $500,000 worth of expenses during the election period, including advertising and partisan activity like canvassing. 
These rules also mean that third parties could not use foreign monies to advertise or carry-out partisan activities. These rules also mean that third parties could not advertise anonymously. Rather, they would have to identify themselves by adding a tag line on partisan advertising in the pre-writ period. Importantly, these rules limit collusion between third parties and any registered party or candidate that would influence its partisan activities.
 It is important to note here that we believe that discourse and debate are essential to the democratic process. As such, these rules are aimed at increasing transparency in our elections, not at limiting discourse. These limitations will be enforced equally on third parties, regardless of the party in whose favour they operate.
As the members of the House undoubtedly know, a third party under the Canada Elections Act can be anyone who is not a recognized political entity, such as an individual elector, a non-governmental organization, a corporation, or others. These are all third parties. All of them have a right to share their views with other Canadians. The spending limit that Bill C-76 imposes would ensure that all of these different voices have an opportunity to be heard.
The bill does not just establish spending limits in the pre-election period, but also makes other changes to increase transparency regarding third-party activities. Under the current legislation, third parties are required to report to Elections Canada on their spending in the months following polling day after electors have already cast their votes. That is why Bill C-76 includes new reporting requirements for third parties that are particularly active, for example, those who receive contributions or incur expenses in amounts of $10,000 or more. These third parties would be required to provide interim reports twice during the pre-election period, first upon registration and again on September 15. Similarly, the third parties that meet this threshold would also have to provide interim reports during the election period. These reports would be required 21 and seven days, respectively, before polling day. 
Elections Canada would be required to publish on its website, in a timely fashion, the reports it receives. These reports will be very beneficial to Canadians. They will increase transparency as to who is trying to influence them before they actually have a chance to cast their votes. This way, Canadian electors will have access to the tools they need to make an informed and responsible decision.
Before I conclude, I would like to note some additional measures in Bill C-76 that would increase the transparency of third party participation in the electoral process. 
First, third parties would have to register with Elections Canada during the pre-election period when they reach $500 in regulated expenses. Currently, that requirement only exists in the election period.
Second, similar to the existing rules regarding political entities, third parties would be required to have a dedicated Canadian bank account for all of the relevant contributions and expenses.
As members can see, Bill C-76 provides a comprehensive regime for the participation of third parties that will contribute to a level playing field, provide greater transparency and, ultimately, make our democracy stronger.
In closing, Mr. Speaker, I wish to join you and all members in saying a fond farewell to this storied place and its hallowed halls until its renovation is complete.",,,"Mr. Andy Fillmore (Parliamentary Secretary to the Minister of Canadian Heritage and Multiculturalism, Lib.)",
4766811,ca.proc.d.2018-12-13.10447464,2018-12-13,031462db-8f61-48ed-bf9f-b033eb8312bb,217323,"Mr. Nathan Cullen (Skeena—Bulkley Valley, NDP)",,Government Orders,Elections Modernization Act,,"Mr. Speaker, I would like to wish my friend a merry Christmas, and the best to his family as well.
Here is the strange irony of what we are going through in the final hours of this House of Commons in this place. Of course, the House of Commons will continue, but 400 metres that way.
If we think about all the debates that have happened across this floor, where wars have been debated, Canadians have been interned, terrible things have been discussed and hard debates have happened, at the foundation of all that is our democracy, the way we vote and the way we elect people. As the member said, there are all these laudable pieces of this bill that help people vote and allow for better reporting as to what happens. 
However, during his speech, part of me was wondering this. If it is such a wonderful bill, why did it take three years for it to get here, and why did it blow right by Elections Canada's deadline to implement many of the things he talked about? That was entirely the Liberals' own choice. In fact, we were banging on the door after they introduced the first version of this bill two years ago, asking them to bring it to the House so we could debate it and get on with it, so that Elections Canada could do its job. 
Therefore, that lack of urgency from the Liberals is weird and troubling, and has caused them a whole bunch of problems. We now have this bill passing through the House under time allocation, which means they are shutting down debate and the ability of this House to do what it was built for.
Here is my question. Come the next election, which is less than a year away, will there be reports coming out that there has been a hack of one of the parties' databases? Will there be some sort of foreign interference in our democratic process, where Canadians will rightly be asking their elected representatives what they have done about it to protect them, to make sure they do not have a Donald Trump-style election or a Brexit-style vote? Will there be interference during the election and then, after the fact, once the votes have all been cast, will it be pulled back so we realize that millions of dollars were spent trying to influence Canadians and how they feel about their country with false information and lies, as that is how it is usually done? 
As members know, a lie makes its way around the world many times before the truth is up in the morning, and is very difficult to correct with the social media environment we are in. We know all these things because the privacy and ethics committee, which the Liberals sit on, reported more than a year ago that parties should exist under some kind of privacy laws. With all the evidence we now have, does my friend at least agree that that omission from this bill was more than an oversight, and that it was in fact a grave error made by the government? ",New Democratic Party,Skeena—Bulkley Valley,Nathan Cullen,http://www.parl.gc.ca/Parliamentarians/en/members/nathan-cullen(217323)
4766812,ca.proc.d.2018-12-13.10447466,2018-12-13,,,,,Government Orders,Elections Modernization Act,,"Mr. Speaker, with respect to how long it has taken us to get here, we were of course subjected to relentless filibustering, in which the member's own party participated. In fact, I remember knocking on the member for Skeena—Bulkley Valley's door, asking him to come quickly with the amendments that he was looking for, so that we could move to clause-by-clause. He was never able to respond to me, and I was never able to move with that member toward clause-by-clause. 
In the end, we heard from 56 witnesses at committee. We had 24 hours of study at committee. However, it was ultimately the filibustering, which began in May of 2018, that did not allow us to get to clause-by-clause until four and a half months later, on October 15, a scant month and a half ago. Therefore, we have moved this as quickly as we could in the face of that relentless opposition.
With respect to foreign interference, this bill bans all foreign money from being used in elections at all times, not only in the pre-writ and writ periods, but at all times. It requires organizations selling ad space to not knowingly accept elections advertisements from foreign entities. This is putting social media platforms on notice that we will be their partners as we head into 2019, to make sure their advertising is fair.",,,Mr. Andy Fillmore,
4766813,ca.proc.d.2018-12-13.10447472,2018-12-13,b4442fcd-62cf-456e-a49b-625ea35069b5,219808,"Mr. Lloyd Longfield (Guelph, Lib.)",,Government Orders,Elections Modernization Act,,"Mr. Speaker, I am specifically looking at the anti-collusion provisions with respect to having a tag line on all advertising that states it has been approved by the financial agent, whether that advertising comes from inside or outside Canada, through the three periods we are discussing, the pre-electoral and during the election period. 
Could the hon. member comment on that?",Liberal,Guelph,Lloyd Longfield,http://www.parl.gc.ca/Parliamentarians/en/members/lloyd-longfield(219808)
4766814,ca.proc.d.2018-12-13.10447475,2018-12-13,,,,,Government Orders,Elections Modernization Act,,"Mr. Speaker, the bill will require organizations selling ad space to not knowingly accept elections advertisements from foreign entities. That is in the writ period and in the pre-writ period.
However, it goes further. The member for Guelph may be interested to know that the bill will also require third parties to use a dedicated Canadian bank account for the payment of election-related spending during the pre-writ and writ periods. This will further help us ensure that these rules are being followed.
Additional punishments also exist for third parties who are found guilty of offences related to the use of foreign funds. They could be subjected to a punishment of up to five times the amount of the foreign funds that were used.
 The bill goes on to create other administrative penalties, including the ability for the commissioner to compel testimony and seek judicial respite.",,,Mr. Andy Fillmore,
4766815,ca.proc.d.2018-12-13.10447479,2018-12-13,48fc6e8f-3117-407b-bba3-bd6eede347ec,224672,"Hon. Bardish Chagger (Leader of the Government in the House of Commons, Lib.)",,Government Orders,Business of the House,,"Mr. Speaker, there have been discussions among the parties and if you seek it, I believe you will find unanimous consent for the following motion. I move:
 That, notwithstanding any Standing Order or usual practice of the House: 
 a) at the expiry of the time provided for Oral Questions today, the notice of motion for the production of papers P-15, standing on the Order Paper in the name of the member for Perth—Wellington, be called, the question be put and, if a recorded division is requested, the bells to call in the members shall not ring and the recorded division shall be taken immediately; 
 b) following the disposal of P-15, all questions necessary to dispose of the motion respecting the Senate amendment to Bill C-76, An Act to amend the Canada Elections Act and other Acts and to make certain consequential amendments, be put forthwith and successively and that any recorded division requested be taken immediately; 
 c) following the disposal of Bill C-76, the sitting shall be suspended until such time as the Chair may reconvene the sitting for the sole purpose of attending a Royal Assent ceremony; 
 d) immediately upon the return from the Royal Assent ceremony, the House shall adjourn until Monday, January 28, 2019, provided that, for the purposes of any Standing Order, it shall be deemed to have been adjourned pursuant to Standing Order 28 and be deemed to have sat on Friday, December 14, 2018. 
",Liberal,Waterloo,Bardish Chagger,http://www.parl.gc.ca/Parliamentarians/en/members/bardish-chagger(224672)
4766816,ca.proc.d.2018-12-13.10447481,2018-12-13,16c839d3-0183-4ed6-892a-8d7bdc37c474,214972,The Assistant Deputy Speaker (Mr. Anthony Rota),,Government Orders,Business of the House,,Does the hon. government House leader have the unanimous consent of the House to move the motion?,Liberal,Nipissing—Timiskaming,Anthony Rota,http://www.parl.gc.ca/Parliamentarians/en/members/anthony-rota(214972)
4766817,ca.proc.d.2018-12-13.p5740230,2018-12-13,,,,intervention,Government Orders,Business of the House,, Agreed.,,,Some hon. members,
4766818,ca.proc.d.2018-12-13.p5740231,2018-12-13,16c839d3-0183-4ed6-892a-8d7bdc37c474,214972,The Assistant Deputy Speaker (Mr. Anthony Rota),,Government Orders,Business of the House,, The House has heard the terms of the motion. Is it the pleasure of the House to adopt the motion?,Liberal,Nipissing—Timiskaming,Anthony Rota,http://www.parl.gc.ca/Parliamentarians/en/members/anthony-rota(214972)
4766819,ca.proc.d.2018-12-13.p5740232,2018-12-13,,,,intervention,Government Orders,Business of the House,, Agreed.,,,Some hon. members,
4766820,ca.proc.d.2018-12-13.p9,2018-12-13,16c839d3-0183-4ed6-892a-8d7bdc37c474,214972,The Assistant Deputy Speaker (Mr. Anthony Rota),,Government Orders,Business of the House,,(Motion agreed to),Liberal,Nipissing—Timiskaming,Anthony Rota,http://www.parl.gc.ca/Parliamentarians/en/members/anthony-rota(214972)
4766821,ca.proc.d.2018-12-13.p5740233,2018-12-13,,,,stagedirection,Government Orders,Elections Modernization Act,,"The House resumed consideration of the motion in relation to the amendment made by the Senate to Bill C-76, An Act to amend the Canada Elections Act and other Acts and to make certain consequential amendments, and of the amendment.",,,,
